id,higherClassification,kingdom,phylum,class,order,family,scientificName,taxonID,genus,subgenus,recordedBy,associatedCollectors,eventDate,year,month,day,startDayOfYear,habitat,substrate,country,stateProvince,county,municipality,locality,decimalLatitude,decimalLongitude,minimumElevationInMeters,maximumElevationInMeters,references
4306534,Protozoa|Myxomycota|Myxomycetes|Trichiales,Protozoa,Myxomycota,Myxomycetes,Trichiales,Trichiaceae,Metatrichia vesparium,643202,Metatrichia,,"Carroll, A.J.",,12/13/40,1940,12,13,348,Ravine slope,Decayed beech log,United States,Ohio,Hamilton,Cincinnati,Mt. Airy Forest,39.165058,-84.574945,,,https://www.mycoportal.org/portal/collections/individual/index.php?occid=4306534
4306535,Protozoa|Myxomycota|Myxomycetes|Trichiales,Protozoa,Myxomycota,Myxomycetes,Trichiales,Trichiaceae,Hemitrichia vesparium,638846,Hemitrichia,,"Keuse, H.O.",,12/30/47,1947,12,30,364,Woods,Decayed log,United States,Ohio,Hamilton,Cincinnati,Mt. Airy Forest,39.165058,-84.574945,,,https://www.mycoportal.org/portal/collections/individual/index.php?occid=4306535
4306537,Protozoa|Myxomycota|Myxomycetes|Trichiales,Protozoa,Myxomycota,Myxomycetes,Trichiales,Trichiaceae,Hemitrichia stipitata,638842,Hemitrichia,,"Ayers, John H.",,7/28/32,1932,7,28,210,,Old log,United States,Ohio,Hamilton,Cincinnati,Kroger Hills (Kroger Hills State Reserve),39.15006,-84.324938,,,https://www.mycoportal.org/portal/collections/individual/index.php?occid=4306537
4306538,Protozoa|Myxomycota|Myxomycetes|Trichiales,Protozoa,Myxomycota,Myxomycetes,Trichiales,Trichiaceae,Hemitrichia stipitata,638842,Hemitrichia,,"Ayers, John H.",,10/2/31,1931,10,2,275,,Rotten log,United States,Ohio,Hamilton,Cincinnati,Kroger Hills (Kroger Hills State Reserve),39.15006,-84.324938,,,https://www.mycoportal.org/portal/collections/individual/index.php?occid=4306538
4306539,Protozoa|Myxomycota|Myxomycetes|Trichiales,Protozoa,Myxomycota,Myxomycetes,Trichiales,Trichiaceae,Hemitrichia stipitata,638842,Hemitrichia,,"Ayers, John H.",,1932-08-00,1932,8,0,,,Rotten wood,United States,Ohio,Hamilton,,"Hamilton County, Ohio",39.195531,-84.542775,,,https://www.mycoportal.org/portal/collections/individual/index.php?occid=4306539
4306540,Protozoa|Myxomycota|Myxomycetes|Trichiales,Protozoa,Myxomycota,Myxomycetes,Trichiales,Trichiaceae,Hemitrichia vesparium,638846,Hemitrichia,,"Casterline, J.",,1947-12-00,1947,12,0,,Woods,On dead log,United States,Ohio,Hamilton,Cincinnati,Mt. Airy Forest,39.165058,-84.574945,,,https://www.mycoportal.org/portal/collections/individual/index.php?occid=4306540
4306541,Protozoa|Myxomycota|Myxomycetes|Trichiales,Protozoa,Myxomycota,Myxomycetes,Trichiales,Trichiaceae,Hemitrichia serpula,638838,Hemitrichia,,"Ayers, John H.",,10/15/32,1932,10,15,289,,Bark on rotten log,United States,Ohio,Hamilton,Cincinnati,College Hill,39.20228,-84.547166,,,https://www.mycoportal.org/portal/collections/individual/index.php?occid=4306541
4306542,Protozoa|Myxomycota|Myxomycetes|Trichiales,Protozoa,Myxomycota,Myxomycetes,Trichiales,Trichiaceae,Hemitrichia serpula,638838,Hemitrichia,,"Ayers, John H.",,4/2/32,1932,4,2,93,,Leaf,United States,Ohio,Hamilton,Cincinnati,"Cincinnati, Given Road",39.162004,-84.456886,,,https://www.mycoportal.org/portal/collections/individual/index.php?occid=4306542
4306543,Protozoa|Myxomycota|Myxomycetes|Trichiales,Protozoa,Myxomycota,Myxomycetes,Trichiales,Trichiaceae,Hemitrichia vesparium,638846,Hemitrichia,,"West, Mary Lou",,10/16/45,1945,10,16,289,,Decaying wood,United States,Ohio,Hamiltion,Cincinnati,Kroger Hills (Kroger Hills State Reserve),39.15006,-84.324938,,,https://www.mycoportal.org/portal/collections/individual/index.php?occid=4306543
4306544,Protozoa|Myxomycota|Myxomycetes|Trichiales,Protozoa,Myxomycota,Myxomycetes,Trichiales,Trichiaceae,Hemitrichia vesparium,638846,Hemitrichia,,"Lillick, Lois",,10/1/32,1932,10,1,275,,Dead log,United States,Ohio,Adams,Beaver Pond,Beaver Pond,38.939515,-83.346299,,,https://www.mycoportal.org/portal/collections/individual/index.php?occid=4306544
4306545,Protozoa|Myxomycota|Myxomycetes|Trichiales,Protozoa,Myxomycota,Myxomycetes,Trichiales,Trichiaceae,Hemitrichia stipitata,638842,Hemitrichia,,"Ayers, John H.",,10/7/33,1933,10,7,280,,Old log,United States,Ohio,Hamilton,Dunlap,Near Dunlap,39.292279,-84.618002,,,https://www.mycoportal.org/portal/collections/individual/index.php?occid=4306545
4306546,Protozoa|Myxomycota|Myxomycetes|Trichiales,Protozoa,Myxomycota,Myxomycetes,Trichiales,Trichiaceae,Hemitrichia stipitata,638842,Hemitrichia,,"Ayers, John H.",,9/24/32,1932,9,24,268,,Rotten wood,United States,Ohio,Hamilton,Cincinnati,Hazelwood,39.266169,-84.362996,,,https://www.mycoportal.org/portal/collections/individual/index.php?occid=4306546
4306547,Protozoa|Myxomycota|Myxomycetes|Trichiales,Protozoa,Myxomycota,Myxomycetes,Trichiales,Trichiaceae,Hemitrichia stipitata,638842,Hemitrichia,,"Cooke, William Bridge",,9/19/22,1922,9,19,262,,Dead wood,United States,Ohio,Highland,Seven Caves,Seven Caves (Highlands Nature Sanctuary),39.344508,-83.59742,,,https://www.mycoportal.org/portal/collections/individual/index.php?occid=4306547
4306548,Protozoa|Myxomycota|Myxomycetes|Trichiales,Protozoa,Myxomycota,Myxomycetes,Trichiales,Trichiaceae,Hemitrichia serpula,638838,Hemitrichia,,"Ayers, John H.",,11/5/32,1932,11,5,310,,Rotten log,United States,Ohio,Hamilton,Cincinnati,"Cincinnati, California",39.065339,-84.423274,,,https://www.mycoportal.org/portal/collections/individual/index.php?occid=4306548
4306549,Protozoa|Myxomycota|Myxomycetes|Trichiales,Protozoa,Myxomycota,Myxomycetes,Trichiales,Trichiaceae,Hemitrichia stipitata,638842,Hemitrichia,,"Ayers, John H.",,9/24/32,1932,9,24,268,,Rotten log,United States,Ohio,Hamilton,Cincinnati,Hazelwood,39.266169,-84.362996,,,https://www.mycoportal.org/portal/collections/individual/index.php?occid=4306549
4306550,Protozoa|Myxomycota|Myxomycetes|Trichiales,Protozoa,Myxomycota,Myxomycetes,Trichiales,Trichiaceae,Hemitrichia serpula,638838,Hemitrichia,,"Hopkins, W.C.",,10/13/38,1938,10,13,286,,Dead wood,United States,Ohio,Hamilton,Cincinnati,"Cincinnati, California",39.065339,-84.423274,,,https://www.mycoportal.org/portal/collections/individual/index.php?occid=4306550
4306551,Protozoa|Myxomycota|Myxomycetes|Trichiales,Protozoa,Myxomycota,Myxomycetes,Trichiales,Trichiaceae,Hemitrichia vesparium,638846,Hemitrichia,,"West, Mary Lou",,1945-10-00,1945,10,0,,,Wood,United States,Ohio,Clermont,,"Wilson's Farm (Clermont County, Ohio)",39.047433,-84.151918,,,https://www.mycoportal.org/portal/collections/individual/index.php?occid=4306551
4306552,Protozoa|Myxomycota|Myxomycetes|Trichiales,Protozoa,Myxomycota,Myxomycetes,Trichiales,Trichiaceae,Hemitrichia serpula,638838,Hemitrichia,,"Johnson, Louise",,10/16/38,1938,10,16,289,Mixed mesophytic woods,Decaying log,United States,Ohio,Adams,Mineral Springs,Mineral Springs,38.887016,-83.329354,,,https://www.mycoportal.org/portal/collections/individual/index.php?occid=4306552
4306553,Protozoa|Myxomycota|Myxomycetes|Trichiales,Protozoa,Myxomycota,Myxomycetes,Trichiales,Trichiaceae,Hemitrichia serpula,638838,Hemitrichia,,"Ayers, John H.",,4/2/32,1932,4,2,93,,Leaf,United States,Ohio,Hamilton,Cincinnati,"Cincinnati, Given Road",39.162004,-84.456886,,,https://www.mycoportal.org/portal/collections/individual/index.php?occid=4306553
4306554,Protozoa|Myxomycota|Myxomycetes|Trichiales,Protozoa,Myxomycota,Myxomycetes,Trichiales,Trichiaceae,Hemitrichia stipitata,638842,Hemitrichia,,"Ayers, John H.",,11/5/32,1932,11,5,310,,Rotten wood,United States,Ohio,Hamilton,Cincinnati,"Cincinnati, California",39.065339,-84.423274,,,https://www.mycoportal.org/portal/collections/individual/index.php?occid=4306554
4306555,Protozoa|Myxomycota|Myxomycetes|Trichiales,Protozoa,Myxomycota,Myxomycetes,Trichiales,Trichiaceae,Hemitrichia stipitata,638842,Hemitrichia,,"Cooke, William Bridge",,7/3/32,1932,7,3,185,,Loam,United States,Ohio,Clermont,Branch Hill,South Branch Hill,39.24617,-84.293271,,,https://www.mycoportal.org/portal/collections/individual/index.php?occid=4306555
4306557,Protozoa|Myxomycota|Myxomycetes|Trichiales,Protozoa,Myxomycota,Myxomycetes,Trichiales,Trichiaceae,Hemitrichia serpula,638838,Hemitrichia,,"Clermont, L.",,10/16/38,1938,10,16,289,Ravine,Wet bark of dead log,United States,Ohio,Adams,Mineral Springs,Mineral Springs,38.887016,-83.329354,,,https://www.mycoportal.org/portal/collections/individual/index.php?occid=4306557
4306813,Protozoa|Myxomycota|Myxomycetes|Trichiales,Protozoa,Myxomycota,Myxomycetes,Trichiales,Trichiaceae,Hemitrichia serpula,638838,Hemitrichia,,"Gray, Carolynne",,10/15/38,1938,10,15,288,,Dead wood,United States,Ohio,Adams,,"Adams County, Ohio",38.845515,-83.472152,,,https://www.mycoportal.org/portal/collections/individual/index.php?occid=4306813
4306815,Protozoa|Myxomycota|Myxomycetes|Trichiales,Protozoa,Myxomycota,Myxomycetes,Trichiales,Trichiaceae,Hemitrichia vesparium,638846,Hemitrichia,,"Ruff, Marion",,1945-10-00,1945,10,0,,,Dead log,United States,Ohio,Clermont,,"Wilson's Farm (Clermont County, Ohio)",39.047433,-84.151918,,,https://www.mycoportal.org/portal/collections/individual/index.php?occid=4306815
4306816,Protozoa|Myxomycota|Myxomycetes|Trichiales,Protozoa,Myxomycota,Myxomycetes,Trichiales,Trichiaceae,Hemitrichia stipitata,638842,Hemitrichia,,"Fulford, Margaret H.",,10/23/31,1931,10,23,296,Woods,Decayed log,United States,Ohio,Hamilton,Cincinnati,"Cincinnati, Given Road, Terrace Park",39.159227,-84.30716,,,https://www.mycoportal.org/portal/collections/individual/index.php?occid=4306816
4306817,Protozoa|Myxomycota|Myxomycetes|Trichiales,Protozoa,Myxomycota,Myxomycetes,Trichiales,Trichiaceae,Hemitrichia stipitata,638842,Hemitrichia,,"Ayers, John H.",,7/28/32,1932,6,28,210,,Rotten wood,United States,Ohio,Hamilton,Cincinnati,Kroger Hills (Kroger Hills State Reserve),39.15006,-84.324938,,,https://www.mycoportal.org/portal/collections/individual/index.php?occid=4306817
4306818,Protozoa|Myxomycota|Myxomycetes|Trichiales,Protozoa,Myxomycota,Myxomycetes,Trichiales,Trichiaceae,Hemitrichia stipata,638841,Hemitrichia,,"Hoskins, John Hobart",,7/11/26,1926,7,11,192,,,United States,Indiana,Saint Joseph,South Bend,South Bend,41.683381,-86.250007,,,https://www.mycoportal.org/portal/collections/individual/index.php?occid=4306818
4306819,Protozoa|Myxomycota|Myxomycetes|Trichiales,Protozoa,Myxomycota,Myxomycetes,Trichiales,Trichiaceae,Hemitrichia stipitata,638842,Hemitrichia,,"Hoskins, John Hobart",,1931-00-00,1931,0,0,,,Rotten log,United States,Indiana,Saint Joseph,South Bend,South Bend,41.683381,-86.250007,,,https://www.mycoportal.org/portal/collections/individual/index.php?occid=4306819
4306820,Protozoa|Myxomycota|Myxomycetes|Trichiales,Protozoa,Myxomycota,Myxomycetes,Trichiales,Trichiaceae,Hemitrichia vesparium,638846,Hemitrichia,,"Lillick, Lois",,10/18/32,1932,10,18,292,,Dead log,United States,Ohio,Hamilton,Cincinnati,"Cincinnati, College Hill",39.20228,-84.547166,,,https://www.mycoportal.org/portal/collections/individual/index.php?occid=4306820
4306821,Protozoa|Myxomycota|Myxomycetes|Trichiales,Protozoa,Myxomycota,Myxomycetes,Trichiales,Trichiaceae,Hemitrichia serpula,638838,Hemitrichia,,"Ayers, John H.",,9/8/33,1933,9,8,251,,Rotten sticks,United States,Kentucky,Boone,Anderson's Ferry,Anderson's Ferry,36.695877,-87.17028,,,https://www.mycoportal.org/portal/collections/individual/index.php?occid=4306821
4306822,Protozoa|Myxomycota|Myxomycetes|Trichiales,Protozoa,Myxomycota,Myxomycetes,Trichiales,Trichiaceae,Hemitrichia stipitata,638842,Hemitrichia,,"Ayers, John H.",,9/8/33,1933,9,8,251,,Rotten log,United States,Kentucky,Boone,Anderson's Ferry,Anderson's Ferry,36.695877,-87.17028,,,https://www.mycoportal.org/portal/collections/individual/index.php?occid=4306822
4306823,Protozoa|Myxomycota|Myxomycetes|Trichiales,Protozoa,Myxomycota,Myxomycetes,Trichiales,Trichiaceae,Hemitrichia vesparium,638846,Hemitrichia,,"Phinney, Harry Kenyon",,7/28/40,1940,7,28,210,,Rotting log,United States,Michigan,Alger,Miners Falls,Miners Falls,46.47443,-86.53122,,,https://www.mycoportal.org/portal/collections/individual/index.php?occid=4306823
4306825,Protozoa|Myxomycota|Myxomycetes|Trichiales,Protozoa,Myxomycota,Myxomycetes,Trichiales,Trichiaceae,Hemitrichia vesparium,638846,Hemitrichia,,"Lloyd, Curtis Gates",,1910-00-00,1910,0,0,,,,United States,Kentucky,Grant,Crittenden,Crittenden,38.782844,-84.605221,,,https://www.mycoportal.org/portal/collections/individual/index.php?occid=4306825
4306826,Protozoa|Myxomycota|Myxomycetes|Trichiales,Protozoa,Myxomycota,Myxomycetes,Trichiales,Trichiaceae,Hemitrichia vesparium,638846,Hemitrichia,,"Ayers, John H.",,4/2/32,1932,4,2,93,,Rotten wood,United States,Ohio,Hamilton,Cincinnati,"Cincinnati, Given Road",39.193808,-84.32535,,,https://www.mycoportal.org/portal/collections/individual/index.php?occid=4306826
4306827,Protozoa|Myxomycota|Myxomycetes|Trichiales,Protozoa,Myxomycota,Myxomycetes,Trichiales,Trichiaceae,Hemitrichia vesparium,638846,Hemitrichia,,"Baur, Kay",,10/1/32,1932,10,1,275,,,United States,Ohio,Adams,Beaver Pond,Beaver Pond,38.939515,-83.346299,,,https://www.mycoportal.org/portal/collections/individual/index.php?occid=4306827
4306828,Protozoa|Myxomycota|Myxomycetes|Trichiales,Protozoa,Myxomycota,Myxomycetes,Trichiales,Trichiaceae,Hemitrichia vesparium,638846,Hemitrichia,,"Cooke, William Bridge",,10/1/32,1932,10,1,275,,Dead wood,United States,Ohio,Adams,Beaver Pond,Beaver Pond,38.939515,-83.346299,,,https://www.mycoportal.org/portal/collections/individual/index.php?occid=4306828
4306829,Protozoa|Myxomycota|Myxomycetes|Trichiales,Protozoa,Myxomycota,Myxomycetes,Trichiales,Trichiaceae,Hemitrichia vesparium,638846,Hemitrichia,,"Cooke, William Bridge",,7/31/32,1932,7,31,213,,Dead wood,United States,Ohio,Highland,Seven Caves,Seven Caves (Highlands Nature Sanctuary),39.344508,-83.59742,,,https://www.mycoportal.org/portal/collections/individual/index.php?occid=4306829
4306957,Protozoa|Myxomycota|Myxomycetes|Trichiales,Protozoa,Myxomycota,Myxomycetes,Trichiales,Trichiaceae,Hemitrichia vesparium,638846,Hemitrichia,,"Cooke, William Bridge",,9/19/32,1932,9,19,263,,Dead wood,United States,Ohio,Highland,Seven Caves,Seven Caves (Highlands Nature Sanctuary),39.344508,-83.59742,,,https://www.mycoportal.org/portal/collections/individual/index.php?occid=4306957
4306958,Protozoa|Myxomycota|Myxomycetes|Trichiales,Protozoa,Myxomycota,Myxomycetes,Trichiales,Trichiaceae,Hemitrichia vesparium,638846,Hemitrichia,,"Cooke, William Bridge",,11/6/32,1932,1,16,311,,Dead logs,United States,Ohio,Clermont,Branch Hill,South Branch Hill,39.24617,-84.293271,,,https://www.mycoportal.org/portal/collections/individual/index.php?occid=4306958
4306959,Protozoa|Myxomycota|Myxomycetes|Trichiales,Protozoa,Myxomycota,Myxomycetes,Trichiales,Trichiaceae,Hemitrichia vesparium,638846,Hemitrichia,,"Ayers, John H.",,10/23/31,1932,10,23,296,,Rotten log,United States,Ohio,Hamilton,Cincinnati,"Cincinnati, Given Road",39.193808,-84.32535,,,https://www.mycoportal.org/portal/collections/individual/index.php?occid=4306959
4306960,Protozoa|Myxomycota|Myxomycetes|Trichiales,Protozoa,Myxomycota,Myxomycetes,Trichiales,Trichiaceae,Hemitrichia vesparium,638846,Hemitrichia,,"Ayers, John H.",,9/24/32,1932,9,24,268,,Rotten log,United States,Ohio,Hamilton,Cincinnati,Hazelwood,39.266169,-84.362996,,,https://www.mycoportal.org/portal/collections/individual/index.php?occid=4306960
4306961,Protozoa|Myxomycota|Myxomycetes|Trichiales,Protozoa,Myxomycota,Myxomycetes,Trichiales,Trichiaceae,Hemitrichia vesparium,638846,Hemitrichia,,"Cosner, L.",,10/16/38,1938,10,16,289,,,United States,Ohio,Adams,,"Adams County, Ohio",38.845515,-83.472152,,,https://www.mycoportal.org/portal/collections/individual/index.php?occid=4306961
4306962,Protozoa|Myxomycota|Myxomycetes|Trichiales,Protozoa,Myxomycota,Myxomycetes,Trichiales,Trichiaceae,Hemitrichia vesparium,638846,Hemitrichia,,"Ayers, John H.",,9/9/33,1933,9,9,252,,Rotten log,United States,Ohio,Hamilton,Cincinnati,"Cincinnati, Mt. Airy Forest",39.165058,-84.574945,,,https://www.mycoportal.org/portal/collections/individual/index.php?occid=4306962
4306963,Protozoa|Myxomycota|Myxomycetes|Trichiales,Protozoa,Myxomycota,Myxomycetes,Trichiales,Trichiaceae,Hemitrichia vesparium,638846,Hemitrichia,,"Gray, Carolynne",,10/15/38,1938,10,15,288,,Dead wood,United States,Ohio,Adams,,"Adams County, Ohio",38.845515,-83.472152,,,https://www.mycoportal.org/portal/collections/individual/index.php?occid=4306963
4306965,Protozoa|Myxomycota|Myxomycetes|Trichiales,Protozoa,Myxomycota,Myxomycetes,Trichiales,Trichiaceae,Hemitrichia vesparium,638846,Hemitrichia,,"Hoskins, John Hobart",,1931-00-00,1931,0,0,,,Rotten log,United States,Ohio,Hamilton,Cincinnati,Newtown,39.124505,-84.361606,,,https://www.mycoportal.org/portal/collections/individual/index.php?occid=4306965
4306967,Protozoa|Myxomycota|Myxomycetes|Trichiales,Protozoa,Myxomycota,Myxomycetes,Trichiales,Trichiaceae,Hemitrichia vesparium,638846,Hemitrichia,,"Hoskins, John Hobart",,1931-00-00,1931,0,0,,,Rotten log,United States,Ohio,Hamilton,Cincinnati,Newtown,39.124505,-84.361606,,,https://www.mycoportal.org/portal/collections/individual/index.php?occid=4306967
4306970,Protozoa|Myxomycota|Myxomycetes|Trichiales,Protozoa,Myxomycota,Myxomycetes,Trichiales,Trichiaceae,Hemitrichia vesparium,638846,Hemitrichia,,"Ayers, John H.",,10/7/33,1933,10,7,280,,Old log,United States,Ohio,Hamilton,Dunlap,Dunlap,39.292279,-84.618002,,,https://www.mycoportal.org/portal/collections/individual/index.php?occid=4306970
4306971,Protozoa|Myxomycota|Myxomycetes|Trichiales,Protozoa,Myxomycota,Myxomycetes,Trichiales,Trichiaceae,Hemitrichia vesparium,638846,Hemitrichia,,"Ayers, John H.",,7/28/32,1932,7,28,210,,Rotten log,United States,Ohio,Hamilton,Cincinnati,"Cincinnati, Kroger Hills",39.150157,-84.32093,,,https://www.mycoportal.org/portal/collections/individual/index.php?occid=4306971
4306973,Protozoa|Myxomycota|Myxomycetes|Trichiales,Protozoa,Myxomycota,Myxomycetes,Trichiales,Trichiaceae,Hemitrichia vesparium,638846,Hemitrichia,,"Johnson, Louise",,10/13/38,1938,10,13,286,,Decaying log,United States,Ohio,Hamilton,California,"Cincinnati, California",39.065339,-84.423274,,,https://www.mycoportal.org/portal/collections/individual/index.php?occid=4306973
4306980,Protozoa|Myxomycota|Myxomycetes|Trichiales,Protozoa,Myxomycota,Myxomycetes,Trichiales,Trichiaceae,Hemitrichia vesparium,638846,Hemitrichia,,"Ayers, John H.",,8/8/32,1932,8,8,221,,Rotten log,United States,Ohio,Clermont,Milford,"East of Milford, G.B.S. Farm",39.175338,-84.294382,,,https://www.mycoportal.org/portal/collections/individual/index.php?occid=4306980
4306982,Protozoa|Myxomycota|Myxomycetes|Trichiales,Protozoa,Myxomycota,Myxomycetes,Trichiales,Trichiaceae,Hemitrichia vesparium,638846,Hemitrichia,,"Ayers, John H.",,10/15/32,1932,10,15,289,,Rotten log,United States,Ohio,Hamilton,Cincinnati,"Cincinnati, College Hill",39.20228,-84.547166,,,https://www.mycoportal.org/portal/collections/individual/index.php?occid=4306982
4306985,Protozoa|Myxomycota|Myxomycetes|Trichiales,Protozoa,Myxomycota,Myxomycetes,Trichiales,Trichiaceae,Hemitrichia vesparium,638846,Hemitrichia,,"Cosner, L.",,10/16/38,1938,10,16,289,,Dead log,United States,Ohio,Adams,,"Adams County, Ohio",38.845515,-83.472152,,,https://www.mycoportal.org/portal/collections/individual/index.php?occid=4306985
4306986,Protozoa|Myxomycota|Myxomycetes|Trichiales,Protozoa,Myxomycota,Myxomycetes,Trichiales,Trichiaceae,Hemitrichia vesparium,638846,Hemitrichia,,"Ayers, John H.",,10/15/32,1932,10,15,289,,Rotten log,United States,Ohio,Hamilton,Cincinnati,"Cincinnati, Kroger Hills",39.150157,-84.32093,,,https://www.mycoportal.org/portal/collections/individual/index.php?occid=4306986
4306988,Protozoa|Myxomycota|Myxomycetes|Trichiales,Protozoa,Myxomycota,Myxomycetes,Trichiales,Trichiaceae,Hemitrichia vesparium,638846,Hemitrichia,,"Cobbe, Thomas J.",,10/16/38,1938,10,16,289,,Moist log,United States,Ohio,Adams,Mineral Springs,Mineral Springs,38.887016,-83.329354,,,https://www.mycoportal.org/portal/collections/individual/index.php?occid=4306988
4306989,Protozoa|Myxomycota|Myxomycetes|Trichiales,Protozoa,Myxomycota,Myxomycetes,Trichiales,Trichiaceae,Hemitrichia vesparium,638846,Hemitrichia,,"Ayers, John H.",,11/5/32,1932,11,5,310,,Rotten log,United States,Ohio,Hamilton,California,"Cincinnati, California",39.065339,-84.423274,,,https://www.mycoportal.org/portal/collections/individual/index.php?occid=4306989
4306991,Protozoa|Myxomycota|Myxomycetes|Trichiales,Protozoa,Myxomycota,Myxomycetes,Trichiales,Trichiaceae,Hemitrichia vesparium,638846,Hemitrichia,,"Ayers, John H.",,8/16/32,1932,8,16,229,,Rotten log,United States,Ohio,Hamilton,Cincinnati,Hazelwood,39.266169,-84.362996,,,https://www.mycoportal.org/portal/collections/individual/index.php?occid=4306991
4307012,Protozoa|Myxomycota,Protozoa,Myxomycota,,,Stemonitidaceae,Stemonitis axifera,655009,Stemonitis,,s.n.,,5/13/33,1933,5,13,133,,,United States,Kentucky,Powell,Natural Bridge,Natural Bridge,37.772584,-83.684358,,,https://www.mycoportal.org/portal/collections/individual/index.php?occid=4307012
4307018,Protozoa|Myxomycota,Protozoa,Myxomycota,,,Stemonitidaceae,Stemonitis axifera,655009,Stemonitis,,"Hoskins, John Hobart",,1931-00-00,1931,0,0,,,,United States,Indiana,Saint Joseph,South Bend,"South Bend, Notre Dame",41.698251,-86.236274,,,https://www.mycoportal.org/portal/collections/individual/index.php?occid=4307018
4331408,Protozoa|Myxomycota,Protozoa,Myxomycota,,,Stemonitidaceae,Stemonitis axifera,655009,Stemonitis,,"Ayers, John H.",,7/28/32,1932,7,28,210,,Rotten log,United States,Ohio,Hamilton,Cincinnati,"Cincinnati, Kroger Hills",39.150157,-84.32093,,,https://www.mycoportal.org/portal/collections/individual/index.php?occid=4331408
4331411,Protozoa|Myxomycota,Protozoa,Myxomycota,,,Stemonitidaceae,Stemonitis axifera,655009,Stemonitis,,"Ayers, John H.",,9/24/32,1932,9,24,268,,Rotten log,United States,Ohio,Hamilton,Cincinnati,Hazelwood,39.266169,-84.362996,,,https://www.mycoportal.org/portal/collections/individual/index.php?occid=4331411
4331418,Protozoa|Myxomycota,Protozoa,Myxomycota,,,Stemonitidaceae,Stemonitis axifera,655009,Stemonitis,,"Wieful, G.",,7/1/32,1932,7,1,183,,On log,United States,Ohio,Hamilton,Cincinnati,"Cincinnati, Kennedy Heights",39.185615,-84.408274,,,https://www.mycoportal.org/portal/collections/individual/index.php?occid=4331418
4331420,Protozoa|Myxomycota,Protozoa,Myxomycota,,,Stemonitidaceae,Stemonitis axifera,655009,Stemonitis,,"Ayers, John H.",,8/13/32,1932,8,13,226,,Rotten log,United States,Ohio,Hamilton,Cincinnati,"Cincinnati, Given Road",39.193808,-84.32535,,,https://www.mycoportal.org/portal/collections/individual/index.php?occid=4331420
4331422,Protozoa|Myxomycota,Protozoa,Myxomycota,,,Stemonitidaceae,Stemonitis axifera,655009,Stemonitis,,"Hoskins, John Hobart",,1931-07-00,1931,7,0,,,,United States,Indiana,Saint Joseph,South Bend,"South Bend, Notre Dame, St. Mary's Ravine",41.699276,-86.234901,,,https://www.mycoportal.org/portal/collections/individual/index.php?occid=4331422
4331424,Protozoa|Myxomycota,Protozoa,Myxomycota,,,Stemonitidaceae,Stemonitis axifera,655009,Stemonitis,,"Ayers, John H.",,6/8/32,1932,6,8,160,,Rotten log,United States,Ohio,Hamiltion,Cincinnati,"Cincinnati, Kroger Hills",39.150157,-84.32093,,,https://www.mycoportal.org/portal/collections/individual/index.php?occid=4331424
4331426,Protozoa|Myxomycota,Protozoa,Myxomycota,,,Stemonitidaceae,Stemonitis axifera,655009,Stemonitis,,"Ayers, John H.",,8/13/32,1932,8,13,226,,Rotten log,United States,Ohio,Hamilton,Cincinnati,"Cincinnati, Given Road",39.193808,-84.32535,,,https://www.mycoportal.org/portal/collections/individual/index.php?occid=4331426
4331427,Protozoa|Myxomycota,Protozoa,Myxomycota,,,Stemonitidaceae,Stemonitis axifera,655009,Stemonitis,,"Ayers, John H.",,8/16/32,1932,8,16,229,,Rotten wood,United States,Ohio,Hamilton,Cincinnati,Hazelwood,39.266169,-84.362996,,,https://www.mycoportal.org/portal/collections/individual/index.php?occid=4331427
4331429,Protozoa|Myxomycota,Protozoa,Myxomycota,,,Stemonitidaceae,Stemonitis axifera,655009,Stemonitis,,"Hoskins, John Hobart",,1932-00-00,1932,0,0,,,,United States,Michigan,Berrien,,"Berrien County, Michigan",41.995778,-86.685421,,,https://www.mycoportal.org/portal/collections/individual/index.php?occid=4331429
4331430,Protozoa|Myxomycota,Protozoa,Myxomycota,,,Stemonitidaceae,Stemonitis axifera,655009,Stemonitis,,"Hoskins, John Hobart",,1931-00-00,1931,0,0,,,,United States,Indiana,Saint Joseph,South Bend,South Bend,41.683381,-86.250007,,,https://www.mycoportal.org/portal/collections/individual/index.php?occid=4331430
4331431,Protozoa|Myxomycota,Protozoa,Myxomycota,,,Stemonitidaceae,Stemonitis axifera,655009,Stemonitis,,"Hoskins, John Hobart",,1932-00-00,1932,0,0,,,,United States,Michigan,Berrien,,"Berrien County, Michigan",41.995778,-86.685421,,,https://www.mycoportal.org/portal/collections/individual/index.php?occid=4331431
4331433,Protozoa|Myxomycota,Protozoa,Myxomycota,,,Stemonitidaceae,Stemonitis axifera,655009,Stemonitis,,"Ayers, John H.",,8/8/32,1932,8,8,221,,rotten log,United States,Ohio,Hamilton,Milford,Milford,39.175338,-84.294382,,,https://www.mycoportal.org/portal/collections/individual/index.php?occid=4331433
4331435,Protozoa|Myxomycota,Protozoa,Myxomycota,,,Stemonitidaceae,Stemonitis axifera,655009,Stemonitis,,"Ayers, John H.",,10/7/33,1933,10,7,280,,rotten log,United States,Ohio,Hamilton,Dunlap,near Dunlap,39.292279,-84.618002,,,https://www.mycoportal.org/portal/collections/individual/index.php?occid=4331435
4331437,Protozoa|Myxomycota,Protozoa,Myxomycota,,,Stemonitidaceae,Stemonitis axifera,655009,Stemonitis,,"Hoskins, John Hobart",,1931-07-00,1931,7,0,,,,United States,Indiana,Saint Joseph,South Bend,"South Bend, Notre Dame, St. Mary's Ravine",41.699276,-86.234901,,,https://www.mycoportal.org/portal/collections/individual/index.php?occid=4331437
4331450,Protozoa|Myxomycota,Protozoa,Myxomycota,,,Stemonitidaceae,Stemonitis fenestrata,655048,Stemonitis,,"Hoskins, John Hobart",,1932-07-00,1931,7,0,,,,United States,Michigan,Houghton,Winona,Winona,46.874379,-88.907356,,,https://www.mycoportal.org/portal/collections/individual/index.php?occid=4331450
4331453,Protozoa|Myxomycota,Protozoa,Myxomycota,,,Stemonitidaceae,Stemonitis axifera,655009,Stemonitis,,"Hoskins, John Hobart",,1932-00-00,1932,0,0,,,,United States,Michigan,Houghton,Winona,Winona,46.874379,-88.907356,,,https://www.mycoportal.org/portal/collections/individual/index.php?occid=4331453
4331462,Protozoa|Myxomycota,Protozoa,Myxomycota,,,Stemonitidaceae,Stemonitis flavogenita,655053,Stemonitis,,"Cooke, William Bridge",,11/6/32,1932,11,6,311,,dead wood,United States,Ohio,Hamilton,Cincinnati,Polk Run,39.247745,-84.29431,,,https://www.mycoportal.org/portal/collections/individual/index.php?occid=4331462
4331467,Protozoa|Myxomycota,Protozoa,Myxomycota,,,Stemonitidaceae,Stemonitis axifera,655009,Stemonitis,,"Hoskins, John Hobart",,1932-00-00,1932,0,0,,,,United States,Michigan,Berrien,,"Berrien County, Michigan",41.995778,-86.685421,,,https://www.mycoportal.org/portal/collections/individual/index.php?occid=4331467
4331470,Protozoa|Myxomycota,Protozoa,Myxomycota,,,Stemonitidaceae,Stemonitis axifera,655009,Stemonitis,,"Hoskins, John Hobart",,1932-00-00,1932,0,0,,,,United States,Michigan,Berrien,,"Berrien County, Michigan",41.995778,-86.685421,,,https://www.mycoportal.org/portal/collections/individual/index.php?occid=4331470
4331472,Protozoa|Myxomycota,Protozoa,Myxomycota,,,Stemonitidaceae,Stemonitis axifera,655009,Stemonitis,,"Ayers, John H.",,9/9/33,1933,9,9,252,,rotten log,United States,Ohio,Hamilton,Cincinnati,Mt. Airy Forest,39.165058,-84.574945,,,https://www.mycoportal.org/portal/collections/individual/index.php?occid=4331472
4331475,Protozoa|Myxomycota,Protozoa,Myxomycota,,,Stemonitidaceae,Stemonitis axifera,655009,Stemonitis,,"Ayers, John H.",,9/9/33,1933,9,9,252,,rotten log,United States,Ohio,Hamilton,Cincinnati,Mt. Airy Forest,39.165058,-84.574945,,,https://www.mycoportal.org/portal/collections/individual/index.php?occid=4331475
4331481,Protozoa|Myxomycota,Protozoa,Myxomycota,,,Stemonitidaceae,Stemonitis fenestrata,655048,Stemonitis,,"Ayers, John H.",,9/24/32,1932,9,24,268,,rotten log,United States,Ohio,Hamilton,Cincinnati,Hazelwood,39.266169,-84.362996,,,https://www.mycoportal.org/portal/collections/individual/index.php?occid=4331481
4331482,Protozoa|Myxomycota,Protozoa,Myxomycota,,,Stemonitidaceae,Stemonitis axifera,655009,Stemonitis,,"Hoskins, John Hobart",,1931-00-00,1931,0,0,,,,United States,Indiana,Saint Joseph,South Bend,"South Bend, Notre Dame",41.699276,-86.234901,,,https://www.mycoportal.org/portal/collections/individual/index.php?occid=4331482
4331497,Protozoa|Myxomycota|Myxomycetes|Physarales|Physaraceae|Fuligo,Protozoa,Myxomycota,Myxomycetes,Physarales,Physaraceae,Fuligo cinerea,617059,Fuligo,,"Sanders, P.J.",,7/3/64,1964,7,3,185,wooded hillside,log,United States,Ohio,Hamilton,Cincinnati,Center Hill Life Science Field Station,39.196066,-84.508607,,,https://www.mycoportal.org/portal/collections/individual/index.php?occid=4331497
4331502,Protozoa|Myxomycota|Myxomycetes|Physarales|Physaraceae|Fuligo,Protozoa,Myxomycota,Myxomycetes,Physarales,Physaraceae,Fuligo cinerea,617059,Fuligo,,"Sanders, P.J.",,8/1/64,1964,8,1,214,thinly wooded area,moist end of dead log,United States,Ohio,Hamilton,Cincinnati,Center Hill Life Science Field Station,39.196066,-84.508607,,,https://www.mycoportal.org/portal/collections/individual/index.php?occid=4331502
4331506,Protozoa|Myxomycota,Protozoa,Myxomycota,,,,Myxomycetes,617004,,,s.n.,,1929-10-00,1929,10,0,,,,United States,Ohio,Hamilton,Cincinnati,"Cincinnati, Kroger Hills",39.150157,-84.32093,,,https://www.mycoportal.org/portal/collections/individual/index.php?occid=4331506
4331513,Protozoa|Myxomycota|Myxomycetes|Physarales|Physaraceae|Fuligo,Protozoa,Myxomycota,Myxomycetes,Physarales,Physaraceae,Fuligo septica,345943,Fuligo,,"Sanders, P.J.",,7/3/64,1964,7,3,185,wooded hillside,log,United States,Ohio,Hamilton,Cincinnati,Center Hill Life Science Field Station,39.196066,-84.508607,,,https://www.mycoportal.org/portal/collections/individual/index.php?occid=4331513
4331516,Fungi|Ascomycota|Pezizomycotina|Sordariomycetes|Xylariomycetidae|Xylariales|Xylariaceae|Daldinia,Fungi,Ascomycota,Sordariomycetes,Xylariales,Xylariaceae,Daldinia concentrica,164607,Daldinia,,"Manley, M.L.",,10/16/38,1938,10,16,289,,on log,United States,Ohio,Adams,Mineral Springs,Mineral Springs,38.887016,-83.329354,,,https://www.mycoportal.org/portal/collections/individual/index.php?occid=4331516
4331523,Fungi|Ascomycota|Pezizomycotina|Sordariomycetes|Xylariomycetidae|Xylariales|Xylariaceae|Daldinia,Fungi,Ascomycota,Sordariomycetes,Xylariales,Xylariaceae,Daldinia concentrica,164607,Daldinia,,"Cooke, William Bridge",,8/13/33,1933,8,13,225,,dead wood,United States,Ohio,Clermont,Miami Township,Horner Run,39.197552,-84.275404,,,https://www.mycoportal.org/portal/collections/individual/index.php?occid=4331523
4331528,Fungi|Ascomycota|Pezizomycotina|Sordariomycetes|Xylariomycetidae|Xylariales|Xylariaceae|Daldinia,Fungi,Ascomycota,Sordariomycetes,Xylariales,Xylariaceae,Daldinia concentrica,164607,Daldinia,,"Cobbe, Thomas J.",,10/16/38,1938,10,16,289,,log,United States,Ohio,Adams,Mineral Springs,Mineral Springs; 38.887016 -83.329354,38.887016,-83.329354,,,https://www.mycoportal.org/portal/collections/individual/index.php?occid=4331528
4331531,Fungi|Ascomycota|Pezizomycotina|Sordariomycetes|Xylariomycetidae|Xylariales|Xylariaceae|Daldinia,Fungi,Ascomycota,Sordariomycetes,Xylariales,Xylariaceae,Daldinia concentrica,164607,Daldinia,,"Cooke, William Bridge",,10/17/35,1935,10,17,290,,,United States,Ohio,Hamilton,Dunlap,Dunlap,39.29222,-84.61806,,,https://www.mycoportal.org/portal/collections/individual/index.php?occid=4331531
4331534,Fungi|Ascomycota|Pezizomycotina|Sordariomycetes|Xylariomycetidae|Xylariales|Xylariaceae|Daldinia,Fungi,Ascomycota,Sordariomycetes,Xylariales,Xylariaceae,Daldinia concentrica,164607,Daldinia,,"Beckman, J.",,10/4/34,1934,10,4,277,,"on dead, decorticated tree",United States,Ohio,Hamilton,Cincinnati,"Cincinnati, O.M.I. (Ohio Mechanics Institute) grounds",39.162004,-84.456886,,,https://www.mycoportal.org/portal/collections/individual/index.php?occid=4331534
4331539,Fungi|Ascomycota|Pezizomycotina|Sordariomycetes|Xylariomycetidae|Xylariales|Xylariaceae|Daldinia,Fungi,Ascomycota,Sordariomycetes,Xylariales,Xylariaceae,Daldinia concentrica,164607,Daldinia,,"Cooke, William Bridge",,12/5/33,1933,12,5,339,,dead beech log,United States,Ohio,Highland,Seven Caves,Seven Caves (Highlands Nature Sanctuary),39.344508,-83.59742,,,https://www.mycoportal.org/portal/collections/individual/index.php?occid=4331539
4331542,Fungi|Ascomycota|Pezizomycotina|Sordariomycetes|Sordariomycetidae|Boliniales|Boliniaceae|Bolinia,Fungi,Ascomycota,Sordariomycetes,Boliniales,Boliniaceae,Bolinia tubulina,117047,Bolinia,,"Cooke, William Bridge",,11/24/32,1932,11,24,329,,dead white oak,United States,Ohio,Clermont,Branch Hill Terrace,Branch Hill Terrace,39.24617,-84.293271,,,https://www.mycoportal.org/portal/collections/individual/index.php?occid=4331542
4331546,Fungi|Ascomycota|Pezizomycotina|Sordariomycetes|Sordariomycetidae|Sordariales|Chaetomiaceae|Chaetomium,Fungi,Ascomycota,Sordariomycetes,Sordariales,Chaetomiaceae,Chaetomium olivaceum,135931,Chaetomium,,"Fulford, Margaret H.",,9/27/29,1929,9,27,270,,decayed log,United States,Ohio,Hamilton,Cincinnati,Kroger Hills,39.150157,-84.32093,,,https://www.mycoportal.org/portal/collections/individual/index.php?occid=4331546
4331552,Fungi|Ascomycota|Pezizomycotina|Sordariomycetes|Sordariomycetidae|Sordariales|Chaetomiaceae|Chaetomium,Fungi,Ascomycota,Sordariomycetes,Sordariales,Chaetomiaceae,Chaetomium olivaceum,135931,Chaetomium,,"Fulford, Margaret H.",,9/27/29,1929,9,27,270,,,United States,Ohio,Hamilton,Cincinnati,Kroger Hills,39.150157,-84.32093,,,https://www.mycoportal.org/portal/collections/individual/index.php?occid=4331552
4331555,Fungi|Ascomycota|Pezizomycotina|Sordariomycetes|Xylariomycetidae|Xylariales|Xylariaceae|Daldinia,Fungi,Ascomycota,Sordariomycetes,Xylariales,Xylariaceae,Daldinia concentrica,164607,Daldinia,,"Fulford, Margaret H.",,10/18/29,1929,10,18,291,,decayed beech log,United States,Ohio,Clermont,Milford,Milford,39.175338,-84.294382,,,https://www.mycoportal.org/portal/collections/individual/index.php?occid=4331555
4331557,Fungi|Ascomycota|Pezizomycotina|Sordariomycetes|Xylariomycetidae|Xylariales|Xylariaceae|Daldinia,Fungi,Ascomycota,Sordariomycetes,Xylariales,Xylariaceae,Daldinia concentrica,164607,Daldinia,,"Fulford, Margaret H.",,6/12/34,1934,6,12,163,,log,United States,North Carolina,Jackson,,Whiteside Mountain,35.080925,-83.138203,,,https://www.mycoportal.org/portal/collections/individual/index.php?occid=4331557
4331559,Fungi|Ascomycota|Pezizomycotina|Dothideomycetes|Botryosphaeriales|Botryosphaeriaceae|Botryosphaeria,Fungi,Ascomycota,Dothideomycetes,Botryosphaeriales,Botryosphaeriaceae,Botryosphaeria fuliginosa,117755,Botryosphaeria,,"Cooke, William Bridge",,3/13/37,1937,3,13,72,,"on Rhus copallina twigs killed by winter (""winter-killed"")",United States,Ohio,Warren,Hopkinsville,Hopkinsville,39.338948,-84.219659,,,https://www.mycoportal.org/portal/collections/individual/index.php?occid=4331559
4331565,Fungi|Ascomycota|Pezizomycotina|Sordariomycetes|Xylariomycetidae|Xylariales|Xylariaceae|Daldinia,Fungi,Ascomycota,Sordariomycetes,Xylariales,Xylariaceae,Daldinia concentrica,164607,Daldinia,,"Sanders, P.J.",,7/25/64,1964,7,25,207,,log crossing a ravine,United States,Ohio,Hamilton,Cincinnati,Center Hill Life Science Field Station,39.196066,-84.508607,,,https://www.mycoportal.org/portal/collections/individual/index.php?occid=4331565
4331568,Fungi|Ascomycota|Pezizomycotina|Sordariomycetes|Xylariomycetidae|Xylariales|Xylariaceae|Daldinia,Fungi,Ascomycota,Sordariomycetes,Xylariales,Xylariaceae,Daldinia concentrica,164607,Daldinia,,"Stephenson, H.",,10/14/29,1929,10,14,287,,cherry branch,United States,Ohio,Hamilton,Montgomery,Hazelwood Preserve (Harris M. Benedict Nature Preserve/Johnson Preserve),39.261725,-84.353273,,,https://www.mycoportal.org/portal/collections/individual/index.php?occid=4331568
4331575,Fungi|Ascomycota|Pezizomycotina|Sordariomycetes|Xylariomycetidae|Xylariales|Xylariaceae|Daldinia,Fungi,Ascomycota,Sordariomycetes,Xylariales,Xylariaceae,Daldinia concentrica,164607,Daldinia,,"Muhlberg, J.",,10/6/31,1931,10,6,279,,,United States,Ohio,Hamilton,Cincinnati,"Cincinnati, College Hill",39.20228,-84.547166,,,https://www.mycoportal.org/portal/collections/individual/index.php?occid=4331575
4331577,Fungi|Ascomycota|Pezizomycotina|Sordariomycetes|Xylariomycetidae|Xylariales|Xylariaceae|Daldinia,Fungi,Ascomycota,Sordariomycetes,Xylariales,Xylariaceae,Daldinia concentrica,164607,Daldinia,,"Thompson, I.",,10/15/38,1938,10,15,288,,tree,United States,Ohio,Adams,Beaver Pond,Beaver Pond,38.939515,-83.346299,,,https://www.mycoportal.org/portal/collections/individual/index.php?occid=4331577
4331580,Fungi|Ascomycota|Pezizomycotina|Sordariomycetes|Xylariomycetidae|Xylariales|Xylariaceae|Daldinia,Fungi,Ascomycota,Sordariomycetes,Xylariales,Xylariaceae,Daldinia concentrica,164607,Daldinia,,"Cooke, William Bridge",,7/8/36,1936,7,8,190,,old Quercus,United States,California,Marin,,Mt. Tamalpais,37.927425,-122.591924,533,,https://www.mycoportal.org/portal/collections/individual/index.php?occid=4331580
4331582,Fungi|Ascomycota|Pezizomycotina|Sordariomycetes|Xylariomycetidae|Xylariales|Xylariaceae|Daldinia,Fungi,Ascomycota,Sordariomycetes,Xylariales,Xylariaceae,Daldinia concentrica,164607,Daldinia,,"Baur, Kay",,10/15/32,1932,10,15,289,,on log,United States,Kentucky,Boone,Camp Ernst,Camp Ernst,38.999505,-84.724669,,,https://www.mycoportal.org/portal/collections/individual/index.php?occid=4331582
4331584,Fungi|Ascomycota|Pezizomycotina|Sordariomycetes|Xylariomycetidae|Xylariales|Xylariaceae|Daldinia,Fungi,Ascomycota,Sordariomycetes,Xylariales,Xylariaceae,Daldinia concentrica,164607,Daldinia,,"Cooke, William Bridge",,9/26/35,1935,9,26,269,,,United States,Ohio,Hamilton,Cincinnati,"Cincinnati, Rapid Transit Bed",39.162004,-84.456886,,,https://www.mycoportal.org/portal/collections/individual/index.php?occid=4331584
4331585,Fungi|Ascomycota|Pezizomycotina|Sordariomycetes|Xylariomycetidae|Xylariales|Xylariaceae|Daldinia,Fungi,Ascomycota,Sordariomycetes,Xylariales,Xylariaceae,Daldinia concentrica,164607,Daldinia,,"Cooke, William Bridge",,11/24/35,1935,11,24,328,,,United States,Ohio,Clermont,Branch Hill,Branch Hill,39.24617,-84.293271,,,https://www.mycoportal.org/portal/collections/individual/index.php?occid=4331585
4331592,Fungi|Ascomycota|Pezizomycotina|Sordariomycetes|Xylariomycetidae|Xylariales|Xylariaceae|Daldinia,Fungi,Ascomycota,Sordariomycetes,Xylariales,Xylariaceae,Daldinia concentrica,164607,Daldinia,,"Cooke, William Bridge",,10/8/35,1935,10,8,281,,,United States,Ohio,Hamilton,California,"Cincinnati, California",39.065339,-84.423274,,,https://www.mycoportal.org/portal/collections/individual/index.php?occid=4331592
4331594,Fungi|Ascomycota|Pezizomycotina|Sordariomycetes|Xylariomycetidae|Xylariales|Xylariaceae|Daldinia,Fungi,Ascomycota,Sordariomycetes,Xylariales,Xylariaceae,Daldinia concentrica,164607,Daldinia,,"Lillick, Lois",,10/15/33,1933,10,15,288,,dead log,United States,Kentucky,Boone,,"Boone County, Kentucky",38.969864,-84.727866,,,https://www.mycoportal.org/portal/collections/individual/index.php?occid=4331594
4331597,Fungi|Ascomycota|Pezizomycotina|Sordariomycetes|Xylariomycetidae|Xylariales|Xylariaceae|Daldinia,Fungi,Ascomycota,Sordariomycetes,Xylariales,Xylariaceae,Daldinia concentrica,164607,Daldinia,,"Phinney, Harry Kenyon",,10/5/40,1940,10,5,279,,on log,United States,Kentucky,Wolfe,Tight Holler,Tight Holler,37.757859,-83.641068,,,https://www.mycoportal.org/portal/collections/individual/index.php?occid=4331597
4331601,Fungi|Ascomycota|Pezizomycotina|Sordariomycetes|Xylariomycetidae|Xylariales|Xylariaceae|Daldinia,Fungi,Ascomycota,Sordariomycetes,Xylariales,Xylariaceae,Daldinia concentrica,164607,Daldinia,,"Diehl, George",,6/22/32,1932,6,22,174,,dead wood,United States,Ohio,Hamilton,Cincinnati,Westwood,39.14867,-84.599389,,,https://www.mycoportal.org/portal/collections/individual/index.php?occid=4331601
4331606,Fungi|Ascomycota|Pezizomycotina|Sordariomycetes|Xylariomycetidae|Xylariales|Diatrypaceae|Anthostoma,Fungi,Ascomycota,Sordariomycetes,Xylariales,Diatrypaceae,Anthostoma grandineum,97698,Anthostoma,,"Cooke, William Bridge",,12/25/32,1932,12,25,360,,"beech branches, inner bark",United States,Ohio,Clermont,Dark Hollow,Dark Hollow,39.113281,-84.796747,,,https://www.mycoportal.org/portal/collections/individual/index.php?occid=4331606
4331611,Fungi|Ascomycota|Pezizomycotina|Sordariomycetes|Xylariomycetidae|Xylariales|Xylariaceae|Daldinia,Fungi,Ascomycota,Sordariomycetes,Xylariales,Xylariaceae,Daldinia occidentalis,164641,Daldinia,,"Parks, H.E.",,1931-05-00,1931,5,0,,,on Alnus rubra log,United States,California,Humboldt,Trinidad,Trinidad,41.059291,-124.143125,,,https://www.mycoportal.org/portal/collections/individual/index.php?occid=4331611
4331630,Protozoa|Myxomycota|Myxomycetes|Trichiales,Protozoa,Myxomycota,Myxomycetes,Trichiales,Trichiaceae,Perichaena depressa,646738,Perichaena,,"Ayers, John H.",,10/15/32,1932,10,15,289,,inside of bark,United States,Ohio,Hamilton,Cincinnati,College Hill,39.20228,-84.547166,,,https://www.mycoportal.org/portal/collections/individual/index.php?occid=4331630
4331641,Protozoa|Myxomycota|Myxomycetes|Trichiales|Arcyriaceae,Protozoa,Myxomycota,Myxomycetes,Trichiales,Arcyriaceae,Arcyria ferruginea,628072,Arcyria,,"Sanders, P.J.",,6/23/64,1964,6,23,175,,dead grape vine in moist ravine bank,United States,Ohio,Hamilton,Cincinnati,Center Hill Life Science Field Station,39.196066,-84.508607,,,https://www.mycoportal.org/portal/collections/individual/index.php?occid=4331641
4331654,Protozoa|Myxomycota|Myxomycetes|Trichiales|Arcyriaceae,Protozoa,Myxomycota,Myxomycetes,Trichiales,Arcyriaceae,Arcyria incarnata,628095,Arcyria,,"Ayers, John H.",,1933-02-00,1933,2,0,,,rotten log,United States,Ohio,Hamilton,Cincinnati,University of Cincinnati,39.131448,-84.516332,,,https://www.mycoportal.org/portal/collections/individual/index.php?occid=4331654
4331658,Protozoa|Myxomycota|Myxomycetes|Trichiales|Arcyriaceae,Protozoa,Myxomycota,Myxomycetes,Trichiales,Arcyriaceae,Arcyria incarnata,628095,Arcyria,,"Ayers, John H.",,10/7/33,1933,10,7,280,,rotten log,United States,Ohio,Hamilton,Dunlap,Dunlap,39.292279,-84.618002,,,https://www.mycoportal.org/portal/collections/individual/index.php?occid=4331658
4331662,Protozoa|Myxomycota|Myxomycetes|Trichiales|Arcyriaceae,Protozoa,Myxomycota,Myxomycetes,Trichiales,Arcyriaceae,Arcyria oerstedii,628124,Arcyria,,"Ayers, John H.",,8/8/32,1932,8,8,221,,rotten log,United States,Ohio,Hamilton,Milford,Milford,39.175338,-84.294382,,,https://www.mycoportal.org/portal/collections/individual/index.php?occid=4331662
4331668,Protozoa|Myxomycota|Myxomycetes|Trichiales|Arcyriaceae,Protozoa,Myxomycota,Myxomycetes,Trichiales,Arcyriaceae,Arcyria incarnata,628095,Arcyria,,"Fulford, Margaret H.",,10/18/29,1929,10,18,291,,log,United States,Ohio,Hamilton,Montgomery,Hazelwood Preserve (Harris M. Benedict Nature Preserve/Johnson Preserve),39.261725,-84.353273,,,https://www.mycoportal.org/portal/collections/individual/index.php?occid=4331668
4331675,Protozoa|Myxomycota|Myxomycetes|Trichiales|Arcyriaceae,Protozoa,Myxomycota,Myxomycetes,Trichiales,Arcyriaceae,Arcyria incarnata,628095,Arcyria,,"Fulford, Margaret H.",,10/4/29,1929,10,4,277,,bark,United States,Ohio,Hamilton,Montgomery,Hazelwood Preserve (Harris M. Benedict Nature Preserve/Johnson Preserve),39.261725,-84.353273,,,https://www.mycoportal.org/portal/collections/individual/index.php?occid=4331675
4331680,Protozoa|Myxomycota|Myxomycetes|Trichiales,Protozoa,Myxomycota,Myxomycetes,Trichiales,Trichiaceae,Perichaena depressa,646738,Perichaena,,"Ayers, John H.",,10/15/32,1932,10,15,289,,inside of bark,United States,Ohio,Hamilton,Cincinnati,College Hill,39.20228,-84.547166,,,https://www.mycoportal.org/portal/collections/individual/index.php?occid=4331680
4331687,Protozoa|Myxomycota|Myxomycetes|Trichiales|Arcyriaceae,Protozoa,Myxomycota,Myxomycetes,Trichiales,Arcyriaceae,Arcyria incarnata,628095,Arcyria,,"Fulford, Margaret H.",,1929-00-00,1929,0,0,,,log,United States,Ohio,Hamilton,Cincinnati,"California, Waterworks",39.065339,-84.423274,,,https://www.mycoportal.org/portal/collections/individual/index.php?occid=4331687
4331695,Protozoa|Myxomycota|Myxomycetes|Trichiales|Arcyriaceae,Protozoa,Myxomycota,Myxomycetes,Trichiales,Arcyriaceae,Arcyria incarnata,628095,Arcyria,,"Hoskins, John Hobart",,1931-00-00,1931,0,0,,,rotten log,United States,Indiana,Saint Joseph,South Bend,South Bend,41.683381,-86.250007,,,https://www.mycoportal.org/portal/collections/individual/index.php?occid=4331695
4331699,Protozoa|Myxomycota|Myxomycetes|Trichiales,Protozoa,Myxomycota,Myxomycetes,Trichiales,Trichiaceae,Perichaena depressa,646738,Perichaena,,"Ayers, John H.",,10/15/32,1932,10,15,289,,inside of bark,United States,Ohio,Hamilton,Cincinnati,College Hill,39.20228,-84.547166,,,https://www.mycoportal.org/portal/collections/individual/index.php?occid=4331699
4331702,Protozoa|Myxomycota|Myxomycetes|Trichiales|Arcyriaceae,Protozoa,Myxomycota,Myxomycetes,Trichiales,Arcyriaceae,Arcyria oerstedii,628124,Arcyria,,"Ayers, John H.",,1933-05-00,1933,5,0,,,rotten log,United States,Ohio,Hamilton,Cincinnati,Kroger Hill,39.150157,-84.32093,,,https://www.mycoportal.org/portal/collections/individual/index.php?occid=4331702
4331705,Protozoa|Myxomycota|Myxomycetes|Trichiales|Arcyriaceae,Protozoa,Myxomycota,Myxomycetes,Trichiales,Arcyriaceae,Arcyria oerstedii,628124,Arcyria,,"Ayers, John H.",,1933-05-00,1933,5,0,,,rotten log,United States,Ohio,Hamilton,Cincinnati,Kroger Hills,39.150157,-84.32093,,,https://www.mycoportal.org/portal/collections/individual/index.php?occid=4331705
4331713,Protozoa|Myxomycota|Myxomycetes|Trichiales|Arcyriaceae,Protozoa,Myxomycota,Myxomycetes,Trichiales,Arcyriaceae,Arcyria nutans,628121,Arcyria,,"Hoskins, John Hobart",,1931-00-00,1931,0,0,,,rotten log,United States,Indiana,Saint Joseph,South Bend,South Bend,41.683381,-86.250007,,,https://www.mycoportal.org/portal/collections/individual/index.php?occid=4331713
4331714,Protozoa|Myxomycota|Myxomycetes|Trichiales|Arcyriaceae,Protozoa,Myxomycota,Myxomycetes,Trichiales,Arcyriaceae,Arcyria incarnata,628095,Arcyria,,"Ayers, John H.",,9/8/33,1933,9,8,251,,rotten log,United States,Kentucky,Boone,Anderson's Ferry,Anderson's Ferry,36.695877,-87.17028,,,https://www.mycoportal.org/portal/collections/individual/index.php?occid=4331714
4331717,Protozoa|Myxomycota|Myxomycetes|Trichiales|Arcyriaceae,Protozoa,Myxomycota,Myxomycetes,Trichiales,Arcyriaceae,Arcyria nutans,628121,Arcyria,,"Ayers, John H.",,8/16/32,1932,8,16,229,,rotten log,United States,Ohio,Hamilton,Terrace Park,Given Road,39.159227,-84.30716,,,https://www.mycoportal.org/portal/collections/individual/index.php?occid=4331717
4331720,Protozoa|Myxomycota|Myxomycetes|Trichiales|Arcyriaceae,Protozoa,Myxomycota,Myxomycetes,Trichiales,Arcyriaceae,Arcyria,100187,Arcyria,,"Cobbe, Thomas J.",,10/16/39,1939,10,16,289,,wet logs,United States,Ohio,Adams,Mineral Springs,Mineral Springs,38.887016,-83.329354,,,https://www.mycoportal.org/portal/collections/individual/index.php?occid=4331720
4331726,Protozoa|Myxomycota,Protozoa,Myxomycota,,,Trichiaceae,Lachnobolus occidentalis,640556,Lachnobolus,,"Cooke, William Bridge",,10/28/32,1932,10,28,302,,dead wood,United States,Ohio,Hamilton,Cincinnati,Kroger Hill,39.150157,-84.32093,,,https://www.mycoportal.org/portal/collections/individual/index.php?occid=4331726
4331729,Protozoa|Myxomycota|Myxomycetes|Trichiales|Arcyriaceae,Protozoa,Myxomycota,Myxomycetes,Trichiales,Arcyriaceae,Arcyria,100187,Arcyria,,"Hopkins, W.C.",,11/5/38,1938,11,5,309,,dead wood,United States,Ohio,Hamilton,Cincinnati,Kroger Hills,39.150157,-84.32093,,,https://www.mycoportal.org/portal/collections/individual/index.php?occid=4331729
4331735,Protozoa|Myxomycota|Myxomycetes|Trichiales|Arcyriaceae,Protozoa,Myxomycota,Myxomycetes,Trichiales,Arcyriaceae,Arcyria digitata,628066,Arcyria,,"Ayers, John H.",,9/9/33,1933,9,9,252,,rotten log,United States,Ohio,Hamilton,Cincinnati,Mt. Airy Forest,39.165058,-84.574945,,,https://www.mycoportal.org/portal/collections/individual/index.php?occid=4331735
4331739,Protozoa|Myxomycota|Myxomycetes|Trichiales|Arcyriaceae,Protozoa,Myxomycota,Myxomycetes,Trichiales,Arcyriaceae,Arcyria nutans,628121,Arcyria,,"Hoskins, John Hobart",,1931-00-00,1931,0,0,,,rotten log,United States,Indiana,Saint Joseph,South Bend,South Bend,41.683381,-86.250007,,,https://www.mycoportal.org/portal/collections/individual/index.php?occid=4331739
4331741,Protozoa|Myxomycota|Myxomycetes|Trichiales|Arcyriaceae,Protozoa,Myxomycota,Myxomycetes,Trichiales,Arcyriaceae,Arcyria incarnata,628095,Arcyria,,"Ayers, John H.",,9/8/33,1933,9,8,251,,rotten log,United States,Kentucky,Boone,Anderson's Ferry,Anderson's Ferry,36.695877,-87.17028,,,https://www.mycoportal.org/portal/collections/individual/index.php?occid=4331741
4331746,Protozoa|Myxomycota|Myxomycetes|Trichiales|Arcyriaceae,Protozoa,Myxomycota,Myxomycetes,Trichiales,Arcyriaceae,Arcyria incarnata,628095,Arcyria,,"Povah, A.",,5/24/30,1930,5,24,144,,conifer log,United States,Kentucky,Wolfe,Natural Bridge,Natural Bridge,37.772584,-83.684358,,,https://www.mycoportal.org/portal/collections/individual/index.php?occid=4331746
4331749,Protozoa|Myxomycota,Protozoa,Myxomycota,,,Arcyriaceae,Lachnobolus globosus,640554,Lachnobolus,,"Braun, E. Lucy",,7/7/32,1932,7,7,189,,on chestnut bur,United States,Kentucky,Harlan,,Big Black Mountain,36.91426,-82.893773,,,https://www.mycoportal.org/portal/collections/individual/index.php?occid=4331749
4331756,Protozoa|Myxomycota|Myxomycetes|Trichiales|Arcyriaceae,Protozoa,Myxomycota,Myxomycetes,Trichiales,Arcyriaceae,Arcyria incarnata,628095,Arcyria,,"Lloyd, Curtis Gates",,1928-05-00,1928,5,0,,,,United States,Kentucky,Grant,Crittenden,Crittenden,38.782844,-84.605221,,,https://www.mycoportal.org/portal/collections/individual/index.php?occid=4331756
4331757,Protozoa|Myxomycota|Myxomycetes|Trichiales|Arcyriaceae,Protozoa,Myxomycota,Myxomycetes,Trichiales,Arcyriaceae,Arcyria incarnata,628095,Arcyria,,"Cooke, William Bridge",,7/31/46,1946,7,31,212,,Shasta fir tree,United States,California,Siskiyou,Mt. Shasta,"Horse Camp, Mt. Shasta",41.37252,-122.23153,2438,,https://www.mycoportal.org/portal/collections/individual/index.php?occid=4331757
4338586,Protozoa|Myxomycota,Protozoa,Myxomycota,,,Stemonitidaceae,Comatricha typhoides,632433,Comatricha,,"Lloyd, Curtis Gates",,1928-05-00,1928,5,0,,,,United States,Kentucky,Grant,Crittenden,Crittenden,38.782844,-84.605221,,,https://www.mycoportal.org/portal/collections/individual/index.php?occid=4338586
4338590,Protozoa|Myxomycota|Myxomycetes,Protozoa,Myxomycota,Myxomycetes,,Cribrariaceae,Dictydium cancellatum,634697,Dictydium,,"Lloyd, Curtis Gates",,1910-00-00,1910,0,0,,,,United States,Kentucky,Grant,Crittenden,Crittenden,38.782844,-84.605221,,,https://www.mycoportal.org/portal/collections/individual/index.php?occid=4338590
4338604,Protozoa|Myxomycota,Protozoa,Myxomycota,,,Stemonitidaceae,Lamproderma arcyrionema,640894,Lamproderma,,"Ayers, John H.",,7/28/32,1932,7,28,210,,rotten log,United States,Ohio,Hamilton,Cincinnati,Kroger Hills,39.150157,-84.32093,,,https://www.mycoportal.org/portal/collections/individual/index.php?occid=4338604
4338609,Protozoa|Myxomycota,Protozoa,Myxomycota,,,Stemonitidaceae,Lamproderma arcyrionema,640894,Lamproderma,,"Ayers, John H.",,7/28/32,1932,7,28,210,,rotten log,United States,Ohio,Hamilton,Cincinnati,Kroger Hills,39.150157,-84.32093,,,https://www.mycoportal.org/portal/collections/individual/index.php?occid=4338609
4338612,Protozoa|Myxomycota,Protozoa,Myxomycota,,,Stemonitidaceae,Lamproderma violaceum,640969,Lamproderma,,"Fulford, Margaret H.",,1929-10-00,1929,10,0,,,wood,United States,Ohio,Hamilton,Cincinnati,"Given Road, Terrace Park",39.159227,-84.30716,,,https://www.mycoportal.org/portal/collections/individual/index.php?occid=4338612
4338614,Protozoa|Myxomycota,Protozoa,Myxomycota,,,Stemonitidaceae,Lamproderma violaceum,640969,Lamproderma,,"Fulford, Margaret H.",,1929-10-00,1929,10,0,,,rotten log in woods,United States,Ohio,Hamilton,Cincinnati,"Given Road, Terrace Park",39.159227,-84.30716,,,https://www.mycoportal.org/portal/collections/individual/index.php?occid=4338614
4338617,Protozoa|Myxomycota,Protozoa,Myxomycota,,,Stemonitidaceae,Lamproderma violaceum,640969,Lamproderma,,"Fulford, Margaret H.",,1929-10-00,1929,10,0,,,rotten log in woods,United States,Ohio,Hamilton,Cincinnati,"Given Road, Terrace Park",39.159227,-84.30716,,,https://www.mycoportal.org/portal/collections/individual/index.php?occid=4338617
4338619,Protozoa|Myxomycota|Myxomycetes,Protozoa,Myxomycota,Myxomycetes,,Tubiferaceae,Tubifera ferruginosa,657429,Tubifera,,"Hoskins, John Hobart",,7/14/32,1932,7,14,196,,mossy log,United States,Michigan,Grand Traverse,Interlochen,Interlochen,44.644723,-85.7673,,,https://www.mycoportal.org/portal/collections/individual/index.php?occid=4338619
4338624,Protozoa|Myxomycota|Myxomycetes,Protozoa,Myxomycota,Myxomycetes,,Tubiferaceae,Enteridium rozeanum,636271,Enteridium,,"Cooke, William Bridge",,12/25/32,1932,12,25,360,,dead log,United States,Ohio,Clermont,Dark Hollow,Dark Hollow,38.915352,-82.693222,,,https://www.mycoportal.org/portal/collections/individual/index.php?occid=4338624
4338626,Protozoa|Myxomycota,Protozoa,Myxomycota,,,Stemonitidaceae,Comatricha typhoides,632433,Comatricha,,"Ayers, John H.",,8/28/32,1932,8,28,241,,Rotten wood,United States,Ohio,Hamilton,Cincinnati,"Cincinnati, Kroger Hills",39.150157,-84.32093,,,https://www.mycoportal.org/portal/collections/individual/index.php?occid=4338626
4338629,Protozoa|Myxomycota|Myxomycetes,Protozoa,Myxomycota,Myxomycetes,,Tubiferaceae,Tubifera ferruginosa,657429,Tubifera,,"Diehl, George",,1932-07-00,1932,7,0,,,rotten log,United States,Ohio,Hamilton,Cincinnati,Westwood,39.14867,-84.599389,,,https://www.mycoportal.org/portal/collections/individual/index.php?occid=4338629
4338631,Protozoa|Myxomycota|Myxomycetes|Liceales|Cribrariaceae,Protozoa,Myxomycota,Myxomycetes,Liceales,Cribrariaceae,Cribraria dictydioides,633360,Cribraria,,"Ayers, John H.",,9/8/33,1933,9,8,251,,rotten log,United States,Kentucky,Boone,Anderson's Ferry,Anderson's Ferry,36.695877,-87.17028,,,https://www.mycoportal.org/portal/collections/individual/index.php?occid=4338631
4338632,Protozoa|Myxomycota,Protozoa,Myxomycota,,,Stemonitidaceae,Comatricha longa,632379,Comatricha,,"Ayers, John H.",,1933-03-00,1933,3,0,,,on log in lab,United States,Ohio,Hamilton,Cincinnati,University of Cincinnati,39.131448,-84.516332,,,https://www.mycoportal.org/portal/collections/individual/index.php?occid=4338632
4338634,Protozoa|Myxomycota|Myxomycetes,Protozoa,Myxomycota,Myxomycetes,,Tubiferaceae,Enteridium rozeanum,636271,Enteridium,,"Ayers, John H.",,1932-08-00,1932,8,0,,,rotten log,United States,Ohio,Hamilton,Cincinnati,Cincinnati,39.162004,-84.456886,,,https://www.mycoportal.org/portal/collections/individual/index.php?occid=4338634
4338636,Protozoa|Myxomycota,Protozoa,Myxomycota,,,Stemonitidaceae,Comatricha typhoides,632433,Comatricha,,"Ayers, John H.",,9/9/33,1933,9,9,252,,Rotten wood,United States,Ohio,Hamilton,Cincinnati,"Cincinnati, Mt. Airy Forest",39.165058,-84.574945,,,https://www.mycoportal.org/portal/collections/individual/index.php?occid=4338636
4338638,Protozoa|Myxomycota,Protozoa,Myxomycota,,,Stemonitidaceae,Comatricha longa,632379,Comatricha,,"Ayers, John H.",,1933-03-00,1933,3,0,,,on log in lab,United States,Ohio,Hamilton,Cincinnati,University of Cincinnati,39.131448,-84.516332,,,https://www.mycoportal.org/portal/collections/individual/index.php?occid=4338638
4338640,Protozoa|Myxomycota,Protozoa,Myxomycota,,,Stemonitidaceae,Comatricha typhoides,632433,Comatricha,,"Ayers, John H.",,9/9/33,1933,9,9,252,,rotten log,United States,Ohio,Hamilton,Cincinnati,Mt. Airy Forest,39.165058,-84.574945,,,https://www.mycoportal.org/portal/collections/individual/index.php?occid=4338640
4338642,Protozoa|Myxomycota|Myxomycetes,Protozoa,Myxomycota,Myxomycetes,,Tubiferaceae,Tubifera ferruginosa,657429,Tubifera,,"Hoskins, John Hobart",,7/14/32,1932,7,14,196,,mossy log,United States,Michigan,Grand Traverse,Interlochen,Interlochen,44.644723,-85.7673,,,https://www.mycoportal.org/portal/collections/individual/index.php?occid=4338642
4338644,Protozoa|Myxomycota,Protozoa,Myxomycota,,,Stemonitidaceae,Comatricha typhoides,632433,Comatricha,,"Ayers, John H.",,8/28/32,1932,8,28,241,,rotten log,United States,Ohio,Hamilton,Cincinnati,Kroger Hills,39.150157,-84.32093,,,https://www.mycoportal.org/portal/collections/individual/index.php?occid=4338644
4338646,Protozoa|Myxomycota|Myxomycetes,Protozoa,Myxomycota,Myxomycetes,,Cribrariaceae,Dictydium cancellatum,634697,Dictydium,,"Ayers, John H.",,8/13/32,1932,8,13,226,,rotten log,United States,Ohio,Hamilton,Cincinnati,"Given Road, Terrace Park",39.159227,-84.30716,,,https://www.mycoportal.org/portal/collections/individual/index.php?occid=4338646
4338647,Protozoa|Myxomycota,Protozoa,Myxomycota,,,Stemonitidaceae,Comatricha typhoides,632433,Comatricha,,"Hoskins, John Hobart",,8/16/32,1932,8,16,229,,Rotten wood,United States,Ohio,Hamilton,Cincinnati,"Cincinnati, Hazelwood",39.266169,-84.362996,,,https://www.mycoportal.org/portal/collections/individual/index.php?occid=4338647
4338652,Protozoa|Myxomycota|Myxomycetes|Liceales|Cribrariaceae,Protozoa,Myxomycota,Myxomycetes,Liceales,Cribrariaceae,Cribraria dictydioides,633360,Cribraria,,"Ayers, John H.",,8/13/32,1932,8,13,226,,rotten log,United States,Ohio,Hamilton,Cincinnati,"Given Road, Terrace Park",39.159227,-84.30716,,,https://www.mycoportal.org/portal/collections/individual/index.php?occid=4338652
4338654,Protozoa|Myxomycota|Myxomycetes,Protozoa,Myxomycota,Myxomycetes,,Cribrariaceae,Dictydium cancellatum,634697,Dictydium,,"Ayers, John H.",,9/8/33,1933,9,8,251,,rotten log,United States,Kentucky,Boone,Anderson's Ferry,Anderson's Ferry,36.695877,-87.17028,,,https://www.mycoportal.org/portal/collections/individual/index.php?occid=4338654
4340703,Protozoa|Myxomycota,Protozoa,Myxomycota,,,Stemonitidaceae,Comatricha longa,632379,Comatricha,,"Ayers, John H.",,9/9/33,1933,9,9,252,,soil,United States,Ohio,Hamilton,Cincinnati,Mt. Airy Forest,39.165058,-84.574945,,,https://www.mycoportal.org/portal/collections/individual/index.php?occid=4340703
4340705,Protozoa|Myxomycota,Protozoa,Myxomycota,,,Stemonitidaceae,Comatricha typhoides,632433,Comatricha,,"Ayers, John H.",,7/28/32,1932,7,28,210,,Rotten wood,United States,Ohio,Hamilton,Cincinnati,"Cincinnati, Kroger Hills",39.150157,-84.32093,,,https://www.mycoportal.org/portal/collections/individual/index.php?occid=4340705
4340707,Protozoa|Myxomycota|Myxomycetes,Protozoa,Myxomycota,Myxomycetes,,Tubiferaceae,Enteridium rozeanum,636271,Enteridium,,"Ayers, John H.",,11/5/32,1932,11,5,310,,old log,United States,Ohio,Hamilton,Cincinnati,California,39.065339,-84.423274,,,https://www.mycoportal.org/portal/collections/individual/index.php?occid=4340707
4340709,Protozoa|Myxomycota,Protozoa,Myxomycota,,,Stemonitidaceae,Lamproderma violaceum,640969,Lamproderma,,"Fulford, Margaret H.",,1929-10-00,1929,10,0,,,rotten log in woods,United States,Ohio,Hamilton,Cincinnati,"Given Road, Terrace Park",39.159227,-84.30716,,,https://www.mycoportal.org/portal/collections/individual/index.php?occid=4340709
4340711,Protozoa|Myxomycota,Protozoa,Myxomycota,,,Stemonitidaceae,Comatricha typhoides,632433,Comatricha,,"Ayers, John H.",,8/8/32,1932,8,8,221,,Rotten wood,United States,Ohio,Hamilton,Milford,Milford,39.175338,-84.294382,,,https://www.mycoportal.org/portal/collections/individual/index.php?occid=4340711
4340714,Protozoa|Myxomycota|Myxomycetes,Protozoa,Myxomycota,Myxomycetes,,Tubiferaceae,Enteridium olivaceum,636269,Enteridium,,"Cooke, William Bridge",,7/26/39,1939,7,26,207,,on Pinus albicaulis,United States,California,Siskiyou,Mt. Shasta,"Mt. Shasta, on summit trail",41.40932,-122.195009,2743,,https://www.mycoportal.org/portal/collections/individual/index.php?occid=4340714
4340716,Protozoa|Myxomycota|Myxomycetes,Protozoa,Myxomycota,Myxomycetes,,Tubiferaceae,Enteridium olivaceum,636269,Enteridium,,"Cooke, William Bridge",,6/20/38,1938,6,20,171,,on Shasta fir,United States,California,Siskiyou,,"Horse Camp, Mt. Shasta",41.37252,-122.23153,2438,,https://www.mycoportal.org/portal/collections/individual/index.php?occid=4340716
4340725,Protozoa|Myxomycota|Mycetozoa|Amoebozoa|Myxogastrea|Stemonitida|Stemonitidaceae|Lamproderma,Protozoa,Amoebozoa,Myxogastrea,Stemonitida,Stemonitidaceae,Lamproderma sauteri,617064,Lamproderma,,"Cooke, William Bridge",,7/23/41,1941,7,23,204,,on Chrysothamnus bloomeri var. angustatus,United States,California,Siskiyou,Mt. Shasta,"Horse camp, Mt. Shasta",41.37252,-122.23153,2438,,https://www.mycoportal.org/portal/collections/individual/index.php?occid=4340725
4340728,Protozoa|Myxomycota,Protozoa,Myxomycota,,,Stemonitidaceae,Comatricha suksdorfii,632429,Comatricha,,"Cooke, William Bridge",,8/7/37,1937,8,7,219,,Shasta fir bark,United States,California,Siskiyou,Mt. Shasta,"Sand Flats, Mt. Shasta",41.352358,-122.249312,2134,,https://www.mycoportal.org/portal/collections/individual/index.php?occid=4340728
4340730,Protozoa|Myxomycota|Myxomycetes|Liceales|Cribrariaceae,Protozoa,Myxomycota,Myxomycetes,Liceales,Cribrariaceae,Cribraria argillacea,633344,Cribraria,,"Cooke, William Bridge",,8/10/38,1938,8,10,222,,on Shasta fir,United States,California,Siskiyou,Mt. Shasta,"Horse camp, Mt. Shasta",41.37252,-122.23153,2438,,https://www.mycoportal.org/portal/collections/individual/index.php?occid=4340730
4340731,Protozoa|Myxomycota,Protozoa,Myxomycota,,,Stemonitidaceae,Comatricha pacifica,632402,Comatricha,,"Cooke, William Bridge",,7/5/39,1939,7,5,186,,on Shasta fir,United States,California,Siskiyou,Mt. Shasta,"Horse camp, Mt. Shasta",41.37252,-122.23153,2438,,https://www.mycoportal.org/portal/collections/individual/index.php?occid=4340731
4340734,Protozoa|Myxomycota|Myxomycetes,Protozoa,Myxomycota,Myxomycetes,,Tubiferaceae,Enteridium olivaceum,636269,Enteridium,,"Cooke, William Bridge",,7/3/40,1940,7,3,185,,on Shasta fir,United States,California,Siskiyou,Mt. Shasta,"Horse camp, Mt. Shasta",41.37252,-122.23153,2438,,https://www.mycoportal.org/portal/collections/individual/index.php?occid=4340734
4340738,Protozoa|Myxomycota|Myxomycetes|Trichiales|Trichiaceae|Trichia,Protozoa,Myxomycota,Myxomycetes,Trichiales,Trichiaceae,Trichia varia,617068,Trichia,,"Murphy, J.",,10/11/34,1934,10,11,284,,dead log,United States,Ohio,Hamilton,Cincinnati,Kroger Hills,39.150157,-84.32093,,,https://www.mycoportal.org/portal/collections/individual/index.php?occid=4340738
4340742,Protozoa|Myxomycota|Myxomycetes|Trichiales|Trichiaceae|Trichia,Protozoa,Myxomycota,Myxomycetes,Trichiales,Trichiaceae,Trichia varia,617068,Trichia,,"McCafferty, Pat",,10/21/32,1932,10,21,295,,,United States,Ohio,Hamilton,Cincinnati,"Cincinnati, College Hill",39.20228,-84.547166,,,https://www.mycoportal.org/portal/collections/individual/index.php?occid=4340742
4340747,Protozoa|Myxomycota|Myxomycetes|Trichiales|Trichiaceae|Trichia,Protozoa,Myxomycota,Myxomycetes,Trichiales,Trichiaceae,Trichia varia,617068,Trichia,,"Ayers, John H.",,10/7/33,1933,10,7,280,,Rotten wood,United States,Ohio,Hamilton,Dunlap,Dunlap,39.292279,-84.618002,,,https://www.mycoportal.org/portal/collections/individual/index.php?occid=4340747
4340754,Protozoa|Myxomycota|Myxomycetes|Trichiales|Trichiaceae|Trichia,Protozoa,Myxomycota,Myxomycetes,Trichiales,Trichiaceae,Trichia varia,617068,Trichia,,"Ayers, John H.",,1932-10-00,1932,10,0,,,rotten log,United States,Ohio,Hamilton,Cincinnati,Kroger Hills,39.150157,-84.32093,,,https://www.mycoportal.org/portal/collections/individual/index.php?occid=4340754
4340755,Protozoa|Myxomycota|Myxomycetes|Trichiales|Trichiaceae|Trichia,Protozoa,Myxomycota,Myxomycetes,Trichiales,Trichiaceae,Trichia varia,617068,Trichia,,"Ayers, John H.",,11/5/32,1932,11,5,310,,Rotten wood,United States,Ohio,Hamilton,Cincinnati,"Cincinnati, California",39.065339,-84.423274,,,https://www.mycoportal.org/portal/collections/individual/index.php?occid=4340755
4340756,Protozoa|Myxomycota|Myxomycetes|Trichiales|Trichiaceae|Trichia,Protozoa,Myxomycota,Myxomycetes,Trichiales,Trichiaceae,Trichia varia,617068,Trichia,,"Ayers, John H.",,7/28/32,1932,7,28,210,,rotten log,United States,Ohio,Hamilton,Cincinnati,Kroger Hills,39.150157,-84.32093,,,https://www.mycoportal.org/portal/collections/individual/index.php?occid=4340756
4340758,Protozoa|Myxomycota|Myxomycetes|Trichiales|Trichiaceae|Trichia,Protozoa,Myxomycota,Myxomycetes,Trichiales,Trichiaceae,Trichia varia,617068,Trichia,,"Ayers, John H.",,9/24/32,1932,9,24,268,,rotten log,United States,Ohio,Hamilton,Cincinnati,Hazelwood,39.266169,-84.362996,,,https://www.mycoportal.org/portal/collections/individual/index.php?occid=4340758
4340761,Protozoa|Myxomycota|Myxomycetes|Trichiales,Protozoa,Myxomycota,Myxomycetes,Trichiales,Trichiaceae,Trichia persimilis,656896,Trichia,,"Hoskins, John Hobart",,1931-00-00,1931,0,0,,,,United States,Indiana,Saint Joseph,South Bend,South Bend,41.683381,-86.250007,,,https://www.mycoportal.org/portal/collections/individual/index.php?occid=4340761
4340762,Protozoa|Myxomycota|Myxomycetes|Trichiales,Protozoa,Myxomycota,Myxomycetes,Trichiales,Trichiaceae,Trichia persimilis,656896,Trichia,,Stevens,Cook,1933-00-00,1933,0,0,,,rotten log,United States,Ohio,Hamilton,Cincinnati,Kroger Hills,39.150157,-84.32093,,,https://www.mycoportal.org/portal/collections/individual/index.php?occid=4340762
4340763,Protozoa|Myxomycota|Myxomycetes|Trichiales|Trichiaceae|Trichia,Protozoa,Myxomycota,Myxomycetes,Trichiales,Trichiaceae,Trichia botrytis,477389,Trichia,,"Phinney, Harry Kenyon",,10/5/40,1940,10,5,279,,rotten log in creek bed,United States,Kentucky,Wolfe,Tight Holler,Tight Holler,37.757859,-83.641068,,,https://www.mycoportal.org/portal/collections/individual/index.php?occid=4340763
4340766,Protozoa|Myxomycota|Myxomycetes|Trichiales|Trichiaceae|Trichia,Protozoa,Myxomycota,Myxomycetes,Trichiales,Trichiaceae,Trichia varia,617068,Trichia,,"Fulford, Margaret H.",,9/27/29,1929,9,27,270,,log,United States,Ohio,Hamilton,Cincinnati,Kroger Hills,39.150157,-84.32093,,,https://www.mycoportal.org/portal/collections/individual/index.php?occid=4340766
4340767,Protozoa|Myxomycota|Myxomycetes|Trichiales,Protozoa,Myxomycota,Myxomycetes,Trichiales,Trichiaceae,Trichia persimilis,656896,Trichia,,"Ayers, John H.",,11/5/32,1932,11,5,310,,Rotten wood,United States,Ohio,Hamilton,Cincinnati,"Cincinnati, California",39.065339,-84.423274,,,https://www.mycoportal.org/portal/collections/individual/index.php?occid=4340767
4340768,Protozoa|Myxomycota|Myxomycetes|Trichiales|Trichiaceae|Trichia,Protozoa,Myxomycota,Myxomycetes,Trichiales,Trichiaceae,Trichia varia,617068,Trichia,,"Fulford, Margaret H.",,9/4/29,1929,9,4,247,,rotten log,United States,Ohio,Hamilton,Cincinnati,Hazelwood,39.266169,-84.362996,,,https://www.mycoportal.org/portal/collections/individual/index.php?occid=4340768
4340769,Protozoa|Myxomycota|Myxomycetes|Trichiales|Trichiaceae|Trichia,Protozoa,Myxomycota,Myxomycetes,Trichiales,Trichiaceae,Trichia varia,617068,Trichia,,"Ayers, John H.",,10/15/32,1932,10,15,289,,rotten log,United States,Ohio,Hamilton,Cincinnati,College Hill,39.20228,-84.547166,,,https://www.mycoportal.org/portal/collections/individual/index.php?occid=4340769
4340773,Protozoa|Myxomycota|Myxomycetes|Trichiales,Protozoa,Myxomycota,Myxomycetes,Trichiales,Trichiaceae,Trichia persimilis,656896,Trichia,,"Hoskins, John Hobart",,1931-00-00,1931,0,0,,,rotten log,United States,Indiana,Saint Joseph,South Bend,South Bend,41.683381,-86.250007,,,https://www.mycoportal.org/portal/collections/individual/index.php?occid=4340773
4340774,Protozoa|Myxomycota|Myxomycetes|Trichiales,Protozoa,Myxomycota,Myxomycetes,Trichiales,Trichiaceae,Trichia persimilis,656896,Trichia,,"Ayers, John H.",,10/15/32,1932,10,15,289,,rotten log,United States,Ohio,Hamilton,Cincinnati,College Hill,39.20228,-84.547166,,,https://www.mycoportal.org/portal/collections/individual/index.php?occid=4340774
4340777,Protozoa|Myxomycota|Myxomycetes|Trichiales,Protozoa,Myxomycota,Myxomycetes,Trichiales,Trichiaceae,Trichia favoginea,656810,Trichia,,"Ayers, John H.",,8/16/32,1932,8,16,229,,Rotten wood,United States,Ohio,Hamilton,Cincinnati,"Cincinnati, Hazelwood",39.266169,-84.362996,,,https://www.mycoportal.org/portal/collections/individual/index.php?occid=4340777
4340779,Protozoa|Myxomycota|Myxomycetes|Trichiales,Protozoa,Myxomycota,Myxomycetes,Trichiales,Trichiaceae,Trichia favoginea,656810,Trichia,,"Ayers, John H.",,1931-10-00,1931,10,0,,,rotten log,United States,Ohio,Hamilton,Cincinnati,Given Road,39.159227,-84.30716,,,https://www.mycoportal.org/portal/collections/individual/index.php?occid=4340779
4340781,Protozoa|Myxomycota|Myxomycetes|Trichiales|Trichiaceae|Trichia,Protozoa,Myxomycota,Myxomycetes,Trichiales,Trichiaceae,Trichia varia,617068,Trichia,,"Ayers, John H.",,1932-10-00,1932,10,0,,,old log,United States,Ohio,Hamilton,Cincinnati,Kroger Hills,39.150157,-84.32093,,,https://www.mycoportal.org/portal/collections/individual/index.php?occid=4340781
4340782,Protozoa|Myxomycota|Myxomycetes|Trichiales,Protozoa,Myxomycota,Myxomycetes,Trichiales,Trichiaceae,Oligonema nitens,645404,Oligonema,,"Ayers, John H.",,8/8/32,1932,8,8,221,,Rotten wood,United States,Ohio,Hamilton,Milford,Milford,39.175338,-84.294382,,,https://www.mycoportal.org/portal/collections/individual/index.php?occid=4340782
4340785,Protozoa|Myxomycota|Myxomycetes|Trichiales|Trichiaceae|Trichia,Protozoa,Myxomycota,Myxomycetes,Trichiales,Trichiaceae,Trichia varia,617068,Trichia,,"Fulford, Margaret H.",,9/27/29,1929,9,27,270,,log in woods,United States,Ohio,Hamilton,Cincinnati,Kroger Hills,39.150157,-84.32093,,,https://www.mycoportal.org/portal/collections/individual/index.php?occid=4340785
4340787,Protozoa|Myxomycota|Myxomycetes|Trichiales,Protozoa,Myxomycota,Myxomycetes,Trichiales,Trichiaceae,Trichia favoginea,656810,Trichia,,"Fulford, Margaret H.",,1929-00-00,1929,0,0,,,rotten log,United States,Ohio,Hamilton,Cincinnati,Kroger Hills,39.150157,-84.32093,,,https://www.mycoportal.org/portal/collections/individual/index.php?occid=4340787
4340788,Protozoa|Myxomycota|Myxomycetes|Trichiales|Trichiaceae|Trichia,Protozoa,Myxomycota,Myxomycetes,Trichiales,Trichiaceae,Trichia decipiens,617069,Trichia,,"Cooke, William Bridge",,11/12/37,1937,11,12,316,,rotten conifer,United States,Oregon,Benton,Greasy Creek,"Greasy Creek, Alsea Mt., near Waldport Highway",44.437175,-123.476869,,,https://www.mycoportal.org/portal/collections/individual/index.php?occid=4340788
4340793,Fungi|Ascomycota|Pezizomycotina|Leotiomycetes|Leotiomycetidae|Erysiphales|Erysiphaceae|Erysiphe,Fungi,Ascomycota,Leotiomycetes,Erysiphales,Erysiphaceae,Erysiphe cichoracearum,497175,Erysiphe,,"Cooke, William Bridge",,9/26/35,1935,9,26,269,,on leaves of Solidago sp.,United States,Ohio,Hamilton,Cincinnati,Duck Creek,39.114272,-84.400264,,,https://www.mycoportal.org/portal/collections/individual/index.php?occid=4340793
4340795,Fungi|Ascomycota|Pezizomycotina|Leotiomycetes|Leotiomycetidae|Erysiphales|Erysiphaceae|Uncinula,Fungi,Ascomycota,Leotiomycetes,Erysiphales,Erysiphaceae,Uncinula salicis,550730,Uncinula,,"Povah, A.H.",,8/19/14,1914,8,19,231,,on Salix sp.,United States,Michigan,Chippewa,Vermilion,Vermilion,46.762522,-85.150103,,,https://www.mycoportal.org/portal/collections/individual/index.php?occid=4340795
4340798,Fungi|Ascomycota|Pezizomycotina|Leotiomycetes|Leotiomycetidae|Erysiphales|Erysiphaceae|Uncinula,Fungi,Ascomycota,Leotiomycetes,Erysiphales,Erysiphaceae,Uncinula salicis,550730,Uncinula,,"Cooke, William Bridge",,10/1/35,1935,10,1,274,,on leaves of Salix sp.,United States,Ohio,Hamilton,Cincinnati,Polk Run,39.260628,-84.310779,,,https://www.mycoportal.org/portal/collections/individual/index.php?occid=4340798
4340801,Fungi|Basidiomycota|Pucciniomycotina|Pucciniomycetes|Septobasidiales|Septobasidiaceae|Glenospora,Fungi,Basidiomycota,Pucciniomycetes,Septobasidiales,Septobasidiaceae,Glenospora curtisii,226896,Glenospora,,"Lillick, Lois",,10/18/32,1932,10,18,292,,on Gledistria triacanthus,United States,Ohio,Hamilton,Addyston,Addyston,39.136725,-84.709114,,,https://www.mycoportal.org/portal/collections/individual/index.php?occid=4340801
4340803,Fungi|Ascomycota|Pezizomycotina|Leotiomycetes|Leotiomycetidae|Erysiphales|Erysiphaceae|Erysiphe,Fungi,Ascomycota,Leotiomycetes,Erysiphales,Erysiphaceae,Erysiphe polygoni,217061,Erysiphe,,"Cooke, William Bridge",,9/26/35,1935,9,26,269,,on leaves of Polygonum aviculare,United States,Ohio,Hamilton,Cincinnati,Duck Creek,39.114272,-84.400264,,,https://www.mycoportal.org/portal/collections/individual/index.php?occid=4340803
4340805,Fungi|Ascomycota|Pezizomycotina|Leotiomycetes|Leotiomycetidae|Erysiphales|Erysiphaceae|Erysiphe,Fungi,Ascomycota,Leotiomycetes,Erysiphales,Erysiphaceae,Erysiphe polygoni,217061,Erysiphe,,"Cooke, William Bridge",,9/26/35,1935,9,26,269,,on leaves of Trifolium repens,United States,Ohio,Hamilton,Cincinnati,Duck Creek,39.114272,-84.400264,,,https://www.mycoportal.org/portal/collections/individual/index.php?occid=4340805
4340807,Fungi|Ascomycota|Pezizomycotina|Leotiomycetes|Leotiomycetidae|Erysiphales|Erysiphaceae|Erysiphe,Fungi,Ascomycota,Leotiomycetes,Erysiphales,Erysiphaceae,Erysiphe cichoracearum,497175,Erysiphe,,"Cooke, William Bridge",,9/26/35,1935,9,26,269,,on leaves of Plantago major,United States,Ohio,Hamilton,Cincinnati,Duck Creek,39.114272,-84.400264,,,https://www.mycoportal.org/portal/collections/individual/index.php?occid=4340807
4340808,Fungi|Ascomycota|Pezizomycotina|Leotiomycetes|Leotiomycetidae|Erysiphales|Erysiphaceae|Erysiphe,Fungi,Ascomycota,Leotiomycetes,Erysiphales,Erysiphaceae,Erysiphe cichoracearum,497175,Erysiphe,,"Cooke, William Bridge",,1934-04-00,1934,4,0,,,on Hydrophyllum sp.,United States,Ohio,Highland,Seven Caves,Seven Caves (Highlands Nature Sanctuary),39.344508,-83.59742,,,https://www.mycoportal.org/portal/collections/individual/index.php?occid=4340808
4340809,Fungi|Ascomycota|Pezizomycotina|Leotiomycetes|Leotiomycetidae|Erysiphales|Erysiphaceae|Microsphaera,Fungi,Ascomycota,Leotiomycetes,Erysiphales,Erysiphaceae,Microsphaera alni,292819,Microsphaera,,"Cooke, William Bridge",,9/6/35,1935,9,6,249,,on Syringa sp.,United States,Ohio,Warren,Maineville,Maineville,39.315059,-84.22077,,,https://www.mycoportal.org/portal/collections/individual/index.php?occid=4340809
4340810,Fungi|Ascomycota|Pezizomycotina|Dothideomycetes|Dothideomycetidae|Capnodiales|Capnodiaceae|Scorias,Fungi,Ascomycota,Dothideomycetes,Capnodiales,Capnodiaceae,Scorias spongiosa,189108,Scorias,,"Cooke, William Bridge",,4/30/33,1933,4,30,120,,on beech leaves on ground,United States,Ohio,Highland,Seven Caves,Seven Caves (Highlands Nature Sanctuary),39.344508,-83.59742,,,https://www.mycoportal.org/portal/collections/individual/index.php?occid=4340810
4340811,Fungi|Ascomycota|Pezizomycotina|Dothideomycetes|Dothideomycetidae|Capnodiales|Capnodiaceae|Scorias,Fungi,Ascomycota,Dothideomycetes,Capnodiales,Capnodiaceae,Scorias spongiosa,189108,Scorias,,"Cooke, William Bridge",,3/25/33,1933,3,25,84,Beech forest,on beech leaves on forest floor,United States,Ohio,Hamilton,Newtown,Newtown,39.124505,-84.361606,,,https://www.mycoportal.org/portal/collections/individual/index.php?occid=4340811
4340812,Fungi|Ascomycota|Pezizomycotina|Leotiomycetes|Leotiomycetidae|Erysiphales|Erysiphaceae|Erysiphe,Fungi,Ascomycota,Leotiomycetes,Erysiphales,Erysiphaceae,Erysiphe cichoracearum,497175,Erysiphe,,"Cooke, William Bridge",,9/26/35,1935,9,26,269,,on leaves of Solidago sp.,United States,Ohio,Hamilton,Cincinnati,Duck Creek,39.114272,-84.400264,,,https://www.mycoportal.org/portal/collections/individual/index.php?occid=4340812
4340813,Fungi|Ascomycota|Pezizomycotina|Leotiomycetes|Leotiomycetidae|Erysiphales|Erysiphaceae|Microsphaera,Fungi,Ascomycota,Leotiomycetes,Erysiphales,Erysiphaceae,Microsphaera lonicerae,292912,Microsphaera,,"Cooke, William Bridge",,11/8/33,1933,11,8,312,,on Lonicera sp.,United States,Ohio,Clermont,,Camp Friedlander,39.215892,-84.284382,,,https://www.mycoportal.org/portal/collections/individual/index.php?occid=4340813
4340814,Fungi|Ascomycota|Pezizomycotina|Dothideomycetes|Dothideomycetidae|Capnodiales|Capnodiaceae,Fungi,Ascomycota,Dothideomycetes,Capnodiales,Capnodiaceae,Capnodium,12764,Capnodium,,"Cooke, William Bridge",,5/1/37,1937,5,1,121,,on Smilax sp.,United States,Ohio,Jackson,Rock Run,Rock Run,39.0671,-82.700343,,,https://www.mycoportal.org/portal/collections/individual/index.php?occid=4340814
4340815,Fungi|Ascomycota|Pezizomycotina|Leotiomycetes|Leotiomycetidae|Erysiphales|Erysiphaceae|Erysiphe,Fungi,Ascomycota,Leotiomycetes,Erysiphales,Erysiphaceae,Erysiphe communis,216779,Erysiphe,,"Cooke, William Bridge",,9/26/35,1935,9,26,269,,,United States,Ohio,Hamilton,Cincinnati,Duck Creek,39.114272,-84.400264,,,https://www.mycoportal.org/portal/collections/individual/index.php?occid=4340815
4340816,Fungi|Ascomycota|Pezizomycotina|Leotiomycetes|Leotiomycetidae|Erysiphales|Erysiphaceae|Microsphaera,Fungi,Ascomycota,Leotiomycetes,Erysiphales,Erysiphaceae,Microsphaera alni,292819,Microsphaera,,"Cooke, William Bridge",,9/26/35,1935,9,26,269,,on lilac leaves,United States,Ohio,Hamilton,Cincinnati,Duck Creek,39.114272,-84.400264,,,https://www.mycoportal.org/portal/collections/individual/index.php?occid=4340816
4340817,Fungi|Ascomycota|Pezizomycotina|Leotiomycetes|Leotiomycetidae|Erysiphales|Erysiphaceae|Microsphaera,Fungi,Ascomycota,Leotiomycetes,Erysiphales,Erysiphaceae,Microsphaera elevata,292871,Microsphaera,,"Cooke, William Bridge",,9/26/35,1935,9,26,269,,on leaves of Catalpa sp.,United States,Ohio,Hamilton,Cincinnati,Walnut Hills,39.114604,-84.486068,,,https://www.mycoportal.org/portal/collections/individual/index.php?occid=4340817
4345861,Protozoa|Myxomycota|Myxomycetes|Physarales|Physaraceae|Physarum,Protozoa,Myxomycota,Myxomycetes,Physarales,Physaraceae,Physarum aureum,648888,Physarum,,"Beckman, J.",,1934-00-00,1934,0,0,,,on decaying wood,United States,Ohio,Hamilton,Cincinnati,"Cincinnati, O.M.I. grounds",39.162004,-84.456886,,,https://www.mycoportal.org/portal/collections/individual/index.php?occid=4345861
4345867,Protozoa|Myxomycota|Myxomycetes|Physarales|Physaraceae|Physarum,Protozoa,Myxomycota,Myxomycetes,Physarales,Physaraceae,Physarum atrum,648882,Physarum,,"Braun, E. Lucy",,8/21/10,1910,8,21,233,,in excavations,United States,Ohio,Hamilton,Cincinnati,"Cincinnati, Prehistoric Cemetery",39.162004,-84.456886,,,https://www.mycoportal.org/portal/collections/individual/index.php?occid=4345867
4345873,Protozoa|Myxomycota|Myxomycetes|Physarales|Physaraceae|Physarum,Protozoa,Myxomycota,Myxomycetes,Physarales,Physaraceae,Physarum globuliferum,477420,Physarum,,"Braun, E. Lucy",,9/14/10,1910,9,14,257,,,United States,Ohio,Hamilton,Cincinnati,Cincinnati,39.162004,-84.456886,,,https://www.mycoportal.org/portal/collections/individual/index.php?occid=4345873
4345877,Protozoa|Myxomycota|Myxomycetes|Physarales|Physaraceae|Physarum,Protozoa,Myxomycota,Myxomycetes,Physarales,Physaraceae,Physarum cinereum,648933,Physarum,,"Hoskins, John Hobart",,9/7/33,1933,9,7,250,,Grass,United States,Ohio,Hamilton,Cincinnati,University of Cincinnati campus,39.131448,-84.516332,,,https://www.mycoportal.org/portal/collections/individual/index.php?occid=4345877
4345879,Protozoa|Myxomycota|Myxomycetes|Physarales|Physaraceae|Badhamia,Protozoa,Myxomycota,Myxomycetes,Physarales,Physaraceae,Badhamia affinis,628994,Badhamia,,"Cooke, William Bridge",,7/31/32,1932,7,31,213,,dead wood,United States,Ohio,Highland,Seven Caves,Seven Caves (Highlands Nature Sanctuary),39.344508,-83.59742,,,https://www.mycoportal.org/portal/collections/individual/index.php?occid=4345879
4345880,Protozoa|Myxomycota,Protozoa,Myxomycota,,,Physaraceae,Physarum penetrale,649136,Physarum,,"Ayers, John H.",,8/16/32,1932,8,16,229,,rotten log,United States,Ohio,Hamilton,Cincinnati,Hazelwood,39.266169,-84.362996,,,https://www.mycoportal.org/portal/collections/individual/index.php?occid=4345880
4345881,Protozoa|Myxomycota,Protozoa,Myxomycota,,,Physaraceae,Physarum pulcherrimum,649157,Physarum,,"Ayers, John H.",,10/7/33,1933,10,7,280,,rotten conifer,United States,Ohio,Hamilton,Dunlap,Dunlap,39.292279,-84.618002,,,https://www.mycoportal.org/portal/collections/individual/index.php?occid=4345881
4345882,Protozoa|Myxomycota|Myxomycetes|Physarales|Physaraceae|Physarum,Protozoa,Myxomycota,Myxomycetes,Physarales,Physaraceae,Physarum globuliferum,477420,Physarum,,"Ayers, John H.",,8/16/32,1932,8,16,229,,old log,United States,Ohio,Hamilton,Cincinnati,Hazelwood,39.266169,-84.362996,,,https://www.mycoportal.org/portal/collections/individual/index.php?occid=4345882
4345883,Protozoa|Myxomycota|Myxomycetes|Physarales|Physaraceae|Physarum,Protozoa,Myxomycota,Myxomycetes,Physarales,Physaraceae,Physarum nutans,649115,Physarum,,"Ayers, John H.",,8/8/32,1932,8,8,221,,old log,United States,Ohio,Hamilton,Milford,Milford,39.175338,-84.294382,,,https://www.mycoportal.org/portal/collections/individual/index.php?occid=4345883
4345884,Protozoa|Myxomycota,Protozoa,Myxomycota,,,Physaraceae,Physarum pulcherrimum,649157,Physarum,,"Braun, E. Lucy",,8/6/13,1913,8,6,218,,logs,United States,Ohio,Adams,,"Adams County, Ohio",38.845515,-83.472152,,,https://www.mycoportal.org/portal/collections/individual/index.php?occid=4345884
4345885,Protozoa|Myxomycota,Protozoa,Myxomycota,,,Physaraceae,Physarum pulcherrimum,649157,Physarum,,"Braun, E. Lucy",,8/6/13,1913,8,6,218,,logs,United States,Ohio,Adams,,"Adams County, Ohio",38.845515,-83.472152,,,https://www.mycoportal.org/portal/collections/individual/index.php?occid=4345885
4345891,Protozoa|Myxomycota|Myxomycetes|Physarales|Physaraceae|Physarum,Protozoa,Myxomycota,Myxomycetes,Physarales,Physaraceae,Physarum viride,477320,Physarum,,"Ayers, John H.",,9/9/33,1933,9,9,252,,old log,United States,Ohio,Hamilton,Cincinnati,Mt. Airy Forest,39.165058,-84.574945,,,https://www.mycoportal.org/portal/collections/individual/index.php?occid=4345891
4345893,Protozoa|Myxomycota|Myxomycetes|Physarales|Physaraceae|Physarum,Protozoa,Myxomycota,Myxomycetes,Physarales,Physaraceae,Physarum viride,477320,Physarum,,"Ayers, John H.",,7/28/32,1932,7,28,210,,rotten log,United States,Ohio,Hamilton,Cincinnati,Kroger Hills,39.150157,-84.32093,,,https://www.mycoportal.org/portal/collections/individual/index.php?occid=4345893
4345905,Protozoa|Myxomycota,Protozoa,Myxomycota,,,Physaraceae,Physarum tenerum,649220,Physarum,,"Cooke, William Bridge",,7/31/32,1932,7,31,213,,dead wood,United States,Ohio,Highland,Seven Caves,Seven Caves (Highlands Nature Sanctuary),39.344508,-83.59742,,,https://www.mycoportal.org/portal/collections/individual/index.php?occid=4345905
4345909,Protozoa|Myxomycota|Myxomycetes|Physarales|Physaraceae|Physarum,Protozoa,Myxomycota,Myxomycetes,Physarales,Physaraceae,Physarum globuliferum,477420,Physarum,,"Ayers, John H.",,9/24/32,1932,9,24,268,,old log,United States,Ohio,Hamilton,Cincinnati,Hazelwood,39.266169,-84.362996,,,https://www.mycoportal.org/portal/collections/individual/index.php?occid=4345909
4345911,Protozoa|Myxomycota|Myxomycetes|Physarales|Physaraceae|Physarum,Protozoa,Myxomycota,Myxomycetes,Physarales,Physaraceae,Physarum polycephalum,617117,Physarum,,"Ayers, John H.",,11/5/32,1932,11,5,310,,rotten beech log,United States,Ohio,Hamilton,Cincinnati,California,39.065339,-84.423274,,,https://www.mycoportal.org/portal/collections/individual/index.php?occid=4345911
4345913,Protozoa|Myxomycota|Myxomycetes|Physarales|Physaraceae|Physarum,Protozoa,Myxomycota,Myxomycetes,Physarales,Physaraceae,Physarum polycephalum,617117,Physarum,,"Cooke, William Bridge",,9/18/32,1932,9,18,262,,dead wood,United States,Ohio,Highland,Seven Caves,Seven Caves (Highlands Nature Sanctuary),39.344508,-83.59742,,,https://www.mycoportal.org/portal/collections/individual/index.php?occid=4345913
4345915,Protozoa|Myxomycota|Myxomycetes|Physarales|Physaraceae|Physarum,Protozoa,Myxomycota,Myxomycetes,Physarales,Physaraceae,Physarum polycephalum,617117,Physarum,,"Ayers, John H.",,11/5/32,1932,11,5,310,,rotten log,United States,Ohio,Hamilton,Cincinnati,California,39.065339,-84.423274,,,https://www.mycoportal.org/portal/collections/individual/index.php?occid=4345915
4345916,Protozoa|Myxomycota|Myxomycetes|Physarales|Physaraceae|Physarum,Protozoa,Myxomycota,Myxomycetes,Physarales,Physaraceae,Physarum viride,477320,Physarum,,"Ayers, John H.",,9/8/33,1933,9,8,251,,log,United States,Kentucky,Boone,Anderson's Ferry,Anderson's Ferry,36.695877,-87.17028,,,https://www.mycoportal.org/portal/collections/individual/index.php?occid=4345916
4345917,Protozoa|Myxomycota,Protozoa,Myxomycota,,,Physaraceae,Physarum didermoides,648983,Physarum,,"Ayers, John H.",,10/21/32,1932,10,21,295,,old log (bark),United States,Ohio,Hamilton,Cincinnati,College Hill,39.20228,-84.547166,,,https://www.mycoportal.org/portal/collections/individual/index.php?occid=4345917
4345919,Protozoa|Myxomycota|Myxomycetes|Physarales|Physaraceae|Physarum,Protozoa,Myxomycota,Myxomycetes,Physarales,Physaraceae,Physarum globuliferum,477420,Physarum,,"Ayers, John H.",,7/28/32,1932,7,28,210,,old log,United States,Ohio,Hamilton,Cincinnati,Kroger Hills,39.150157,-84.32093,,,https://www.mycoportal.org/portal/collections/individual/index.php?occid=4345919
4345921,Protozoa|Myxomycota,Protozoa,Myxomycota,,,Physaraceae,Physarum didermoides,648983,Physarum,,"McCafferty, Pat",,10/21/32,1932,10,21,295,,,United States,Ohio,Hamilton,Cincinnati,"Cincinnati, College Hill",39.20228,-84.547166,,,https://www.mycoportal.org/portal/collections/individual/index.php?occid=4345921
4345923,Protozoa|Myxomycota|Myxomycetes|Physarales|Physaraceae|Physarum,Protozoa,Myxomycota,Myxomycetes,Physarales,Physaraceae,Physarum cinereum,648933,Physarum,,"Hoskins, John Hobart",,9/7/33,1933,9,7,250,,Grass,United States,Ohio,Hamilton,Cincinnati,University of Cincinnati campus,39.131448,-84.516332,,,https://www.mycoportal.org/portal/collections/individual/index.php?occid=4345923
4345925,Protozoa|Myxomycota|Myxomycetes|Physarales|Physaraceae|Physarum,Protozoa,Myxomycota,Myxomycetes,Physarales,Physaraceae,Physarum polycephalum,617117,Physarum,,"Ayers, John H.",,1933-08-00,1933,8,0,,,bark of dead log,United States,Ohio,Hamilton,,"Hamilton County, Ohio",39.195531,-84.542775,,,https://www.mycoportal.org/portal/collections/individual/index.php?occid=4345925
4345927,Protozoa|Myxomycota|Myxomycetes|Physarales|Physaraceae|Physarum,Protozoa,Myxomycota,Myxomycetes,Physarales,Physaraceae,Physarum globuliferum,477420,Physarum,,"Ayers, John H.",,8/16/32,1932,8,16,229,,old log,United States,Ohio,Hamilton,Cincinnati,Hazelwood,39.266169,-84.362996,,,https://www.mycoportal.org/portal/collections/individual/index.php?occid=4345927
4345928,Protozoa|Myxomycota,Protozoa,Myxomycota,,,Physaraceae,Physarum pulcherrimum,649157,Physarum,,"Ayers, John H.",,8/16/32,1932,8,16,229,,rotten log,United States,Ohio,Hamilton,Cincinnati,Hazelwood,39.266169,-84.362996,,,https://www.mycoportal.org/portal/collections/individual/index.php?occid=4345928
4345929,Protozoa|Myxomycota|Myxomycetes|Physarales|Physaraceae|Physarum,Protozoa,Myxomycota,Myxomycetes,Physarales,Physaraceae,Physarum polycephalum,617117,Physarum,,"Ayers, John H.",,10/7/33,1933,10,7,280,,"Bark, leaves",United States,Ohio,Hamilton,Dunlap,Northwest Dunlap,39.292279,-84.618002,,,https://www.mycoportal.org/portal/collections/individual/index.php?occid=4345929
4345930,Protozoa|Myxomycota,Protozoa,Myxomycota,,,Physaraceae,Physarum pulcherrimum,649157,Physarum,,"Ayers, John H.",,10/7/33,1933,10,7,280,,rotten log,United States,Ohio,Hamilton,,Northwest Hamilton county,39.195531,-84.542775,,,https://www.mycoportal.org/portal/collections/individual/index.php?occid=4345930
4345931,Protozoa|Myxomycota|Myxomycetes|Physarales|Physaraceae|Physarum,Protozoa,Myxomycota,Myxomycetes,Physarales,Physaraceae,Physarum polycephalum,617117,Physarum,,"Fahnestack, G.",,1933-08-00,1933,8,0,,,bark of log,United States,Ohio,Clermont,Blowville,Blowville,39.097564,-84.044933,,,https://www.mycoportal.org/portal/collections/individual/index.php?occid=4345931
4345932,Protozoa|Myxomycota,Protozoa,Myxomycota,,,Physaraceae,Physarum pulcherrimum,649157,Physarum,,"Braun, E. Lucy",,8/6/13,1913,8,6,218,,logs,United States,Ohio,Adams,,"Adams County, Ohio",38.845515,-83.472152,,,https://www.mycoportal.org/portal/collections/individual/index.php?occid=4345932
4345933,Protozoa|Myxomycota|Myxomycetes|Physarales|Physaraceae|Physarum,Protozoa,Myxomycota,Myxomycetes,Physarales,Physaraceae,Physarum globuliferum,477420,Physarum,,"Ayers, John H.",,1932-07-00,1932,7,0,,,old log,United States,Ohio,Hamilton,,"Hamilton County, Ohio",39.195531,-84.542775,,,https://www.mycoportal.org/portal/collections/individual/index.php?occid=4345933
4345934,Protozoa|Myxomycota,Protozoa,Myxomycota,,,Physaraceae,Physarum pulcherrimum,649157,Physarum,,"Braun, E. Lucy",,8/6/13,1913,8,6,218,,logs,United States,Ohio,Adams,,"Adams County, Ohio",38.845515,-83.472152,,,https://www.mycoportal.org/portal/collections/individual/index.php?occid=4345934
4345935,Protozoa|Myxomycota|Myxomycetes|Physarales|Physaraceae|Physarum,Protozoa,Myxomycota,Myxomycetes,Physarales,Physaraceae,Physarum nutans,649115,Physarum,,"Ayers, John H.",,1932-08-00,1932,8,0,,,old wood,United States,Ohio,Hamilton,,"Hamilton County, Ohio",39.195531,-84.542775,,,https://www.mycoportal.org/portal/collections/individual/index.php?occid=4345935
4345936,Protozoa|Myxomycota,Protozoa,Myxomycota,,,Physaraceae,Physarum didermoides,648983,Physarum,,"Cooke, William Bridge",,10/31/39,1939,10,31,304,,on Carya sp.,United States,Ohio,Warren,Foster,Foster,39.319226,-84.252993,,,https://www.mycoportal.org/portal/collections/individual/index.php?occid=4345936
4345937,Protozoa|Myxomycota|Myxomycetes|Physarales|Physaraceae|Physarum,Protozoa,Myxomycota,Myxomycetes,Physarales,Physaraceae,Physarum albescens,617058,Physarum,,"Cooke, William Bridge",,6/30/38,1938,6,30,181,,on Chrysothamnus bloomeri var. angustatus,United States,California,Siskiyou,Mt. Shasta,"near Horse Camp, Mt. Shasta",41.37252,-122.23153,2469,,https://www.mycoportal.org/portal/collections/individual/index.php?occid=4345937
4345947,Protozoa|Myxomycota|Myxomycetes|Physarales|Physaraceae|Fuligo,Protozoa,Myxomycota,Myxomycetes,Physarales,Physaraceae,Fuligo septica,345943,Fuligo,,"Ayers, John H.",,1932-05-00,1932,5,0,,,"sidewalk, by stump",United States,Ohio,Hamilton,Cincinnati,"Cincinnati, 1810 Young St.",39.117318,-84.506271,,,https://www.mycoportal.org/portal/collections/individual/index.php?occid=4345947
4345954,Protozoa|Myxomycota|Myxomycetes|Physarales|Physaraceae|Fuligo,Protozoa,Myxomycota,Myxomycetes,Physarales,Physaraceae,Fuligo septica,345943,Fuligo,,"Cooke, William Bridge",,8/21/32,1932,8,21,234,,leaves,United States,Ohio,Highland,Seven Caves,Seven Caves (Highlands Nature Sanctuary),39.344508,-83.59742,,,https://www.mycoportal.org/portal/collections/individual/index.php?occid=4345954
4345957,Protozoa|Myxomycota|Myxomycetes|Physarales|Physaraceae|Fuligo,Protozoa,Myxomycota,Myxomycetes,Physarales,Physaraceae,Fuligo septica,345943,Fuligo,,"Ayers, John H.",,7/28/32,1932,7,28,210,,grass and old log,United States,Ohio,Hamilton,Cincinnati,Kroger Hills,39.150157,-84.32093,,,https://www.mycoportal.org/portal/collections/individual/index.php?occid=4345957
4345968,Protozoa|Myxomycota|Myxomycetes|Physarales|Physaraceae|Fuligo,Protozoa,Myxomycota,Myxomycetes,Physarales,Physaraceae,Fuligo septica,345943,Fuligo,,"Cooke, William Bridge",,7/31/32,1932,7,31,213,,dead wood,United States,Ohio,Highland,Seven Caves,Seven Caves (Highlands Nature Sanctuary),39.344508,-83.59742,,,https://www.mycoportal.org/portal/collections/individual/index.php?occid=4345968
4345976,Fungi|Ascomycota|Pezizomycotina|Sordariomycetes|Hypocreomycetidae|Hypocreales|Cordycipitaceae|Ceratiomyxa,Fungi,Ascomycota,Sordariomycetes,Hypocreales,Ceratiomyxaceae,Ceratiomyxa fruticulosa,345933,Ceratiomyxa,,"Ayers, John H.",,10/7/33,1933,10,7,280,,rotten log,United States,Ohio,Hamilton,Dunlap,Northwest Dunlap,39.292279,-84.618002,,,https://www.mycoportal.org/portal/collections/individual/index.php?occid=4345976
4345980,Protozoa|Myxomycota|Myxomycetes|Physarales|Physaraceae|Fuligo,Protozoa,Myxomycota,Myxomycetes,Physarales,Physaraceae,Fuligo septica,345943,Fuligo,,"Ayers, John H.",,8/5/32,1932,8,5,218,,rotten log,United States,Ohio,Hamilton,Cincinnati,Kroger Hills,39.150157,-84.32093,,,https://www.mycoportal.org/portal/collections/individual/index.php?occid=4345980
4345986,Protozoa|Myxomycota|Myxomycetes|Physarales|Physaraceae|Fuligo,Protozoa,Myxomycota,Myxomycetes,Physarales,Physaraceae,Fuligo septica,345943,Fuligo,,"Ayers, John H.",,9/24/32,1932,9,24,268,,rotten log,United States,Ohio,Hamilton,Cincinnati,Hazelwood,39.266169,-84.362996,,,https://www.mycoportal.org/portal/collections/individual/index.php?occid=4345986
4345988,Protozoa|Myxomycota|Myxomycetes|Physarales|Physaraceae|Fuligo,Protozoa,Myxomycota,Myxomycetes,Physarales,Physaraceae,Fuligo septica,345943,Fuligo,,"Ayers, John H.",,9/24/32,1932,9,24,268,,rotten log,United States,Ohio,Hamilton,Cincinnati,Hazelwood,39.266169,-84.362996,,,https://www.mycoportal.org/portal/collections/individual/index.php?occid=4345988
4345991,Protozoa|Myxomycota|Myxomycetes|Physarales|Physaraceae|Fuligo,Protozoa,Myxomycota,Myxomycetes,Physarales,Physaraceae,Fuligo septica,345943,Fuligo,,"Ayers, John H.",,8/16/32,1932,8,16,229,,rotten log,United States,Ohio,Hamilton,Cincinnati,Hazelwood,39.266169,-84.362996,,,https://www.mycoportal.org/portal/collections/individual/index.php?occid=4345991
4345998,Protozoa|Myxomycota,Protozoa,Myxomycota,,,Physaraceae,Fuligo septica var. candida,664636,Fuligo,,"Beckman, J.",,10/4/34,1934,10,4,277,,,United States,Ohio,Hamilton,Cincinnati,"Cincinnati, O.M.I. (Ohio Mechanics Institute) woods",39.162004,-84.456886,,,https://www.mycoportal.org/portal/collections/individual/index.php?occid=4345998
4346004,Fungi|Ascomycota|Pezizomycotina|Sordariomycetes|Hypocreomycetidae|Hypocreales|Cordycipitaceae|Ceratiomyxa,Fungi,Ascomycota,Sordariomycetes,Hypocreales,Ceratiomyxaceae,Ceratiomyxa fruticulosa,345933,Ceratiomyxa,,"Ayers, John H.",,7/28/32,1932,7,28,210,,Rotten wood,United States,Ohio,Hamilton,Cincinnati,"Cincinnati, Kroger Hills",39.150157,-84.32093,,,https://www.mycoportal.org/portal/collections/individual/index.php?occid=4346004
4346007,Fungi|Ascomycota|Pezizomycotina|Sordariomycetes|Hypocreomycetidae|Hypocreales|Cordycipitaceae|Ceratiomyxa,Fungi,Ascomycota,Sordariomycetes,Hypocreales,Ceratiomyxaceae,Ceratiomyxa fruticulosa,345933,Ceratiomyxa,,"Cooke, William Bridge",,7/31/32,1932,7,31,213,,dead wood,United States,Ohio,Highland,Seven Caves,Seven Caves (Highlands Nature Sanctuary),39.344508,-83.59742,,,https://www.mycoportal.org/portal/collections/individual/index.php?occid=4346007
4346011,Fungi|Ascomycota|Pezizomycotina|Sordariomycetes|Hypocreomycetidae|Hypocreales|Cordycipitaceae|Ceratiomyxa,Fungi,Ascomycota,Sordariomycetes,Hypocreales,Ceratiomyxaceae,Ceratiomyxa fruticulosa,345933,Ceratiomyxa,,"Hoskins, John Hobart",,1931-00-00,1931,0,0,,,,United States,Michigan,Grand Traverse,Traverse City,Traverse City,44.76306,-85.62056,,,https://www.mycoportal.org/portal/collections/individual/index.php?occid=4346011
4346014,Protozoa|Myxomycota|Myxomycetes|Physarales|Physaraceae|Fuligo,Protozoa,Myxomycota,Myxomycetes,Physarales,Physaraceae,Fuligo septica,345943,Fuligo,,"Fahnestack, G.",,9/11/33,1933,9,11,254,,old log,United States,Ohio,Clermont,Blowville,Blowville,39.097564,-84.044933,,,https://www.mycoportal.org/portal/collections/individual/index.php?occid=4346014
4346015,Fungi|Ascomycota|Pezizomycotina|Sordariomycetes|Hypocreomycetidae|Hypocreales|Cordycipitaceae|Ceratiomyxa,Fungi,Ascomycota,Sordariomycetes,Hypocreales,Ceratiomyxaceae,Ceratiomyxa fruticulosa,345933,Ceratiomyxa,,"Hoskins, John Hobart",,1931-00-00,1931,0,0,,,,United States,Michigan,Grand Traverse,Traverse City,Traverse City,44.76306,-85.62056,,,https://www.mycoportal.org/portal/collections/individual/index.php?occid=4346015
4346023,Protozoa|Myxomycota|Myxomycetes|Physarales|Physaraceae|Fuligo,Protozoa,Myxomycota,Myxomycetes,Physarales,Physaraceae,Fuligo septica,345943,Fuligo,,"Fulford, Margaret H.",,10/3/31,1931,10,3,276,,decayed log,United States,Ohio,Hamilton,Cincinnati,Kroger Hills,39.150157,-84.32093,,,https://www.mycoportal.org/portal/collections/individual/index.php?occid=4346023
4346029,Fungi|Ascomycota|Pezizomycotina|Sordariomycetes|Hypocreomycetidae|Hypocreales|Cordycipitaceae|Ceratiomyxa,Fungi,Ascomycota,Sordariomycetes,Hypocreales,Ceratiomyxaceae,Ceratiomyxa fruticulosa,345933,Ceratiomyxa,,"Ayers, John H.",,9/8/33,1933,9,8,251,,rotten log,United States,Kentucky,Boone,Anderson's Ferry,Anderson's Ferry,36.695877,-87.17028,,,https://www.mycoportal.org/portal/collections/individual/index.php?occid=4346029
4346035,Fungi|Ascomycota|Pezizomycotina|Sordariomycetes|Hypocreomycetidae|Hypocreales|Cordycipitaceae|Ceratiomyxa,Fungi,Ascomycota,Sordariomycetes,Hypocreales,Ceratiomyxaceae,Ceratiomyxa fruticulosa,345933,Ceratiomyxa,,"Cooke, William Bridge",,7/3/32,1932,7,3,185,,,United States,Ohio,Clermont,Branch Hill,South Branch Hill,39.24617,-84.293271,,,https://www.mycoportal.org/portal/collections/individual/index.php?occid=4346035
4346052,Fungi|Ascomycota|Pezizomycotina|Sordariomycetes|Hypocreomycetidae|Hypocreales|Cordycipitaceae|Ceratiomyxa,Fungi,Ascomycota,Sordariomycetes,Hypocreales,Ceratiomyxaceae,Ceratiomyxa fruticulosa,345933,Ceratiomyxa,,"Cooke, William Bridge",,7/31/32,1932,7,31,213,,dead wood,United States,Ohio,Highland,Seven Caves,Seven Caves (Highlands Nature Sanctuary),39.344508,-83.59742,,,https://www.mycoportal.org/portal/collections/individual/index.php?occid=4346052
4346057,Protozoa|Myxomycota|Myxomycetes|Physarales|Physaraceae|Fuligo,Protozoa,Myxomycota,Myxomycetes,Physarales,Physaraceae,Fuligo septica,345943,Fuligo,,"Ayers, John H.",,10/7/33,1933,10,7,280,,old log,United States,Ohio,Hamilton,Dunlap,Northwest Dunlap,39.292279,-84.618002,,,https://www.mycoportal.org/portal/collections/individual/index.php?occid=4346057
4346060,Protozoa|Myxomycota|Myxomycetes|Physarales|Physaraceae|Fuligo,Protozoa,Myxomycota,Myxomycetes,Physarales,Physaraceae,Fuligo septica,345943,Fuligo,,"Ayers, John H.",,10/7/33,1933,10,7,280,,rotten log,United States,Ohio,Hamilton,Dunlap,Northwest Dunlap,39.292279,-84.618002,,,https://www.mycoportal.org/portal/collections/individual/index.php?occid=4346060
4346067,Protozoa|Myxomycota|Myxomycetes|Physarales|Physaraceae|Fuligo,Protozoa,Myxomycota,Myxomycetes,Physarales,Physaraceae,Fuligo septica,345943,Fuligo,,"Hoskins, John Hobart",,1931-07-00,1931,7,0,,,,United States,Indiana,Saint Joseph,South Bend,"St. Mary's College, north of South Bend",41.699276,-86.234901,,,https://www.mycoportal.org/portal/collections/individual/index.php?occid=4346067
4346110,Protozoa|Myxomycota|Myxomycetes|Physarales|Physaraceae|Fuligo|Fuligo septica,Protozoa,Myxomycota,Myxomycetes,Physarales,Physaraceae,Fuligo septica f. ovata,714479,Fuligo,,"Beckman, J.",,1934-00-00,1934,0,0,,,,United States,Ohio,Hamilton,Cincinnati,Kroger Hills,39.150157,-84.32093,,,https://www.mycoportal.org/portal/collections/individual/index.php?occid=4346110
4346115,Fungi|Ascomycota|Pezizomycotina|Sordariomycetes|Hypocreomycetidae|Hypocreales|Cordycipitaceae|Ceratiomyxa,Fungi,Ascomycota,Sordariomycetes,Hypocreales,Ceratiomyxaceae,Ceratiomyxa fruticulosa,345933,Ceratiomyxa,,"Ayers, John H.",,1932-08-00,1932,8,0,,,Rotten wood,United States,Ohio,Hamilton,,"Hamilton County, Ohio",39.195531,-84.542775,,,https://www.mycoportal.org/portal/collections/individual/index.php?occid=4346115
4346121,Protozoa|Myxomycota|Myxomycetes|Physarales|Physaraceae|Fuligo,Protozoa,Myxomycota,Myxomycetes,Physarales,Physaraceae,Fuligo septica,345943,Fuligo,,"Fulford, Margaret H.",,1932-09-00,1932,9,0,,,on moss,United States,Ohio,Hamilton,,"Hamilton County, Ohio",39.195531,-84.542775,,,https://www.mycoportal.org/portal/collections/individual/index.php?occid=4346121
4346128,Protozoa|Myxomycota|Myxomycetes|Physarales|Physaraceae|Fuligo,Protozoa,Myxomycota,Myxomycetes,Physarales,Physaraceae,Fuligo septica,345943,Fuligo,,"Hoskins, John Hobart",,1931-07-00,1931,7,0,,,,United States,Indiana,Saint Joseph,South Bend,"St. Mary's ravine, north of South Bend",41.699276,-86.234901,,,https://www.mycoportal.org/portal/collections/individual/index.php?occid=4346128
4346135,Fungi|Ascomycota|Pezizomycotina|Sordariomycetes|Hypocreomycetidae|Hypocreales|Cordycipitaceae|Ceratiomyxa,Fungi,Ascomycota,Sordariomycetes,Hypocreales,Ceratiomyxaceae,Ceratiomyxa fruticulosa,345933,Ceratiomyxa,,"Hoskins, John Hobart",,1931-00-00,1931,0,0,,,,United States,Michigan,Grand Traverse,Traverse City,Traverse City,44.76306,-85.62056,,,https://www.mycoportal.org/portal/collections/individual/index.php?occid=4346135
4346141,Fungi|Ascomycota|Pezizomycotina|Sordariomycetes|Hypocreomycetidae|Hypocreales|Cordycipitaceae|Ceratiomyxa,Fungi,Ascomycota,Sordariomycetes,Hypocreales,Ceratiomyxaceae,Ceratiomyxa fruticulosa,345933,Ceratiomyxa,,"Cooke, William Bridge",,7/31/32,1932,7,31,213,,dead wood,United States,Ohio,Highland,Seven Caves,Seven Caves (Highlands Nature Sanctuary),39.344508,-83.59742,,,https://www.mycoportal.org/portal/collections/individual/index.php?occid=4346141
4346144,Fungi|Ascomycota|Pezizomycotina|Sordariomycetes|Hypocreomycetidae|Hypocreales|Cordycipitaceae|Ceratiomyxa,Fungi,Ascomycota,Sordariomycetes,Hypocreales,Ceratiomyxaceae,Ceratiomyxa fruticulosa,345933,Ceratiomyxa,,"Ayers, John H.",,9/9/33,1933,9,9,252,,old log,United States,Ohio,Hamilton,Cincinnati,Mt. Airy Forest,39.165058,-84.574945,,,https://www.mycoportal.org/portal/collections/individual/index.php?occid=4346144
4346148,Protozoa|Myxomycota|Myxomycetes|Physarales|Physaraceae|Fuligo,Protozoa,Myxomycota,Myxomycetes,Physarales,Physaraceae,Fuligo septica,345943,Fuligo,,"Hoskins, John Hobart",,1931-07-00,1931,7,0,,,,United States,Indiana,Saint Joseph,South Bend,"St. Mary's ravine, north of South Bend",41.699276,-86.234901,,,https://www.mycoportal.org/portal/collections/individual/index.php?occid=4346148
4346157,Fungi|Ascomycota|Pezizomycotina|Sordariomycetes|Hypocreomycetidae|Hypocreales|Cordycipitaceae|Ceratiomyxa,Fungi,Ascomycota,Sordariomycetes,Hypocreales,Ceratiomyxaceae,Ceratiomyxa fruticulosa,345933,Ceratiomyxa,,"Cooke, William Bridge",,6/30/46,1946,6,30,181,,inside rotten Shasta fir log,United States,California,Siskiyou,Mt. Shasta,Horse Camp,41.37252,-122.23153,2438,,https://www.mycoportal.org/portal/collections/individual/index.php?occid=4346157
4346161,Fungi|Ascomycota|Pezizomycotina|Sordariomycetes|Hypocreomycetidae|Hypocreales|Cordycipitaceae|Ceratiomyxa,Fungi,Ascomycota,Sordariomycetes,Hypocreales,Ceratiomyxaceae,Ceratiomyxa fruticulosa,345933,Ceratiomyxa,,"Cooke, William Bridge",,8/7/41,1941,8,7,219,,on Shasta fir,United States,California,Siskiyou,Mt. Shasta,Horse Camp,41.37252,-122.23153,2438,,https://www.mycoportal.org/portal/collections/individual/index.php?occid=4346161
4352647,Fungi|Ascomycota|Pezizomycotina|Sordariomycetes|Hypocreomycetidae|Hypocreales|Cordycipitaceae,Fungi,Ascomycota,Sordariomycetes,Hypocreales,Ceratiomyxaceae,Ceratiomyxa,214890,Ceratiomyxa,,"Tokarski, R.",,11/18/64,1964,11,18,323,,live grass,United States,Ohio,Hamilton,Cincinnati,"Mt. Airy Forest, behind Arboretum",39.181909,-84.571512,,,https://www.mycoportal.org/portal/collections/individual/index.php?occid=4352647
4352649,Protozoa|Myxomycota,Protozoa,Myxomycota,,,Physaraceae,Leocarpus fragilis,641392,Leocarpus,,"Davidson, W.A.",,10/28/34,1934,10,28,301,,on wet log,United States,Ohio,Adams,Beaver Pond,Beaver Pond,38.939515,-83.346299,,,https://www.mycoportal.org/portal/collections/individual/index.php?occid=4352649
4352650,Protozoa|Myxomycota,Protozoa,Myxomycota,,,Physaraceae,Leocarpus fragilis,641392,Leocarpus,,"Fulford, Margaret H.",,10/4/29,1929,10,4,277,,"sticks, grass, etc. in woods",United States,Ohio,Hamilton,Cincinnati,Hazelwood Preserve (Harris M. Benedict Nature Preserve/Johnson Preserve),39.261725,-84.353273,,,https://www.mycoportal.org/portal/collections/individual/index.php?occid=4352650
4352652,Protozoa|Myxomycota|Myxomycetes|Physarales|Didymiaceae|Diderma,Protozoa,Myxomycota,Myxomycetes,Physarales,Didymiaceae,Diderma floriforme,477572,Diderma,,"Ayers, John H.",,9/9/33,1933,9,9,252,,Rotten wood,United States,Ohio,Hamilton,Cincinnati,"Cincinnati, Mt. Airy Forest",39.165058,-84.574945,,,https://www.mycoportal.org/portal/collections/individual/index.php?occid=4352652
4352653,Protozoa|Myxomycota,Protozoa,Myxomycota,,,Physaraceae,Physarella oblonga,648853,Physarella,,"Ayers, John H.",,9/24/32,1932,9,24,268,,old log,United States,Ohio,Hamilton,Cincinnati,Hazelwood,39.266169,-84.362996,,,https://www.mycoportal.org/portal/collections/individual/index.php?occid=4352653
4352655,Protozoa|Myxomycota|Myxomycetes|Physarales|Didymiaceae|Diderma,Protozoa,Myxomycota,Myxomycetes,Physarales,Didymiaceae,Diderma floriforme,477572,Diderma,,"Ayers, John H.",,10/7/33,1933,10,7,280,,rotten log,United States,Ohio,Hamilton,Dunlap,Northwest Dunlap,39.292279,-84.618002,,,https://www.mycoportal.org/portal/collections/individual/index.php?occid=4352655
4352656,Protozoa|Myxomycota,Protozoa,Myxomycota,,,Didymiaceae,Diderma testaceum,635061,Diderma,,"Ayers, John H.",,9/24/32,1932,9,24,268,,dead leaves,United States,Ohio,Hamilton,Cincinnati,Hazelwood,39.266169,-84.362996,,,https://www.mycoportal.org/portal/collections/individual/index.php?occid=4352656
4352657,Protozoa|Myxomycota,Protozoa,Myxomycota,,,Physaraceae,Physarella oblonga,648853,Physarella,,"Ayers, John H.",,7/28/32,1932,7,28,210,,old log,United States,Ohio,Hamilton,Cincinnati,Kroger Hills,39.150157,-84.32093,,,https://www.mycoportal.org/portal/collections/individual/index.php?occid=4352657
4352658,Protozoa|Myxomycota,Protozoa,Myxomycota,,,Didymiaceae,Mucilago spongiosa,643870,Mucilago,,"Ayers, John H.",,9/9/32,1932,9,9,253,,soil,United States,Ohio,Hamilton,Cincinnati,Hazelwood,39.266169,-84.362996,,,https://www.mycoportal.org/portal/collections/individual/index.php?occid=4352658
4352659,Protozoa|Myxomycota,Protozoa,Myxomycota,,,Didymiaceae,Diderma testaceum,635061,Diderma,,"Fahnestack, G.R.",,10/7/34,1934,10,7,280,,dead wood,United States,Ohio,Hamilton,Cincinnati,Burnet Woods,39.139271,-84.517276,,,https://www.mycoportal.org/portal/collections/individual/index.php?occid=4352659
4352660,Protozoa|Myxomycota,Protozoa,Myxomycota,,,Stemonitidaceae,Diachea leucopodia,634446,Diachea,,"Ayers, John H.",,6/8/32,1932,6,8,160,,dead twig and leaves,United States,Ohio,Hamilton,Cincinnati,Kroger Hills,39.150157,-84.32093,,,https://www.mycoportal.org/portal/collections/individual/index.php?occid=4352660
4352661,Protozoa|Myxomycota|Mycetozoa|Amoebozoa|Myxogastrea|Stemonitida|Stemonitidaceae|Diachea,Protozoa,Amoebozoa,Myxogastrea,Stemonitida,Stemonitidaceae,Diachea splendens,634454,Diachea,,"Ayers, John H.",,7/28/32,1932,7,28,210,,old log,United States,Ohio,Hamilton,Cincinnati,Kroger Hills,39.150157,-84.32093,,,https://www.mycoportal.org/portal/collections/individual/index.php?occid=4352661
4352662,Protozoa|Myxomycota,Protozoa,Myxomycota,,,Physaraceae,Craterium cylindricum,633274,Craterium,,"Cooke, William Bridge",,7/31/32,1932,7,31,213,,dead wood,United States,Ohio,Highland,Seven Caves,Seven Caves (Highlands Nature Sanctuary),39.344508,-83.59742,,,https://www.mycoportal.org/portal/collections/individual/index.php?occid=4352662
4352663,Protozoa|Myxomycota,Protozoa,Myxomycota,,,Didymiaceae,Didymium squamulosum,635329,Didymium,,"Ayers, John H.",,9/8/33,1933,9,8,251,,fallen leaves,United States,Kentucky,Boone,Anderson's Ferry,Anderson's Ferry,36.695877,-87.17028,,,https://www.mycoportal.org/portal/collections/individual/index.php?occid=4352663
4352664,Protozoa|Myxomycota,Protozoa,Myxomycota,,,Stemonitidaceae,Diachea leucopoda,634444,Diachea,,"Ayers, John H.",,6/8/32,1932,6,8,160,,"dead leaves, etc.",United States,Ohio,Hamilton,Cincinnati,Kroger Hills,39.150157,-84.32093,,,https://www.mycoportal.org/portal/collections/individual/index.php?occid=4352664
4352665,Protozoa|Myxomycota,Protozoa,Myxomycota,,,Stemonitidaceae,Diachea leucopoda,634444,Diachea,,"Ayers, John H.",,6/8/33,1933,6,8,159,,stems and twigs,United States,Ohio,Hamilton,Cincinnati,Kroger Hills,39.150157,-84.32093,,,https://www.mycoportal.org/portal/collections/individual/index.php?occid=4352665
4352667,Protozoa|Myxomycota,Protozoa,Myxomycota,,,Didymiaceae,Diderma testaceum,635061,Diderma,,"Ayers, John H.",,11/7/31,1931,11,7,311,,rotten log,United States,Ohio,Hamilton,,"Hamilton County, Ohio",39.195531,-84.542775,,,https://www.mycoportal.org/portal/collections/individual/index.php?occid=4352667
4352674,Fungi|Chytridiomycota|Chytridiomycetes|Chytridiales|Chytridiaceae|Chytridium,Fungi,Chytridiomycota,Chytridiomycetes,Chytridiales,Chytridiaceae,Chytridium spinulosum,138833,Chytridium,,"Langenheim, G.",,1910-09-00,1910,9,0,,,on Spirogyrae sp.,Sweden,Uppland,Stockholm,Liding,Liding,59.366667,18.133333,,,https://www.mycoportal.org/portal/collections/individual/index.php?occid=4352674
4352675,Fungi|Ascomycota|Pezizomycotina|Dothideomycetes|Botryosphaeriales|Botryosphaeriaceae|Dothiorella,Fungi,Ascomycota,Dothideomycetes,Botryosphaeriales,Botryosphaeriaceae,Dothiorella magnifructa,177681,Dothiorella,,"Cooke, William Bridge",,4/8/47,1947,4,8,98,on cones under trees in small grove,on Libocedrus decurrens,United States,California,Siskiyou,,"Mud Creek Dam Road, 1 mile north of McCloud, south side of Mt. Shasta",41.317837,-122.098681,1219,,https://www.mycoportal.org/portal/collections/individual/index.php?occid=4352675
4352676,Protozoa|Myxomycota,Protozoa,Myxomycota,,,Didymiaceae,Didymium dubium,635186,Didymium,,"Cooke, William Bridge",,6/30/38,1938,6,30,181,,on Chrysothamnus bloomeri var. angustatus,United States,California,Siskiyou,Mt. Shasta,near Horse Camp,41.37252,-122.23153,2469,,https://www.mycoportal.org/portal/collections/individual/index.php?occid=4352676
4352677,Protozoa|Myxomycota,Protozoa,Myxomycota,,,Didymiaceae,Diderma montanum,634992,Diderma,,"Cooke, William Bridge",,7/6/38,1938,7,6,187,,on Shasta Fir,United States,California,Siskiyou,Mt. Shasta,Horse Camp,41.37252,-122.23153,2438,,https://www.mycoportal.org/portal/collections/individual/index.php?occid=4352677
4352678,Protozoa|Myxomycota,Protozoa,Myxomycota,,,Didymiaceae,Diderma montanum,634992,Diderma,,"Cooke, William Bridge",,6/20/38,1938,6,20,171,,on Shasta Fir,United States,California,Siskiyou,Mt. Shasta,Horse Camp,41.372268,-122.229867,2438,,https://www.mycoportal.org/portal/collections/individual/index.php?occid=4352678
4352679,Protozoa|Myxomycota,Protozoa,Myxomycota,,,,Myxomycetes,617004,,,"Cooke, William Bridge",,11/12/36,1936,11,12,317,,,United States,Ohio,Hamilton,Cincinnati,Red Bird Hollow,39.171121,-84.319385,,,https://www.mycoportal.org/portal/collections/individual/index.php?occid=4352679
4352680,Protozoa|Myxomycota,Protozoa,Myxomycota,,,,Myxomycetes,617004,,,"Cooke, William Bridge",,8/9/36,1936,8,9,222,,dead Shasta Red Fir,United States,California,Siskiyou,Mt. Shasta,Mt. Shasta,41.40932,-122.195009,2134,,https://www.mycoportal.org/portal/collections/individual/index.php?occid=4352680
4352681,Protozoa|Myxomycota,Protozoa,Myxomycota,,,,Myxomycetes,617004,,,"Cooke, William Bridge",,10/31/35,1935,10,31,304,,dead wood,United States,Ohio,Hamilton,Cincinnati,"Cincinnati, Caldwell Preserve",39.20169,-84.49169,,,https://www.mycoportal.org/portal/collections/individual/index.php?occid=4352681
4352682,Fungi|Basidiomycota|Agaricomycotina|Agaricomycetes|Agaricomycetidae|Agaricales|Mycenaceae|Xeromphalina,Fungi,Basidiomycota,Agaricomycetes,Agaricales,Mycenaceae,Xeromphalina campanella,190565,Xeromphalina,,"Feigley, M.",,1947-07-00,1947,7,0,,,on wood,United States,Michigan,Cheboygan,,"Cheboygan County, Michigan",45.472944,-84.492063,,,https://www.mycoportal.org/portal/collections/individual/index.php?occid=4352682
4352683,,,,,,,,,,,"Parker, Dorothy Inez",,12/8/37,1937,12,8,342,,on decaying log,United States,Ohio,Hamilton,Milford,"Milford, Little Lake",39.175338,-84.294382,,,https://www.mycoportal.org/portal/collections/individual/index.php?occid=4352683
4352684,Protozoa|Myxomycota,Protozoa,Myxomycota,,,,Myxomycetes,617004,,,"Cooke, William Bridge",,8/27/36,1936,8,27,240,,dead Fir,United States,California,Siskiyou,Mt. Shasta,Mt. Shasta,41.40932,-122.195009,2286,,https://www.mycoportal.org/portal/collections/individual/index.php?occid=4352684
4352685,Protozoa|Myxomycota,Protozoa,Myxomycota,,,,Myxomycetes,617004,,,"Manley, M.L.",,10/16/38,1938,10,16,289,,wet log,United States,Ohio,Adams,Mineral Springs,Mineral Springs,38.887016,-83.329354,,,https://www.mycoportal.org/portal/collections/individual/index.php?occid=4352685
4352686,Protozoa|Myxomycota,Protozoa,Myxomycota,,,,Myxomycetes,617004,,,"Cooke, William Bridge",,10/17/35,1935,10,17,290,,,United States,Ohio,Hamilton,Dunlap,Dunlap,39.29222,-84.61806,,,https://www.mycoportal.org/portal/collections/individual/index.php?occid=4352686
4352706,Fungi|Ascomycota|Pezizomycotina|Sordariomycetes|Hypocreomycetidae|Coronophorales|Nitschkiaceae|Acanthonitschkea,Fungi,Ascomycota,Sordariomycetes,Coronophorales,Nitschkiaceae,Acanthonitschkea coloradensis,83524,Acanthonitschkea,,"Cooke, William Bridge","Cooke, V.G.",7/10/46,1946,7,10,191,,on dead branches of Abies magnifica var. shastensis,United States,California,Siskiyou,Mt. Shasta,Horse Camp Creek below Horse Camp,41.372268,-122.229867,2377,2377,https://www.mycoportal.org/portal/collections/individual/index.php?occid=4352706
4352709,Incertae Sedis|Fungi|Ascomycota|Pezizomycotina|Sordariomycetes|Dothideomycetes|Xylariomycetidae|Xylariales|Pseudomassariaceae|Hyponectriaceae|Apiosporella,Fungi,Ascomycota,Dothideomycetes,Xylariales,Leptosphaeriaceae,Apiosporella mimuli,99099,Apiosporella,,"Cooke, William Bridge",,8/15/47,1947,8,15,227,,on Senecio triangularis,United States,California,Siskiyou,Mt. Shasta,"Along creek below Panther Creek Meadows, Mt. Shasta",41.309765,-122.311135,2286,,https://www.mycoportal.org/portal/collections/individual/index.php?occid=4352709
4352712,Fungi|Ascomycota|Pezizomycotina|Sordariomycetes|Hypocreomycetidae|Coronophorales|Bertiaceae|Bertia,Fungi,Ascomycota,Sordariomycetes,Coronophorales,Bertiaceae,Bertia moriformis,112914,Bertia,,"Cooke, William Bridge",,7/23/41,1941,7,23,204,,on branch of Abies magnifica var. shastensis,United States,California,Siskiyou,Mt. Shasta,"Horse camp, Mt. Shasta",41.31,-122.30944,2438,,https://www.mycoportal.org/portal/collections/individual/index.php?occid=4352712
4352719,Fungi|Ascomycota|Pezizomycotina|Sordariomycetes|Sordariomycetidae|Sordariales|Lasiosphaeriaceae|Bombardia,Fungi,Ascomycota,Sordariomycetes,Sordariales,Lasiosphaeriaceae,Bombardia ambigua,117051,Bombardia,,"Hariot, P.",,1859-09-01,1859,9,1,244,,clay soil (terra argillosa),France,Aisne,Hauts-de-France,Villers-Cotterts,Villers-Cotterts,49.252284,3.091455,,,https://www.mycoportal.org/portal/collections/individual/index.php?occid=4352719
4352724,Fungi|Ascomycota|Pezizomycotina|Sordariomycetes|Sordariomycetidae|Annulatascaceae|Ceratostomella,Fungi,Ascomycota,Sordariomycetes,,Ceratocystidaceae,Ceratostomella pilifera,130569,Ceratostomella,,"Cooke, William Bridge","Cooke, V.G.",10/5/46,1946,10,5,278,,"on coniferous crate boards (crating done in Philadelphia, Penn., with boards from unknown source. Uncrated 3 months later.)",United States,Washington,Whitman,Pullman,Pullman,46.731274,-117.179616,,,https://www.mycoportal.org/portal/collections/individual/index.php?occid=4352724
4352731,Fungi|Ascomycota|Pezizomycotina|Sordariomycetes|Sordariomycetidae|Sordariales|Chaetomiaceae|Chaetomium,Fungi,Ascomycota,Sordariomycetes,Sordariales,Chaetomiaceae,Chaetomium atrobrunneum,135733,Chaetomium,,"Martin, G.W.",,1945-00-00,1945,0,0,,Isolated from a mattress cover in Guadalcanal,Good perithecial production on potato dextrose agar,Solomon Islands,Guadalcanal Province,,Guadalcanal,Gaudalcanal,9999.99,9999.99,,,https://www.mycoportal.org/portal/collections/individual/index.php?occid=4352731
4352739,Fungi|Ascomycota|Pezizomycotina|Sordariomycetes|Sordariomycetidae|Sordariales|Chaetomiaceae|Chaetomium,Fungi,Ascomycota,Sordariomycetes,Sordariales,Chaetomiaceae,Chaetomium causiaeforme,135759,Chaetomium,,"Martin, G.W.",,1946-00-00,1946,0,0,,Isolated from helmet liner in Guadalcanal,Good perithecial production on potato dextrose agar,Solomon Islands,Guadalcanal Province,,Guadalcanal,Gaudalcanal,9999.99,9999.99,,,https://www.mycoportal.org/portal/collections/individual/index.php?occid=4352739
4352755,Fungi|Ascomycota|Pezizomycotina|Sordariomycetes|Sordariomycetidae|Sordariales|Chaetomiaceae|Chaetomium,Fungi,Ascomycota,Sordariomycetes,Sordariales,Chaetomiaceae,Chaetomium mollipilium,135913,Chaetomium,,"Martin, G.W.",,1944-00-00,1944,0,0,,Isolated from Japanese raincoat in New Guineae,Good perithecial production on potato dextrose agar,Papua New Guinea,,,,,9999.99,9999.99,,,https://www.mycoportal.org/portal/collections/individual/index.php?occid=4352755
4352759,Fungi|Ascomycota|Pezizomycotina|Sordariomycetes|Sordariomycetidae|Sordariales|Chaetomiaceae|Chaetomium,Fungi,Ascomycota,Sordariomycetes,Sordariales,Chaetomiaceae,Chaetomium mollipilium,135913,Chaetomium,,"Martin, G.W.",,1945-00-00,1945,0,0,,"Isolated from tent, New Guinea",Good perithecial production on potato dextrose agar,Papua New Guinea,,,,,9999.99,9999.99,,,https://www.mycoportal.org/portal/collections/individual/index.php?occid=4352759
4352763,Fungi|Ascomycota|Pezizomycotina|Sordariomycetes|Sordariomycetidae|Sordariales|Chaetomiaceae|Chaetomium,Fungi,Ascomycota,Sordariomycetes,Sordariales,Chaetomiaceae,Chaetomium turgidopilosum,136041,Chaetomium,,"Martin, G.W.",,1945-00-00,1945,0,0,,Isolated from side wall of tent in New Guinea,Good perithecial production on potato dextrose agar,Papua New Guinea,,,,,9999.99,9999.99,,,https://www.mycoportal.org/portal/collections/individual/index.php?occid=4352763
4352767,Fungi|Ascomycota|Pezizomycotina|Sordariomycetes|Sordariomycetidae|Sordariales|Chaetomiaceae|Chaetomium,Fungi,Ascomycota,Sordariomycetes,Sordariales,Chaetomiaceae,Chaetomium velutinum,136054,Chaetomium,,"Martin, G.W.",,1944-00-00,1944,0,0,,Isolated from Japanese tent in New Guinea,Good perithecial production on potato dextrose agar,Papua New Guinea,,,,,9999.99,9999.99,,,https://www.mycoportal.org/portal/collections/individual/index.php?occid=4352767
4352781,Fungi|Ascomycota|Pezizomycotina|Cryptomycina,Fungi,Ascomycota,,,Sordariomycetes,Cryptomycina pteridis,159344,Cryptomycina,,"Cooke, William Bridge","Cooke, V.G.",7/17/49,1949,7,17,198,,on Pteridium aquilium var. pubescens,United States,Idaho,Idaho,Kooskia,"along the Rackliff Ridge Trail one half mile above Rackliff Creek Public Camp, Nez Perce National Forest",46.153118,-115.458197,762,,https://www.mycoportal.org/portal/collections/individual/index.php?occid=4352781
4352787,Fungi|Ascomycota|Pezizomycotina|Sordariomycetes|Sordariomycetidae|Diaporthales|Diaporthaceae|Diaporthe,Fungi,Ascomycota,Sordariomycetes,Diaporthales,Gnomoniaceae,Diaporthe tiliacea,168937,Diaporthe,,"Parks, H.E.",,1934-03-00,1934,3,0,,,on fresh cut saplings of Alnus rubra,United States,California,Humboldt,Trinidad,"Spruce Cove, Trinidad",41.065402,-124.153125,,,https://www.mycoportal.org/portal/collections/individual/index.php?occid=4352787
4352799,Fungi|Ascomycota|Pezizomycotina|Sordariomycetes|Hypocreomycetidae|Microascales|Ceratocystidaceae|Endoconidiophora,Fungi,Ascomycota,Sordariomycetes,Microascales,Ceratocystidaceae,Endoconidiophora adiposa,180212,Endoconidiophora,,"Hedgcock, G.G.",,2/12/10,1910,2,12,43,,on Platanus occidentalis,United States,Maryland,Baltimore,Baltimore,Baltimore,39.290385,-76.612189,,,https://www.mycoportal.org/portal/collections/individual/index.php?occid=4352799
4352809,Fungi|Ascomycota|Pezizomycotina|Sordariomycetes|Sordariomycetidae|Diaporthales|Cryphonectriaceae|Endothia,Fungi,Ascomycota,Sordariomycetes,Diaporthales,Cryphonectriaceae,Endothia parasitica,180820,Endothia,,"Cooke, William Bridge","Cooke, V.G.",3/18/45,1945,3,18,77,"On most saplings and crown sprouts of all living butts of the host on Bull Run Mountain, Fauquier and Prince Wiliam Counties",on Castanea dentata,United States,Virginia,,Bull Run Mountains,"Bull Run Mountain, Fauquier & Prince William Counties",38.827891,-77.487212,,,https://www.mycoportal.org/portal/collections/individual/index.php?occid=4352809
4352814,,,,,,Diatrypaceae,Eutypella ceanothi,636938,Eutypella,,"Parks, H.E.",,11/25/31,1931,11,25,329,,on Baccharis pilularis subsp. consanguinea,United States,California,Humboldt,Trinidad,Trinidad,41.059291,-124.143125,,,https://www.mycoportal.org/portal/collections/individual/index.php?occid=4352814
4352819,Fungi|Ascomycota|Pezizomycotina|Sordariomycetes|Hypocreomycetidae|Coronophorales|Nitschkiaceae|Fracchiaea,Fungi,Ascomycota,Sordariomycetes,Coronophorales,Cucurbitariaceae,Fracchiaea callista,221570,Fracchiaea,,"Thaxter, R.",,1890-07-00,1890,7,0,,,on Cornus alternifolia,United States,Connecticut,New Haven,West Haven,West Haven,41.270653,-72.947047,,,https://www.mycoportal.org/portal/collections/individual/index.php?occid=4352819
4352830,Fungi|Ascomycota|Pezizomycotina|Sordariomycetes|Sordariomycetidae|Diaporthales|Gnomoniaceae|Gnomoniella,Fungi,Ascomycota,Sordariomycetes,Diaporthales,Ceratostomataceae,Gnomoniella tubiformis,183752,Gnomoniella,,"Bonar, L.",,8/5/40,1940,8,5,218,,On Alnus tenuifolia,United States,California,El Dorado,Echo Lake,East shore of Echo Lake,38.834425,-120.04674,,,https://www.mycoportal.org/portal/collections/individual/index.php?occid=4352830
4352847,Fungi|Ascomycota|Pezizomycotina|Dothideomycetes|Botryosphaeriales|Botryosphaeriaceae|Guignardia,Fungi,Ascomycota,Dothideomycetes,Botryosphaeriales,Mycosphaerellaceae,Guignardia gentianicola,232107,Guignardia,,"Hariot, P.",,1890-06-05,1890,6,5,156,,on Gentianae luteae,France,Auvergne-Rhone-Alps,,Puy de Cme,Puy de Come,45.829423,3.032715,,,https://www.mycoportal.org/portal/collections/individual/index.php?occid=4352847
4352876,Fungi|Ascomycota|Pezizomycotina|Sordariomycetes|Xylariomycetidae|Xylariales|Diatrypaceae|Eutypella,Fungi,Ascomycota,Sordariomycetes,Xylariales,Diatrypaceae,Eutypella stellulata,183361,Eutypella,,"Cooke, William Bridge",,6/10/35,1935,6,10,161,,on Osage Orange,United States,Ohio,Fairfield,Lancaster,Lancaster,39.713675,-82.599329,,,https://www.mycoportal.org/portal/collections/individual/index.php?occid=4352876
4352881,Fungi|Ascomycota|Pezizomycotina|Sordariomycetes|Xylariomycetidae|Xylariales|Diatrypaceae|Eutypella,Fungi,Ascomycota,Sordariomycetes,Xylariales,Diatrypaceae,Eutypella fraxinicola,217932,Eutypella,,"Cooke, William Bridge",,11/30/35,1935,11,30,334,,,United States,Ohio,Clermont,Modest,Modest Uplands,39.193117,-84.107156,,,https://www.mycoportal.org/portal/collections/individual/index.php?occid=4352881
4352884,Fungi|Ascomycota|Pezizomycotina|Sordariomycetes|Xylariomycetidae|Xylariales|Diatrypaceae|Eutypella,Fungi,Ascomycota,Sordariomycetes,Xylariales,Diatrypaceae,Eutypella fraxinicola,217932,Eutypella,,"Cooke, William Bridge",,3/17/33,1933,3,17,76,,dead sticks,United States,Ohio,Warren,Hopkinsville,"Hopkinsville, White Oak Woods",39.338948,-84.219659,,,https://www.mycoportal.org/portal/collections/individual/index.php?occid=4352884
4352890,Fungi|Ascomycota|Pezizomycotina|Sordariomycetes|Xylariomycetidae|Xylariales|Diatrypaceae,Fungi,Ascomycota,Sordariomycetes,Xylariales,Diatrypaceae,Eutypella,14317,Eutypella,,"Cooke, William Bridge",,8/11/33,1933,8,11,223,,rotten sticks,United States,Ohio,Hamilton,Colerain Township,Taylor Creek,39.211141,-84.696093,,,https://www.mycoportal.org/portal/collections/individual/index.php?occid=4352890
4352893,Fungi|Ascomycota|Pezizomycotina|Sordariomycetes|Sordariomycetidae|Diaporthales|Cryphonectriaceae|Endothia,Fungi,Ascomycota,Sordariomycetes,Diaporthales,Cryphonectriaceae,Endothia parasitica,180820,Endothia,,"Cooke, William Bridge",,3/30/37,1937,3,30,89,,on Castanea dentata,United States,Ohio,Ross,Alum Cliffs,Alum Cliffs,39.30562,-83.073238,,,https://www.mycoportal.org/portal/collections/individual/index.php?occid=4352893
4352897,Fungi|Ascomycota|Pezizomycotina|Sordariomycetes|Sordariomycetidae|Diaporthales|Cryphonectriaceae|Endothia,Fungi,Ascomycota,Sordariomycetes,Diaporthales,Cryphonectriaceae,Endothia parasitica,180820,Endothia,,"Cooke, William Bridge",,12/6/33,1933,12,6,340,,dead Chestnut,United States,Ohio,Highland,Seven Caves,Seven Caves (Highlands Nature Sanctuary),39.344508,-83.59742,,,https://www.mycoportal.org/portal/collections/individual/index.php?occid=4352897
4352900,Fungi|Ascomycota|Pezizomycotina|Sordariomycetes|Xylariomycetidae|Xylariales|Diatrypaceae|Eutypa,Fungi,Ascomycota,Sordariomycetes,Xylariales,Diatrypaceae,Eutypa heteracantha,217759,Eutypa,,"Parks, H.E.",,1935-03-00,1935,3,0,,,on Sambucus sp.,United States,California,Humboldt,Trinidad,Trinidad,41.059291,-124.143125,,,https://www.mycoportal.org/portal/collections/individual/index.php?occid=4352900
4352904,Fungi|Ascomycota|Pezizomycotina|Sordariomycetes|Hypocreomycetidae|Microascales|Ceratocystidaceae|Endoconidiophora,Fungi,Ascomycota,Sordariomycetes,Microascales,Microascales,Endoconidiophora coerulescens,180214,Endoconidiophora,,"Parks, H.E.",,1934-03-00,1934,3,0,,,on sapwood of Pseudotsuga taxifolia,United States,California,Humboldt,Trinidad,Trinidad,41.059291,-124.143125,,,https://www.mycoportal.org/portal/collections/individual/index.php?occid=4352904
4352910,,,,,,Diatrypaceae,Eutypella deusta,636942,Eutypella,,"Cooke, William Bridge",,2/29/36,1936,2,29,60,,,United States,Ohio,Clermont,,"Alpine Road, Clermont County, Ohio",39.047433,-84.151918,,,https://www.mycoportal.org/portal/collections/individual/index.php?occid=4352910
4352912,Fungi|Ascomycota|Pezizomycotina|Sordariomycetes|Xylariomycetidae|Xylariales|Diatrypaceae|Eutypa,Fungi,Ascomycota,Sordariomycetes,Xylariales,Diatrypaceae,Eutypa spinosa,183346,Eutypa,,"Hoskins, John Hobart",,1931-00-00,1931,0,0,,,,United States,Michigan,Grand Traverse,Traverse City,Traverse City,44.763057,-85.620632,,,https://www.mycoportal.org/portal/collections/individual/index.php?occid=4352912
4352915,Fungi|Ascomycota|Pezizomycotina|Sordariomycetes|Xylariomycetidae|Xylariales|Diatrypaceae|Eutypa,Fungi,Ascomycota,Sordariomycetes,Xylariales,Diatrypaceae,Eutypa spinosa,183346,Eutypa,,"Parker, Dorothy Inez",,10/11/34,1934,10,11,284,,,United States,Ohio,Hamilton,Cincinnati,Kroger Hills,39.150157,-84.32093,,,https://www.mycoportal.org/portal/collections/individual/index.php?occid=4352915
4352917,Fungi|Ascomycota|Pezizomycotina|Sordariomycetes|Xylariomycetidae|Xylariales|Diatrypaceae|Eutypa,Fungi,Ascomycota,Sordariomycetes,Xylariales,Diatrypaceae,Eutypa spinosa,183346,Eutypa,,"Cooke, William Bridge",,12/5/33,1933,12,5,339,,dead log,United States,Ohio,Highland,Seven Caves,Seven Caves (Highlands Nature Sanctuary),39.344508,-83.59742,,,https://www.mycoportal.org/portal/collections/individual/index.php?occid=4352917
4352920,Fungi|Ascomycota|Pezizomycotina|Sordariomycetes|Xylariomycetidae|Xylariales|Diatrypaceae|Eutypella,Fungi,Ascomycota,Sordariomycetes,Xylariales,Diatrypaceae,Eutypella scoparia,218021,Eutypella,,"Cooke, William Bridge",,3/5/36,1936,3,5,65,,,United States,Ohio,Hamilton,Cincinnati,Rapid Run,39.099503,-84.671335,,,https://www.mycoportal.org/portal/collections/individual/index.php?occid=4352920
4352923,Fungi|Ascomycota|Pezizomycotina|Sordariomycetes|Sordariomycetidae|Diaporthales|Cryphonectriaceae|Endothia,Fungi,Ascomycota,Sordariomycetes,Diaporthales,Cryphonectriaceae,Endothia parasitica,180820,Endothia,,"Cooke, William Bridge",,4/12/36,1936,4,12,103,,,United States,Ohio,Jackson,Rock Run,Rock Run,38.973405,-83.163515,,,https://www.mycoportal.org/portal/collections/individual/index.php?occid=4352923
4352925,Fungi|Ascomycota|Pezizomycotina|Sordariomycetes|Xylariomycetidae|Xylariales|Diatrypaceae|Eutypella,Fungi,Ascomycota,Sordariomycetes,Xylariales,Diatrypaceae,Eutypella fraxinicola,217932,Eutypella,,"Cooke, William Bridge",,3/10/36,1936,3,10,70,,,United States,Ohio,Hamilton,Remington,"Sycamore Creek, near Remington",39.247559,-84.322239,,,https://www.mycoportal.org/portal/collections/individual/index.php?occid=4352925
4352927,Fungi|Ascomycota|Pezizomycotina|Sordariomycetes|Xylariomycetidae|Xylariales|Diatrypaceae|Eutypa,Fungi,Ascomycota,Sordariomycetes,Xylariales,Diatrypaceae,Eutypa spinosa,183346,Eutypa,,"Cooke, William Bridge",,11/24/36,1936,11,24,329,,,United States,Ohio,Hamilton,Cincinnati,"Cincinnati, Salem Pike",39.162004,-84.456886,,,https://www.mycoportal.org/portal/collections/individual/index.php?occid=4352927
4352930,Fungi|Ascomycota|Pezizomycotina|Sordariomycetes|Xylariomycetidae|Xylariales|Diatrypaceae|Eutypella,Fungi,Ascomycota,Sordariomycetes,Xylariales,Diatrypaceae,Eutypella cerviculata,183353,Eutypella,,"Cooke, William Bridge",,10/31/35,1935,10,31,304,,,United States,Ohio,Hamilton,Cincinnati,Caldwell Preserve,39.202231,-84.490503,,,https://www.mycoportal.org/portal/collections/individual/index.php?occid=4352930
4352932,Fungi|Ascomycota|Pezizomycotina|Sordariomycetes|Xylariomycetidae|Xylariales|Diatrypaceae|Eutypa,Fungi,Ascomycota,Sordariomycetes,Xylariales,Diatrypaceae,Eutypa spinosa,183346,Eutypa,,"Blickle, A.H.",,10/12/34,1934,10,12,285,,,United States,Ohio,Hamilton,Cincinnati,Kroger Hills,39.150157,-84.32093,,,https://www.mycoportal.org/portal/collections/individual/index.php?occid=4352932
4352942,Fungi|Ascomycota|Pezizomycotina|Sordariomycetes|Xylariomycetidae|Xylariales|Diatrypaceae|Eutypa,Fungi,Ascomycota,Sordariomycetes,Xylariales,Diatrypaceae,Eutypa spinosa,183346,Eutypa,,"Cooke, William Bridge",,10/2/32,1932,10,2,276,,dead wood,United States,Ohio,Highland,Seven Caves,Seven Caves (Highlands Nature Sanctuary),39.344508,-83.59742,,,https://www.mycoportal.org/portal/collections/individual/index.php?occid=4352942
4352946,Fungi|Ascomycota|Pezizomycotina|Sordariomycetes|Sordariomycetidae|Diaporthales|Cryphonectriaceae|Endothia,Fungi,Ascomycota,Sordariomycetes,Diaporthales,Cryphonectriaceae,Endothia parasitica,180820,Endothia,,"Cooke, William Bridge",,12/5/33,1933,12,5,339,,Chestnut (blight),United States,Ohio,Highland,Seven Caves,Seven Caves (Highlands Nature Sanctuary),39.344508,-83.59742,,,https://www.mycoportal.org/portal/collections/individual/index.php?occid=4352946
4352949,Fungi|Ascomycota|Pezizomycotina|Sordariomycetes|Xylariomycetidae|Xylariales|Diatrypaceae|Eutypa,Fungi,Ascomycota,Sordariomycetes,Xylariales,Diatrypaceae,Eutypa spinosa,183346,Eutypa,,"Cooke, William Bridge",,11/7/33,1933,11,7,311,,Rotten wood,United States,Ohio,Clermont,Branch Hill,South Branch Hill,39.24617,-84.293271,,,https://www.mycoportal.org/portal/collections/individual/index.php?occid=4352949
4352951,Fungi|Ascomycota|Pezizomycotina|Sordariomycetes|Xylariomycetidae|Xylariales|Diatrypaceae|Eutypa,Fungi,Ascomycota,Sordariomycetes,Xylariales,Diatrypaceae,Eutypa spinosa,183346,Eutypa,,"Cooke, William Bridge",,3/10/36,1936,3,10,70,,,United States,Ohio,Hamilton,Sycamore Creek,"Sycamore Creek, near Remington",39.247559,-84.322239,,,https://www.mycoportal.org/portal/collections/individual/index.php?occid=4352951
4352962,,,,,,Peronosporaceae,Peronospora polygoni,647389,Peronospora,,"Cooke, William Bridge",,5/22/37,1937,5,22,142,,on Polygonum convolvulus,United States,Kentucky,Boone,Bullitsville,Bullitsville,39.075272,-84.73852,,,https://www.mycoportal.org/portal/collections/individual/index.php?occid=4352962
4352964,Fungi|Zygomycota|Entomophthoromycotina|Entomophthorales|Entomophthoraceae|Empusa,Fungi,Zygomycota,,Entomophthorales,Entomophthoraceae,Empusa muscae,179725,Empusa,,"Cooke, William Bridge",,8/26/36,1936,8,26,239,,rotten wood in running water,United States,California,Siskiyou,Mt. Shasta,Mt. Shasta,41.40932,-122.195009,1981,,https://www.mycoportal.org/portal/collections/individual/index.php?occid=4352964
4352966,Fungi|Zygomycota|Entomophthoromycotina|Entomophthorales|Entomophthoraceae|Massospora,Fungi,Zygomycota,,Entomophthorales,Entomophthoraceae,Massospora cicadina,284051,Massospora,,"Cooke, William Bridge",,9/13/35,1935,9,13,256,,,United States,Ohio,Clermont,Dark Hollow,Dark Hollow,38.914083,-82.678459,,,https://www.mycoportal.org/portal/collections/individual/index.php?occid=4352966
4352968,Chromista|Oomycota|Oomycetes|Peronosporales|Albuginaceae|Albugo,Chromista,Oomycota,Oomycetes,Peronosporales,Albuginaceae,Albugo candida,617106,Albugo,,"Cooke, William Bridge",,5/20/37,1937,5,20,140,,on Capsella bursa-pastoris,United States,Ohio,Hamilton,Avondale,Avondale,39.147837,-84.494943,,,https://www.mycoportal.org/portal/collections/individual/index.php?occid=4352968
4352974,Chromista|Oomycota|Oomycetes|Peronosporales|Albuginaceae|Albugo,Chromista,Oomycota,Oomycetes,Peronosporales,Albuginaceae,Albugo candida,617106,Albugo,,"Cooke, William Bridge",,10/31/33,1933,10,31,304,,on Labiatae sp.,United States,Ohio,Hamilton,Polk Run,Polk Run,39.260628,-84.310779,,,https://www.mycoportal.org/portal/collections/individual/index.php?occid=4352974
4352979,Incertae Sedis|Fungi|Zygomycota|Mucoromycotina|Mucorales|Sporodinia,Fungi,Zygomycota,,Mucorales,Mucorales,Sporodinia aspergillus,431754,Sporodinia,,"Linder, D.H.",,8/24/33,1933,8,24,236,,on dead Boletus sp.,United States,Ohio,Clermont,Branch Hill,Branch Hill,39.24617,-84.293271,,,https://www.mycoportal.org/portal/collections/individual/index.php?occid=4352979
4352985,Fungi|Zygomycota|Ascomycota|Pezizomycotina|Mucoromycotina|Lecanoromycetes|Lecanoromycetidae|Teloschistales|Mucorales|Rhizopodaceae|Caliciaceae|Mucoraceae|Mucor,Fungi,Ascomycota,Lecanoromycetes,Mucorales,Mucoraceae,Mucor mucedo,296967,Mucor,,"Cooke, William Bridge",,8/11/33,1933,8,11,223,,rotten Poria sp.,United States,Ohio,Hamilton,Taylor Creek,Taylor Creek,39.215374,-84.688389,,,https://www.mycoportal.org/portal/collections/individual/index.php?occid=4352985
4352987,Fungi|Zygomycota|Mucoromycotina|Mucorales|Cunninghamellaceae|Cunninghamella,Fungi,Zygomycota,,Mucorales,Cunninghamellaceae,Cunninghamella blakesleeana,160591,Cunninghamella,,"Cooke, William Bridge",,8/26/45,1945,8,26,238,Isolated from tent in New Guinea,Grows well on potato dextrose agar,Papua New Guinea,,,,,9999.99,9999.99,,,https://www.mycoportal.org/portal/collections/individual/index.php?occid=4352987
4352996,,,,,,,Sorangium sp.,,,,"Martin, G.W.",,6/29/37,1937,6,29,180,,on Abies magnifica v. shastense,United States,California,Siskiyou,Mt. Shasta,Horse Camp,41.37252,-122.23153,2438,,https://www.mycoportal.org/portal/collections/individual/index.php?occid=4352996
4353583,Fungi|Ascomycota|Pezizomycotina|Sordariomycetes|Hypocreomycetidae|Hypocreales|Cordycipitaceae,Fungi,Ascomycota,Sordariomycetes,Hypocreales,Cordycipitaceae,Cordyceps,13363,Cordyceps,,"Cooke, William Bridge",,8/11/33,1933,8,11,223,,on dead insect,United States,Ohio,Hamilton,Taylor Creek,Taylor Creek,39.215374,-84.688389,,,https://www.mycoportal.org/portal/collections/individual/index.php?occid=4353583
4353586,Fungi|Ascomycota|Pezizomycotina|Sordariomycetes|Hypocreomycetidae|Hypocreales|Cordycipitaceae,Fungi,Ascomycota,Sordariomycetes,Hypocreales,Cordycipitaceae,Cordyceps,13363,Cordyceps,,"Cooke, William Bridge",,8/11/33,1933,8,11,223,,on dead insect,United States,Ohio,Hamilton,Colerain Township,Taylor Creek,39.215374,-84.688389,,,https://www.mycoportal.org/portal/collections/individual/index.php?occid=4353586
4353593,,,,,,Peronosporaceae,Plasmopara australis,649699,Plasmopara,,"Kellerman, W.A.",,7/27/03,1903,7,27,208,,on Sicyos angulatus,United States,Ohio,Erie,Sandusky,Sandusky,41.446238,-82.716715,,,https://www.mycoportal.org/portal/collections/individual/index.php?occid=4353593
4353599,,,,,,Peronosporaceae,Plasmopara australis,649699,Plasmopara,,"Selby, A.D.",,1898-09-00,1898,9,0,,,on Sicyos angulatus,United States,Ohio,Wayne,Wooster,Wooster,40.805056,-81.935143,,,https://www.mycoportal.org/portal/collections/individual/index.php?occid=4353599
4353602,,,,,,Peronosporaceae,Plasmopara australis,649699,Plasmopara,,"Kellerman, W.A.",,7/27/03,1903,7,27,208,,on Sicyos angulatus,United States,Ohio,Erie,Sandusky,Sandusky,41.446238,-82.716715,,,https://www.mycoportal.org/portal/collections/individual/index.php?occid=4353602
4353612,,,,,,Peronosporaceae,Plasmopara densa,649728,Plasmopara,,"Sydow, P.",,1899-06-26,1899,6,26,177,,,Germany,Brandenburg,Barnim,Chorin,Chorin,52.902829,13.87112,,,https://www.mycoportal.org/portal/collections/individual/index.php?occid=4353612
4353622,,,,,,Peronosporaceae,Plasmopara cubensis,649723,Plasmopara,,"Lodder, F.J.",,1895-12-23,1895,12,23,357,,on wild cucumber,United States,Ohio,Hamilton,Cincinnati,Hyde Park,39.135347,-84.442756,,,https://www.mycoportal.org/portal/collections/individual/index.php?occid=4353622
4353628,,,,,,Peronosporaceae,Plasmopara cubensis,649723,Plasmopara,,"Selby, A.D.",,1898-09-10,1898,9,10,253,,with Micrampelis lobata,United States,Ohio,Wayne,Wooster,Wooster,40.805056,-81.935143,,,https://www.mycoportal.org/portal/collections/individual/index.php?occid=4353628
4353886,,,,,,Peronosporaceae,Plasmopara cubensis,649723,Plasmopara,,"Selby, A.D.",,1898-08-18,1898,8,18,230,,on Cucumis melo,United States,Ohio,Muskingum,Trinway,Trinway,40.14118,-82.009858,,,https://www.mycoportal.org/portal/collections/individual/index.php?occid=4353886
4353909,,,,,,Peronosporaceae,Plasmopara cubensis,649723,Plasmopara,,"Selby, A.D.","Duval, J.W.T.",1899-10-15,1899,10,15,288,,on Cucumis sativus,United States,Ohio,Wayne,Wooster,Wooster,40.805056,-81.935143,,,https://www.mycoportal.org/portal/collections/individual/index.php?occid=4353909
4353918,,,,,,Peronosporaceae,Plasmopara cubensis,649723,Plasmopara,,"Duval, J.W.T.",,1898-08-00,1898,8,0,,,on cultivated plants of Citrullus vulgaris,United States,Ohio,Wayne,Wooster,Wooster,40.805056,-81.935143,,,https://www.mycoportal.org/portal/collections/individual/index.php?occid=4353918
4353931,,,,,,Peronosporaceae,Plasmopara geranii,649736,Plasmopara,,"Earle, F.S.",,1897-09-03,1897,9,3,246,,on Geranium carolinianum,United States,Alabama,Lee,Auburn,Auburn,32.609857,-85.480782,,,https://www.mycoportal.org/portal/collections/individual/index.php?occid=4353931
4353932,,,,,,Peronosporaceae,Plasmopara halstedii,649742,Plasmopara,,s.n.,,1898-05-22,1898,5,22,142,,on Helianthus grosseserratus,United States,Kansas,Riley,Manhattan,Manhattan,39.183608,-96.571669,,,https://www.mycoportal.org/portal/collections/individual/index.php?occid=4353932
4353955,,,,,,Peronosporaceae,Plasmopara halstedii,649742,Plasmopara,,"Kellerman, W.A.",,6/6/01,1901,6,6,157,,"on Helianthus annuus, cultivated",United States,Ohio,Franklin,Columbus,Columbus,39.987615,-82.996897,,,https://www.mycoportal.org/portal/collections/individual/index.php?occid=4353955
4353956,,,,,,Peronosporaceae,Plasmopara halstedii,649742,Plasmopara,,"Kellerman, W.A.",,6/6/01,1901,6,6,157,,"on Vitis sp., cultivated",United States,Ohio,Franklin,Columbus,Columbus,39.987615,-82.996897,,,https://www.mycoportal.org/portal/collections/individual/index.php?occid=4353956
4353959,,,,,,Peronosporaceae,Plasmopara pygmaea,649796,Plasmopara,,"Sydow, P.",,1899-05-00,1899,5,0,,,on Anemone nemorosa,Germany,Brandenburg,Havelland,Nauen,Nauen,52.60673,12.876518,,,https://www.mycoportal.org/portal/collections/individual/index.php?occid=4353959
4353970,,,,,,Peronosporaceae,Plasmopara sordida,649814,Plasmopara,,"Kellerman, W.A.",,8/3/03,1903,8,3,215,,on Scrophularia marilandica,United States,Ohio,Erie,Sandusky,Sandusky,41.446238,-82.716715,,,https://www.mycoportal.org/portal/collections/individual/index.php?occid=4353970
4353975,,,,,,Peronosporaceae,Plasmopara sordida,649814,Plasmopara,,"Kellerman, W.A.",,8/3/03,1903,8,3,215,,on Scrophularia marilandica,United States,Ohio,Erie,Sandusky,Sandusky,41.446238,-82.716715,,,https://www.mycoportal.org/portal/collections/individual/index.php?occid=4353975
4353978,,,,,,Peronosporaceae,Plasmopara viburni,649825,Plasmopara,,"Earle, F.S.",,1897-11-08,1897,11,8,312,,on Viburnum nudum,United States,Alabama,Lee,Auburn,Auburn,32.609857,-85.480782,,,https://www.mycoportal.org/portal/collections/individual/index.php?occid=4353978
4353986,,,,,,Peronosporaceae,Plasmopara viburni,649825,Plasmopara,,"Davis, J.J.",,8/23/13,1913,8,23,235,,on Viburnum opulus var. americanum,United States,Wisconsin,Marinette,Wausaukee,Wausaukee,45.378763,-87.956453,,,https://www.mycoportal.org/portal/collections/individual/index.php?occid=4353986
4353993,Fungi|Ascomycota|Pezizomycotina|Leotiomycetes|Leotiomycetidae|Helotiales|Sclerotiniaceae|Plasmopara,Fungi,Ascomycota,Leotiomycetes,Helotiales,Peronosporaceae,Plasmopara viticola,214715,Plasmopara,,s.n.,,1899-10-01,1899,10,1,274,,on Vitis flexuosa,Japan,Honshu,Kant?,Tokyo,Tokyo Botanical Garden,35.685,139.751389,,,https://www.mycoportal.org/portal/collections/individual/index.php?occid=4353993
4354011,Fungi|Ascomycota|Pezizomycotina|Leotiomycetes|Leotiomycetidae|Helotiales|Sclerotiniaceae|Plasmopara,Fungi,Ascomycota,Leotiomycetes,Helotiales,Peronosporaceae,Plasmopara viticola,214715,Plasmopara,,"Kellerman, W.A.",,6/10/00,1900,6,10,161,,"on Vitis sp., cultivated, on leaves only",United States,Ohio,Franklin,Columbus,Columbus,39.975911,-82.985061,,,https://www.mycoportal.org/portal/collections/individual/index.php?occid=4354011
4354020,Fungi|Ascomycota|Pezizomycotina|Leotiomycetes|Leotiomycetidae|Helotiales|Sclerotiniaceae|Plasmopara,Fungi,Ascomycota,Leotiomycetes,Helotiales,Peronosporaceae,Plasmopara viticola,214715,Plasmopara,,"Kellerman, W.A.",,6/10/00,1900,6,10,161,,"on Vitis sp., cultivated, on leaves only",United States,Ohio,Franklin,Columbus,Columbus,39.975911,-82.985061,,,https://www.mycoportal.org/portal/collections/individual/index.php?occid=4354020
4354031,Fungi|Ascomycota|Pezizomycotina|Leotiomycetes|Leotiomycetidae|Helotiales|Sclerotiniaceae|Plasmopara,Fungi,Ascomycota,Leotiomycetes,Helotiales,Peronosporaceae,Plasmopara viticola,214715,Plasmopara,,"Davis, J.J.",,9/1/13,1913,9,1,244,,on Psedera quinquefolia var. hirsuta (a synonym of Parthenocissus quinquefolia f. hirsuta (Pursh) Fernald),United States,Wisconsin,Sauk,Devil's Lake,Devil's Lake,43.416929,-89.703734,,,https://www.mycoportal.org/portal/collections/individual/index.php?occid=4354031
4354044,Chromista|Oomycota|Oomycetes|Peronosporales|Peronosporaceae|Peronospora,Chromista,Oomycota,Oomycetes,Peronosporales,Peronosporaceae,Peronospora arenariae,214669,Peronospora,,"Vestergren, T.",,5/25/13,1913,5,25,145,,on Arenaria trinervia,Sweden,Uppland,Stockholm,Stockholm,Stockholm,59.3283,18.072,,,https://www.mycoportal.org/portal/collections/individual/index.php?occid=4354044
4354045,,,,,,Peronosporaceae,Peronospora bulbocapni,646975,Peronospora,,"Mayor, E.",,5/10/13,1913,5,10,130,,on Corydalis cava,Switzerland,Canton de Vaud,Jura-Nord Vaudois,Montagny-prs-Yverdon,Montagny-prs-Yverdon,46.793032,6.61224,,,https://www.mycoportal.org/portal/collections/individual/index.php?occid=4354045
4354052,,,,,,Peronosporaceae,Peronospora calotheca,646982,Peronospora,,"Lind, J.",,6/14/12,1912,6,14,166,,on Galium verum,Denmark,Central Jutland,,Struer,Struer Jutlandia,56,9.25,,,https://www.mycoportal.org/portal/collections/individual/index.php?occid=4354052
4354062,,,,,,Peronosporaceae,Peronospora corollae,647041,Peronospora,,"Lagerheim, G.",,1913-07-00,1913,7,0,,,on Campanula persicifolia,Sweden,Sdermanland,Sdermanland,Strngns,Strngns,59.383333,17.033333,,,https://www.mycoportal.org/portal/collections/individual/index.php?occid=4354062
4354071,,,,,,Peronosporaceae,Peronospora diplotaxidis,647091,Peronospora,,"Smarods, Julijs",,8/1/37,1937,8,1,213,,on Diplotaxis muralis,Latvia,Vidzeme,Riga,Riga,Uzvaras Park,56.935659,24.086651,,,https://www.mycoportal.org/portal/collections/individual/index.php?occid=4354071
4354075,Chromista|Oomycota|Oomycetes|Peronosporales|Peronosporaceae|Peronospora,Chromista,Oomycota,Oomycetes,Peronosporales,Peronosporaceae,Peronospora leptosperma,647272,Peronospora,,"Smarods, Julijs",,7/12/36,1936,7,12,194,,with Matricaria discoidea,Latvia,Vidzeme,Riga,L?gatne,L?gatne,57.233333,25.05,,,https://www.mycoportal.org/portal/collections/individual/index.php?occid=4354075
4354078,,,,,,Peronosporaceae,Peronospora obovata,647350,Peronospora,,"Parks, H.E.",,1933-06-00,1933,6,0,,,on Spergula arvensis,United States,California,Humboldt,Trinidad,Spruce Cove,41.059291,-124.143125,,,https://www.mycoportal.org/portal/collections/individual/index.php?occid=4354078
4354083,,,,,,Peronosporaceae,Peronospora radii,647405,Peronospora,,"Lagerheim, G.",,1913-07-00,1913,7,0,,,with Matricaria inodora,Sweden,Sdermanland,Strngns,Strngns,Strngns,59.383333,17.033333,,,https://www.mycoportal.org/portal/collections/individual/index.php?occid=4354083
4354086,,,,,,Peronosporaceae,Peronospora radii,647405,Peronospora,,"Lagerheim, G.",,1913-07-00,1913,7,0,,,on Chrysanthemum leucanthemum (syn. Leucanthemum vulgare),Sweden,Sdermanland,Strngns,Strngns,Strngns,59.383333,17.033333,,,https://www.mycoportal.org/portal/collections/individual/index.php?occid=4354086
4354091,,,,,,Peronosporaceae,Peronospora schachtii,647442,Peronospora,,"Hariot, P.",,8/17/13,1913,8,17,229,,on cultivated Beta vulgaris,France,le-de-France,Seine-et-Marne,Coupvray,Coupvray,48.892893,2.7967,,,https://www.mycoportal.org/portal/collections/individual/index.php?occid=4354091
4354096,,,,,,Peronosporaceae,Peronospora schleidenii,647444,Peronospora,,"Hariot, P.",,6/18/11,1911,6,18,169,,on leaves of Allii cepae,France,le-de-France,Seine-et-Marne,Coupvray,"Coupvray, near Meaux",48.959601,2.8879,,,https://www.mycoportal.org/portal/collections/individual/index.php?occid=4354096
4354099,,,,,,Peronosporaceae,Peronospora valerianellae,647548,Peronospora,,"Lind, J.",,5/15/13,1913,5,15,135,,on Valerianella olitoria (syn. Valerianella locusta),Denmark,Zealand,Vordingborg,Vordingborg,Vordingborg,55.01044,11.903918,,,https://www.mycoportal.org/portal/collections/individual/index.php?occid=4354099
4364480,,,,,,Peronosporaceae,Sclerospora graminicola,653589,Sclerospora,,"Brenckle, J.F.",,1909-08-00,1909,8,0,,,on Panicum viridis,United States,North Dakota,Lamoure,Kulm,Kulm,46.301914,-98.948162,,,https://www.mycoportal.org/portal/collections/individual/index.php?occid=4364480
4364483,,,,,,Peronosporaceae,Sclerospora macrospora,653594,Sclerospora,,"Holton, C.S.","Stanton, T.R.",7/23/48,1948,7,23,205,In low areas in irrigated fields,on Avena sativa var. overland,United States,Idaho,Bingham,Aberdeen,Aberdeen,42.94417,-112.8375,,,https://www.mycoportal.org/portal/collections/individual/index.php?occid=4364483
4364487,Fungi|Blastocladiomycota|Blastocladiomycetes|Blastocladiales|Physodermataceae|Physoderma,Fungi,Blastocladiomycota,Blastocladiomycetes,Blastocladiales,Physodermataceae,Physoderma heleocharidis,377156,Physoderma,,"Holway, E.W.D.",,1908-09-00,1908,9,0,,,on Eleocharis palustris,United States,North Dakota,Lamoure,Kulm,Kulm,46.301914,-98.948162,,,https://www.mycoportal.org/portal/collections/individual/index.php?occid=4364487
4364490,Fungi|Chytridiomycota|Chytridiomycetes|Chytridiales|Synchytriaceae|Synchytrium,Fungi,Chytridiomycota,Chytridiomycetes,Chytridiales,Synchytriaceae,Synchytrium anemones,189647,Synchytrium,,"Vestergren, T.",,1911-05-00,1911,5,0,,,on leaves of Anemone ranunculoides,Sweden,Sdermanland,Stockholm,Salem,Salem,59.245716,17.698751,,,https://www.mycoportal.org/portal/collections/individual/index.php?occid=4364490
4364491,Fungi|Chytridiomycota|Chytridiomycetes|Chytridiales|Synchytriaceae|Synchytrium,Fungi,Chytridiomycota,Chytridiomycetes,Chytridiales,Synchytriaceae,Synchytrium asari,439017,Synchytrium,,"Cooke, William Bridge",,6/29/40,1940,6,29,181,,on Asarum hartwegii,United States,California,Siskiyou,Mt. Shasta,in transition zone near Memorial Highway,41.339083,-122.253483,1524,,https://www.mycoportal.org/portal/collections/individual/index.php?occid=4364491
4364492,Fungi|Chytridiomycota|Chytridiomycetes|Chytridiales|Synchytriaceae|Synchytrium,Fungi,Chytridiomycota,Chytridiomycetes,Chytridiales,Synchytriaceae,Synchytrium asari,439017,Synchytrium,,"Cooke, William Bridge",,1938-00-00,1938,0,0,,,on Asarum hartwegii,United States,California,Siskiyou,Mt. Shasta,Along the Sisson Southern Trail,41.339569,-122.287735,1524,,https://www.mycoportal.org/portal/collections/individual/index.php?occid=4364492
4364494,Fungi|Chytridiomycota|Chytridiomycetes|Chytridiales|Synchytriaceae|Synchytrium,Fungi,Chytridiomycota,Chytridiomycetes,Chytridiales,Synchytriaceae,Synchytrium aureum,439023,Synchytrium,,"Cooke, William Bridge",,8/8/41,1941,8,8,220,,on Ligusticum grayi,United States,California,Siskiyou,Mt. Shasta,Along a creek between Wagon Camp and Bear Springs,41.2996,-122.300991,1676,,https://www.mycoportal.org/portal/collections/individual/index.php?occid=4364494
4364496,Fungi|Chytridiomycota|Chytridiomycetes|Chytridiales|Synchytriaceae|Synchytrium,Fungi,Chytridiomycota,Chytridiomycetes,Chytridiales,Synchytriaceae,Synchytrium decipiens,439068,Synchytrium,,"Kellerman, W.A.",,7/9/03,1903,7,9,190,,on Falcata comosa (syn. Amphicarpaea bracteata),United States,Ohio,Erie,Sandusky,Sandusky,41.446238,-82.716715,,,https://www.mycoportal.org/portal/collections/individual/index.php?occid=4364496
4364497,Fungi|Chytridiomycota|Chytridiomycetes|Chytridiales|Synchytriaceae|Synchytrium,Fungi,Chytridiomycota,Chytridiomycetes,Chytridiales,Synchytriaceae,Synchytrium decipiens,439068,Synchytrium,,"Kellerman, W.A.",,7/9/03,1903,7,9,190,,on Falcata comosa (syn. Amphicarpaea bracteata),United States,Ohio,Erie,Sandusky,Sandusky,41.446238,-82.716715,,,https://www.mycoportal.org/portal/collections/individual/index.php?occid=4364497
4364498,Fungi|Chytridiomycota|Chytridiomycetes|Chytridiales|Synchytriaceae|Synchytrium,Fungi,Chytridiomycota,Chytridiomycetes,Chytridiales,Synchytriaceae,Synchytrium fulgens,439086,Synchytrium,,s.n.,,1897-01-16,1897,1,16,16,,on Oenothera laciniata,United States,Alabama,Lee,Auburn,Auburn,32.609857,-85.480782,,,https://www.mycoportal.org/portal/collections/individual/index.php?occid=4364498
4364499,Fungi|Chytridiomycota|Chytridiomycetes|Chytridiales|Synchytriaceae|Synchytrium,Fungi,Chytridiomycota,Chytridiomycetes,Chytridiales,Synchytriaceae,Synchytrium phegopteridis,439171,Synchytrium,,"Johanson, C.J.",,1884-08-17,1884,8,17,230,,on leaves of Phegopteris polypodioides,Sweden,Jmtland,Jmtland,re,re,63.396458,13.080644,,,https://www.mycoportal.org/portal/collections/individual/index.php?occid=4364499
4364500,Fungi|Chytridiomycota|Chytridiomycetes|Chytridiales|Synchytriaceae|Synchytrium,Fungi,Chytridiomycota,Chytridiomycetes,Chytridiales,Synchytriaceae,Synchytrium succisae,439215,Synchytrium,,"Sydow, P.",,1897-06-00,1897,6,0,,,on Succisa pratensis,Germany,Brandenburg,Havelland,Nauen,Nauen,52.60673,12.876518,,,https://www.mycoportal.org/portal/collections/individual/index.php?occid=4364500
4364502,Fungi|Ascomycota|Pezizomycotina|Leotiomycetes|Leotiomycetidae|Helotiales|Sclerotiniaceae|Phytophthora,Fungi,Ascomycota,Leotiomycetes,Helotiales,Peronosporaceae,Phytophthora infestans,214712,Phytophthora,,"Dearness, J.",,1894-08-00,1894,8,0,,,on leaves of potato,Canada,Ontario,,London,London,42.983333,-81.25,,,https://www.mycoportal.org/portal/collections/individual/index.php?occid=4364502
4364508,Chromista|Oomycota|Oomycetes|Peronosporales|Albuginaceae|Albugo,Chromista,Oomycota,Oomycetes,Peronosporales,Albuginaceae,Albugo candida,617106,Albugo,,"Lloyd, Curtis Gates",,1899-05-25,1899,5,25,145,,on Capsella bursa-pastoris,Japan,Honshu,Kant?,Tokyo,Botanical Gardens in Tokyo,35.686882,139.756539,,,https://www.mycoportal.org/portal/collections/individual/index.php?occid=4364508
4364509,Chromista|Oomycota|Oomycetes|Peronosporales|Albuginaceae|Albugo,Chromista,Oomycota,Oomycetes,Peronosporales,Albuginaceae,Albugo candida,617106,Albugo,,"Brenckle, J.F.",,1908-07-00,1908,7,0,,,on Brassica arvensis,United States,North Dakota,Lamoure,Kulm,Kulm,46.301914,-98.948162,,,https://www.mycoportal.org/portal/collections/individual/index.php?occid=4364509
4364510,Chromista|Oomycota|Oomycetes|Peronosporales|Albuginaceae|Albugo,Chromista,Oomycota,Oomycetes,Peronosporales,Albuginaceae,Albugo candida,617106,Albugo,,"Aiken, Walter H.",,1901-05-00,1901,5,0,,,on Capsella bursa-pastoris,United States,Ohio,Hamilton,Cincinnati,Cincinnati,39.162004,-84.456886,,,https://www.mycoportal.org/portal/collections/individual/index.php?occid=4364510
4364511,Chromista|Oomycota|Oomycetes|Peronosporales|Albuginaceae|Albugo,Chromista,Oomycota,Oomycetes,Peronosporales,Albuginaceae,Albugo candida,617106,Albugo,,"Kellerman, W.A.",,1897-04-21,1897,4,21,111,,on Capsella bursa-pastoris,United States,Ohio,Hamilton,Cincinnati,College Hill,39.20228,-84.547166,,,https://www.mycoportal.org/portal/collections/individual/index.php?occid=4364511
4364512,Chromista|Oomycota|Oomycetes|Peronosporales|Albuginaceae|Albugo,Chromista,Oomycota,Oomycetes,Peronosporales,Albuginaceae,Albugo candida,617106,Albugo,,"Aiken, Walter H.",,1897-05-28,1897,5,28,148,,on Iodanthus pinnatifidus,United States,Ohio,Hamilton,Cincinnati,College Hill,39.20228,-84.547166,,,https://www.mycoportal.org/portal/collections/individual/index.php?occid=4364512
4364513,Chromista|Oomycota|Oomycetes|Peronosporales|Albuginaceae|Albugo,Chromista,Oomycota,Oomycetes,Peronosporales,Albuginaceae,Albugo candida,617106,Albugo,,"Aiken, Walter H.",,1897-05-31,1897,5,31,151,,on Lepidium virginicum,United States,Ohio,Hamilton,Cincinnati,College Hill,39.20228,-84.547166,,,https://www.mycoportal.org/portal/collections/individual/index.php?occid=4364513
4364516,Chromista|Oomycota|Oomycetes|Peronosporales|Albuginaceae|Albugo,Chromista,Oomycota,Oomycetes,Peronosporales,Albuginaceae,Albugo candida,617106,Albugo,,"Aiken, Walter H.",,7/15/01,1901,7,15,196,,on Sisymbrium officinale,United States,Ohio,Hamilton,Cincinnati,College Hill,39.20228,-84.547166,,,https://www.mycoportal.org/portal/collections/individual/index.php?occid=4364516
4364517,Chromista|Oomycota|Oomycetes|Peronosporales|Albuginaceae|Albugo,Chromista,Oomycota,Oomycetes,Peronosporales,Albuginaceae,Albugo bliti,617105,Albugo,,s.n.,,1899-08-13,1899,8,13,225,,on Achyranthes bidentata var. japonica,Japan,Fukushima,Hamad?ri,Iwaki,"Iwaki, Hamad?ri, Fukushima",37.05,140.883333,,,https://www.mycoportal.org/portal/collections/individual/index.php?occid=4364517
4364518,Chromista|Oomycota|Oomycetes|Peronosporales|Albuginaceae|Albugo,Chromista,Oomycota,Oomycetes,Peronosporales,Albuginaceae,Albugo candida,617106,Albugo,,"Tyler, F.J.",,5/15/02,1902,5,15,135,,on Camelina sativa,United States,Ohio,Franklin,Columbus,Columbus,39.975911,-82.985061,,,https://www.mycoportal.org/portal/collections/individual/index.php?occid=4364518
4364519,Chromista|Oomycota|Oomycetes|Peronosporales|Albuginaceae|Albugo,Chromista,Oomycota,Oomycetes,Peronosporales,Albuginaceae,Albugo candida,617106,Albugo,,"Tyler, F.J.",,5/15/02,1902,5,15,135,,on Camelina sativa,United States,Ohio,Franklin,Columbus,Columbus,39.975911,-82.985061,,,https://www.mycoportal.org/portal/collections/individual/index.php?occid=4364519
4364520,Chromista|Oomycota|Oomycetes|Peronosporales|Albuginaceae|Albugo,Chromista,Oomycota,Oomycetes,Peronosporales,Albuginaceae,Albugo candida,617106,Albugo,,"Kellerman, W.A.",,5/9/03,1903,5,9,129,,on Capsella bursa-pastoris,United States,Ohio,Franklin,Columbus,Columbus,39.961176,-82.998794,,,https://www.mycoportal.org/portal/collections/individual/index.php?occid=4364520
4364523,,,,,,Albuginaceae,Albugo ipomoeae-panduratae,621026,Albugo,,"Aiken, Walter H.",,1897-07-02,1897,7,2,183,,on Ipomoea pandurata,United States,Ohio,Hamilton,Cincinnati,College Hill,39.20228,-84.547166,,,https://www.mycoportal.org/portal/collections/individual/index.php?occid=4364523
4364525,,,,,,Albuginaceae,Albugo ipomoeae-panduratae,621026,Albugo,,"Aiken, Walter H.",,8/10/00,1900,8,10,222,,on Ipomoea hederacea,United States,Ohio,Hamilton,,"Hamilton County, Ohio",39.195531,-84.542775,,,https://www.mycoportal.org/portal/collections/individual/index.php?occid=4364525
4364529,Chromista|Oomycota|Oomycetes|Peronosporales|Albuginaceae|Albugo,Chromista,Oomycota,Oomycetes,Peronosporales,Albuginaceae,Albugo portulacae,617108,Albugo,,"Tyler, F.J.",,7/12/02,1902,7,12,193,,on Portulaca oleracea,United States,Ohio,Lake,Perry,Perry,41.760326,-81.140932,,,https://www.mycoportal.org/portal/collections/individual/index.php?occid=4364529
4364531,Chromista|Oomycota|Oomycetes|Peronosporales|Albuginaceae|Albugo,Chromista,Oomycota,Oomycetes,Peronosporales,Albuginaceae,Albugo portulacae,617108,Albugo,,"Tyler, F.J.",,7/12/02,1902,7,12,193,,on Portulaca oleracea,United States,Ohio,Lake,Perry,Perry,41.760326,-81.140932,,,https://www.mycoportal.org/portal/collections/individual/index.php?occid=4364531
4364536,,,,,,Albuginaceae,Cystopus candidus,633970,Cystopus,,"Cooke, William Bridge",,1940-06-00,1940,6,0,,,on Sisymbrium altissimum,United States,California,Siskiyou,Mt. Shasta,Along Memorial Highway,41.339083,-122.253483,1219,,https://www.mycoportal.org/portal/collections/individual/index.php?occid=4364536
4364539,,,,,,Albuginaceae,Cystopus candidus,633970,Cystopus,,"Cooke, William Bridge",,8/19/36,1936,8,19,232,,on Sisymbrium altissimum,United States,California,Siskiyou,Mt. Shasta,Along the lower end of the Sisson Southern Trail,41.339569,-122.287735,1219,,https://www.mycoportal.org/portal/collections/individual/index.php?occid=4364539
4364542,,,,,,Albuginaceae,Cystopus candidus,633970,Cystopus,,"Kelsey, F.D.","Ricksecker, A.E.",1894-06-07,1894,6,7,158,,on Sisymbrium officinale,United States,Ohio,Lorain,Oberlin,Oberlin,41.293939,-82.217379,,,https://www.mycoportal.org/portal/collections/individual/index.php?occid=4364542
4364545,,,,,,Albuginaceae,Cystopus candidus,633970,Cystopus,,"Kelsey, F.D.",,1895-00-00,1895,0,0,,,on Nasturtium armoracia,United States,Ohio,Lorain,Oberlin,Oberlin,41.293939,-82.217379,,,https://www.mycoportal.org/portal/collections/individual/index.php?occid=4364545
4364549,,,,,,Albuginaceae,Cystopus candidus,633970,Cystopus,,"Cooke, William Bridge",,7/25/41,1941,7,25,206,,on Sisymbrium altissimum,United States,California,Siskiyou,Mt. Shasta,Along the Memorial Highway below MacBride Springs,41.35342,-122.281635,1219,,https://www.mycoportal.org/portal/collections/individual/index.php?occid=4364549
4364552,,,,,,Albuginaceae,Cystopus candidus,633970,Cystopus,,"Cooke, William Bridge",,7/11/41,1941,7,11,192,In the chaparral,on Sisymbrium altissimum,United States,California,Siskiyou,Mt. Shasta,"Along the Memorial Highway, Mount Shasta",41.339083,-122.253483,1524,,https://www.mycoportal.org/portal/collections/individual/index.php?occid=4364552
4364554,,,,,,Albuginaceae,Cystopus candidus,633970,Cystopus,,"Cooke, William Bridge",,7/25/41,1941,7,25,206,,on Sisymbrium altissimum,United States,California,Siskiyou,Mt. Shasta,Along the Memorial Highway below MacBride Springs,41.35342,-122.281635,1524,,https://www.mycoportal.org/portal/collections/individual/index.php?occid=4364554
4364556,Chromista|Oomycota|Oomycetes|Peronosporales|Albuginaceae|Albugo,Chromista,Oomycota,Oomycetes,Peronosporales,Albuginaceae,Albugo tragopogonis,617109,Albugo,,"Nelson, D.",,3/30/37,1937,3,30,89,,on Matricaria suaveolens,United States,California,Contra Costa,Byron,Byron,37.867148,-121.638007,,,https://www.mycoportal.org/portal/collections/individual/index.php?occid=4364556
4364567,Chromista|Oomycota|Oomycetes|Peronosporales|Albuginaceae|Cystopus,Chromista,Oomycota,Oomycetes,Peronosporales,Albuginaceae,Cystopus tragopogonis,621435,Cystopus,,"Kelsey, F.D.",,1892-08-02,1892,8,2,215,,,United States,Montana,Lewis and Clark,Helena,Helena,46.592712,-112.036109,,,https://www.mycoportal.org/portal/collections/individual/index.php?occid=4364567
4364571,,,,,,Albuginaceae,Cystopus candidus,633970,Cystopus,,"Kelsey, F.D.",,1889-06-12,1889,6,12,163,,on Sisymbrium incisum,United States,Montana,Lewis and Clark,Helena,Helena,46.592712,-112.036109,,,https://www.mycoportal.org/portal/collections/individual/index.php?occid=4364571
4364572,,,,,,Albuginaceae,Cystopus candidus,633970,Cystopus,,"Kelsey, F.D.",,1892-05-13,1892,5,13,134,,on Sisymbrium canescens,United States,Montana,Deer Lodge,Anaconda,Anaconda,46.128537,-112.942264,,,https://www.mycoportal.org/portal/collections/individual/index.php?occid=4364572
4364575,Chromista|Oomycota|Oomycetes|Peronosporales|Albuginaceae|Cystopus,Chromista,Oomycota,Oomycetes,Peronosporales,Albuginaceae,Cystopus bliti,633967,Cystopus,,"Kelsey, F.D.",,1892-07-05,1892,7,5,187,,on Chenopodium rubrum (syn. Oxybasis rubra),United States,Montana,Jefferson,Basin,Basin,46.271318,-112.26362,,,https://www.mycoportal.org/portal/collections/individual/index.php?occid=4364575
4364580,Chromista|Oomycota|Oomycetes|Peronosporales|Peronosporaceae|Peronospora,Chromista,Oomycota,Oomycetes,Peronosporales,Peronosporaceae,Peronospora arborescens,214668,Peronospora,,"Sydow, P.",,1899-06-14,1899,6,14,165,,on Papaver rhoeas,Germany,Berlin,Tempelhof-Schneberg,Schneberg,Schneberg,52.489825,13.352837,,,https://www.mycoportal.org/portal/collections/individual/index.php?occid=4364580
4364581,Chromista|Oomycota|Oomycetes|Peronosporales|Peronosporaceae|Peronospora,Chromista,Oomycota,Oomycetes,Peronosporales,Peronosporaceae,Peronospora arthurii,646943,Peronospora,,"Kellerman, W.A.",,6/5/01,1901,6,5,156,,on Onagra biennis (syn. Oenothera biennis),United States,Ohio,Franklin,Columbus,Columbus,39.961176,-82.998794,,,https://www.mycoportal.org/portal/collections/individual/index.php?occid=4364581
4364584,Chromista|Oomycota|Oomycetes|Peronosporales|Peronosporaceae|Peronospora,Chromista,Oomycota,Oomycetes,Peronosporales,Peronosporaceae,Peronospora arthurii,646943,Peronospora,,"Brenckle, J.F.",,1910-06-00,1910,6,0,,,on Onagra strigosa,United States,North Dakota,Lamoure,Kulm,Kulm,46.301914,-98.948162,,,https://www.mycoportal.org/portal/collections/individual/index.php?occid=4364584
4364587,,,,,,Peronosporaceae,Peronospora floerkeae,647145,Peronospora,,"Kellerman, W.A.",,5/15/03,1903,5,15,135,,on Floerkea proserpinacoides,United States,Ohio,Franklin,Columbus,Columbus,39.961176,-82.998794,,,https://www.mycoportal.org/portal/collections/individual/index.php?occid=4364587
4364589,,,,,,Peronosporaceae,Peronospora oerteliana,647353,Peronospora,,"Sydow, P.",,1897-06-00,1897,6,0,,,on Primula officinalis (syn. Primula veris),Germany,Brandenburg,Havelland,Nauen,Nauen,52.60673,12.876518,,,https://www.mycoportal.org/portal/collections/individual/index.php?occid=4364589
4364590,Chromista|Oomycota|Oomycetes|Peronosporales|Peronosporaceae|Peronospora,Chromista,Oomycota,Oomycetes,Peronosporales,Peronosporaceae,Peronospora parasitica,647368,Peronospora,,"Kellerman, W.A.",,5/5/03,1903,5,5,125,,on Dentaria laciniata (syn. Cardamine concatenata),United States,Ohio,Franklin,Columbus,Columbus,39.961176,-82.998794,,,https://www.mycoportal.org/portal/collections/individual/index.php?occid=4364590
4364591,Chromista|Oomycota|Oomycetes|Peronosporales|Peronosporaceae|Peronospora,Chromista,Oomycota,Oomycetes,Peronosporales,Peronosporaceae,Peronospora parasitica,647368,Peronospora,,"Kellerman, W.A.",,5/5/03,1903,5,5,125,,on Dentaria laciniata (syn. Cardamine concatenata),United States,Ohio,Franklin,Columbus,Columbus,39.961176,-82.998794,,,https://www.mycoportal.org/portal/collections/individual/index.php?occid=4364591
4364592,Chromista|Oomycota|Oomycetes|Peronosporales|Peronosporaceae|Peronospora,Chromista,Oomycota,Oomycetes,Peronosporales,Peronosporaceae,Peronospora parasitica,647368,Peronospora,,"Aiken, Walter H.",,1899-05-00,1899,5,0,,,on Cardamine pensylvanica,United States,Ohio,Hamilton,,"Hamilton County, Ohio",39.195531,-84.542775,,,https://www.mycoportal.org/portal/collections/individual/index.php?occid=4364592
4364597,Chromista|Oomycota|Oomycetes|Peronosporales|Peronosporaceae|Peronospora,Chromista,Oomycota,Oomycetes,Peronosporales,Peronosporaceae,Peronospora viciae,214673,Peronospora,,"Brenckle, J.F.",,1909-06-00,1909,6,0,,,on Vicia linearis,United States,North Dakota,Lamoure,Kulm,Kulm,46.301914,-98.948162,,,https://www.mycoportal.org/portal/collections/individual/index.php?occid=4364597
4364599,Chromista|Oomycota|Oomycetes|Peronosporales|Peronosporaceae|Peronospora,Chromista,Oomycota,Oomycetes,Peronosporales,Peronosporaceae,Peronospora parasitica,647368,Peronospora,,s.n.,,1899-02-04,1899,2,4,35,,on Rhaphanus sativus,Japan,Honshu,Kant?,Tokyo,Tokyo Botanical Gardens,35.685,139.751389,,,https://www.mycoportal.org/portal/collections/individual/index.php?occid=4364599
4366646,,,,,,Peronosporaceae,Peronospora violae,647566,Peronospora,,"Earle, F.S.",,1897-04-13,1897,4,13,103,,on Viola tenella,United States,Alabama,Lee,Auburn,Auburn,32.609857,-85.480782,,,https://www.mycoportal.org/portal/collections/individual/index.php?occid=4366646
4366647,,,,,,Peronosporaceae,Peronospora violacea,647565,Peronospora,,"Sydow, P.",,1899-06-23,1899,6,23,174,,on Knautia arvensis,Germany,Brandenburg,Teltow-Flming,Grobeeren,Grobeeren,52.357768,13.309968,,,https://www.mycoportal.org/portal/collections/individual/index.php?occid=4366647
4366668,,,,,,Peronosporaceae,Peronospora nivea,647341,Peronospora,,"Tauscher, Gyula",,1877-07-23,1877,7,23,204,,on Conium maculatum,Hungary,,Arad,Ujfalu,Ujfalu,45.965548,17.712086,,,https://www.mycoportal.org/portal/collections/individual/index.php?occid=4366668
4366935,Chromista|Oomycota|Oomycetes|Peronosporales|Albuginaceae|Cystopus,Chromista,Oomycota,Oomycetes,Peronosporales,Albuginaceae,Cystopus lepigoni,621434,Cystopus,,"Staritz, Richard",,1876-09-00,1876,9,0,,,on Spergularia sp.,Germany,Saxony-Anhalt,,Halle,Halle,51.486948,11.97045,,,https://www.mycoportal.org/portal/collections/individual/index.php?occid=4366935
4366938,Chromista|Oomycota|Oomycetes|Peronosporales|Albuginaceae|Cystopus,Chromista,Oomycota,Oomycetes,Peronosporales,Albuginaceae,Cystopus cubicus,633977,Cystopus,,"Staritz, Richard",,1876-09-00,1876,9,0,,,,Germany,,Saxony-Anhalt,Halle,Halle,51.481389,11.985556,,,https://www.mycoportal.org/portal/collections/individual/index.php?occid=4366938
4366956,Fungi|Basidiomycota|Agaricomycotina|Agaricomycetes|Agaricomycetidae|Polyporales|Meruliaceae|Gloeoporus,Fungi,Basidiomycota,Agaricomycetes,Polyporales,Meruliaceae,Gloeoporus conchoides,227399,Gloeoporus,,"Cooke, William Bridge",,11/19/35,1935,11,19,323,,,United States,Ohio,Hamilton,Cincinnati,Red Bird Hollow,39.171121,-84.319385,,,https://www.mycoportal.org/portal/collections/individual/index.php?occid=4366956
4366964,Fungi|Basidiomycota|Agaricomycotina|Agaricomycetes|Agaricomycetidae|Polyporales|Polyporaceae|Fomes,Fungi,Basidiomycota,Agaricomycetes,Polyporales,Ganodermataceae,Fomes lobatus,221010,Fomes,,"Cooke, William Bridge",,10/10/35,1935,10,10,283,,on Acer saccharinum,United States,Ohio,Clermont,Mt. Carmel,Mt. Carmel,39.105894,-84.304104,,,https://www.mycoportal.org/portal/collections/individual/index.php?occid=4366964
4366966,Fungi|Basidiomycota|Agaricomycotina|Agaricomycetes|Agaricomycetidae|Polyporales|Polyporaceae|Fomes,Fungi,Basidiomycota,Agaricomycetes,Polyporales,Polyporaceae,Fomes fraxinophilus,220895,Fomes,,"Cooke, William Bridge",,2/29/36,1936,2,29,60,,on dead bark,United States,Ohio,Clermont,,Alpine Road,39.047433,-84.151918,,,https://www.mycoportal.org/portal/collections/individual/index.php?occid=4366966
4366968,Fungi|Basidiomycota|Agaricomycotina|Agaricomycetes|Agaricomycetidae|Polyporales|Polyporaceae|Fomes,Fungi,Basidiomycota,Agaricomycetes,Polyporales,Hymenochaetaceae,Fomes robustus,221194,Fomes,,"Cooke, William Bridge",,3/21/36,1936,3,21,81,,,United States,Ohio,Hamilton,Polk Run,Polk Run,39.247745,-84.29431,,,https://www.mycoportal.org/portal/collections/individual/index.php?occid=4366968
4366971,Fungi|Basidiomycota|Agaricomycotina|Agaricomycetes|Agaricomycetidae|Polyporales|Polyporaceae|Fomes,Fungi,Basidiomycota,Agaricomycetes,Polyporales,Hymenochaetaceae,Fomes robustus,221194,Fomes,,"Cooke, William Bridge",,3/21/36,1936,3,21,81,,,United States,Ohio,Hamilton,Polk Run,Polk Run,39.247745,-84.29431,,,https://www.mycoportal.org/portal/collections/individual/index.php?occid=4366971
4366975,Fungi|Basidiomycota|Agaricomycotina|Agaricomycetes|Agaricomycetidae|Polyporales|Polyporaceae|Fomes,Fungi,Basidiomycota,Agaricomycetes,Polyporales,Hymenochaetaceae,Fomes rimosus,221190,Fomes,,"Cooke, William Bridge",,10/10/35,1935,10,10,283,,,United States,Ohio,Clermont,Batavia,"Batavia, Glen Forest",39.077007,-84.17688,,,https://www.mycoportal.org/portal/collections/individual/index.php?occid=4366975
4366979,Fungi|Basidiomycota|Agaricomycotina|Agaricomycetes|Agaricomycetidae|Polyporales|Polyporaceae|Fomes,Fungi,Basidiomycota,Agaricomycetes,Polyporales,Hymenochaetaceae,Fomes igniarius,220956,Fomes,,"Hurst, E.B.",,1921-06-00,1921,6,0,,,on hardwood,United States,New York,Saint Lawrence,Clifton,Cranberry Lake,44.222562,-74.836299,,,https://www.mycoportal.org/portal/collections/individual/index.php?occid=4366979
4366981,Fungi|Basidiomycota|Agaricomycotina|Agaricomycetes|Agaricomycetidae|Polyporales|Polyporaceae|Fomes,Fungi,Basidiomycota,Agaricomycetes,Polyporales,Ganodermataceae,Fomes applanatus,220751,Fomes,,"Cooke, William Bridge",,3/16/37,1937,3,16,75,,,United States,Ohio,Clermont,Epworth Heights,Epworth Heights,39.249225,-84.278826,,,https://www.mycoportal.org/portal/collections/individual/index.php?occid=4366981
4366983,Protozoa|Myxomycota|Myxomycetes|Trichiales,Protozoa,Myxomycota,Myxomycetes,Trichiales,Trichiaceae,Hemitrichia leiotricha,638824,Hemitrichia,,"Kaps, C.",,10/27/34,1934,10,27,300,,,United States,Ohio,Adams,Beaver Pond,Beaver Pond,38.939515,-83.346299,,,https://www.mycoportal.org/portal/collections/individual/index.php?occid=4366983
4366985,Protozoa|Myxomycota|Myxomycetes|Trichiales,Protozoa,Myxomycota,Myxomycetes,Trichiales,Trichiaceae,Hemitrichia clavata,638812,Hemitrichia,,"Lillick, Lois",,10/21/32,1932,10,21,295,,dead log,United States,Ohio,Hamilton,Cincinnati,Terrace Park,39.159227,-84.30716,,,https://www.mycoportal.org/portal/collections/individual/index.php?occid=4366985
4366986,Protozoa|Myxomycota|Myxomycetes|Trichiales,Protozoa,Myxomycota,Myxomycetes,Trichiales,Trichiaceae,Hemitrichia leiotricha,638824,Hemitrichia,,"David, D.D.","Kaps, C.",10/15/34,1934,10,15,288,,,United States,Ohio,Adams,Beaver Pond,Beaver Pond,38.939515,-83.346299,,,https://www.mycoportal.org/portal/collections/individual/index.php?occid=4366986
4366987,Protozoa|Myxomycota|Myxomycetes|Trichiales,Protozoa,Myxomycota,Myxomycetes,Trichiales,Trichiaceae,Hemitrichia serpula,638838,Hemitrichia,,"Cosner, L.",,10/16/38,1938,10,16,289,,dead wood,United States,Ohio,Adams,,"Adams County, Ohio",38.845515,-83.472152,,,https://www.mycoportal.org/portal/collections/individual/index.php?occid=4366987
4366988,Protozoa|Myxomycota|Myxomycetes|Trichiales,Protozoa,Myxomycota,Myxomycetes,Trichiales,Trichiaceae,Hemitrichia clavata,638812,Hemitrichia,,"Ayers, John H.",,10/7/33,1933,10,7,280,,old log,United States,Ohio,Hamilton,,"Hamilton County, Ohio",39.195531,-84.542775,,,https://www.mycoportal.org/portal/collections/individual/index.php?occid=4366988
4366989,Protozoa|Myxomycota|Myxomycetes|Trichiales,Protozoa,Myxomycota,Myxomycetes,Trichiales,Trichiaceae,Hemitrichia clavata,638812,Hemitrichia,,"Ayers, John H.",,10/23/31,1931,10,23,296,,rotten log,United States,Ohio,Hamilton,Cincinnati,"Terrace Park, Given Road",39.159227,-84.30716,,,https://www.mycoportal.org/portal/collections/individual/index.php?occid=4366989
4366990,Protozoa|Myxomycota|Myxomycetes|Trichiales,Protozoa,Myxomycota,Myxomycetes,Trichiales,Trichiaceae,Hemitrichia leiotricha,638824,Hemitrichia,,"Ruff, M.",,1945-10-00,1945,10,0,,,on dead log,United States,Ohio,Hamilton,Cincinnati,Kroger Hills,39.150157,-84.32093,,,https://www.mycoportal.org/portal/collections/individual/index.php?occid=4366990
4366991,Protozoa|Myxomycota|Myxomycetes|Trichiales,Protozoa,Myxomycota,Myxomycetes,Trichiales,Trichiaceae,Hemitrichia vesparium,638846,Hemitrichia,,"Sanders, P.J.",,6/23/64,1964,6,23,175,,"Maple stump in woods, on slope near creek",United States,Ohio,Hamilton,Cincinnati,Center Hill Life Science Field Station,39.196066,-84.508607,,,https://www.mycoportal.org/portal/collections/individual/index.php?occid=4366991
4366992,Protozoa|Myxomycota|Myxomycetes|Trichiales,Protozoa,Myxomycota,Myxomycetes,Trichiales,Trichiaceae,Hemitrichia clavata,638812,Hemitrichia,,"Lillick, Lois",,10/8/32,1932,10,8,282,,dead log,United States,Ohio,Hamilton,Cincinnati,College Hill,39.20228,-84.547166,,,https://www.mycoportal.org/portal/collections/individual/index.php?occid=4366992
4366993,Protozoa|Myxomycota|Myxomycetes|Trichiales,Protozoa,Myxomycota,Myxomycetes,Trichiales,Trichiaceae,Hemitrichia clavata,638812,Hemitrichia,,"Ruff, M.",,1945-10-00,1945,10,0,,,dead log,United States,Ohio,Clermont,,"Wilson's Farm (Clermont County, Ohio)",39.047433,-84.151918,,,https://www.mycoportal.org/portal/collections/individual/index.php?occid=4366993
4366994,Protozoa|Myxomycota|Myxomycetes|Trichiales,Protozoa,Myxomycota,Myxomycetes,Trichiales,Trichiaceae,Hemitrichia clavata,638812,Hemitrichia,,"Muhlberg, M.",,10/7/31,1931,10,7,280,,rotten log,United States,Ohio,Hamilton,Cincinnati,College Hill,39.198536,-84.548427,,,https://www.mycoportal.org/portal/collections/individual/index.php?occid=4366994
4366996,Protozoa|Myxomycota|Myxomycetes|Trichiales,Protozoa,Myxomycota,Myxomycetes,Trichiales,Trichiaceae,Hemitrichia leiotricha,638824,Hemitrichia,,"Murphy, J.",,10/27/34,1934,10,27,300,,dead wood,United States,Ohio,Adams,,"Adams County, Ohio",38.845515,-83.472152,,,https://www.mycoportal.org/portal/collections/individual/index.php?occid=4366996
4366998,Protozoa|Myxomycota|Myxomycetes|Trichiales,Protozoa,Myxomycota,Myxomycetes,Trichiales,Trichiaceae,Hemitrichia leiotricha,638824,Hemitrichia,,"Fahnestack, G.R.",,10/14/34,1934,10,14,287,,dead wood,United States,Ohio,Scioto,,Shawnee Forest,38.74287,-83.204008,,,https://www.mycoportal.org/portal/collections/individual/index.php?occid=4366998
4367010,Protozoa|Myxomycota|Myxomycetes|Trichiales,Protozoa,Myxomycota,Myxomycetes,Trichiales,Trichiaceae,Hemitrichia clavata,638812,Hemitrichia,,"Ayers, John H.",,10/23/31,1931,10,23,296,,rotten log,United States,Ohio,Hamilton,Cincinnati,Given Road,39.159227,-84.30716,,,https://www.mycoportal.org/portal/collections/individual/index.php?occid=4367010
4367011,Protozoa|Myxomycota|Myxomycetes|Trichiales,Protozoa,Myxomycota,Myxomycetes,Trichiales,Trichiaceae,Hemitrichia clavata,638812,Hemitrichia,,"Ayers, John H.",,1932-10-00,1932,10,0,,,rotten log,United States,Ohio,Hamilton,Cincinnati,Kroger Hills,39.150157,-84.32093,,,https://www.mycoportal.org/portal/collections/individual/index.php?occid=4367011
4367023,Protozoa|Myxomycota|Myxomycetes|Trichiales,Protozoa,Myxomycota,Myxomycetes,Trichiales,Trichiaceae,Hemitrichia clavata,638812,Hemitrichia,,"Ayers, John H.",,1933-05-00,1933,5,0,,,Rotten wood,United States,Ohio,Hamilton,Cincinnati,"Cincinnati, Kroger Hills",39.150157,-84.32093,,,https://www.mycoportal.org/portal/collections/individual/index.php?occid=4367023
4367025,Protozoa|Myxomycota|Myxomycetes|Trichiales,Protozoa,Myxomycota,Myxomycetes,Trichiales,Trichiaceae,Hemitrichia clavata,638812,Hemitrichia,,"Sanders, P.J.",,6/25/64,1964,6,25,177,"Woods, maple grove.",Stump,United States,Ohio,Hamilton,Cincinnati,Center Hill Life Science Field Station,39.196066,-84.508607,,,https://www.mycoportal.org/portal/collections/individual/index.php?occid=4367025
4367028,Protozoa|Myxomycota|Myxomycetes|Trichiales,Protozoa,Myxomycota,Myxomycetes,Trichiales,Trichiaceae,Hemitrichia clavata,638812,Hemitrichia,,"Fulford, Margaret H.",,10/4/29,1929,10,4,277,,rotten log,United States,Ohio,Hamilton,Cincinnati,Hazelwood,39.266169,-84.362996,,,https://www.mycoportal.org/portal/collections/individual/index.php?occid=4367028
4367030,Protozoa|Myxomycota|Myxomycetes|Trichiales,Protozoa,Myxomycota,Myxomycetes,Trichiales,Trichiaceae,Hemitrichia clavata,638812,Hemitrichia,,"Ayers, John H.",,10/15/32,1932,10,15,289,,rotten log,United States,Ohio,Hamilton,Cincinnati,College Hill,39.20228,-84.547166,,,https://www.mycoportal.org/portal/collections/individual/index.php?occid=4367030
4367031,Protozoa|Myxomycota|Myxomycetes|Trichiales,Protozoa,Myxomycota,Myxomycetes,Trichiales,Trichiaceae,Hemitrichia clavata,638812,Hemitrichia,,"Manley, M.",,10/16/38,1938,10,16,289,,wet log,United States,Ohio,Adams,Mineral Springs,Mineral Springs,38.887016,-83.329354,,,https://www.mycoportal.org/portal/collections/individual/index.php?occid=4367031
4367035,Protozoa|Myxomycota|Myxomycetes|Trichiales,Protozoa,Myxomycota,Myxomycetes,Trichiales,Trichiaceae,Hemitrichia clavata,638812,Hemitrichia,,"Fulford, Margaret H.",,10/9/31,1931,10,9,282,,decayed log,United States,Ohio,Hamilton,Cincinnati,Kroger Hills,39.150157,-84.32093,,,https://www.mycoportal.org/portal/collections/individual/index.php?occid=4367035
4367043,Protozoa|Myxomycota|Myxomycetes|Trichiales,Protozoa,Myxomycota,Myxomycetes,Trichiales,Trichiaceae,Hemitrichia clavata,638812,Hemitrichia,,"Fulford, Margaret H.",,10/23/31,1931,10,23,296,,decayed log,United States,Ohio,Hamilton,Cincinnati,"Given Road, Terrace Park",39.159227,-84.30716,,,https://www.mycoportal.org/portal/collections/individual/index.php?occid=4367043
4367044,Protozoa|Myxomycota|Myxomycetes|Trichiales,Protozoa,Myxomycota,Myxomycetes,Trichiales,Trichiaceae,Hemitrichia clavata,638812,Hemitrichia,,"Fulford, Margaret H.",,10/23/31,1931,10,23,296,,decayed log,United States,Ohio,Hamilton,Cincinnati,"Given Road, Terrace Park",39.159227,-84.30716,,,https://www.mycoportal.org/portal/collections/individual/index.php?occid=4367044
4367045,Protozoa|Myxomycota|Myxomycetes|Trichiales,Protozoa,Myxomycota,Myxomycetes,Trichiales,Trichiaceae,Hemitrichia clavata,638812,Hemitrichia,,"Hoskins, John Hobart",,1931-00-00,1931,0,0,,,,United States,Ohio,Hamilton,Cincinnati,Cincinnati,39.162004,-84.456886,,,https://www.mycoportal.org/portal/collections/individual/index.php?occid=4367045
4367046,Protozoa|Myxomycota|Myxomycetes|Trichiales,Protozoa,Myxomycota,Myxomycetes,Trichiales,Trichiaceae,Hemitrichia clavata,638812,Hemitrichia,,"Cooke, William Bridge",,7/31/32,1932,7,31,213,,dead wood,United States,Ohio,Highland,,Seven Caves,39.222845,-83.355158,,,https://www.mycoportal.org/portal/collections/individual/index.php?occid=4367046
4367049,Protozoa|Myxomycota|Myxomycetes|Trichiales,Protozoa,Myxomycota,Myxomycetes,Trichiales,Trichiaceae,Hemitrichia clavata,638812,Hemitrichia,,"Cooke, William Bridge",,10/28/32,1932,10,28,302,,dead logs,United States,Ohio,Hamilton,Cincinnati,Kroger Hills,39.150157,-84.32093,,,https://www.mycoportal.org/portal/collections/individual/index.php?occid=4367049
4367051,Protozoa|Myxomycota|Myxomycetes|Trichiales,Protozoa,Myxomycota,Myxomycetes,Trichiales,Trichiaceae,Hemitrichia vesparium,638846,Hemitrichia,,"Hoskins, John Hobart",,1931-00-00,1931,0,0,,,rotten log,United States,Indiana,Saint Joseph,South Bend,South Bend,41.683381,-86.250007,,,https://www.mycoportal.org/portal/collections/individual/index.php?occid=4367051
4367056,Protozoa|Myxomycota|Myxomycetes|Trichiales,Protozoa,Myxomycota,Myxomycetes,Trichiales,Trichiaceae,Hemitrichia leiotricha,638824,Hemitrichia,,"Otting, H.",,10/27/34,1934,10,27,300,,decayed moist wood,United States,Ohio,Adams,,"Adams County, Ohio",38.845515,-83.472152,,,https://www.mycoportal.org/portal/collections/individual/index.php?occid=4367056
4367057,Protozoa|Myxomycota|Myxomycetes|Trichiales,Protozoa,Myxomycota,Myxomycetes,Trichiales,Trichiaceae,Prototrichia metallica,650949,Prototrichia,,"Cooke, William Bridge",,8/7/41,1941,8,7,219,,on Shasta fir,United States,California,Siskiyou,Mt. Shasta,Horse Camp,41.37252,-122.23153,2438,,https://www.mycoportal.org/portal/collections/individual/index.php?occid=4367057
4367058,Protozoa|Myxomycota|Myxomycetes|Trichiales,Protozoa,Myxomycota,Myxomycetes,Trichiales,Trichiaceae,Trichia persimilis,656896,Trichia,,"Casterline, J.",,10/9/47,1947,10,9,282,,log in woods,United States,Ohio,Clermont,,"Clermont County, Ohio",39.047433,-84.151918,,,https://www.mycoportal.org/portal/collections/individual/index.php?occid=4367058
4367059,Protozoa|Myxomycota|Myxomycetes|Trichiales,Protozoa,Myxomycota,Myxomycetes,Trichiales,Trichiaceae,Trichia favoginea,656810,Trichia,,"Cosner, L.",,10/16/38,1938,10,16,289,,dead wood,United States,Ohio,Adams,,"Adams County, Ohio",38.845515,-83.472152,,,https://www.mycoportal.org/portal/collections/individual/index.php?occid=4367059
4367064,Protozoa|Myxomycota|Myxomycetes|Trichiales,Protozoa,Myxomycota,Myxomycetes,Trichiales,Trichiaceae,Trichia favoginea,656810,Trichia,,"Cooke, William Bridge",,10/9/32,1932,10,9,283,,dead wood,United States,Ohio,Highland,,Seven Caves,39.222845,-83.355158,,,https://www.mycoportal.org/portal/collections/individual/index.php?occid=4367064
4367066,Protozoa|Myxomycota|Myxomycetes|Trichiales,Protozoa,Myxomycota,Myxomycetes,Trichiales,Trichiaceae,Trichia favoginea,656810,Trichia,,"West, M.",,10/16/45,1945,10,16,289,,decaying wood,United States,Ohio,Hamilton,Cincinnati,Kroger Hill,39.150157,-84.32093,,,https://www.mycoportal.org/portal/collections/individual/index.php?occid=4367066
4367069,Protozoa|Myxomycota|Myxomycetes|Trichiales,Protozoa,Myxomycota,Myxomycetes,Trichiales,Trichiaceae,Trichia favoginea,656810,Trichia,,"Ayers, John H.",,7/28/32,1932,7,28,210,,Rotten wood,United States,Ohio,Hamilton,Cincinnati,"Cincinnati, Kroger Hills",39.150157,-84.32093,,,https://www.mycoportal.org/portal/collections/individual/index.php?occid=4367069
4367071,Protozoa|Myxomycota|Myxomycetes|Trichiales,Protozoa,Myxomycota,Myxomycetes,Trichiales,Trichiaceae,Trichia favoginea,656810,Trichia,,"Ayers, John H.",,1932-10-00,1932,10,0,,,Rotten wood,United States,Ohio,Hamilton,Cincinnati,"Cincinnati, Kroger Hills",39.150157,-84.32093,,,https://www.mycoportal.org/portal/collections/individual/index.php?occid=4367071
4367072,Protozoa|Myxomycota|Myxomycetes|Trichiales,Protozoa,Myxomycota,Myxomycetes,Trichiales,Trichiaceae,Trichia favoginea,656810,Trichia,,"Ayers, John H.",,9/9/33,1933,9,9,252,,Rotten wood,United States,Ohio,Hamilton,Cincinnati,"Cincinnati, Mt. Airy Forest",39.165058,-84.574945,,,https://www.mycoportal.org/portal/collections/individual/index.php?occid=4367072
4367074,Protozoa|Myxomycota|Myxomycetes|Trichiales,Protozoa,Myxomycota,Myxomycetes,Trichiales,Trichiaceae,Trichia favoginea,656810,Trichia,,"Ayers, John H.",,5/2/32,1932,5,2,123,,rotten log,United States,Ohio,Hamilton,Cincinnati,"Cincinnati, Orphanage woods",39.162004,-84.456886,,,https://www.mycoportal.org/portal/collections/individual/index.php?occid=4367074
4367076,Protozoa|Myxomycota|Myxomycetes|Trichiales,Protozoa,Myxomycota,Myxomycetes,Trichiales,Trichiaceae,Trichia favoginea,656810,Trichia,,"Ayers, John H.",,1931-08-00,1931,8,0,,,Rotten wood,United States,Ohio,Hamilton,,"Hamilton County, Ohio",39.195531,-84.542775,,,https://www.mycoportal.org/portal/collections/individual/index.php?occid=4367076
4367078,Protozoa|Myxomycota|Myxomycetes|Trichiales,Protozoa,Myxomycota,Myxomycetes,Trichiales,Trichiaceae,Trichia favoginea,656810,Trichia,,"Davidson, W.A.",,10/27/34,1934,10,27,300,,dead log,United States,Ohio,Adams,Beaver Pond,Beaver Pond,38.939515,-83.346299,,,https://www.mycoportal.org/portal/collections/individual/index.php?occid=4367078
4367080,Protozoa|Myxomycota|Myxomycetes|Trichiales,Protozoa,Myxomycota,Myxomycetes,Trichiales,Trichiaceae,Trichia favoginea,656810,Trichia,,"Fulford, Margaret H.",,1929-09-00,1929,9,0,,,rotten log,United States,Ohio,Hamilton,Cincinnati,Kroger Hills,39.150157,-84.32093,,,https://www.mycoportal.org/portal/collections/individual/index.php?occid=4367080
4367082,Protozoa|Myxomycota|Myxomycetes|Trichiales,Protozoa,Myxomycota,Myxomycetes,Trichiales,Trichiaceae,Trichia favoginea,656810,Trichia,,"Ayers, John H.",,5/6/32,1932,5,6,127,,rotten log,United States,Ohio,Hamilton,Cincinnati,Hazelwood,39.266169,-84.362996,,,https://www.mycoportal.org/portal/collections/individual/index.php?occid=4367082
4367083,Protozoa|Myxomycota|Myxomycetes|Trichiales,Protozoa,Myxomycota,Myxomycetes,Trichiales,Trichiaceae,Trichia favoginea,656810,Trichia,,"Ayers, John H.",,10/7/33,1933,10,7,280,,rotten log,United States,Ohio,Hamilton,,"Hamilton County, Ohio",39.195531,-84.542775,,,https://www.mycoportal.org/portal/collections/individual/index.php?occid=4367083
4367085,Protozoa|Myxomycota|Myxomycetes|Trichiales,Protozoa,Myxomycota,Myxomycetes,Trichiales,Trichiaceae,Trichia favoginea,656810,Trichia,,"Hoskins, John Hobart",,1931-00-00,1931,0,0,,,,United States,Ohio,Hamilton,Cincinnati,Cincinnati,39.162004,-84.456886,,,https://www.mycoportal.org/portal/collections/individual/index.php?occid=4367085
4367087,Protozoa|Myxomycota|Myxomycetes|Trichiales,Protozoa,Myxomycota,Myxomycetes,Trichiales,Trichiaceae,Trichia favoginea,656810,Trichia,,"Hoskins, John Hobart",,1931-00-00,1931,0,0,,,,United States,Indiana,Saint Joseph,South Bend,South Bend,41.683381,-86.250007,,,https://www.mycoportal.org/portal/collections/individual/index.php?occid=4367087
4367090,Protozoa|Myxomycota|Myxomycetes|Trichiales,Protozoa,Myxomycota,Myxomycetes,Trichiales,Trichiaceae,Trichia favoginea,656810,Trichia,,"Ruff, M.",,1945-10-00,1945,10,0,,,wood,United States,Ohio,Hamilton,Cincinnati,Kroger Hills,39.150157,-84.32093,,,https://www.mycoportal.org/portal/collections/individual/index.php?occid=4367090
4367093,Protozoa|Myxomycota|Myxomycetes|Trichiales,Protozoa,Myxomycota,Myxomycetes,Trichiales,Trichiaceae,Trichia favoginea,656810,Trichia,,"Bauer, Kay",,10/21/32,1932,10,31,295,,,United States,Ohio,Hamilton,Cincinnati,"Cincinnati, College Hill",39.20228,-84.547166,,,https://www.mycoportal.org/portal/collections/individual/index.php?occid=4367093
4367096,Protozoa|Myxomycota|Myxomycetes|Trichiales,Protozoa,Myxomycota,Myxomycetes,Trichiales,Trichiaceae,Trichia favoginea,656810,Trichia,,"Hoskins, John Hobart",,1931-00-00,1931,0,0,,,,United States,Indiana,Saint Joseph,South Bend,South Bend,41.683381,-86.250007,,,https://www.mycoportal.org/portal/collections/individual/index.php?occid=4367096
4367098,Protozoa|Myxomycota|Myxomycetes|Trichiales,Protozoa,Myxomycota,Myxomycetes,Trichiales,Trichiaceae,Trichia favoginea,656810,Trichia,,"Hoskins, John Hobart",,1931-00-00,1931,0,0,,,,United States,Indiana,Saint Joseph,South Bend,South Bend,41.683381,-86.250007,,,https://www.mycoportal.org/portal/collections/individual/index.php?occid=4367098
4367100,Protozoa|Myxomycota|Myxomycetes|Trichiales,Protozoa,Myxomycota,Myxomycetes,Trichiales,Trichiaceae,Trichia scabra,656929,Trichia,,"Carroll, G.",,10/5/40,1940,10,5,279,,dead log,United States,Kentucky,Wolfe,Tight Holler,Tight Holler,37.757859,-83.641068,,,https://www.mycoportal.org/portal/collections/individual/index.php?occid=4367100
4367101,Protozoa|Myxomycota|Myxomycetes|Trichiales,Protozoa,Myxomycota,Myxomycetes,Trichiales,Trichiaceae,Trichia scabra,656929,Trichia,,"Hoskins, John Hobart",,1931-00-00,1931,0,0,,,,United States,Indiana,Saint Joseph,South Bend,South Bend,41.683381,-86.250007,,,https://www.mycoportal.org/portal/collections/individual/index.php?occid=4367101
4367103,Protozoa|Myxomycota|Myxomycetes|Trichiales,Protozoa,Myxomycota,Myxomycetes,Trichiales,Trichiaceae,Trichia scabra,656929,Trichia,,"Ayers, John H.",,1932-08-00,1932,8,0,,,Rotten wood,United States,Ohio,Hamilton,Cincinnati,Cincinnati,39.162004,-84.456886,,,https://www.mycoportal.org/portal/collections/individual/index.php?occid=4367103
4367112,Protozoa|Myxomycota,Protozoa,Myxomycota,,,Stemonitidaceae,Stemonitis axifera,655009,Stemonitis,,"Hoskins, John Hobart",,1932-07-00,1932,7,0,,,,United States,Michigan,Grand Traverse,Interlochen,Interlochen,44.644723,-85.7673,,,https://www.mycoportal.org/portal/collections/individual/index.php?occid=4367112
4367115,Protozoa|Myxomycota,Protozoa,Myxomycota,,,Stemonitidaceae,Stemonitis herbatica,655069,Stemonitis,,"Ayers, John H.",,8/5/32,1932,8,5,218,,Grass,United States,Ohio,Clermont,Mulberry,Mulberry,39.193393,-84.242159,,,https://www.mycoportal.org/portal/collections/individual/index.php?occid=4367115
4367117,Protozoa|Myxomycota,Protozoa,Myxomycota,,,Stemonitidaceae,Stemonitis herbatica,655069,Stemonitis,,"Sanders, P.J.",,6/25/64,1964,6,25,177,"Woods, maple grove.",Stump,United States,Ohio,Hamilton,Cincinnati,Center Hill Life Science Field Station,39.196066,-84.508607,,,https://www.mycoportal.org/portal/collections/individual/index.php?occid=4367117
4367119,Protozoa|Myxomycota,Protozoa,Myxomycota,,,Stemonitidaceae,Stemonitis herbatica,655069,Stemonitis,,"Ayers, John H.",,8/5/33,1933,8,5,217,,grass leaf,United States,Ohio,Hamilton,Cincinnati,Kroger Hills,39.150157,-84.32093,,,https://www.mycoportal.org/portal/collections/individual/index.php?occid=4367119
4367121,Protozoa|Myxomycota,Protozoa,Myxomycota,,,Stemonitidaceae,Stemonitis pallida,655110,Stemonitis,,"Hoskins, John Hobart",,1932-07-00,1932,7,0,,,,United States,Michigan,Grand Traverse,Interlochen,Interlochen,44.644723,-85.7673,,,https://www.mycoportal.org/portal/collections/individual/index.php?occid=4367121
4367123,Protozoa|Myxomycota,Protozoa,Myxomycota,,,Stemonitidaceae,Stemonitis pallida,655110,Stemonitis,,"Hoskins, John Hobart",,1932-00-00,1932,0,0,,,,United States,Michigan,Berrien,,"Berrien County, Michigan",41.995778,-86.685421,,,https://www.mycoportal.org/portal/collections/individual/index.php?occid=4367123
4367125,Protozoa|Myxomycota,Protozoa,Myxomycota,,,Stemonitidaceae,Stemonitis pallida,655110,Stemonitis,,"Ayers, John H.",,7/28/32,1932,7,28,210,,Rotten wood,United States,Ohio,Hamilton,Cincinnati,"Cincinnati, Kroger Hills",39.150157,-84.32093,,,https://www.mycoportal.org/portal/collections/individual/index.php?occid=4367125
4367127,Protozoa|Myxomycota,Protozoa,Myxomycota,,,Stemonitidaceae,Stemonitis pallida,655110,Stemonitis,,"Hoskins, John Hobart",,1932-00-00,1932,0,0,,,,United States,Michigan,Berrien,,"Berrien County, Michigan",41.995778,-86.685421,,,https://www.mycoportal.org/portal/collections/individual/index.php?occid=4367127
4367129,Protozoa|Myxomycota,Protozoa,Myxomycota,,,Stemonitidaceae,Stemonitis pallida,655110,Stemonitis,,"Ayers, John H.",,9/9/33,1933,9,9,252,,Rotten wood,United States,Ohio,Hamilton,Cincinnati,"Cincinnati, Mt. Airy Forest",39.165058,-84.574945,,,https://www.mycoportal.org/portal/collections/individual/index.php?occid=4367129
4367131,Protozoa|Myxomycota,Protozoa,Myxomycota,,,Stemonitidaceae,Stemonitis pallida,655110,Stemonitis,,"Hoskins, John Hobart",,1932-00-00,1932,0,0,,,,United States,Michigan,Grand Traverse,Interlochen,Interlochen,44.644723,-85.7673,,,https://www.mycoportal.org/portal/collections/individual/index.php?occid=4367131
4375420,Protozoa|Myxomycota|Mycetozoa|Amoebozoa|Myxogastrea|Stemonitida|Stemonitidaceae|Stemonitis,Protozoa,Amoebozoa,Myxogastrea,Stemonitida,Stemonitidaceae,Stemonitis fusca,655061,Stemonitis,,"Hoskins, John Hobart",,1931-00-00,1931,0,0,,,,United States,Indiana,Saint Joseph,South Bend,South Bend,41.683381,-86.250007,,,https://www.mycoportal.org/portal/collections/individual/index.php?occid=4375420
4375421,Protozoa|Myxomycota|Mycetozoa|Amoebozoa|Myxogastrea|Stemonitida|Stemonitidaceae|Stemonitis,Protozoa,Amoebozoa,Myxogastrea,Stemonitida,Stemonitidaceae,Stemonitis fusca,655061,Stemonitis,,"Ayers, John H.",,8/5/33,1933,8,5,217,,rotten log,United States,Ohio,Hamilton,Cincinnati,Kroger Hills,39.150157,-84.32093,,,https://www.mycoportal.org/portal/collections/individual/index.php?occid=4375421
4375422,Protozoa|Myxomycota|Mycetozoa|Amoebozoa|Myxogastrea|Stemonitida|Stemonitidaceae|Stemonitis,Protozoa,Amoebozoa,Myxogastrea,Stemonitida,Stemonitidaceae,Stemonitis fusca,655061,Stemonitis,,"Carroll, G.",,10/3/40,1940,10,3,277,,Stump,United States,Ohio,Hamilton,Cincinnati,Kroger Hills,39.150157,-84.32093,,,https://www.mycoportal.org/portal/collections/individual/index.php?occid=4375422
4375423,Protozoa|Myxomycota|Mycetozoa|Amoebozoa|Myxogastrea|Stemonitida|Stemonitidaceae|Stemonitis,Protozoa,Amoebozoa,Myxogastrea,Stemonitida,Stemonitidaceae,Stemonitis fusca,655061,Stemonitis,,"Cooke, William Bridge",,7/31/32,1932,7,31,213,,dead wood,United States,Ohio,Highland,,Seven Caves,39.222845,-83.355158,,,https://www.mycoportal.org/portal/collections/individual/index.php?occid=4375423
4375424,Protozoa|Myxomycota|Mycetozoa|Amoebozoa|Myxogastrea|Stemonitida|Stemonitidaceae|Stemonitis,Protozoa,Amoebozoa,Myxogastrea,Stemonitida,Stemonitidaceae,Stemonitis fusca,655061,Stemonitis,,"Hoskins, John Hobart",,1931-00-00,1931,0,0,,,,United States,Indiana,Saint Joseph,South Bend,South Bend,41.683381,-86.250007,,,https://www.mycoportal.org/portal/collections/individual/index.php?occid=4375424
4375425,Protozoa|Myxomycota|Mycetozoa|Amoebozoa|Myxogastrea|Stemonitida|Stemonitidaceae|Stemonitis,Protozoa,Amoebozoa,Myxogastrea,Stemonitida,Stemonitidaceae,Stemonitis fusca,655061,Stemonitis,,"Gray, Carolynne",,10/15/38,1938,10,15,288,,decayed wood,United States,Ohio,Adams,,"Adams County, Ohio",38.845515,-83.472152,,,https://www.mycoportal.org/portal/collections/individual/index.php?occid=4375425
4375426,Protozoa|Myxomycota|Mycetozoa|Amoebozoa|Myxogastrea|Stemonitida|Stemonitidaceae|Stemonitis,Protozoa,Amoebozoa,Myxogastrea,Stemonitida,Stemonitidaceae,Stemonitis fusca,655061,Stemonitis,,"Ayers, John H.",,1932-10-00,1932,10,0,,,rotten log,United States,Ohio,Hamilton,Cincinnati,Kroger Hills,39.150157,-84.32093,,,https://www.mycoportal.org/portal/collections/individual/index.php?occid=4375426
4375427,Protozoa|Myxomycota|Mycetozoa|Amoebozoa|Myxogastrea|Stemonitida|Stemonitidaceae|Stemonitis,Protozoa,Amoebozoa,Myxogastrea,Stemonitida,Stemonitidaceae,Stemonitis fusca,655061,Stemonitis,,"Hoskins, John Hobart",,1931-00-00,1931,0,0,,,,United States,Indiana,Saint Joseph,South Bend,South Bend,41.683381,-86.250007,,,https://www.mycoportal.org/portal/collections/individual/index.php?occid=4375427
4375429,Protozoa|Myxomycota|Mycetozoa|Amoebozoa|Myxogastrea|Stemonitida|Stemonitidaceae|Stemonitis,Protozoa,Amoebozoa,Myxogastrea,Stemonitida,Stemonitidaceae,Stemonitis fusca,655061,Stemonitis,,"Ayers, John H.",,8/28/32,1932,8,28,241,,rotten log,United States,Ohio,Hamilton,Cincinnati,Kroger Hills,39.150157,-84.32093,,,https://www.mycoportal.org/portal/collections/individual/index.php?occid=4375429
4375430,Protozoa|Myxomycota|Mycetozoa|Amoebozoa|Myxogastrea|Stemonitida|Stemonitidaceae|Stemonitis,Protozoa,Amoebozoa,Myxogastrea,Stemonitida,Stemonitidaceae,Stemonitis fusca,655061,Stemonitis,,"Ayers, John H.",,7/28/32,1932,7,28,210,,rotten log,United States,Ohio,Hamilton,Cincinnati,Kroger Hills,39.150157,-84.32093,,,https://www.mycoportal.org/portal/collections/individual/index.php?occid=4375430
4375431,Protozoa|Myxomycota|Mycetozoa|Amoebozoa|Myxogastrea|Stemonitida|Stemonitidaceae|Stemonitis,Protozoa,Amoebozoa,Myxogastrea,Stemonitida,Stemonitidaceae,Stemonitis fusca,655061,Stemonitis,,"Ruff, M.",,1945-10-00,1945,10,0,,,dead log,United States,Ohio,Clermont,,"Clermont County, Ohio",39.047433,-84.151918,,,https://www.mycoportal.org/portal/collections/individual/index.php?occid=4375431
4375432,Protozoa|Myxomycota|Mycetozoa|Amoebozoa|Myxogastrea|Stemonitida|Stemonitidaceae|Stemonitis,Protozoa,Amoebozoa,Myxogastrea,Stemonitida,Stemonitidaceae,Stemonitis fusca,655061,Stemonitis,,"Hoskins, John Hobart",,1931-00-00,1931,0,0,,,,United States,Indiana,Saint Joseph,South Bend,South Bend,41.683381,-86.250007,,,https://www.mycoportal.org/portal/collections/individual/index.php?occid=4375432
4375433,Protozoa|Myxomycota|Mycetozoa|Amoebozoa|Myxogastrea|Stemonitida|Stemonitidaceae|Stemonitis,Protozoa,Amoebozoa,Myxogastrea,Stemonitida,Stemonitidaceae,Stemonitis fusca,655061,Stemonitis,,"Hoskins, John Hobart",,1931-00-00,1931,0,0,,,no information given,United States,Indiana,Saint Joseph,South Bend,South Bend,41.683381,-86.250007,,,https://www.mycoportal.org/portal/collections/individual/index.php?occid=4375433
4375434,Protozoa|Myxomycota|Mycetozoa|Amoebozoa|Myxogastrea|Stemonitida|Stemonitidaceae|Stemonitis,Protozoa,Amoebozoa,Myxogastrea,Stemonitida,Stemonitidaceae,Stemonitis fusca,655061,Stemonitis,,"Ayers, John H.",,8/28/32,1932,8,28,241,,Rotten wood,United States,Ohio,Clermont,Milford,Milford,39.175338,-84.294382,,,https://www.mycoportal.org/portal/collections/individual/index.php?occid=4375434
4375435,Protozoa|Myxomycota|Mycetozoa|Amoebozoa|Myxogastrea|Stemonitida|Stemonitidaceae|Stemonitis,Protozoa,Amoebozoa,Myxogastrea,Stemonitida,Stemonitidaceae,Stemonitis fusca,655061,Stemonitis,,"Hoskins, John Hobart",,1932-07-00,1932,7,0,,,,United States,Michigan,Grand Traverse,Interlochen,Interlochen,44.644723,-85.7673,,,https://www.mycoportal.org/portal/collections/individual/index.php?occid=4375435
4375436,Protozoa|Myxomycota|Mycetozoa|Amoebozoa|Myxogastrea|Stemonitida|Stemonitidaceae|Stemonitis,Protozoa,Amoebozoa,Myxogastrea,Stemonitida,Stemonitidaceae,Stemonitis fusca,655061,Stemonitis,,"Sayrs, M.",,10/13/38,1938,10,13,286,,decayed log,United States,Ohio,Hamilton,Cincinnati,California,39.065339,-84.423274,,,https://www.mycoportal.org/portal/collections/individual/index.php?occid=4375436
4375437,Protozoa|Myxomycota|Mycetozoa|Amoebozoa|Myxogastrea|Stemonitida|Stemonitidaceae|Stemonitis,Protozoa,Amoebozoa,Myxogastrea,Stemonitida,Stemonitidaceae,Stemonitis fusca,655061,Stemonitis,,"Ayers, John H.",,9/9/33,1933,9,9,252,,old log,United States,Ohio,Hamilton,Cincinnati,Mt. Airy Forest,39.165058,-84.574945,,,https://www.mycoportal.org/portal/collections/individual/index.php?occid=4375437
4375438,Protozoa|Myxomycota|Mycetozoa|Amoebozoa|Myxogastrea|Stemonitida|Stemonitidaceae|Stemonitis,Protozoa,Amoebozoa,Myxogastrea,Stemonitida,Stemonitidaceae,Stemonitis fusca,655061,Stemonitis,,"Ayers, John H.",,8/13/32,1932,8,13,226,,rotten log,United States,Ohio,Hamilton,Cincinnati,Given Road,39.159227,-84.30716,,,https://www.mycoportal.org/portal/collections/individual/index.php?occid=4375438
4375439,Protozoa|Myxomycota|Mycetozoa|Amoebozoa|Myxogastrea|Stemonitida|Stemonitidaceae|Stemonitis,Protozoa,Amoebozoa,Myxogastrea,Stemonitida,Stemonitidaceae,Stemonitis fusca,655061,Stemonitis,,"Hoskins, John Hobart",,1931-00-00,1931,0,0,,,,United States,Indiana,Saint Joseph,South Bend,South Bend,41.683381,-86.250007,,,https://www.mycoportal.org/portal/collections/individual/index.php?occid=4375439
4375440,Protozoa|Myxomycota|Mycetozoa|Amoebozoa|Myxogastrea|Stemonitida|Stemonitidaceae|Stemonitis,Protozoa,Amoebozoa,Myxogastrea,Stemonitida,Stemonitidaceae,Stemonitis fusca,655061,Stemonitis,,"Lloyd, Curtis Gates",,1928-05-00,1928,5,0,,frondose woods,bark,United States,Kentucky,Grant,Crittenden,Crittenden,38.782844,-84.605221,,,https://www.mycoportal.org/portal/collections/individual/index.php?occid=4375440
4375441,Protozoa|Myxomycota|Mycetozoa|Amoebozoa|Myxogastrea|Stemonitida|Stemonitidaceae|Stemonitis,Protozoa,Amoebozoa,Myxogastrea,Stemonitida,Stemonitidaceae,Stemonitis fusca,655061,Stemonitis,,"Lloyd, Curtis Gates",,1928-05-00,1928,5,0,,frondose woods,bark,United States,Kentucky,Grant,Crittenden,Crittenden,38.782844,-84.605221,,,https://www.mycoportal.org/portal/collections/individual/index.php?occid=4375441
4375442,Protozoa|Myxomycota|Mycetozoa|Amoebozoa|Myxogastrea|Stemonitida|Stemonitidaceae|Stemonitis,Protozoa,Amoebozoa,Myxogastrea,Stemonitida,Stemonitidaceae,Stemonitis fusca,655061,Stemonitis,,"Ayers, John H.",,8/16/32,1932,8,16,229,,rotten log,United States,Ohio,Hamilton,Cincinnati,Hazelwood,39.266169,-84.362996,,,https://www.mycoportal.org/portal/collections/individual/index.php?occid=4375442
4375443,Protozoa|Myxomycota|Mycetozoa|Amoebozoa|Myxogastrea|Stemonitida|Stemonitidaceae|Stemonitis,Protozoa,Amoebozoa,Myxogastrea,Stemonitida,Stemonitidaceae,Stemonitis fusca,655061,Stemonitis,,"Ayers, John H.",,1932-07-00,1932,7,0,,,rotten log,United States,Ohio,Hamilton,Cincinnati,Kroger Hills,39.150157,-84.32093,,,https://www.mycoportal.org/portal/collections/individual/index.php?occid=4375443
4375445,Protozoa|Myxomycota|Mycetozoa|Amoebozoa|Myxogastrea|Stemonitida|Stemonitidaceae|Stemonitis,Protozoa,Amoebozoa,Myxogastrea,Stemonitida,Stemonitidaceae,Stemonitis fusca,655061,Stemonitis,,"Ayers, John H.",,8/5/33,1933,8,5,217,,rotten log,United States,Ohio,Hamilton,Cincinnati,Kroger Hills,39.150157,-84.32093,,,https://www.mycoportal.org/portal/collections/individual/index.php?occid=4375445
4375446,Protozoa|Myxomycota|Mycetozoa|Amoebozoa|Myxogastrea|Stemonitida|Stemonitidaceae|Stemonitis,Protozoa,Amoebozoa,Myxogastrea,Stemonitida,Stemonitidaceae,Stemonitis fusca,655061,Stemonitis,,"Hopkins, W.C.",,10/13/38,1938,10,13,286,,willow stump,United States,Ohio,Hamilton,Cincinnati,California,39.065339,-84.423274,,,https://www.mycoportal.org/portal/collections/individual/index.php?occid=4375446
4380135,Protozoa|Myxomycota,Protozoa,Myxomycota,,,Stemonitidaceae,Stemonitis virginiensis,655160,Stemonitis,,"Ayers, John H.",,8/16/32,1932,8,16,229,,rotten log,United States,Ohio,Hamilton,Cincinnati,Hazelwood,39.266169,-84.362996,,,https://www.mycoportal.org/portal/collections/individual/index.php?occid=4380135
4380137,Protozoa|Myxomycota,Protozoa,Myxomycota,,,Stemonitidaceae,Stemonitis virginiensis,655160,Stemonitis,,"Ayers, John H.",,8/16/32,1932,8,16,229,,rotten log,United States,Ohio,Hamilton,Cincinnati,Hazelwood,39.266169,-84.362996,,,https://www.mycoportal.org/portal/collections/individual/index.php?occid=4380137
4380139,Protozoa|Myxomycota|Mycetozoa|Amoebozoa|Myxogastrea|Stemonitida|Stemonitidaceae|Stemonitis,Protozoa,Amoebozoa,Myxogastrea,Stemonitida,Stemonitidaceae,Stemonitis splendens,617158,Stemonitis,,"Ayers, John H.",,10/7/33,1933,10,7,280,,log,United States,Ohio,Hamilton,,"Hamilton County, Ohio",39.195531,-84.542775,,,https://www.mycoportal.org/portal/collections/individual/index.php?occid=4380139
4380142,Protozoa|Myxomycota|Mycetozoa|Amoebozoa|Myxogastrea|Stemonitida|Stemonitidaceae|Stemonitis,Protozoa,Amoebozoa,Myxogastrea,Stemonitida,Stemonitidaceae,Stemonitis splendens,617158,Stemonitis,,s.n.,,10/11/34,1934,10,11,284,,damp log,United States,Ohio,Hamilton,Cincinnati,Kroger Hills,39.150157,-84.32093,,,https://www.mycoportal.org/portal/collections/individual/index.php?occid=4380142
4380143,Protozoa|Myxomycota|Mycetozoa|Amoebozoa|Myxogastrea|Stemonitida|Stemonitidaceae|Stemonitis,Protozoa,Amoebozoa,Myxogastrea,Stemonitida,Stemonitidaceae,Stemonitis splendens,617158,Stemonitis,,"Casterline, J.",,10/9/47,1947,10,9,282,woods,log,United States,Ohio,Clermont,,"Wilson's Farm (Clermont County, Ohio)",39.047433,-84.151918,,,https://www.mycoportal.org/portal/collections/individual/index.php?occid=4380143
4380145,Protozoa|Myxomycota|Mycetozoa|Amoebozoa|Myxogastrea|Stemonitida|Stemonitidaceae|Stemonitis,Protozoa,Amoebozoa,Myxogastrea,Stemonitida,Stemonitidaceae,Stemonitis splendens,617158,Stemonitis,,"Lloyd, Curtis Gates",,1928-05-00,1928,5,0,,frondose woods,,United States,Kentucky,Grant,Crittenden,Crittenden,38.782844,-84.605221,,,https://www.mycoportal.org/portal/collections/individual/index.php?occid=4380145
4380147,Protozoa|Myxomycota|Mycetozoa|Amoebozoa|Myxogastrea|Stemonitida|Stemonitidaceae|Stemonitis,Protozoa,Amoebozoa,Myxogastrea,Stemonitida,Stemonitidaceae,Stemonitis splendens,617158,Stemonitis,,"Lloyd, Curtis Gates",,1928-05-00,1928,5,0,,frondose woods,,United States,Kentucky,Grant,Crittenden,Crittenden,38.782844,-84.605221,,,https://www.mycoportal.org/portal/collections/individual/index.php?occid=4380147
4380149,Protozoa|Myxomycota|Mycetozoa|Amoebozoa|Myxogastrea|Stemonitida|Stemonitidaceae|Stemonitis,Protozoa,Amoebozoa,Myxogastrea,Stemonitida,Stemonitidaceae,Stemonitis splendens,617158,Stemonitis,,"Ruff, M.",,1945-11-00,1945,11,0,,,wood,United States,Ohio,Clermont,,"Clermont County, Ohio",39.047433,-84.151918,,,https://www.mycoportal.org/portal/collections/individual/index.php?occid=4380149
4380151,Protozoa|Myxomycota|Mycetozoa|Amoebozoa|Myxogastrea|Stemonitida|Stemonitidaceae|Stemonitis,Protozoa,Amoebozoa,Myxogastrea,Stemonitida,Stemonitidaceae,Stemonitis splendens,617158,Stemonitis,,"Ayers, John H.",,10/15/32,1932,10,15,289,,old log,United States,Ohio,Hamilton,Cincinnati,College Hill,39.20228,-84.547166,,,https://www.mycoportal.org/portal/collections/individual/index.php?occid=4380151
4380153,Protozoa|Myxomycota|Mycetozoa|Amoebozoa|Myxogastrea|Stemonitida|Stemonitidaceae|Stemonitis,Protozoa,Amoebozoa,Myxogastrea,Stemonitida,Stemonitidaceae,Stemonitis splendens,617158,Stemonitis,,"Fulford, Margaret H.",,1929-00-00,1929,0,0,,,rotten log,United States,Ohio,Hamilton,Cincinnati,California,39.065339,-84.423274,,,https://www.mycoportal.org/portal/collections/individual/index.php?occid=4380153
4380155,Protozoa|Myxomycota|Mycetozoa|Amoebozoa|Myxogastrea|Stemonitida|Stemonitidaceae|Stemonitis,Protozoa,Amoebozoa,Myxogastrea,Stemonitida,Stemonitidaceae,Stemonitis splendens,617158,Stemonitis,,"Cosner, L.M.",,10/16/38,1938,10,16,289,,dead wood,United States,Ohio,Adams,,"Adams County, Ohio",38.845515,-83.472152,,,https://www.mycoportal.org/portal/collections/individual/index.php?occid=4380155
4380158,Protozoa|Myxomycota|Mycetozoa|Amoebozoa|Myxogastrea|Stemonitida|Stemonitidaceae|Stemonitis,Protozoa,Amoebozoa,Myxogastrea,Stemonitida,Stemonitidaceae,Stemonitis splendens,617158,Stemonitis,,"Sanders, P.J.",,6/23/64,1964,6,23,175,wooded ravine,log,United States,Ohio,Hamilton,Cincinnati,Center Hill Life Science Field Station,39.196066,-84.508607,,,https://www.mycoportal.org/portal/collections/individual/index.php?occid=4380158
4380160,Protozoa|Myxomycota,Protozoa,Myxomycota,,,Stemonitidaceae,Stemonitis smithii,655130,Stemonitis,,"Hoskins, John Hobart",,1931-00-00,1931,0,0,,,,United States,Indiana,Saint Joseph,South Bend,South Bend,41.683381,-86.250007,,,https://www.mycoportal.org/portal/collections/individual/index.php?occid=4380160
4380163,Protozoa|Myxomycota,Protozoa,Myxomycota,,,Stemonitidaceae,Stemonitis smithii,655130,Stemonitis,,"Hoskins, John Hobart",,1931-00-00,1931,0,0,,,,United States,Indiana,Saint Joseph,South Bend,South Bend,41.683381,-86.250007,,,https://www.mycoportal.org/portal/collections/individual/index.php?occid=4380163
4380165,Protozoa|Myxomycota,Protozoa,Myxomycota,,,Stemonitidaceae,Stemonitis smithii,655130,Stemonitis,,"Hoskins, John Hobart",,1932-00-00,1932,0,0,,,,United States,Indiana,Saint Joseph,South Bend,South Bend,41.683381,-86.250007,,,https://www.mycoportal.org/portal/collections/individual/index.php?occid=4380165
4380166,Protozoa|Myxomycota,Protozoa,Myxomycota,,,Stemonitidaceae,Stemonitis smithii,655130,Stemonitis,,"Hoskins, John Hobart",,1932-00-00,1932,0,0,,,,United States,Michigan,Houghton,Winona,Winona,46.874379,-88.907356,,,https://www.mycoportal.org/portal/collections/individual/index.php?occid=4380166
4380167,Protozoa|Myxomycota,Protozoa,Myxomycota,,,Stemonitidaceae,Stemonitis smithii,655130,Stemonitis,,"Hoskins, John Hobart",,1932-00-00,1932,0,0,,,,United States,Michigan,Berrien,,"Berrien County, Michigan",41.995778,-86.685421,,,https://www.mycoportal.org/portal/collections/individual/index.php?occid=4380167
4380168,Protozoa|Myxomycota,Protozoa,Myxomycota,,,Stemonitidaceae,Stemonitis smithii,655130,Stemonitis,,"Hoskins, John Hobart",,1931-00-00,1931,0,0,,,,United States,Indiana,Saint Joseph,South Bend,South Bend,41.683381,-86.250007,,,https://www.mycoportal.org/portal/collections/individual/index.php?occid=4380168
4380170,Protozoa|Myxomycota,Protozoa,Myxomycota,,,Stemonitidaceae,Stemonitis smithii,655130,Stemonitis,,"Cooke, William Bridge",,10/10/35,1935,10,10,283,,,United States,Ohio,Clermont,Milford,South Milford,39.175338,-84.294382,,,https://www.mycoportal.org/portal/collections/individual/index.php?occid=4380170
4380173,Protozoa|Myxomycota,Protozoa,Myxomycota,,,Stemonitidaceae,Stemonitis smithii,655130,Stemonitis,,"Ayers, John H.",,8/16/32,1932,8,16,229,,rotten log,United States,Ohio,Hamilton,Cincinnati,Hazelwood,39.266169,-84.362996,,,https://www.mycoportal.org/portal/collections/individual/index.php?occid=4380173
4380174,Protozoa|Myxomycota,Protozoa,Myxomycota,,,Stemonitidaceae,Stemonitis smithii,655130,Stemonitis,,"Ayers, John H.",,8/16/32,1932,8,16,229,,Rotten wood,United States,Ohio,Hamilton,Cincinnati,"Cincinnati, Hazelwood",39.266169,-84.362996,,,https://www.mycoportal.org/portal/collections/individual/index.php?occid=4380174
4380178,Protozoa|Myxomycota,Protozoa,Myxomycota,,,Stemonitidaceae,Stemonitis smithii,655130,Stemonitis,,"Hoskins, John Hobart",,1932-00-00,1932,0,0,,,,United States,Michigan,Houghton,Winona,Winona,46.874379,-88.907356,,,https://www.mycoportal.org/portal/collections/individual/index.php?occid=4380178
4380179,Protozoa|Myxomycota,Protozoa,Myxomycota,,,Stemonitidaceae,Stemonitis smithii,655130,Stemonitis,,"Hoskins, John Hobart",,1932-00-00,1932,0,0,,,,United States,Michigan,Berrien,,"Berrien County, Michigan",41.995778,-86.685421,,,https://www.mycoportal.org/portal/collections/individual/index.php?occid=4380179
4380215,Protozoa|Myxomycota|Myxomycetes|Liceales|Reticulariaceae|Lycogala,Protozoa,Myxomycota,Myxomycetes,Liceales,Tubiferaceae,Lycogala epidendrum,617008,Lycogala,,"Braun, E. Lucy",,10/24/29,1929,10,24,297,,,United States,Kentucky,Jessamine,High Bridge,High Bridge,37.824245,-84.718279,,,https://www.mycoportal.org/portal/collections/individual/index.php?occid=4380215
4380219,Protozoa|Myxomycota|Myxomycetes|Liceales|Reticulariaceae|Lycogala,Protozoa,Myxomycota,Myxomycetes,Liceales,Tubiferaceae,Lycogala epidendrum,617008,Lycogala,,"Sayrs, M.",,10/16/38,1938,10,16,289,mesophytic woods,,United States,Ohio,Adams,Mineral Springs,Mineral Springs,38.887016,-83.329354,,,https://www.mycoportal.org/portal/collections/individual/index.php?occid=4380219
4380220,Protozoa|Myxomycota|Myxomycetes|Liceales|Reticulariaceae|Lycogala,Protozoa,Myxomycota,Myxomycetes,Liceales,Tubiferaceae,Lycogala epidendrum,617008,Lycogala,,"Beckman, J.",,10/4/34,1934,10,4,277,woods,,United States,Ohio,Hamilton,Cincinnati,"Cincinnati, O.M.I. (Ohio Mechanics Institute) woods",39.162004,-84.456886,,,https://www.mycoportal.org/portal/collections/individual/index.php?occid=4380220
4380222,Protozoa|Myxomycota|Myxomycetes|Liceales|Reticulariaceae|Lycogala,Protozoa,Myxomycota,Myxomycetes,Liceales,Tubiferaceae,Lycogala epidendrum,617008,Lycogala,,"Cobbe, Thomas J.",,12/16/38,1938,12,16,350,,decayed log,United States,Ohio,Hamilton,Cincinnati,Mt. Airy Forest,39.165058,-84.574945,,,https://www.mycoportal.org/portal/collections/individual/index.php?occid=4380222
4380223,Protozoa|Myxomycota|Myxomycetes|Liceales|Reticulariaceae|Lycogala,Protozoa,Myxomycota,Myxomycetes,Liceales,Tubiferaceae,Lycogala epidendrum,617008,Lycogala,,"West, M.",,1945-10-00,1945,10,0,,,on wood,United States,Ohio,Hamilton,Cincinnati,California,39.065339,-84.423274,,,https://www.mycoportal.org/portal/collections/individual/index.php?occid=4380223
4380224,Protozoa|Myxomycota|Myxomycetes|Liceales|Reticulariaceae|Lycogala,Protozoa,Myxomycota,Myxomycetes,Liceales,Tubiferaceae,Lycogala epidendrum,617008,Lycogala,,"Ayers, John H.",,8/5/32,1932,8,5,218,,rotten log,United States,Ohio,Hamilton,,"Hamilton County, Ohio",39.195531,-84.542775,,,https://www.mycoportal.org/portal/collections/individual/index.php?occid=4380224
4380227,Protozoa|Myxomycota|Myxomycetes|Liceales|Reticulariaceae|Lycogala,Protozoa,Myxomycota,Myxomycetes,Liceales,Tubiferaceae,Lycogala epidendrum,617008,Lycogala,,"Davidson, W.A.",,10/4/34,1934,10,4,277,woods,wet log,United States,Ohio,Hamilton,Cincinnati,"Cincinnati, O.M.I. (Ohio Mechanics Institute, UC College of Applied Sciences) woods",39.162004,-84.456886,,,https://www.mycoportal.org/portal/collections/individual/index.php?occid=4380227
4380228,Protozoa|Myxomycota|Myxomycetes|Liceales|Reticulariaceae|Lycogala,Protozoa,Myxomycota,Myxomycetes,Liceales,Tubiferaceae,Lycogala epidendrum,617008,Lycogala,,"Bauer, Kay",,10/21/32,1932,10,21,295,,,United States,Ohio,Hamilton,Cincinnati,College Hill,39.20228,-84.547166,,,https://www.mycoportal.org/portal/collections/individual/index.php?occid=4380228
4380229,Protozoa|Myxomycota|Myxomycetes|Liceales|Reticulariaceae|Lycogala,Protozoa,Myxomycota,Myxomycetes,Liceales,Tubiferaceae,Lycogala epidendrum,617008,Lycogala,,"Ayers, John H.",,11/5/32,1932,11,5,310,,rotten log,United States,Ohio,Hamilton,Cincinnati,California,39.065339,-84.423274,,,https://www.mycoportal.org/portal/collections/individual/index.php?occid=4380229
4380230,Protozoa|Myxomycota|Myxomycetes|Liceales|Reticulariaceae|Lycogala,Protozoa,Myxomycota,Myxomycetes,Liceales,Tubiferaceae,Lycogala epidendrum,617008,Lycogala,,"Clermont, L.",,10/16/38,1938,10,16,289,mesophytic woods,damp log,United States,Ohio,Adams,Mineral Springs,Mineral Springs,38.887016,-83.329354,,,https://www.mycoportal.org/portal/collections/individual/index.php?occid=4380230
4380232,Protozoa|Myxomycota|Myxomycetes|Liceales|Reticulariaceae|Lycogala,Protozoa,Myxomycota,Myxomycetes,Liceales,Tubiferaceae,Lycogala epidendrum,617008,Lycogala,,"Fulford, Margaret H.",,10/23/31,1931,10,23,296,woods,decayed log,United States,Ohio,Hamilton,Cincinnati,Kroger Hills,39.150157,-84.32093,,,https://www.mycoportal.org/portal/collections/individual/index.php?occid=4380232
4380233,Protozoa|Myxomycota|Myxomycetes|Liceales|Reticulariaceae|Lycogala,Protozoa,Myxomycota,Myxomycetes,Liceales,Tubiferaceae,Lycogala epidendrum,617008,Lycogala,,"Ayers, John H.",,1932-10-00,1932,10,0,,,rotten log,United States,Ohio,Hamilton,Cincinnati,Kroger Hills,39.150157,-84.32093,,,https://www.mycoportal.org/portal/collections/individual/index.php?occid=4380233
4380234,Protozoa|Myxomycota|Myxomycetes|Liceales|Reticulariaceae|Lycogala,Protozoa,Myxomycota,Myxomycetes,Liceales,Tubiferaceae,Lycogala epidendrum,617008,Lycogala,,"Fulford, Margaret H.",,10/23/31,1931,10,23,296,woods,decayed log,United States,Ohio,Hamilton,Cincinnati,"Given Road, Terrace Park",39.159227,-84.30716,,,https://www.mycoportal.org/portal/collections/individual/index.php?occid=4380234
4380235,Protozoa|Myxomycota|Myxomycetes|Liceales|Reticulariaceae|Lycogala,Protozoa,Myxomycota,Myxomycetes,Liceales,Tubiferaceae,Lycogala epidendrum,617008,Lycogala,,"Ayers, John H.",,10/7/33,1933,10,7,280,,rotten log,United States,Ohio,Hamilton,Dunlap,near Dunlap,39.292279,-84.618002,,,https://www.mycoportal.org/portal/collections/individual/index.php?occid=4380235
4380237,Protozoa|Myxomycota|Myxomycetes|Liceales|Reticulariaceae|Lycogala,Protozoa,Myxomycota,Myxomycetes,Liceales,Tubiferaceae,Lycogala epidendrum,617008,Lycogala,,"Phinney, Harry Kenyon",,6/28/40,1940,6,28,180,,on sawdust by ice house,United States,Michigan,Cheboygan,,University of Michigan Biological Station,45.559635,-84.673787,,,https://www.mycoportal.org/portal/collections/individual/index.php?occid=4380237
4380238,Protozoa|Myxomycota|Myxomycetes|Liceales|Reticulariaceae|Lycogala,Protozoa,Myxomycota,Myxomycetes,Liceales,Tubiferaceae,Lycogala epidendrum,617008,Lycogala,,"Manley, M.L.",,12/16/38,1938,12,16,350,,on bark,United States,Ohio,Hamilton,Cincinnati,Mt. Airy Forest,39.165058,-84.574945,,,https://www.mycoportal.org/portal/collections/individual/index.php?occid=4380238
4380240,Protozoa|Myxomycota|Myxomycetes|Liceales|Reticulariaceae|Lycogala,Protozoa,Myxomycota,Myxomycetes,Liceales,Tubiferaceae,Lycogala epidendrum,617008,Lycogala,,"Cooke, William Bridge",,7/31/32,1932,7,31,213,,dead wood,United States,Ohio,Highland,,Seven Caves,39.222845,-83.355158,,,https://www.mycoportal.org/portal/collections/individual/index.php?occid=4380240
4380241,Protozoa|Myxomycota|Myxomycetes|Liceales|Reticulariaceae|Lycogala,Protozoa,Myxomycota,Myxomycetes,Liceales,Tubiferaceae,Lycogala epidendrum,617008,Lycogala,,"Cooke, William Bridge",,9/19/32,1932,9,19,263,,dead wood,United States,Ohio,Highland,,Seven Caves,39.222845,-83.355158,,,https://www.mycoportal.org/portal/collections/individual/index.php?occid=4380241
4380242,Protozoa|Myxomycota|Myxomycetes|Liceales|Reticulariaceae|Lycogala,Protozoa,Myxomycota,Myxomycetes,Liceales,Tubiferaceae,Lycogala epidendrum,617008,Lycogala,,"Cooke, William Bridge",,10/12/32,1932,10,12,286,,dead wood,United States,Ohio,Clermont,Branch Hill,South Branch Hill,39.24617,-84.293271,,,https://www.mycoportal.org/portal/collections/individual/index.php?occid=4380242
4380498,Protozoa|Myxomycota|Myxomycetes|Liceales|Reticulariaceae|Lycogala,Protozoa,Myxomycota,Myxomycetes,Liceales,Tubiferaceae,Lycogala epidendrum,617008,Lycogala,,"Ayers, John H.",,8/5/32,1932,8,5,218,,rotten log,United States,Ohio,Hamilton,Cincinnati,Kroger Hills,39.150157,-84.32093,,,https://www.mycoportal.org/portal/collections/individual/index.php?occid=4380498
4380499,Protozoa|Myxomycota|Myxomycetes|Liceales|Reticulariaceae|Lycogala,Protozoa,Myxomycota,Myxomycetes,Liceales,Tubiferaceae,Lycogala epidendrum,617008,Lycogala,,"Cooke, William Bridge",,10/12/32,1932,10,12,286,,dead wood,United States,Ohio,Clermont,Branch Hill,South Branch Hill,39.24617,-84.293271,,,https://www.mycoportal.org/portal/collections/individual/index.php?occid=4380499
4380500,Protozoa|Myxomycota|Myxomycetes|Liceales|Reticulariaceae|Lycogala,Protozoa,Myxomycota,Myxomycetes,Liceales,Tubiferaceae,Lycogala epidendrum,617008,Lycogala,,"Diehl, George",,9/1/32,1932,9,1,245,,,United States,Ohio,Hamilton,Cincinnati,Kennedy Heights,39.185615,-84.408274,,,https://www.mycoportal.org/portal/collections/individual/index.php?occid=4380500
4380502,Protozoa|Myxomycota|Myxomycetes|Liceales|Reticulariaceae|Lycogala,Protozoa,Myxomycota,Myxomycetes,Liceales,Tubiferaceae,Lycogala epidendrum,617008,Lycogala,,"Ayers, John H.",,8/16/32,1932,8,16,229,,rotten log,United States,Ohio,Hamilton,Cincinnati,Hazelwood,39.266169,-84.362996,,,https://www.mycoportal.org/portal/collections/individual/index.php?occid=4380502
4380503,Protozoa|Myxomycota|Myxomycetes|Liceales|Reticulariaceae|Lycogala,Protozoa,Myxomycota,Myxomycetes,Liceales,Tubiferaceae,Lycogala epidendrum,617008,Lycogala,,"Manley, M.L.",,10/16/38,1938,10,16,289,,on log,United States,Ohio,Adams,Mineral Springs,Mineral Springs,38.887016,-83.329354,,,https://www.mycoportal.org/portal/collections/individual/index.php?occid=4380503
4380504,Protozoa|Myxomycota|Myxomycetes|Liceales|Reticulariaceae|Lycogala,Protozoa,Myxomycota,Myxomycetes,Liceales,Tubiferaceae,Lycogala epidendrum,617008,Lycogala,,"Carroll, G.",,11/22/44,1944,11,22,327,,dead log,United States,Georgia,Dade,,"Dade County, Georgia (Carroll Farm)",34.854521,-85.504527,,,https://www.mycoportal.org/portal/collections/individual/index.php?occid=4380504
4380505,Protozoa|Myxomycota|Myxomycetes|Liceales|Reticulariaceae|Lycogala,Protozoa,Myxomycota,Myxomycetes,Liceales,Tubiferaceae,Lycogala epidendrum,617008,Lycogala,,"Keuse, H.O.",,12/30/42,1942,12,30,364,woods,decayed log,United States,Ohio,Hamilton,Cincinnati,Mt. Airy Forest,39.165058,-84.574945,,,https://www.mycoportal.org/portal/collections/individual/index.php?occid=4380505
4380506,Protozoa|Myxomycota|Myxomycetes|Liceales|Reticulariaceae|Lycogala,Protozoa,Myxomycota,Myxomycetes,Liceales,Tubiferaceae,Lycogala epidendrum,617008,Lycogala,,"Ayers, John H.",,10/17/31,1931,10,17,290,,rotten log,United States,Ohio,Clermont,Milford,Milford,39.175338,-84.294382,,,https://www.mycoportal.org/portal/collections/individual/index.php?occid=4380506
4380507,Protozoa|Myxomycota|Myxomycetes|Liceales|Reticulariaceae|Lycogala,Protozoa,Myxomycota,Myxomycetes,Liceales,Tubiferaceae,Lycogala epidendrum,617008,Lycogala,,"Duval, D.D.",,10/4/34,1934,10,4,277,,,United States,Ohio,Hamilton,Cincinnati,College Hill,39.20228,-84.547166,,,https://www.mycoportal.org/portal/collections/individual/index.php?occid=4380507
4380508,Protozoa|Myxomycota|Myxomycetes|Liceales|Reticulariaceae|Lycogala,Protozoa,Myxomycota,Myxomycetes,Liceales,Tubiferaceae,Lycogala epidendrum,617008,Lycogala,,"Fulford, Margaret H.",,10/2/31,1931,10,2,275,,decayed log,United States,Ohio,Hamilton,Cincinnati,College Hill,39.20228,-84.547166,,,https://www.mycoportal.org/portal/collections/individual/index.php?occid=4380508
4380509,Protozoa|Myxomycota|Myxomycetes|Liceales|Reticulariaceae|Lycogala,Protozoa,Myxomycota,Myxomycetes,Liceales,Tubiferaceae,Lycogala epidendrum,617008,Lycogala,,"Fulford, Margaret H.",,9/27/29,1929,9,27,270,,log in woods,United States,Ohio,Hamilton,Cincinnati,Kroger Hills,39.150157,-84.32093,,,https://www.mycoportal.org/portal/collections/individual/index.php?occid=4380509
4380510,Protozoa|Myxomycota|Myxomycetes|Liceales|Reticulariaceae|Lycogala,Protozoa,Myxomycota,Myxomycetes,Liceales,Tubiferaceae,Lycogala epidendrum,617008,Lycogala,,"Fulford, Margaret H.",,10/4/29,1929,10,4,277,,log in woods,United States,Ohio,Hamilton,Cincinnati,Hazelwood Preserve (Harris M. Benedict Nature Preserve/Johnson Preserve),39.263489,-84.354512,,,https://www.mycoportal.org/portal/collections/individual/index.php?occid=4380510
4380511,Protozoa|Myxomycota|Myxomycetes|Liceales|Reticulariaceae|Lycogala,Protozoa,Myxomycota,Myxomycetes,Liceales,Tubiferaceae,Lycogala epidendrum,617008,Lycogala,,"Fulford, Margaret H.",,9/27/29,1929,9,27,270,,log in woods,United States,Ohio,Hamilton,Cincinnati,Kroger Hills,39.150157,-84.32093,,,https://www.mycoportal.org/portal/collections/individual/index.php?occid=4380511
4380512,Protozoa|Myxomycota|Myxomycetes|Liceales|Reticulariaceae|Lycogala,Protozoa,Myxomycota,Myxomycetes,Liceales,Tubiferaceae,Lycogala epidendrum,617008,Lycogala,,"Sanders, P.J.",,7/4/64,1964,7,4,186,woods,log,United States,Ohio,Hamilton,Cincinnati,Center Hill Life Science Field Station,39.196066,-84.508607,,,https://www.mycoportal.org/portal/collections/individual/index.php?occid=4380512
4380513,Protozoa|Myxomycota|Myxomycetes|Liceales|Reticulariaceae|Lycogala,Protozoa,Myxomycota,Myxomycetes,Liceales,Tubiferaceae,Lycogala epidendrum,617008,Lycogala,,"Ayers, John H.",,10/15/32,1932,10,15,289,,rotten log,United States,Ohio,Hamilton,Cincinnati,College Hill,39.20228,-84.547166,,,https://www.mycoportal.org/portal/collections/individual/index.php?occid=4380513
4380514,Protozoa|Myxomycota|Myxomycetes|Liceales|Reticulariaceae|Lycogala,Protozoa,Myxomycota,Myxomycetes,Liceales,Tubiferaceae,Lycogala epidendrum,617008,Lycogala,,"Cooke, William Bridge",,10/2/32,1932,10,2,276,,dead wood,United States,Ohio,Highland,,Seven Caves,39.222845,-83.355158,,,https://www.mycoportal.org/portal/collections/individual/index.php?occid=4380514
4380515,Protozoa|Myxomycota|Myxomycetes|Liceales|Reticulariaceae|Lycogala,Protozoa,Myxomycota,Myxomycetes,Liceales,Tubiferaceae,Lycogala epidendrum,617008,Lycogala,,"Smarods, Julijs",,10/9/36,1936,10,9,283,,Pinus sylvestris,Latvia,Vidzeme,Riga,Paba?i,Paba?i,57.261111,24.5925,,,https://www.mycoportal.org/portal/collections/individual/index.php?occid=4380515
4380517,Protozoa|Myxomycota|Myxomycetes|Liceales|Reticulariaceae|Lycogala,Protozoa,Myxomycota,Myxomycetes,Liceales,Tubiferaceae,Lycogala epidendrum,617008,Lycogala,,"Tokarski, R.",,10/15/64,1964,10,15,289,woods,dead log,United States,Ohio,Hamilton,Cincinnati,"Cincinnati, Center Hill Rd.",39.162004,-84.456886,,,https://www.mycoportal.org/portal/collections/individual/index.php?occid=4380517
4380518,Protozoa|Myxomycota|Myxomycetes|Liceales|Reticulariaceae|Lycogala,Protozoa,Myxomycota,Myxomycetes,Liceales,Tubiferaceae,Lycogala conicum,617009,Lycogala,,"Ayers, John H.",,10/7/33,1933,10,7,280,,rotten log,United States,Ohio,Hamilton,Dunlap,Northwest Dunlap,39.292279,-84.618002,,,https://www.mycoportal.org/portal/collections/individual/index.php?occid=4380518
4380519,Protozoa|Myxomycota|Myxomycetes|Liceales|Reticulariaceae|Lycogala,Protozoa,Myxomycota,Myxomycetes,Liceales,Tubiferaceae,Lycogala exiguum,617056,Lycogala,,"Ayers, John H.",,7/28/32,1932,7,28,210,,rotten log,United States,Ohio,Hamilton,Cincinnati,Kroger Hills,39.150157,-84.32093,,,https://www.mycoportal.org/portal/collections/individual/index.php?occid=4380519
4380521,Protozoa|Myxomycota|Myxomycetes|Liceales|Reticulariaceae|Lycogala,Protozoa,Myxomycota,Myxomycetes,Liceales,Tubiferaceae,Lycogala exiguum,617056,Lycogala,,"Ayers, John H.",,9/9/33,1933,9,9,252,,rotten log,United States,Ohio,Hamilton,Cincinnati,Mt. Airy Forest,39.165058,-84.574945,,,https://www.mycoportal.org/portal/collections/individual/index.php?occid=4380521
4380522,Protozoa|Myxomycota|Myxomycetes|Liceales|Reticulariaceae|Lycogala,Protozoa,Myxomycota,Myxomycetes,Liceales,Tubiferaceae,Lycogala exiguum,617056,Lycogala,,"Ayers, John H.",,7/28/32,1932,7,28,210,,rotten log,United States,Ohio,Hamilton,Cincinnati,Kroger Hills,39.150157,-84.32093,,,https://www.mycoportal.org/portal/collections/individual/index.php?occid=4380522
4380523,Protozoa|Myxomycota|Myxomycetes|Liceales|Reticulariaceae|Lycogala,Protozoa,Myxomycota,Myxomycetes,Liceales,Tubiferaceae,Lycogala exiguum,617056,Lycogala,,"Ayers, John H.",,10/7/33,1933,10,7,280,,rotten log,United States,Ohio,Hamilton,,near Dunlap,39.292279,-84.618002,,,https://www.mycoportal.org/portal/collections/individual/index.php?occid=4380523
4380524,Protozoa|Myxomycota|Myxomycetes|Liceales|Reticulariaceae,Protozoa,Myxomycota,Myxomycetes,Liceales,Reticulariaceae,Lycogala,617007,Lycogala,,D. P.,,6/9/35,1935,6,9,160,,log,United States,Indiana,Bartholomew,Driftwood,"Driftwood Township, Bartholomew County, Indiana",39.3333,-85.9833,,,https://www.mycoportal.org/portal/collections/individual/index.php?occid=4380524
4380526,Protozoa|Myxomycota|Mycetozoa|Amoebozoa|Myxogastrea|Stemonitida|Stemonitidaceae,Protozoa,Amoebozoa,Myxogastrea,Stemonitida,Stemonitidaceae,Stemonitis,617157,Stemonitis,,"David, D.D.",,10/10/34,1934,10,10,283,,,United States,Ohio,Hamilton,Cincinnati,Kroger Hills,39.150157,-84.32093,,,https://www.mycoportal.org/portal/collections/individual/index.php?occid=4380526
4381089,Chromista|Oomycota|Oomycetes|Peronosporales|Peronosporaceae|Peronospora,Chromista,Oomycota,Oomycetes,Peronosporales,Peronosporaceae,Peronospora arthurii,646943,Peronospora,,"Brenckle, J.F.",,1910-06-00,1910,6,0,,,on Onagra strigosa,United States,North Dakota,Lamoure,Kulm,Kulm,46.301914,-98.948162,,,https://www.mycoportal.org/portal/collections/individual/index.php?occid=4381089
4381179,Protozoa|Myxomycota|Myxomycetes|Liceales|Reticulariaceae,Protozoa,Myxomycota,Myxomycetes,Liceales,Reticulariaceae,Lycogala,617007,Lycogala,,"Cooke, William Bridge",,10/24/35,1935,10,24,297,,,United States,Ohio,Hamilton,Cincinnati,College Hill,39.20228,-84.547166,,,https://www.mycoportal.org/portal/collections/individual/index.php?occid=4381179
4381183,Protozoa|Myxomycota|Myxomycetes|Liceales|Reticulariaceae,Protozoa,Myxomycota,Myxomycetes,Liceales,Reticulariaceae,Lycogala,617007,Lycogala,,"Cooke, William Bridge",,10/10/35,1935,10,10,283,,,United States,Ohio,Clermont,Milford,South Milford,39.175338,-84.294382,,,https://www.mycoportal.org/portal/collections/individual/index.php?occid=4381183
4381186,Protozoa|Myxomycota|Myxomycetes|Liceales|Reticulariaceae,Protozoa,Myxomycota,Myxomycetes,Liceales,Reticulariaceae,Lycogala,617007,Lycogala,,"Cooke, William Bridge",,10/10/35,1935,10,10,283,,,United States,Ohio,Clermont,Batavia,"Batavia, Glen Forest",39.077007,-84.17688,,,https://www.mycoportal.org/portal/collections/individual/index.php?occid=4381186
4381188,Protozoa|Myxomycota|Myxomycetes|Liceales|Reticulariaceae,Protozoa,Myxomycota,Myxomycetes,Liceales,Reticulariaceae,Lycogala,617007,Lycogala,,"Cooke, William Bridge",,10/17/35,1935,10,17,290,,,United States,Ohio,Hamilton,Dunlap,Dunlap,39.292279,-84.618002,,,https://www.mycoportal.org/portal/collections/individual/index.php?occid=4381188
4381193,Protozoa|Myxomycota|Myxomycetes|Trichiales|Arcyriaceae,Protozoa,Myxomycota,Myxomycetes,Trichiales,Arcyriaceae,Arcyria denudata,214363,Arcyria,,"Owens, M.",,10/3/46,1946,10,3,276,moist woods,dead log,United States,Ohio,Hamilton,,"Hamilton County, Ohio",39.195531,-84.542775,,,https://www.mycoportal.org/portal/collections/individual/index.php?occid=4381193
4381200,Protozoa|Myxomycota|Myxomycetes|Trichiales|Arcyriaceae,Protozoa,Myxomycota,Myxomycetes,Trichiales,Arcyriaceae,Arcyria denudata,214363,Arcyria,,"Lloyd, Curtis Gates",,1910-00-00,1910,0,0,,frondose woods,,United States,Kentucky,Grant,Crittenden,Crittenden,38.782844,-84.605221,,,https://www.mycoportal.org/portal/collections/individual/index.php?occid=4381200
4381204,Protozoa|Myxomycota|Myxomycetes|Trichiales|Arcyriaceae,Protozoa,Myxomycota,Myxomycetes,Trichiales,Arcyriaceae,Arcyria denudata,214363,Arcyria,,"Ayers, John H.",,8/8/32,1932,8,8,221,,rotten log,United States,Ohio,Clermont,Milford,Milford,39.175338,-84.294382,,,https://www.mycoportal.org/portal/collections/individual/index.php?occid=4381204
4381208,Protozoa|Myxomycota|Myxomycetes|Trichiales|Arcyriaceae,Protozoa,Myxomycota,Myxomycetes,Trichiales,Arcyriaceae,Arcyria denudata,214363,Arcyria,,"Blickle, A.H.",,5/4/35,1935,5,4,124,,dead and rotting Ulmus americana,United States,Ohio,Hamilton,Cincinnati,Burnet Woods,39.139271,-84.517276,,,https://www.mycoportal.org/portal/collections/individual/index.php?occid=4381208
4381212,Protozoa|Myxomycota|Myxomycetes|Trichiales|Arcyriaceae,Protozoa,Myxomycota,Myxomycetes,Trichiales,Arcyriaceae,Arcyria denudata,214363,Arcyria,,"Hoskins, John Hobart",,1931-00-00,1931,0,0,,,rotten log,United States,Indiana,Saint Joseph,South Bend,South Bend,41.683381,-86.250007,,,https://www.mycoportal.org/portal/collections/individual/index.php?occid=4381212
4381220,Protozoa|Myxomycota|Myxomycetes|Trichiales|Arcyriaceae,Protozoa,Myxomycota,Myxomycetes,Trichiales,Arcyriaceae,Arcyria denudata,214363,Arcyria,,"Hoskins, John Hobart",,1931-00-00,1931,0,0,,,rotten log,United States,Indiana,Saint Joseph,South Bend,South Bend,41.683381,-86.250007,,,https://www.mycoportal.org/portal/collections/individual/index.php?occid=4381220
4381224,Protozoa|Myxomycota|Myxomycetes|Trichiales|Arcyriaceae,Protozoa,Myxomycota,Myxomycetes,Trichiales,Arcyriaceae,Arcyria denudata,214363,Arcyria,,"Ayers, John H.",,10/15/32,1932,10,15,289,,rotten log,United States,Ohio,Hamilton,Cincinnati,College Hill,39.20228,-84.547166,,,https://www.mycoportal.org/portal/collections/individual/index.php?occid=4381224
4381229,Protozoa|Myxomycota|Myxomycetes|Trichiales|Arcyriaceae,Protozoa,Myxomycota,Myxomycetes,Trichiales,Arcyriaceae,Arcyria denudata,214363,Arcyria,,"Hoskins, John Hobart",,1931-00-00,1931,0,0,,,rotten log,United States,Indiana,Saint Joseph,South Bend,South Bend,41.683381,-86.250007,,,https://www.mycoportal.org/portal/collections/individual/index.php?occid=4381229
4381231,Protozoa|Myxomycota|Myxomycetes|Trichiales|Arcyriaceae,Protozoa,Myxomycota,Myxomycetes,Trichiales,Arcyriaceae,Arcyria denudata,214363,Arcyria,,"Ayers, John H.",,9/9/33,1933,9,9,252,,rotten log,United States,Ohio,Hamilton,Cincinnati,Mt. Airy Forest,39.165058,-84.574945,,,https://www.mycoportal.org/portal/collections/individual/index.php?occid=4381231
4381235,Protozoa|Myxomycota|Myxomycetes|Trichiales|Arcyriaceae,Protozoa,Myxomycota,Myxomycetes,Trichiales,Arcyriaceae,Arcyria denudata,214363,Arcyria,,"Ayers, John H.",,9/24/32,1932,9,24,268,,rotten log,United States,Ohio,Hamilton,Cincinnati,Hazelwood,39.266169,-84.362996,,,https://www.mycoportal.org/portal/collections/individual/index.php?occid=4381235
4381238,Protozoa|Myxomycota|Myxomycetes|Trichiales|Arcyriaceae,Protozoa,Myxomycota,Myxomycetes,Trichiales,Arcyriaceae,Arcyria denudata,214363,Arcyria,,"Ayers, John H.",,8/16/32,1932,8,16,229,,rotten log,United States,Ohio,Hamilton,Cincinnati,Hazelwood,39.266169,-84.362996,,,https://www.mycoportal.org/portal/collections/individual/index.php?occid=4381238
4381242,Protozoa|Myxomycota|Myxomycetes|Trichiales|Arcyriaceae,Protozoa,Myxomycota,Myxomycetes,Trichiales,Arcyriaceae,Arcyria denudata,214363,Arcyria,,"Cooke, William Bridge",,9/19/32,1932,9,19,263,,dead wood,United States,Ohio,Highland,,Seven Caves,39.222845,-83.355158,,,https://www.mycoportal.org/portal/collections/individual/index.php?occid=4381242
4381256,Protozoa|Myxomycota|Myxomycetes|Trichiales|Arcyriaceae,Protozoa,Myxomycota,Myxomycetes,Trichiales,Arcyriaceae,Arcyria denudata,214363,Arcyria,,"Lillick, Lois",,10/18/32,1932,10,18,292,,dead log,United States,Ohio,Hamilton,Cincinnati,College Hill,39.20228,-84.547166,,,https://www.mycoportal.org/portal/collections/individual/index.php?occid=4381256
4381259,Protozoa|Myxomycota|Myxomycetes|Trichiales|Arcyriaceae|Arcyria,Protozoa,Myxomycota,Myxomycetes,Trichiales,Arcyriaceae,Arcyria cinerea,628046,Arcyria,,"Ayers, John H.",,7/31/32,1932,7,31,213,,rotten log,United States,Ohio,Clermont,Milford,Milford,39.175338,-84.294382,,,https://www.mycoportal.org/portal/collections/individual/index.php?occid=4381259
4381261,Protozoa|Myxomycota|Myxomycetes|Trichiales|Arcyriaceae|Arcyria,Protozoa,Myxomycota,Myxomycetes,Trichiales,Arcyriaceae,Arcyria cinerea,628046,Arcyria,,"Cooke, William Bridge",,7/31/32,1932,7,31,213,,dead wood,United States,Ohio,Highland,,Seven Caves,39.222845,-83.355158,,,https://www.mycoportal.org/portal/collections/individual/index.php?occid=4381261
4381262,Protozoa|Myxomycota|Myxomycetes|Trichiales|Arcyriaceae|Arcyria,Protozoa,Myxomycota,Myxomycetes,Trichiales,Arcyriaceae,Arcyria cinerea,628046,Arcyria,,"Ayers, John H.",,9/9/33,1933,9,9,252,,rotten log,United States,Ohio,Hamilton,Cincinnati,Mt. Airy Forest,39.165058,-84.574945,,,https://www.mycoportal.org/portal/collections/individual/index.php?occid=4381262
4381266,Protozoa|Myxomycota|Myxomycetes|Trichiales|Arcyriaceae|Arcyria,Protozoa,Myxomycota,Myxomycetes,Trichiales,Arcyriaceae,Arcyria cinerea,628046,Arcyria,,"Fulford, Margaret H.",,1929-00-00,1929,0,0,,,rotten log in woods,United States,Ohio,Hamilton,Cincinnati,"California, near Water Works",39.065339,-84.423274,,,https://www.mycoportal.org/portal/collections/individual/index.php?occid=4381266
4381268,Protozoa|Myxomycota|Myxomycetes|Trichiales|Arcyriaceae|Arcyria,Protozoa,Myxomycota,Myxomycetes,Trichiales,Arcyriaceae,Arcyria cinerea,628046,Arcyria,,"Fulford, Margaret H.",,1929-00-00,1929,0,0,,,rotten log in woods,United States,Ohio,Hamilton,Cincinnati,"California, near Water Works",39.065339,-84.423274,,,https://www.mycoportal.org/portal/collections/individual/index.php?occid=4381268
4381271,Protozoa|Myxomycota|Myxomycetes|Trichiales|Arcyriaceae|Arcyria,Protozoa,Myxomycota,Myxomycetes,Trichiales,Arcyriaceae,Arcyria cinerea,628046,Arcyria,,"Fulford, Margaret H.",,1929-00-00,1929,0,0,,,rotten log in woods,United States,Ohio,Hamilton,Cincinnati,"California, near Water Works",39.065339,-84.423274,,,https://www.mycoportal.org/portal/collections/individual/index.php?occid=4381271
4381273,Protozoa|Myxomycota|Myxomycetes|Trichiales|Arcyriaceae|Arcyria,Protozoa,Myxomycota,Myxomycetes,Trichiales,Arcyriaceae,Arcyria cinerea,628046,Arcyria,,"Fulford, Margaret H.",,1929-00-00,1929,0,0,,,rotten log in woods,United States,Ohio,Hamilton,Cincinnati,"California, near Water Works",39.065339,-84.423274,,,https://www.mycoportal.org/portal/collections/individual/index.php?occid=4381273
4381275,Protozoa|Myxomycota|Myxomycetes|Trichiales|Arcyriaceae|Arcyria,Protozoa,Myxomycota,Myxomycetes,Trichiales,Arcyriaceae,Arcyria cinerea,628046,Arcyria,,"Ayers, John H.",,8/8/32,1932,8,8,221,,rotten log,United States,Ohio,Clermont,Milford,Milford,39.175338,-84.294382,,,https://www.mycoportal.org/portal/collections/individual/index.php?occid=4381275
4381277,Protozoa|Myxomycota|Myxomycetes|Trichiales|Arcyriaceae|Arcyria,Protozoa,Myxomycota,Myxomycetes,Trichiales,Arcyriaceae,Arcyria cinerea,628046,Arcyria,,"Fulford, Margaret H.",,1929-00-00,1929,0,0,,,rotten log in woods,United States,Ohio,Hamilton,Cincinnati,"California, near Water Works",39.065339,-84.423274,,,https://www.mycoportal.org/portal/collections/individual/index.php?occid=4381277
4381285,Protozoa|Myxomycota|Myxomycetes|Trichiales|Arcyriaceae|Arcyria,Protozoa,Myxomycota,Myxomycetes,Trichiales,Arcyriaceae,Arcyria cinerea,628046,Arcyria,,"Lloyd, Curtis Gates",,1928-05-00,1928,5,0,,frondose woods,,United States,Kentucky,Grant,Crittenden,Crittenden,38.782844,-84.605221,,,https://www.mycoportal.org/portal/collections/individual/index.php?occid=4381285
4381287,Protozoa|Myxomycota|Myxomycetes|Trichiales|Arcyriaceae|Arcyria,Protozoa,Myxomycota,Myxomycetes,Trichiales,Arcyriaceae,Arcyria cinerea,628046,Arcyria,,"Lloyd, Curtis Gates",,1928-05-00,1928,5,0,,frondose woods,,United States,Kentucky,Grant,Crittenden,Crittenden,38.782844,-84.605221,,,https://www.mycoportal.org/portal/collections/individual/index.php?occid=4381287
4381291,Protozoa|Myxomycota|Myxomycetes|Trichiales|Arcyriaceae,Protozoa,Myxomycota,Myxomycetes,Trichiales,Arcyriaceae,Arcyria incarnata,628095,Arcyria,,"Lloyd, Curtis Gates",,1928-05-00,1928,5,0,,,,United States,Kentucky,Grant,Crittenden,Crittenden,38.782844,-84.605221,,,https://www.mycoportal.org/portal/collections/individual/index.php?occid=4381291
4381292,Protozoa|Myxomycota|Myxomycetes|Trichiales|Arcyriaceae,Protozoa,Myxomycota,Myxomycetes,Trichiales,Arcyriaceae,Arcyria versicolor,628165,Arcyria,,"Cooke, William Bridge",,7/8/38,1938,7,8,189,,on Shasta fir,United States,California,Siskiyou,Mt. Shasta,Along Sisson Southern Trail,41.339569,-122.287735,1981,,https://www.mycoportal.org/portal/collections/individual/index.php?occid=4381292
4381295,Protozoa|Myxomycota|Myxomycetes|Trichiales|Arcyriaceae,Protozoa,Myxomycota,Myxomycetes,Trichiales,Arcyriaceae,Arcyria versicolor,628165,Arcyria,,"Cooke, William Bridge","Cooke, V.G.",6/25/46,1946,6,25,176,,on Shasta fir,United States,California,Siskiyou,Mt. Shasta,Horse Camp,41.372268,-122.229867,2438,,https://www.mycoportal.org/portal/collections/individual/index.php?occid=4381295
4381297,Protozoa|Myxomycota|Myxomycetes|Trichiales|Arcyriaceae,Protozoa,Myxomycota,Myxomycetes,Trichiales,Arcyriaceae,Arcyria versicolor,628165,Arcyria,,"Cooke, William Bridge",,7/28/38,1938,7,28,209,,on Shasta fir,United States,California,Siskiyou,Mt. Shasta,Ridge north of Horse Camp,41.37252,-122.23153,2591,,https://www.mycoportal.org/portal/collections/individual/index.php?occid=4381297
4381303,Fungi|Ascomycota|Pezizomycotina|Sordariomycetes|Xylariomycetidae|Xylariales|Diatrypaceae|Diatrype,Fungi,Ascomycota,Sordariomycetes,Xylariales,Diatrypaceae,Diatrype albopruinosa,169031,Diatrype,,"Cooke, William Bridge",,1934-00-00,1934,0,0,,,dead sticks,United States,Ohio,Hamilton,,"Hamilton County, Ohio",39.195531,-84.542775,,,https://www.mycoportal.org/portal/collections/individual/index.php?occid=4381303
4381305,Fungi|Ascomycota|Pezizomycotina|Sordariomycetes|Xylariomycetidae|Xylariales|Diatrypaceae|Diatrype,Fungi,Ascomycota,Sordariomycetes,Xylariales,Diatrypaceae,Diatrype disciformis,169115,Diatrype,,"Parks, H.E.",,1935-02-00,1935,2,0,,,on Salix hookeriana,United States,California,Humboldt,Trinidad,Spruce Cove,41.065402,-124.153125,,,https://www.mycoportal.org/portal/collections/individual/index.php?occid=4381305
4381308,Fungi|Ascomycota|Pezizomycotina|Sordariomycetes|Xylariomycetidae|Xylariales|Diatrypaceae|Diatrype,Fungi,Ascomycota,Sordariomycetes,Xylariales,Diatrypaceae,Diatrype virescens,169332,Diatrype,,"Cooke, William Bridge",,2/2/33,1933,2,2,33,,dead Fagus sp. sticks,United States,Ohio,Highland,Seven Caves,Seven Caves (Highlands Nature Sanctuary),39.344508,-83.59742,,,https://www.mycoportal.org/portal/collections/individual/index.php?occid=4381308
4381310,Fungi|Ascomycota|Pezizomycotina|Sordariomycetes|Xylariomycetidae|Xylariales|Diatrypaceae|Diatrype,Fungi,Ascomycota,Sordariomycetes,Xylariales,Diatrypaceae,Diatrype virescens,169332,Diatrype,,"Cooke, William Bridge",,2/2/33,1933,2,2,33,,dead Fagus sp. sticks,United States,Ohio,Highland,,Seven Caves,39.222845,-83.355158,,,https://www.mycoportal.org/portal/collections/individual/index.php?occid=4381310
4381312,Fungi|Ascomycota|Pezizomycotina|Sordariomycetes|Xylariomycetidae|Xylariales|Diatrypaceae|Diatrype,Fungi,Ascomycota,Sordariomycetes,Xylariales,Diatrypaceae,Diatrype virescens,169332,Diatrype,,"Hopkins, W.C.",,10/13/38,1938,10,13,286,,dead wood,United States,Ohio,Hamilton,Cincinnati,California,39.065339,-84.423274,,,https://www.mycoportal.org/portal/collections/individual/index.php?occid=4381312
4381313,Fungi|Ascomycota|Pezizomycotina|Sordariomycetes|Xylariomycetidae|Xylariales|Diatrypaceae|Diatrype,Fungi,Ascomycota,Sordariomycetes,Xylariales,Diatrypaceae,Diatrype virescens,169332,Diatrype,,"Fulford, Margaret H.",,9/27/29,1929,9,27,270,,sticks,United States,Ohio,Hamilton,Cincinnati,Kroger Hills,39.150157,-84.32093,,,https://www.mycoportal.org/portal/collections/individual/index.php?occid=4381313
4381316,Fungi|Ascomycota|Pezizomycotina|Sordariomycetes|Xylariomycetidae|Xylariales|Diatrypaceae|Diatrype,Fungi,Ascomycota,Sordariomycetes,Xylariales,Diatrypaceae,Diatrype virescens,169332,Diatrype,,"Lillick, Lois",,10/8/32,1932,10,8,282,,dead log,United States,Ohio,Hamilton,Cincinnati,Hazelwood Preserve (Harris M. Benedict Nature Preserve/Johnson Preserve),39.261725,-84.353273,,,https://www.mycoportal.org/portal/collections/individual/index.php?occid=4381316
4381317,Fungi|Ascomycota|Pezizomycotina|Sordariomycetes|Xylariomycetidae|Xylariales|Diatrypaceae|Diatrype,Fungi,Ascomycota,Sordariomycetes,Xylariales,Diatrypaceae,Diatrype virescens,169332,Diatrype,,"Fulford, Margaret H.",,9/27/29,1929,9,27,270,,beech twigs,United States,Ohio,Hamilton,Cincinnati,Kroger Hills,39.150157,-84.32093,,,https://www.mycoportal.org/portal/collections/individual/index.php?occid=4381317
4381318,Fungi|Ascomycota|Pezizomycotina|Sordariomycetes|Xylariomycetidae|Xylariales|Diatrypaceae|Diatrype,Fungi,Ascomycota,Sordariomycetes,Xylariales,Diatrypaceae,Diatrype virescens,169332,Diatrype,,"Cooke, William Bridge",,10/31/35,1935,10,31,304,,sticks,United States,Ohio,Hamilton,Cincinnati,Caldwell Preserve,39.20159,-84.49139,,,https://www.mycoportal.org/portal/collections/individual/index.php?occid=4381318
4381322,Fungi|Ascomycota|Pezizomycotina|Sordariomycetes|Xylariomycetidae|Xylariales|Diatrypaceae|Diatrype,Fungi,Ascomycota,Sordariomycetes,Xylariales,Diatrypaceae,Diatrype virescens,169332,Diatrype,,"Cooke, William Bridge",,12/16/35,1935,12,16,350,,sticks,United States,Ohio,Hamilton,Cincinnati,MacFarlan Woods,39.177572,-84.570911,,,https://www.mycoportal.org/portal/collections/individual/index.php?occid=4381322
4381323,Fungi|Ascomycota|Pezizomycotina|Sordariomycetes|Xylariomycetidae|Xylariales|Diatrypaceae|Diatrype,Fungi,Ascomycota,Sordariomycetes,Xylariales,Diatrypaceae,Diatrype virescens,169332,Diatrype,,"Cooke, William Bridge",,5/1/37,1937,5,1,121,,on Fagus grandifolia,United States,Ohio,Jackson,Rock Run,Rock Run,39.0667,-82.7,,,https://www.mycoportal.org/portal/collections/individual/index.php?occid=4381323
4381324,Fungi|Ascomycota|Pezizomycotina|Sordariomycetes|Xylariomycetidae|Xylariales|Diatrypaceae|Diatrype,Fungi,Ascomycota,Sordariomycetes,Xylariales,Diatrypaceae,Diatrype virescens,169332,Diatrype,,"Cooke, William Bridge",,2/9/37,1937,2,9,40,,on Fagus grandifolia,United States,Ohio,Hamilton,Cincinnati,Mt. Airy Forest,39.165058,-84.574945,,,https://www.mycoportal.org/portal/collections/individual/index.php?occid=4381324
4381326,Fungi|Ascomycota|Pezizomycotina|Sordariomycetes|Xylariomycetidae|Xylariales|Diatrypaceae|Diatrype,Fungi,Ascomycota,Sordariomycetes,Xylariales,Diatrypaceae,Diatrype virescens,169332,Diatrype,,"Fulford, Margaret H.",,10/18/29,1929,10,18,291,,on beech wood,United States,Ohio,Clermont,Milford,Milford,39.175338,-84.294382,,,https://www.mycoportal.org/portal/collections/individual/index.php?occid=4381326
4381327,Fungi|Ascomycota|Pezizomycotina|Sordariomycetes|Xylariomycetidae|Xylariales|Diatrypaceae|Diatrype,Fungi,Ascomycota,Sordariomycetes,Xylariales,Diatrypaceae,Diatrype virescens,169332,Diatrype,,"Fulford, Margaret H.",,1947-10-00,1947,10,0,,,on beech twigs,United States,Kentucky,Powell,,Along Red River,37.838038,-84.002172,,,https://www.mycoportal.org/portal/collections/individual/index.php?occid=4381327
4381328,Fungi|Ascomycota|Pezizomycotina|Sordariomycetes|Xylariomycetidae|Xylariales|Diatrypaceae|Diatrype,Fungi,Ascomycota,Sordariomycetes,Xylariales,Diatrypaceae,Diatrype stigma,169292,Diatrype,,"Cooke, William Bridge",,12/15/35,1935,12,15,349,,,United States,Ohio,Hamilton,Cincinnati,Newtown Woods,39.124505,-84.361606,,,https://www.mycoportal.org/portal/collections/individual/index.php?occid=4381328
4381330,Fungi|Ascomycota|Pezizomycotina|Sordariomycetes|Xylariomycetidae|Xylariales|Diatrypaceae|Diatrype,Fungi,Ascomycota,Sordariomycetes,Xylariales,Diatrypaceae,Diatrype stigma,169292,Diatrype,,"Cooke, William Bridge",,2/29/36,1936,2,29,60,,,United States,Ohio,Clermont,,Alpine Road,39.047433,-84.151918,,,https://www.mycoportal.org/portal/collections/individual/index.php?occid=4381330
4381335,Fungi|Ascomycota|Pezizomycotina|Sordariomycetes|Xylariomycetidae|Xylariales|Diatrypaceae|Diatrype,Fungi,Ascomycota,Sordariomycetes,Xylariales,Diatrypaceae,Diatrype stigma,169292,Diatrype,,"Cooke, William Bridge",,11/30/35,1935,11,30,334,,,United States,Ohio,Clermont,Modest,Modest Uplands,39.193117,-84.107156,,,https://www.mycoportal.org/portal/collections/individual/index.php?occid=4381335
4381336,Fungi|Ascomycota|Pezizomycotina|Sordariomycetes|Xylariomycetidae|Xylariales|Diatrypaceae|Diatrype,Fungi,Ascomycota,Sordariomycetes,Xylariales,Diatrypaceae,Diatrype stigma,169292,Diatrype,,"Cooke, William Bridge",,11/30/35,1935,11,30,334,,,United States,Ohio,Clermont,Modest,Modest Uplands,39.193117,-84.107156,,,https://www.mycoportal.org/portal/collections/individual/index.php?occid=4381336
4381338,Fungi|Ascomycota|Pezizomycotina|Sordariomycetes|Xylariomycetidae|Xylariales|Diatrypaceae|Diatrype,Fungi,Ascomycota,Sordariomycetes,Xylariales,Diatrypaceae,Diatrype stigma,169292,Diatrype,,"Cooke, William Bridge",,3/10/36,1936,3,10,70,,,United States,Ohio,Hamilton,Sycamore Creek,Sycamore Creek,39.247559,-84.322239,,,https://www.mycoportal.org/portal/collections/individual/index.php?occid=4381338
4381341,Fungi|Ascomycota|Pezizomycotina|Sordariomycetes|Xylariomycetidae|Xylariales|Diatrypaceae|Diatrype,Fungi,Ascomycota,Sordariomycetes,Xylariales,Diatrypaceae,Diatrype stigma,169292,Diatrype,,"Cooke, William Bridge",,12/4/33,1933,12,4,338,,surrounding sticks over area,United States,Ohio,Clermont,Dark Hollow,Dark Hollow,38.915352,-82.693222,,,https://www.mycoportal.org/portal/collections/individual/index.php?occid=4381341
4381344,Fungi|Ascomycota|Pezizomycotina|Sordariomycetes|Xylariomycetidae|Xylariales|Diatrypaceae|Diatrype,Fungi,Ascomycota,Sordariomycetes,Xylariales,Diatrypaceae,Diatrype stigma,169292,Diatrype,,"Cooke, William Bridge",,11/30/35,1935,11,30,334,,,United States,Ohio,Clermont,Modest,Modest Uplands,39.193117,-84.107156,,,https://www.mycoportal.org/portal/collections/individual/index.php?occid=4381344
4381347,Fungi|Ascomycota|Pezizomycotina|Sordariomycetes|Xylariomycetidae|Xylariales|Diatrypaceae|Diatrype,Fungi,Ascomycota,Sordariomycetes,Xylariales,Diatrypaceae,Diatrype stigma,169292,Diatrype,,"Cooke, William Bridge",,11/30/35,1935,11,30,334,,,United States,Ohio,Clermont,Modest,Modest Uplands,39.193117,-84.107156,,,https://www.mycoportal.org/portal/collections/individual/index.php?occid=4381347
4381349,Fungi|Ascomycota|Pezizomycotina|Sordariomycetes|Xylariomycetidae|Xylariales|Diatrypaceae|Diatrype,Fungi,Ascomycota,Sordariomycetes,Xylariales,Diatrypaceae,Diatrype stigma,169292,Diatrype,,"McCaffery, P.",,10/1/32,1932,10,1,275,,,United States,Ohio,Adams,,"Adams County, Ohio",38.845515,-83.472152,,,https://www.mycoportal.org/portal/collections/individual/index.php?occid=4381349
4381352,Fungi|Ascomycota|Pezizomycotina|Sordariomycetes|Xylariomycetidae|Xylariales|Diatrypaceae|Diatrype,Fungi,Ascomycota,Sordariomycetes,Xylariales,Diatrypaceae,Diatrype stigma,169292,Diatrype,,"Cooke, William Bridge",,11/30/35,1935,11,30,334,,,United States,Ohio,Clermont,Modest,Modest Uplands,39.193117,-84.107156,,,https://www.mycoportal.org/portal/collections/individual/index.php?occid=4381352
4381353,Fungi|Ascomycota|Pezizomycotina|Sordariomycetes|Xylariomycetidae|Xylariales|Diatrypaceae|Diatrype,Fungi,Ascomycota,Sordariomycetes,Xylariales,Diatrypaceae,Diatrype stigma,169292,Diatrype,,"Cooke, William Bridge",,3/16/34,1934,3,16,75,,dead Quercus log,United States,Ohio,Clermont,Dark Hollow,Dark Hollow,38.915352,-82.693222,,,https://www.mycoportal.org/portal/collections/individual/index.php?occid=4381353
4381356,Fungi|Ascomycota|Pezizomycotina|Sordariomycetes|Xylariomycetidae|Xylariales|Diatrypaceae|Diatrype,Fungi,Ascomycota,Sordariomycetes,Xylariales,Diatrypaceae,Diatrype stigma,169292,Diatrype,,"Fulford, Margaret H.",,9/27/29,1929,9,27,270,,decayed log,United States,Ohio,Hamilton,Cincinnati,Kroger Hills,39.150157,-84.32093,,,https://www.mycoportal.org/portal/collections/individual/index.php?occid=4381356
4381357,Fungi|Ascomycota|Pezizomycotina|Sordariomycetes|Xylariomycetidae|Xylariales|Diatrypaceae|Diatrype,Fungi,Ascomycota,Sordariomycetes,Xylariales,Diatrypaceae,Diatrype stigma,169292,Diatrype,,"Cooke, William Bridge",,10/10/35,1935,10,10,283,,,United States,Ohio,Clermont,Milford,South Milford,39.175338,-84.294382,,,https://www.mycoportal.org/portal/collections/individual/index.php?occid=4381357
4381358,Fungi|Ascomycota|Pezizomycotina|Sordariomycetes|Xylariomycetidae|Xylariales|Diatrypaceae|Diatrype,Fungi,Ascomycota,Sordariomycetes,Xylariales,Diatrypaceae,Diatrype stigma,169292,Diatrype,,"Stephenson, H.",,2/19/30,1930,2,19,50,,decayed beech,United States,Ohio,Hamilton,Cincinnati,Hazelwood Preserve (Harris M. Benedict Nature Preserve/Johnson Preserve),39.261725,-84.353273,,,https://www.mycoportal.org/portal/collections/individual/index.php?occid=4381358
4381360,Fungi|Ascomycota|Pezizomycotina|Sordariomycetes|Xylariomycetidae|Xylariales|Diatrypaceae|Diatrype,Fungi,Ascomycota,Sordariomycetes,Xylariales,Diatrypaceae,Diatrype stigma,169292,Diatrype,,"Cooke, William Bridge",,11/30/35,1935,11,30,334,,,United States,Ohio,Clermont,Modest,Modest Uplands,39.193117,-84.107156,,,https://www.mycoportal.org/portal/collections/individual/index.php?occid=4381360
4381361,Fungi|Ascomycota|Pezizomycotina|Sordariomycetes|Xylariomycetidae|Xylariales|Diatrypaceae|Diatrype,Fungi,Ascomycota,Sordariomycetes,Xylariales,Diatrypaceae,Diatrype stigma,169292,Diatrype,,"Cooke, William Bridge",,5/2/26,1926,5,2,122,,,United States,Ohio,Clermont,Mt. Repose,Mt. Repose,39.200616,-84.22438,,,https://www.mycoportal.org/portal/collections/individual/index.php?occid=4381361
4381362,Fungi|Ascomycota|Pezizomycotina|Sordariomycetes|Xylariomycetidae|Xylariales|Diatrypaceae|Diatrype,Fungi,Ascomycota,Sordariomycetes,Xylariales,Diatrypaceae,Diatrype stigma,169292,Diatrype,,"Cooke, William Bridge",,3/12/33,1933,3,12,71,,sticks,United States,Ohio,Clermont,Dark Hollow,Dark Hollow,38.915352,-82.693222,,,https://www.mycoportal.org/portal/collections/individual/index.php?occid=4381362
4381363,Fungi|Ascomycota|Pezizomycotina|Sordariomycetes|Xylariomycetidae|Xylariales|Diatrypaceae|Diatrype,Fungi,Ascomycota,Sordariomycetes,Xylariales,Diatrypaceae,Diatrype stigma,169292,Diatrype,,"Cooke, William Bridge",,1/7/36,1936,1,7,7,,,United States,Ohio,Hamilton,Cincinnati,"Cincinnati, Weller Road",39.162004,-84.456886,,,https://www.mycoportal.org/portal/collections/individual/index.php?occid=4381363
4381364,Fungi|Ascomycota|Pezizomycotina|Sordariomycetes|Xylariomycetidae|Xylariales|Diatrypaceae|Diatrype,Fungi,Ascomycota,Sordariomycetes,Xylariales,Diatrypaceae,Diatrype stigma,169292,Diatrype,,"Fulford, Margaret H.",,10/17/29,1929,10,17,290,,decaying beech,United States,Ohio,Clermont,Milford,Milford,39.175338,-84.294382,,,https://www.mycoportal.org/portal/collections/individual/index.php?occid=4381364
4381365,Fungi|Ascomycota|Pezizomycotina|Sordariomycetes|Xylariomycetidae|Xylariales|Diatrypaceae|Diatrype,Fungi,Ascomycota,Sordariomycetes,Xylariales,Diatrypaceae,Diatrype stigma,169292,Diatrype,,"Fulford, Margaret H.",,9/27/29,1929,9,27,270,,dead beech bark,United States,Ohio,Hamilton,Cincinnati,Kroger Hills,39.150157,-84.32093,,,https://www.mycoportal.org/portal/collections/individual/index.php?occid=4381365
4381367,Fungi|Ascomycota|Pezizomycotina|Sordariomycetes|Xylariomycetidae|Xylariales|Diatrypaceae|Diatrype,Fungi,Ascomycota,Sordariomycetes,Xylariales,Diatrypaceae,Diatrype stigma,169292,Diatrype,,"Cooke, William Bridge",,10/11/35,1935,10,11,284,,,United States,Ohio,Clermont,Milford,South Milford,39.175338,-84.294382,,,https://www.mycoportal.org/portal/collections/individual/index.php?occid=4381367
4381368,Fungi|Ascomycota|Pezizomycotina|Sordariomycetes|Xylariomycetidae|Xylariales|Diatrypaceae|Diatrype,Fungi,Ascomycota,Sordariomycetes,Xylariales,Diatrypaceae,Diatrype stigma,169292,Diatrype,,"Cooke, William Bridge",,12/5/33,1933,12,5,339,,,United States,Ohio,Highland,,Seven Caves,39.222845,-83.355158,,,https://www.mycoportal.org/portal/collections/individual/index.php?occid=4381368
4388623,Fungi|Ascomycota|Pezizomycotina|Sordariomycetes|Xylariomycetidae|Xylariales|Xylariaceae|Hypoxylon,Fungi,Ascomycota,Sordariomycetes,Xylariales,Xylariaceae,Hypoxylon atropunctatum,248972,Hypoxylon,,"Cooke, William Bridge",,2/29/36,1936,2,29,60,,,United States,Ohio,Clermont,,Alpine Road,39.047433,-84.151918,,,https://www.mycoportal.org/portal/collections/individual/index.php?occid=4388623
4388624,Fungi|Ascomycota|Pezizomycotina|Sordariomycetes|Xylariomycetidae|Xylariales|Xylariaceae|Hypoxylon,Fungi,Ascomycota,Sordariomycetes,Xylariales,Xylariaceae,Hypoxylon fuscum,249211,Hypoxylon,,"Cooke, William Bridge",,2/29/36,1936,2,29,60,,,United States,Ohio,Clermont,,Alpine Road,39.047433,-84.151918,,,https://www.mycoportal.org/portal/collections/individual/index.php?occid=4388624
4388625,Fungi|Ascomycota|Pezizomycotina|Sordariomycetes|Xylariomycetidae|Xylariales|Xylariaceae|Hypoxylon,Fungi,Ascomycota,Sordariomycetes,Xylariales,Xylariaceae,Hypoxylon effusum,249159,Hypoxylon,,"Cooke, William Bridge",,10/24/35,1935,10,24,297,,,United States,Ohio,Hamilton,Cincinnati,College Hill,39.20228,-84.547166,,,https://www.mycoportal.org/portal/collections/individual/index.php?occid=4388625
4388626,Fungi|Ascomycota|Pezizomycotina|Sordariomycetes|Xylariomycetidae|Xylariales|Xylariaceae|Hypoxylon,Fungi,Ascomycota,Sordariomycetes,Xylariales,Xylariaceae,Hypoxylon atropunctatum,248972,Hypoxylon,,"Cooke, William Bridge",,3/4/37,1937,3,4,63,,,United States,Ohio,Clinton,Cowan's Creek,Cowan's Creek,39.38927,-83.92185,,,https://www.mycoportal.org/portal/collections/individual/index.php?occid=4388626
4388627,Fungi|Ascomycota|Pezizomycotina|Sordariomycetes|Sordariomycetidae|Glomerellaceae|Glomerella,Fungi,Ascomycota,Sordariomycetes,,Glomerellaceae,Glomerella cingulata,183718,Glomerella,,"Cooke, William Bridge",,5/15/37,1937,5,15,135,,on Malus sylvestris,United States,Ohio,Warren,Foster,Foster,39.319226,-84.252993,,,https://www.mycoportal.org/portal/collections/individual/index.php?occid=4388627
4388628,Fungi|Ascomycota|Pezizomycotina|Sordariomycetes|Xylariomycetidae|Xylariales|Xylariaceae|Hypoxylon,Fungi,Ascomycota,Sordariomycetes,Xylariales,Xylariaceae,Hypoxylon coccineum,503328,Hypoxylon,,"Cooke, William Bridge",,11/30/35,1935,11,30,334,,,United States,Ohio,Clermont,Modest,Modest Upland,39.193117,-84.107156,,,https://www.mycoportal.org/portal/collections/individual/index.php?occid=4388628
4388629,Fungi|Ascomycota|Pezizomycotina|Sordariomycetes|Xylariomycetidae|Xylariales|Xylariaceae|Hypoxylon,Fungi,Ascomycota,Sordariomycetes,Xylariales,Xylariaceae,Hypoxylon atropunctatum,248972,Hypoxylon,,"Cooke, William Bridge",,11/14/36,1936,11,14,319,,,United States,Ohio,Hamilton,Cincinnati,Red Bird Hollow,39.171121,-84.319385,,,https://www.mycoportal.org/portal/collections/individual/index.php?occid=4388629
4388630,Fungi|Ascomycota|Pezizomycotina|Sordariomycetes|Xylariomycetidae|Xylariales|Xylariaceae|Hypoxylon,Fungi,Ascomycota,Sordariomycetes,Xylariales,Xylariaceae,Hypoxylon atropunctatum,248972,Hypoxylon,,"Cooke, William Bridge",,11/30/35,1935,11,30,334,,,United States,Ohio,Clermont,Modest,Modest Uplands,39.193117,-84.107156,,,https://www.mycoportal.org/portal/collections/individual/index.php?occid=4388630
4388631,Fungi|Ascomycota|Pezizomycotina|Sordariomycetes|Xylariomycetidae|Xylariales|Xylariaceae|Hypoxylon,Fungi,Ascomycota,Sordariomycetes,Xylariales,Xylariaceae,Hypoxylon coccineum,503328,Hypoxylon,,"Blickle, A.H.",,4/19/36,1936,4,19,110,,,United States,Ohio,Hamilton,Cincinnati,"Cincinnati, Werk Road",39.162004,-84.456886,,,https://www.mycoportal.org/portal/collections/individual/index.php?occid=4388631
4388632,Fungi|Ascomycota|Pezizomycotina|Sordariomycetes|Xylariomycetidae|Xylariales|Xylariaceae|Hypoxylon,Fungi,Ascomycota,Sordariomycetes,Xylariales,Xylariaceae,Hypoxylon coccineum,503328,Hypoxylon,,"Cooke, William Bridge",,10/24/35,1935,10,24,297,,,United States,Ohio,Hamilton,Cincinnati,College Hill,39.20228,-84.547166,,,https://www.mycoportal.org/portal/collections/individual/index.php?occid=4388632
4388634,Fungi|Ascomycota|Pezizomycotina|Sordariomycetes|Xylariomycetidae|Xylariales|Xylariaceae|Hypoxylon,Fungi,Ascomycota,Sordariomycetes,Xylariales,Xylariaceae,Hypoxylon atropunctatum,248972,Hypoxylon,,"Stephenson, H.",,3/5/30,1930,3,5,64,,beech,United States,Ohio,Hamilton,Cincinnati,Hazelwood Preserve (Harris M. Benedict Nature Preserve/Johnson Preserve),39.261725,-84.353273,,,https://www.mycoportal.org/portal/collections/individual/index.php?occid=4388634
4388636,Fungi|Ascomycota|Pezizomycotina|Sordariomycetes|Xylariomycetidae|Xylariales|Xylariaceae|Hypoxylon,Fungi,Ascomycota,Sordariomycetes,Xylariales,Xylariaceae,Hypoxylon serpens,249599,Hypoxylon,,"Cooke, William Bridge","Cooke, V.G.",6/28/46,1946,6,28,179,,on Ceanothus veluntinus,United States,California,Siskiyou,Mt. Shasta,Mt. Shasta,41.40932,-122.195009,1524,,https://www.mycoportal.org/portal/collections/individual/index.php?occid=4388636
4388637,Fungi|Ascomycota|Pezizomycotina|Sordariomycetes|Xylariomycetidae|Xylariales|Xylariaceae|Hypoxylon,Fungi,Ascomycota,Sordariomycetes,Xylariales,Xylariaceae,Hypoxylon marginatum,503397,Hypoxylon,,"Cobbe, Thomas J.",,1938-10-00,1938,10,0,,,twigs and branches,United States,Kentucky,Kenton,White Villa,White Villa,38.879232,-84.450495,,,https://www.mycoportal.org/portal/collections/individual/index.php?occid=4388637
4388639,Fungi|Ascomycota|Pezizomycotina|Sordariomycetes|Xylariomycetidae|Xylariales|Xylariaceae|Hypoxylon,Fungi,Ascomycota,Sordariomycetes,Xylariales,Xylariaceae,Hypoxylon coccineum,503328,Hypoxylon,,"Diehl, George",,6/21/32,1932,6,21,173,,dead sticks,United States,Ohio,Hamilton,Cincinnati,Westwood,39.14867,-84.599389,,,https://www.mycoportal.org/portal/collections/individual/index.php?occid=4388639
4388640,Fungi|Ascomycota|Pezizomycotina|Dothideomycetes|Pleosporomycetidae|Pleosporales|Herpotrichia,Fungi,Ascomycota,Dothideomycetes,Pleosporales,Massarinaceae,Herpotrichia rhodospila,240175,Herpotrichia,,"Phinney, Harry Kenyon",,9/13/40,1940,9,13,257,,on Sycamore tree,United States,West Virginia,Upshur,Buckhannon,"Buckhannon River, five miles below Buckhannon on Buckhannon-Hall Road",38.996244,-80.228929,,,https://www.mycoportal.org/portal/collections/individual/index.php?occid=4388640
4388642,Fungi|Ascomycota|Pezizomycotina|Sordariomycetes|Xylariomycetidae|Xylariales|Xylariaceae|Hypoxylon,Fungi,Ascomycota,Sordariomycetes,Xylariales,Xylariaceae,Hypoxylon marginatum,503397,Hypoxylon,,"Cooke, William Bridge",,3/10/36,1936,3,10,70,,,United States,Ohio,Hamilton,Sycamore Creek,Sycamore Creek,39.247559,-84.322239,,,https://www.mycoportal.org/portal/collections/individual/index.php?occid=4388642
4388644,Fungi|Ascomycota|Pezizomycotina|Sordariomycetes|Xylariomycetidae|Xylariales|Xylariaceae|Hypoxylon,Fungi,Ascomycota,Sordariomycetes,Xylariales,Xylariaceae,Hypoxylon coccineum,503328,Hypoxylon,,"Phinney, Harry Kenyon",,10/17/40,1940,10,17,291,,on beech log in ravine,United States,Ohio,Clermont,,East fork of Little Miami River,40.381993,-83.929882,,,https://www.mycoportal.org/portal/collections/individual/index.php?occid=4388644
4388645,Fungi|Ascomycota|Pezizomycotina|Sordariomycetes|Xylariomycetidae|Xylariales|Xylariaceae|Hypoxylon,Fungi,Ascomycota,Sordariomycetes,Xylariales,Xylariaceae,Hypoxylon investiens,249288,Hypoxylon,,"Cooke, William Bridge",,10/1/32,1932,10,1,275,,dead log,United States,Ohio,Adams,Beaver Pond,Beaver Pond,38.939515,-83.346299,,,https://www.mycoportal.org/portal/collections/individual/index.php?occid=4388645
4388647,Fungi|Ascomycota|Pezizomycotina|Sordariomycetes|Xylariomycetidae|Xylariales|Xylariaceae|Hypoxylon,Fungi,Ascomycota,Sordariomycetes,Xylariales,Xylariaceae,Hypoxylon atropunctatum,248972,Hypoxylon,,"Cooke, William Bridge",,3/10/36,1936,3,10,70,,,United States,Ohio,Hamilton,Sycamore Creek,"South Fork, Sycamore Creek",39.247559,-84.322239,,,https://www.mycoportal.org/portal/collections/individual/index.php?occid=4388647
4388648,Fungi|Ascomycota|Pezizomycotina|Sordariomycetes|Xylariomycetidae|Xylariales|Xylariaceae|Hypoxylon,Fungi,Ascomycota,Sordariomycetes,Xylariales,Xylariaceae,Hypoxylon atropunctatum,248972,Hypoxylon,,"Cooke, William Bridge",,11/10/35,1935,11,10,314,,,United States,Ohio,Clermont,Mt. Repose II,Mt. Repose,39.200616,-84.22438,,,https://www.mycoportal.org/portal/collections/individual/index.php?occid=4388648
4388649,Fungi|Ascomycota|Pezizomycotina|Sordariomycetes|Xylariomycetidae|Xylariales|Xylariaceae|Hypoxylon,Fungi,Ascomycota,Sordariomycetes,Xylariales,Xylariaceae,Hypoxylon coccineum,503328,Hypoxylon,,"Murphy, J.",,10/11/34,1934,10,11,284,,on beech bark,United States,Ohio,Hamilton,Cincinnati,Kroger Hills,39.150157,-84.32093,,,https://www.mycoportal.org/portal/collections/individual/index.php?occid=4388649
4388650,Fungi|Ascomycota|Pezizomycotina|Sordariomycetes|Xylariomycetidae|Xylariales|Xylariaceae|Hypoxylon,Fungi,Ascomycota,Sordariomycetes,Xylariales,Xylariaceae,Hypoxylon atropunctatum,248972,Hypoxylon,,"Cooke, William Bridge",,11/19/35,1935,11,19,323,,,United States,Ohio,Hamilton,Red Bird Hollow,Red Bird Hollow,39.171121,-84.319385,,,https://www.mycoportal.org/portal/collections/individual/index.php?occid=4388650
4388652,Fungi|Ascomycota|Pezizomycotina|Sordariomycetes|Xylariomycetidae|Xylariales|Xylariaceae|Hypoxylon,Fungi,Ascomycota,Sordariomycetes,Xylariales,Xylariaceae,Hypoxylon coccineum,503328,Hypoxylon,,"Cooke, William Bridge",,10/10/35,1935,10,10,283,,,United States,Ohio,Clermont,Milford,South Milford,39.175338,-84.294382,,,https://www.mycoportal.org/portal/collections/individual/index.php?occid=4388652
4388653,Fungi|Ascomycota|Pezizomycotina|Sordariomycetes|Xylariomycetidae|Xylariales|Xylariaceae|Hypoxylon,Fungi,Ascomycota,Sordariomycetes,Xylariales,Xylariaceae,Hypoxylon coccineum,503328,Hypoxylon,,"Cooke, William Bridge",,10/17/35,1935,10,17,290,,,United States,Ohio,Hamilton,Dunlap,Dunlap,39.292279,-84.618002,,,https://www.mycoportal.org/portal/collections/individual/index.php?occid=4388653
4388658,Fungi|Ascomycota|Pezizomycotina|Sordariomycetes|Xylariomycetidae|Xylariales|Xylariaceae,Fungi,Ascomycota,Sordariomycetes,Xylariales,Xylariaceae,Hypoxylon,15140,Hypoxylon,,"Cooke, William Bridge",,6/13/33,1933,6,13,164,,Rotten wood,United States,Kentucky,Boone,Walton,Walton,38.875619,-84.610221,,,https://www.mycoportal.org/portal/collections/individual/index.php?occid=4388658
4389054,Fungi|Ascomycota|Pezizomycotina|Sordariomycetes|Trichosphaeriales|Trichosphaeriaceae|Trichosphaeria,Fungi,Ascomycota,Sordariomycetes,Trichosphaeriales,Lasiosphaeriaceae,Trichosphaeria solaris,546763,Trichosphaeria,,"Cooke, William Bridge",,11/7/33,1933,11,7,311,,dead Carpinus sp.,United States,Ohio,Clermont,Branch Hill,South Branch Hill,39.24617,-84.293271,,,https://www.mycoportal.org/portal/collections/individual/index.php?occid=4389054
4389055,Fungi|Ascomycota|Pezizomycotina|Sordariomycetes|Xylariomycetidae|Xylariales|Xylariaceae|Hypoxylon,Fungi,Ascomycota,Sordariomycetes,Xylariales,Xylariaceae,Hypoxylon atropunctatum,248972,Hypoxylon,,"Cooke, William Bridge",,11/14/36,1936,11,14,319,,,United States,Ohio,Hamilton,Red Bird Hollow,Red Bird Hollow,39.171121,-84.319385,,,https://www.mycoportal.org/portal/collections/individual/index.php?occid=4389055
4389187,Fungi|Ascomycota|Pezizomycotina|Sordariomycetes|Xylariomycetidae|Xylariales|Xylariaceae|Hypoxylon,Fungi,Ascomycota,Sordariomycetes,Xylariales,Xylariaceae,Hypoxylon perforatum,249483,Hypoxylon,,"Fulford, Margaret H.",,10/5/31,1931,10,5,278,,log in woods,United States,Ohio,Hamilton,Cincinnati,Kroger Hills,39.150157,-84.32093,,,https://www.mycoportal.org/portal/collections/individual/index.php?occid=4389187
4389449,Fungi|Ascomycota|Pezizomycotina|Sordariomycetes|Xylariomycetidae|Xylariales|Xylariaceae|Hypoxylon,Fungi,Ascomycota,Sordariomycetes,Xylariales,Xylariaceae,Hypoxylon cohaerens,249080,Hypoxylon,,"Hoskins, John Hobart",,1931-00-00,1931,0,0,,,,United States,Michigan,Grand Traverse,Traverse City,Traverse City,44.763057,-85.620632,,,https://www.mycoportal.org/portal/collections/individual/index.php?occid=4389449
4389452,Fungi|Ascomycota|Pezizomycotina|Sordariomycetes|Xylariomycetidae|Xylariales|Xylariaceae|Hypoxylon,Fungi,Ascomycota,Sordariomycetes,Xylariales,Xylariaceae,Hypoxylon coccineum,503328,Hypoxylon,,"Cooke, William Bridge",,12/4/33,1933,12,4,338,,dead beech log and branches,United States,Ohio,Clermont,Dark Hollow,Dark Hollow,38.915352,-82.693222,,,https://www.mycoportal.org/portal/collections/individual/index.php?occid=4389452
4389459,Fungi|Ascomycota|Pezizomycotina|Sordariomycetes|Xylariomycetidae|Xylariales|Xylariaceae|Hypoxylon,Fungi,Ascomycota,Sordariomycetes,Xylariales,Xylariaceae,Hypoxylon marginatum,503397,Hypoxylon,,"Cooke, William Bridge",,3/24/33,1933,3,24,83,,dead Fagus log,United States,Ohio,Hamilton,Newtown,Newtown Woods,39.124957,-84.360643,,,https://www.mycoportal.org/portal/collections/individual/index.php?occid=4389459
4389463,Fungi|Ascomycota|Pezizomycotina|Sordariomycetes|Xylariomycetidae|Xylariales|Xylariaceae|Hypoxylon,Fungi,Ascomycota,Sordariomycetes,Xylariales,Xylariaceae,Hypoxylon semi-immersum,249595,Hypoxylon,,"Cooke, William Bridge",,9/18/32,1932,9,18,262,,dead log,United States,Ohio,Highland,Seven Caves,Seven Caves (Highlands Nature Sanctuary),39.344508,-83.59742,,,https://www.mycoportal.org/portal/collections/individual/index.php?occid=4389463
4389466,Fungi|Ascomycota|Pezizomycotina|Sordariomycetes|Xylariomycetidae|Xylariales|Xylariaceae|Hypoxylon,Fungi,Ascomycota,Sordariomycetes,Xylariales,Xylariaceae,Hypoxylon nummularium,249438,Hypoxylon,,"Sanders, P.J.",,10/25/65,1965,10,25,298,wooded hillside,dead maple,United States,Ohio,Hamilton,Cincinnati,Center Hill Life Science Field Station,39.196066,-84.508607,,,https://www.mycoportal.org/portal/collections/individual/index.php?occid=4389466
4389469,Fungi|Ascomycota|Pezizomycotina|Sordariomycetes|Xylariomycetidae|Xylariales|Xylariaceae,Fungi,Ascomycota,Sordariomycetes,Xylariales,Xylariaceae,Hypoxylon,15140,Hypoxylon,,"Sanders, P.J.",,10/25/64,1964,10,25,299,wood hilltop,beech log,United States,Ohio,Hamilton,Cincinnati,Center Hill Life Science Field Station,39.196066,-84.508607,,,https://www.mycoportal.org/portal/collections/individual/index.php?occid=4389469
4389474,Fungi|Ascomycota|Pezizomycotina|Dothideomycetes|Pleosporomycetidae|Pleosporales|Herpotrichia,Fungi,Ascomycota,Dothideomycetes,Pleosporales,Melanommataceae,Herpotrichia nigra,240155,Herpotrichia,,"Cooke, William Bridge","Cooke, V.G.",6/24/46,1946,6,24,175,,on branches of Shasta fir,United States,California,Siskiyou,Mt. Shasta,"Horse Camp, Mount Shasta",41.37252,-122.23153,2438,,https://www.mycoportal.org/portal/collections/individual/index.php?occid=4389474
4389476,Fungi|Ascomycota|Pezizomycotina|Dothideomycetes|Pleosporomycetidae|Pleosporales|Herpotrichia,Fungi,Ascomycota,Dothideomycetes,Pleosporales,Melanommataceae,Herpotrichia nigra,240155,Herpotrichia,,"Cooke, William Bridge","Cooke, V.G.",8/29/46,1946,8,29,241,,on Juniperus communis var. montanus,United States,California,Siskiyou,Mt. Shasta,"Lava fields above Panther Creek, Mount Shasta",41.356389,-122.199033,2743,2743,https://www.mycoportal.org/portal/collections/individual/index.php?occid=4389476
4389481,Fungi|Ascomycota|Pezizomycotina|Sordariomycetes|Xylariomycetidae|Xylariales|Xylariaceae|Hypoxylon,Fungi,Ascomycota,Sordariomycetes,Xylariales,Xylariaceae,Hypoxylon bovei,249010,Hypoxylon,,"Thaxter, R.",,1906-03-00,1906,3,0,,,on Nothofagus antartica var. bicrenata,Chile,Magallanes y Antrtica Chilena,Magallanes,Punta Arenas,Punta Arenas,-53.130267,-70.853963,,,https://www.mycoportal.org/portal/collections/individual/index.php?occid=4389481
4389483,Fungi|Ascomycota|Pezizomycotina|Sordariomycetes|Xylariomycetidae|Xylariales|Xylariaceae|Hypoxylon,Fungi,Ascomycota,Sordariomycetes,Xylariales,Xylariaceae,Hypoxylon diathrauston,249131,Hypoxylon,,"Cooke, William Bridge",,6/27/47,1947,6,27,178,,on Abies concolor; on twigs and branches of fallen trees,United States,California,Siskiyou,Mt. Shasta,"Along the Sisson Southern Trail, 5500 ft.",41.339569,-122.287735,1676,,https://www.mycoportal.org/portal/collections/individual/index.php?occid=4389483
4389486,Fungi|Ascomycota|Pezizomycotina|Sordariomycetes|Xylariomycetidae|Xylariales|Xylariaceae|Hypoxylon,Fungi,Ascomycota,Sordariomycetes,Xylariales,Xylariaceae,Hypoxylon haematostroma,249252,Hypoxylon,,"Thaxter, R.",,1898-00-00,1898,0,0,,,,United States,Florida,Miami Dade,Miami,Coconut Grove,25.71222,-80.25722,,,https://www.mycoportal.org/portal/collections/individual/index.php?occid=4389486
4389490,Fungi|Ascomycota|Pezizomycotina|Dothideomycetes|Pleosporomycetidae|Pleosporales|Herpotrichia,Fungi,Ascomycota,Dothideomycetes,Pleosporales,Melanommataceae,Herpotrichia nigra,240155,Herpotrichia,,"Cooke, William Bridge","Cooke, V.G.",7/10/37,1937,7,10,191,,on Abies concolor,United States,California,Siskiyou,Mt. Shasta,"Above lower springs, Squaw Valley Creek",41.3685,-122.172746,1676,,https://www.mycoportal.org/portal/collections/individual/index.php?occid=4389490
4389494,Fungi|Ascomycota|Pezizomycotina|Sordariomycetes|Xylariomycetidae|Xylariales|Xylariaceae|Hypoxylon,Fungi,Ascomycota,Sordariomycetes,Xylariales,Xylariaceae,Hypoxylon pruinatum,249520,Hypoxylon,,"Thaxter, R.",,1901-08-00,1901,8,0,,,On Populus sp.,United States,New Hampshire,Carroll,Intervale,"Intervale, Sawyer's River",44.074236,-71.140071,,,https://www.mycoportal.org/portal/collections/individual/index.php?occid=4389494
4389498,Fungi|Ascomycota|Pezizomycotina|Sordariomycetes|Xylariomycetidae|Xylariales|Xylariaceae|Hypoxylon,Fungi,Ascomycota,Sordariomycetes,Xylariales,Xylariaceae,Hypoxylon serpens,249599,Hypoxylon,,"Cooke, William Bridge",,1/1/42,1942,1,1,1,,on rotting sticks of Arctostaphylos pungens,United States,California,Marin,,Along the fire trail between San Geronimo and Fairfax,37.996753,-122.623564,427,,https://www.mycoportal.org/portal/collections/individual/index.php?occid=4389498
4389502,Fungi|Ascomycota|Pezizomycotina|Sordariomycetes|Xylariomycetidae|Xylariales|Xylariaceae|Hypoxylon,Fungi,Ascomycota,Sordariomycetes,Xylariales,Xylariaceae,Hypoxylon tinctor,184436,Hypoxylon,,"Calkins, W.W.",,1886-00-00,1886,0,0,,,,United States,Florida,,,,9999.99,9999.99,,,https://www.mycoportal.org/portal/collections/individual/index.php?occid=4389502
4389505,Fungi|Ascomycota|Pezizomycotina|Sordariomycetes|Xylariomycetidae|Xylariales|Xylariaceae|Hypoxylon,Fungi,Ascomycota,Sordariomycetes,Xylariales,Xylariaceae,Hypoxylon turbinatum,249682,Hypoxylon,,"Williams, R.S.",,1905-04-00,1905,4,0,,,,Philippines,Mindanao,,Jodaya,"Mt. Apo, southeast Mindanao",6.989444,125.269722,1219,,https://www.mycoportal.org/portal/collections/individual/index.php?occid=4389505
4389514,Fungi|Ascomycota|Pezizomycotina|Sordariomycetes|Xylariomycetidae|Xylariales|Xylariaceae|Kretzschmaria,Fungi,Ascomycota,Sordariomycetes,Xylariales,Xylariaceae,Kretzschmaria scruposa,255095,Kretzschmaria,,"Hariot, P.",,1900-06-00,1900,6,0,,,,New Caledonia,,,Yahou,Yahou,-22.207257,166.485738,,,https://www.mycoportal.org/portal/collections/individual/index.php?occid=4389514
4389516,Fungi|Ascomycota|Pezizomycotina|Sordariomycetes|Sordariomycetidae|Sordariales|Lasiosphaeriaceae|Lasiosphaeria,Fungi,Ascomycota,Sordariomycetes,Sordariales,Helminthosphaeriaceae,Lasiosphaeria stuppea,259542,Lasiosphaeria,,"Cooke, William Bridge","Cooke, V.G.",7/31/46,1946,7,31,212,,on Abies magnifica v. shastensis,United States,California,Siskiyou,Mt. Shasta,"Horse Camp, Mt. Shasta; 41.37252 -122.23153",41.37252,-122.23153,,,https://www.mycoportal.org/portal/collections/individual/index.php?occid=4389516
4389520,Fungi|Ascomycota|Pezizomycotina|Sordariomycetes|Sordariomycetidae|Sordariales|Lasiosphaeriaceae,Fungi,Ascomycota,Sordariomycetes,Sordariales,Trichosphaeriaceae,Lasiosphaeria vermicularia,641027,Lasiosphaeria,,"Bonar, L.",,6/29/37,1937,6,29,180,,on dead sticks of Abies magnifica v. shastensis,United States,California,Siskiyou,Mt. Shasta,Horse Camp,41.37252,-122.23153,2438,,https://www.mycoportal.org/portal/collections/individual/index.php?occid=4389520
4389524,Fungi|Ascomycota|Pezizomycotina|Dothideomycetes|Pleosporomycetidae|Pleosporales|Leptosphaeriaceae|Leptosphaeria|Leptosphaeria agnita,Fungi,Ascomycota,Dothideomycetes,Pleosporales,Leptosphaeriaceae,Leptosphaeria agnita var. ambigua,510241,Leptosphaeria,,"Vestergren, T.",,1899-06-24,1899,6,24,175,,,Estonia,,Saare,Kuressaare,"Rossia baltica: Osilia, Arensburg",58.248056,22.503889,,,https://www.mycoportal.org/portal/collections/individual/index.php?occid=4389524
4389654,Fungi|Ascomycota|Pezizomycotina|Dothideomycetes|Pleosporomycetidae|Pleosporales|Leptosphaeriaceae|Leptosphaeria,Fungi,Ascomycota,Dothideomycetes,Pleosporales,Phaeosphaeriaceae,Leptosphaeria caricinella,272107,Leptosphaeria,,"Sprague, R.",,6/27/37,1937,6,27,178,On dead culms and leaves,on Juncus balticus v. montanus,United States,California,Siskiyou,Mt. Shasta,Horse Camp,41.37252,-122.23153,2438,,https://www.mycoportal.org/portal/collections/individual/index.php?occid=4389654
4389662,Fungi|Ascomycota|Pezizomycotina|Dothideomycetes|Pleosporomycetidae|Pleosporales|Leptosphaeriaceae|Leptosphaeria,Fungi,Ascomycota,Dothideomycetes,Pleosporales,Phaeosphaeriaceae,Leptosphaeria culmorum,510292,Leptosphaeria,,"Cooke, William Bridge",,8/6/37,1937,8,6,218,,dead leaves on Juncus orthophyllus,United States,California,Siskiyou,Mt. Shasta,Spring area above Horse Camp,41.37252,-122.23153,2438,,https://www.mycoportal.org/portal/collections/individual/index.php?occid=4389662
4389667,Fungi|Ascomycota|Pezizomycotina|Dothideomycetes|Pleosporomycetidae|Pleosporales|Leptosphaeriaceae|Leptosphaeria,Fungi,Ascomycota,Dothideomycetes,Pleosporales,Montagnulaceae,Leptosphaeria michotii,272651,Leptosphaeria,,"Cooke, William Bridge",,8/13/37,1937,8,13,225,,on dead leaves of Juncus orthophyllus,United States,California,Siskiyou,Mt. Shasta,Spring area above Horse Camp,41.37252,-122.23153,2438,,https://www.mycoportal.org/portal/collections/individual/index.php?occid=4389667
4389678,Fungi|Ascomycota|Pezizomycotina|Dothideomycetes|Pleosporomycetidae|Pleosporales|Leptosphaeriaceae|Leptosphaeria,Fungi,Ascomycota,Dothideomycetes,Pleosporales,Leptosphaeriaceae,Leptosphaeria maculans,185139,Leptosphaeria,,"Cooke, William Bridge",,7/16/47,1947,7,16,197,,on Lupinus albicaulis var. shastensis,United States,California,Siskiyou,Mt. Shasta,Ridge south of Horse Camp,41.37252,-122.23153,2438,,https://www.mycoportal.org/portal/collections/individual/index.php?occid=4389678
4389690,Fungi|Ascomycota|Pezizomycotina|Dothideomycetes|Pleosporomycetidae|Pleosporales|Leptosphaeriaceae|Leptosphaeria,Fungi,Ascomycota,Dothideomycetes,Pleosporales,Leptosphaeriaceae,Leptosphaeria millefolii,272658,Leptosphaeria,,"Cooke, William Bridge","Cooke, V.G.",7/10/46,1946,7,10,191,,on Lupinus obtusilobus,United States,California,Siskiyou,Mt. Shasta,"in the vicinity of Horse Camp, 7800 ft.",41.37252,-122.23153,2377,,https://www.mycoportal.org/portal/collections/individual/index.php?occid=4389690
4389696,Fungi|Ascomycota|Pezizomycotina|Dothideomycetes|Pleosporomycetidae|Pleosporales|Leptosphaeriaceae|Leptosphaeria,Fungi,Ascomycota,Dothideomycetes,Pleosporales,Phaeosphaeriaceae,Leptosphaeria vagans,273160,Leptosphaeria,,"Sprague, R.","Cooke, W.B.",8/17/37,1937,8,17,229,,on Trisetum spicatum,United States,California,Siskiyou,Mt. Shasta,South Gate,41.365928,-122.171961,2438,,https://www.mycoportal.org/portal/collections/individual/index.php?occid=4389696
4389700,Fungi|Ascomycota|Pezizomycotina|Dothideomycetes|Pleosporomycetidae|Pleosporales|Leptosphaeriaceae|Leptosphaeria,Fungi,Ascomycota,Dothideomycetes,Pleosporales,Phaeosphaeriaceae,Leptosphaeria vagans,273160,Leptosphaeria,,"Sprague, R.",,7/23/37,1937,7,23,204,,on Carex sp.,United States,California,Siskiyou,Mt. Shasta,Along the Sisson Southern Trail,41.339569,-122.287735,1981,,https://www.mycoportal.org/portal/collections/individual/index.php?occid=4389700
4389702,Fungi|Ascomycota|Pezizomycotina|Dothideomycetes|Pleosporomycetidae|Pleosporales|Leptosphaeriaceae|Leptosphaeria,Fungi,Ascomycota,Dothideomycetes,Pleosporales,Phaeosphaeriaceae,Leptosphaeria vagans,273160,Leptosphaeria,,"Sprague, R.",,6/24/37,1937,6,24,175,,on Agrostis sp.,United States,California,Siskiyou,Mt. Shasta,Horse Camp,41.37252,-122.23153,2438,,https://www.mycoportal.org/portal/collections/individual/index.php?occid=4389702
4389706,Fungi|Ascomycota|Pezizomycotina|Dothideomycetes|Pleosporomycetidae|Pleosporales|Leptosphaeriaceae|Leptosphaeria,Fungi,Ascomycota,Dothideomycetes,Pleosporales,Phaeosphaeriaceae,Leptosphaeria vagans,273160,Leptosphaeria,,"Sprague, R.",,7/28/37,1937,7,28,209,On dead leaves at base of plants scattered through lava ridges,on Trisetum spicatum,United States,California,Siskiyou,Mt. Shasta,Lava ridges above Horse Camp,41.37252,-122.23153,2515,,https://www.mycoportal.org/portal/collections/individual/index.php?occid=4389706
4389708,Fungi|Ascomycota|Pezizomycotina|Dothideomycetes|Pleosporomycetidae|Pleosporales|Leptosphaeriaceae|Leptosphaeria,Fungi,Ascomycota,Dothideomycetes,Pleosporales,Phaeosphaeriaceae,Leptosphaeria vagans,273160,Leptosphaeria,,"Sprague, R.","Cooke, W.B.",6/24/37,1937,6,24,175,,on Phleum alpinum,United States,California,Siskiyou,Mt. Shasta,Horse Camp,41.37252,-122.23153,2438,,https://www.mycoportal.org/portal/collections/individual/index.php?occid=4389708
4389710,Fungi|Ascomycota|Pezizomycotina|Dothideomycetes|Pleosporomycetidae|Pleosporales|Leptosphaeriaceae|Leptosphaeria,Fungi,Ascomycota,Dothideomycetes,Pleosporales,Phaeosphaeriaceae,Leptosphaeria vagans,273160,Leptosphaeria,,"Cooke, William Bridge",,6/24/37,1937,6,24,175,,on Phleum alpinum,United States,California,Siskiyou,Mt. Shasta,Mt. Shasta,41.40932,-122.195009,2438,,https://www.mycoportal.org/portal/collections/individual/index.php?occid=4389710
4389716,Fungi|Basidiomycota|Agaricomycotina|Agaricomycetes|Agaricomycetidae|Polyporales|Polyporaceae|Fomes,Fungi,Basidiomycota,Agaricomycetes,Polyporales,Ganodermataceae,Fomes applanatus,220751,Fomes,,"Beckman, J.M.",,10/11/34,1934,10,11,284,,dead tree trunks,United States,Ohio,Hamilton,Cincinnati,"Kroger Hills, ravine behind Vine St. cemetery",39.150157,-84.32093,,,https://www.mycoportal.org/portal/collections/individual/index.php?occid=4389716
4389723,Fungi|Basidiomycota|Agaricomycotina|Agaricomycetes|Agaricomycetidae|Polyporales|Fomitopsidaceae|Daedalea,Fungi,Basidiomycota,Agaricomycetes,Polyporales,Polyporaceae,Daedalea confragosa,164350,Daedalea,,"Lillick, Lois",,1933-10-00,1933,10,0,,,,United States,Ohio,Hamilton,Cincinnati,Fairmount,39.127837,-84.553555,,,https://www.mycoportal.org/portal/collections/individual/index.php?occid=4389723
4389727,Fungi|Basidiomycota|Agaricomycotina|Agaricomycetes|Agaricomycetidae|Polyporales|Polyporaceae|Fomes,Fungi,Basidiomycota,Agaricomycetes,Polyporales,Ganodermataceae,Fomes applanatus,220751,Fomes,,"Kaps, C.",,1934-10-00,1934,10,0,,,,United States,Ohio,Brown,,"Brown County, Ohio",38.934048,-83.867428,,,https://www.mycoportal.org/portal/collections/individual/index.php?occid=4389727
4389728,Fungi|Basidiomycota|Agaricomycotina|Agaricomycetes|Agaricomycetidae|Polyporales|Polyporaceae,Fungi,Basidiomycota,Agaricomycetes,Polyporales,Polyporaceae,Fomes,14432,Fomes,,"Fulford, Margaret H.",,10/4/29,1929,10,4,277,,on tree,United States,Ohio,Hamilton,Cincinnati,Harris M. Benedict Botanical Preserve (Johnson Nature Preserve),39.261725,-84.353273,,,https://www.mycoportal.org/portal/collections/individual/index.php?occid=4389728
4389730,Fungi|Basidiomycota|Agaricomycotina|Agaricomycetes|Agaricomycetidae|Polyporales|Polyporaceae|Fomes,Fungi,Basidiomycota,Agaricomycetes,Polyporales,Hymenochaetaceae,Fomes connatus,220827,Fomes,,"Kaps, C.",,10/5/34,1934,10,5,278,,,United States,Ohio,Brown,Locest Ridge,Locust Ridge,38.99201,-84.007154,,,https://www.mycoportal.org/portal/collections/individual/index.php?occid=4389730
4389731,Fungi|Basidiomycota|Agaricomycotina|Agaricomycetes|Agaricomycetidae|Polyporales|Polyporaceae|Fomes,Fungi,Basidiomycota,Agaricomycetes,Polyporales,Ganodermataceae,Fomes applanatus,220751,Fomes,,"Murphy, J.",,10/11/34,1934,10,11,284,,bark of tree,United States,Ohio,Hamilton,Cincinnati,Kroger Hills,39.150157,-84.32093,,,https://www.mycoportal.org/portal/collections/individual/index.php?occid=4389731
4389732,Fungi|Basidiomycota|Agaricomycotina|Agaricomycetes|Agaricomycetidae|Polyporales|Polyporaceae|Fomes,Fungi,Basidiomycota,Agaricomycetes,Polyporales,Hymenochaetaceae,Fomes everhartii,220878,Fomes,,"Cooke, William Bridge",,3/10/36,1936,3,10,70,,on Crataegus sp.,United States,Ohio,Hamilton,Sycamore Creek,"South Fork, Sycamore Creek",39.247559,-84.322239,,,https://www.mycoportal.org/portal/collections/individual/index.php?occid=4389732
4389735,Fungi|Basidiomycota|Agaricomycotina|Agaricomycetes|Agaricomycetidae|Polyporales|Fomitopsidaceae|Daedalea,Fungi,Basidiomycota,Agaricomycetes,Polyporales,Fomitopsidaceae,Daedalea ambigua,164314,Daedalea,,"Cooke, William Bridge",,10/17/35,1935,10,17,290,,,United States,Ohio,Hamilton,Dunlap,Dunlap,39.292279,-84.618002,,,https://www.mycoportal.org/portal/collections/individual/index.php?occid=4389735
4389736,Fungi|Basidiomycota|Agaricomycotina|Agaricomycetes|Agaricomycetidae|Polyporales|Fomitopsidaceae|Daedalea,Fungi,Basidiomycota,Agaricomycetes,Polyporales,Fomitopsidaceae,Daedalea ambigua,164314,Daedalea,,"Cooke, William Bridge",,10/17/35,1935,10,17,290,,,United States,Ohio,Hamilton,Dunlap,Dunlap,39.292279,-84.618002,,,https://www.mycoportal.org/portal/collections/individual/index.php?occid=4389736
4389738,Fungi|Basidiomycota|Agaricomycotina|Agaricomycetes|Agaricomycetidae|Polyporales|Polyporaceae|Fomes,Fungi,Basidiomycota,Agaricomycetes,Polyporales,Ganodermataceae,Fomes applanatus,220751,Fomes,,"Cooke, William Bridge",,10/10/35,1935,10,10,283,,,United States,Ohio,Clermont,Mt. Carmel,Mt. Carmel,39.105894,-84.304104,,,https://www.mycoportal.org/portal/collections/individual/index.php?occid=4389738
4389739,Fungi|Basidiomycota|Agaricomycotina|Agaricomycetes|Agaricomycetidae|Polyporales|Polyporaceae|Fomes,Fungi,Basidiomycota,Agaricomycetes,Polyporales,Polyporaceae,Fomes fraxinophilus,220895,Fomes,,"Cooke, William Bridge",,2/29/36,1936,2,29,60,,,United States,Ohio,Clermont,,Alpine Road,39.047433,-84.151918,,,https://www.mycoportal.org/portal/collections/individual/index.php?occid=4389739
4389740,Fungi|Basidiomycota|Agaricomycotina|Agaricomycetes|Agaricomycetidae|Polyporales|Polyporaceae|Fomes,Fungi,Basidiomycota,Agaricomycetes,Polyporales,Ganodermataceae,Fomes applanatus,220751,Fomes,,"Cooke, William Bridge",,11/30/35,1935,11,30,334,,,United States,Ohio,Clermont,Modest,Modest Uplands,39.193117,-84.107156,,,https://www.mycoportal.org/portal/collections/individual/index.php?occid=4389740
4389741,Fungi|Basidiomycota|Agaricomycotina|Agaricomycetes|Agaricomycetidae|Polyporales|Fomitopsidaceae|Daedalea,Fungi,Basidiomycota,Agaricomycetes,Polyporales,Fomitopsidaceae,Daedalea ambigua,164314,Daedalea,,"Cooke, William Bridge",,10/17/35,1935,10,17,290,,,United States,Ohio,Hamilton,Dunlap,Dunlap,39.292279,-84.618002,,,https://www.mycoportal.org/portal/collections/individual/index.php?occid=4389741
4389745,Fungi|Ascomycota|Pezizomycotina|Sartorya,Fungi,Ascomycota,,,Trichocomaceae,Sartorya fumigata,414549,Sartorya,,"Cooke, William Bridge",,1945-00-00,1945,0,0,,,isolated from asphalt coated paper,United States,Georgia,Fulton,Atlanta,Atlanta,33.748995,-84.387982,,,https://www.mycoportal.org/portal/collections/individual/index.php?occid=4389745
4389747,Fungi|Ascomycota|Pezizomycotina|Eurotiomycetes|Eurotiomycetidae|Eurotiales|Trichocomaceae|Diplostephanus,Fungi,Ascomycota,Eurotiomycetes,Eurotiales,Trichocomaceae,Diplostephanus nidulans,175462,Diplostephanus,,"Reese, E.T.",,11/17/44,1944,11,17,322,Isolated from cotton rope in New Guinea,Grows well on potato dextrose agar,Papua New Guinea,,,,,9999.99,9999.99,,,https://www.mycoportal.org/portal/collections/individual/index.php?occid=4389747
4389748,Fungi|Ascomycota|Pezizomycotina|Sordariomycetes|Sordariomycetidae|Sordariales|Chaetomiaceae|Thielavia,Fungi,Ascomycota,Sordariomycetes,Sordariales,Chaetomiaceae,Thielavia sepedonium,540181,Thielavia,,s.n.,,1944-00-00,1944,0,0,,Isolated from tent rope from India,Grows well on potato dextrose agar and cellulose substrates,India,,,,,9999.99,9999.99,,,https://www.mycoportal.org/portal/collections/individual/index.php?occid=4389748
4389750,Fungi|Ascomycota|Pezizomycotina|Dothideomycetes|Dothideomycetidae|Capnodiales|Capnodiaceae|Scorias,Fungi,Ascomycota,Dothideomycetes,Capnodiales,Capnodiaceae,Scorias spongiosa,189108,Scorias,,"Cooke, William Bridge","Cooke, V.G.",5/6/45,1945,5,6,126,common on lower branches of grove of beeches,on Fagus grandifolia,United States,Virginia,Prince William,Manassas,"Ravenswood, near Manassas",38.750949,-77.475267,,,https://www.mycoportal.org/portal/collections/individual/index.php?occid=4389750
4389751,Fungi|Ascomycota|Pezizomycotina|Dothideomycetes|Dothideomycetidae|Capnodiales|Euantennariaceae|Aithalomyces,Fungi,Ascomycota,Dothideomycetes,Capnodiales,Euantennariaceae,Aithalomyces rhododendri,92815,Aithalomyces,,"Cooke, William Bridge",,8/23/42,1942,8,23,235,,on Arctostaphylos sensitiva,United States,California,Marin,Mt. Tamalpais,Along Cascade Trail above Mill Valley on southeast side of Mt. Tamalpais,37.927425,-122.591924,,,https://www.mycoportal.org/portal/collections/individual/index.php?occid=4389751
4389753,Fungi|Ascomycota|Pezizomycotina|Dothideomycetes|Pleosporomycetidae|Pleosporales|Venturiaceae|Rhizogene,Fungi,Ascomycota,Dothideomycetes,Pleosporales,Venturiaceae,Rhizogene symphoricarpi,312834,Rhizogene,,"Tracy, J.P.",,8/7/36,1936,8,7,220,,on Symphoricarpos mollis,United States,California,Humboldt,Trinity,Trinity Summit,40.979584,-122.703809,1524,,https://www.mycoportal.org/portal/collections/individual/index.php?occid=4389753
4389755,Fungi|Ascomycota|Pezizomycotina|Dothideomycetes|Dothideomycetidae|Parodiopsidaceae|Stomatogene,Fungi,Ascomycota,Dothideomycetes,,Parodiopsidaceae,Stomatogene agaves,189560,Stomatogene,,"Parks, H.E.",,1929-02-00,1929,2,0,,,on Yucca whipplei,United States,California,San Diego,La Jolla,La Jolla,32.84727,-117.274204,91,,https://www.mycoportal.org/portal/collections/individual/index.php?occid=4389755
4389756,Fungi|Ascomycota|Pezizomycotina|Dothideomycetes|Dothideomycetidae|Parodiopsidaceae|Stomatogene,Fungi,Ascomycota,Dothideomycetes,,Parodiopsidaceae,Stomatogene agaves,189560,Stomatogene,,"Parks, H.E.",,2/17/29,1929,2,17,48,,on Yucca mohavensis,United States,California,San Diego,Camp Kearny,Camp Kearny,38.002145,-120.137131,122,,https://www.mycoportal.org/portal/collections/individual/index.php?occid=4389756
4389764,Fungi|Ascomycota|Pezizomycotina|Dothideomycetes|Meliolomycetidae|Meliolales|Meliolaceae|Meliola,Fungi,Ascomycota,Dothideomycetes,Meliolales,Meliolaceae,Meliola mangiferae,287951,Meliola,,"Earle, F.S.",,1928-10-00,1928,10,0,,,on mango,Jamaica,,,Castleton,Castleton,18.173607,-76.821693,,,https://www.mycoportal.org/portal/collections/individual/index.php?occid=4389764
4389768,Fungi|Ascomycota|Pezizomycotina|Dothideomycetes|Meliolomycetidae|Meliolales|Meliolaceae|Meliola,Fungi,Ascomycota,Dothideomycetes,Meliolales,Meliolaceae,Meliola amphitricha,286799,Meliola,,"Dacy, S.W.",,1897-10-13,1897,10,13,286,,on Cladium effusum,United States,Mississippi,Harrison,Biloxi,Biloxi,30.396032,-88.885308,,,https://www.mycoportal.org/portal/collections/individual/index.php?occid=4389768
4389833,Fungi|Ascomycota|Pezizomycotina|Dothideomycetes|Dothideomycetidae|Parodiopsidaceae|Dimerium,Fungi,Ascomycota,Dothideomycetes,,Antennulariellaceae,Dimerium alpinum,172696,Dimerium,,"Cooke, William Bridge","Cooke, V.G.",7/30/46,1946,7,30,211,,on Pentstemon menziesii var. davidsonii,United States,California,Siskiyou,Mt. Shasta,West-facing slopes above timberline above the Shasta Alpine Lodge at Horse Camp,41.37252,-122.23153,2515,,https://www.mycoportal.org/portal/collections/individual/index.php?occid=4389833
4389835,Fungi|Ascomycota|Pezizomycotina|Dothideomycetes|Dothideomycetidae|Parodiopsidaceae|Dimerium,Fungi,Ascomycota,Dothideomycetes,,Venturiaceae,Dimerium juniperi,172746,Dimerium,,"Cooke, William Bridge","Cooke, V.G.",9/11/46,1946,9,11,254,,on Juniperus californica var. utahensis,United States,Oregon,Wasco,,west side of U.S. Highway 97 near the top of Cow Canyon Grade,44.838457,-120.931988,,,https://www.mycoportal.org/portal/collections/individual/index.php?occid=4389835
4390095,Fungi|Ascomycota|Pezizomycotina|Leotiomycetes|Leotiomycetidae|Erysiphales|Erysiphaceae|Uncinula,Fungi,Ascomycota,Leotiomycetes,Erysiphales,Erysiphaceae,Uncinula salicis,550730,Uncinula,,"Cooke, William Bridge","Cooke, V.G.",9/30/50,1950,9,30,273,In a thicket in a marshy place,on Salix sp.,United States,Washington,Columbia,,Lewis and Clark Trail State Park,46.288196,-118.07189,,,https://www.mycoportal.org/portal/collections/individual/index.php?occid=4390095
4390097,Fungi|Ascomycota|Pezizomycotina|Leotiomycetes|Leotiomycetidae|Erysiphales|Erysiphaceae|Uncinula|Uncinula salicis,Fungi,Ascomycota,Leotiomycetes,Erysiphales,Erysiphaceae,Uncinula salicis f. salicis,613912,Uncinula,,"Smarods, Julijs",,9/5/37,1937,9,5,248,,on Salix caprea,Latvia,Zemgale,Jelgava,Ozolnieki,Ozolnieki,56.689865,23.776097,,,https://www.mycoportal.org/portal/collections/individual/index.php?occid=4390097
4390098,Fungi|Ascomycota|Pezizomycotina|Leotiomycetes|Leotiomycetidae|Erysiphales|Erysiphaceae|Uncinula,Fungi,Ascomycota,Leotiomycetes,Erysiphales,Erysiphaceae,Uncinula shiraiana,550738,Uncinula,,"Kusano, S.",,1899-10-26,1899,10,26,299,,on Celtis sinensis,Japan,Kant?,Honshu,Tokyo,Tokyo Botanical Gardens,35.705494,139.749157,,,https://www.mycoportal.org/portal/collections/individual/index.php?occid=4390098
4390100,Fungi|Ascomycota|Pezizomycotina|Leotiomycetes|Leotiomycetidae|Erysiphales|Erysiphaceae|Uncinula,Fungi,Ascomycota,Leotiomycetes,Erysiphales,Erysiphaceae,Uncinula circinata,550638,Uncinula,,"Aiken, Walter H.",,1897-09-20,1897,9,20,263,,on Acer saccharum,United States,Ohio,Hamilton,Cincinnati,College Hill,39.20228,-84.547166,,,https://www.mycoportal.org/portal/collections/individual/index.php?occid=4390100
4390101,Fungi|Ascomycota|Pezizomycotina|Leotiomycetes|Leotiomycetidae|Erysiphales|Erysiphaceae|Uncinula,Fungi,Ascomycota,Leotiomycetes,Erysiphales,Erysiphaceae,Uncinula circinata,550638,Uncinula,,"Earle, F.S.","Baker, C.F.",1897-10-21,1897,10,21,294,,on Acer rubrum,United States,Alabama,Lee,Auburn,Auburn,32.609857,-85.480782,,,https://www.mycoportal.org/portal/collections/individual/index.php?occid=4390101
4390103,Fungi|Ascomycota|Pezizomycotina|Leotiomycetes|Leotiomycetidae|Erysiphales|Erysiphaceae|Uncinula,Fungi,Ascomycota,Leotiomycetes,Erysiphales,Erysiphaceae,Uncinula salicis,550730,Uncinula,,s.n.,,1897-10-00,1897,10,0,,,on Salix nipponica,Japan,Kant?,Honshu,Tokyo,Tokyo Botanical Gardens,35.685,139.751389,,,https://www.mycoportal.org/portal/collections/individual/index.php?occid=4390103
4390104,Fungi|Ascomycota|Pezizomycotina|Leotiomycetes|Leotiomycetidae|Erysiphales|Erysiphaceae|Uncinula,Fungi,Ascomycota,Leotiomycetes,Erysiphales,Erysiphaceae,Uncinula salicis,550730,Uncinula,,"Cooke, William Bridge",,9/30/38,1938,9,30,273,,on Salix sp. (water leaves),United States,Oregon,Marion,Scio,Scio,44.704844,-122.849256,,,https://www.mycoportal.org/portal/collections/individual/index.php?occid=4390104
4390111,Fungi|Ascomycota|Pezizomycotina|Leotiomycetes|Leotiomycetidae|Erysiphales|Erysiphaceae|Uncinula,Fungi,Ascomycota,Leotiomycetes,Erysiphales,Erysiphaceae,Uncinula necator,550700,Uncinula,,"Aiken, Walter H.",,9/16/00,1900,9,16,259,,on Ampelopsis quinquefolia,United States,Ohio,Hamilton,Cincinnati,"Cincinnati, Walnut Hills",39.127004,-84.484109,,,https://www.mycoportal.org/portal/collections/individual/index.php?occid=4390111
4390112,Fungi|Ascomycota|Pezizomycotina|Leotiomycetes|Leotiomycetidae|Erysiphales|Erysiphaceae|Uncinula,Fungi,Ascomycota,Leotiomycetes,Erysiphales,Erysiphaceae,Uncinula clandestina,550639,Uncinula,,"Kusano, S.",,1899-10-11,1899,10,11,284,,on Ulmus campestris var. vulgaris,Japan,Kant?,Honshu,Tokyo,Tokyo Botanical Gardens,35.685,139.751389,,,https://www.mycoportal.org/portal/collections/individual/index.php?occid=4390112
4390113,Fungi|Ascomycota|Pezizomycotina|Leotiomycetes|Leotiomycetidae|Erysiphales|Erysiphaceae|Uncinula,Fungi,Ascomycota,Leotiomycetes,Erysiphales,Erysiphaceae,Uncinula ampelopsidis,550616,Uncinula,,"Kellerman, W.A.",,1884-10-07,1884,10,7,281,,on A. quinquefolia,United States,Kansas,Riley,Manhattan,Manhattan,39.183608,-96.571669,,,https://www.mycoportal.org/portal/collections/individual/index.php?occid=4390113
4390114,Fungi|Ascomycota|Pezizomycotina|Leotiomycetes|Leotiomycetidae|Erysiphales|Erysiphaceae|Uncinula,Fungi,Ascomycota,Leotiomycetes,Erysiphales,Erysiphaceae,Uncinula macrospora,550691,Uncinula,,"Holway, E.W.",,1879-10-00,1879,10,0,,,on leaves of Ulmus,United States,Iowa,Winneshiek,Decorah,Decorah,43.303306,-91.785709,,,https://www.mycoportal.org/portal/collections/individual/index.php?occid=4390114
4390116,Fungi|Ascomycota|Pezizomycotina|Leotiomycetes|Leotiomycetidae|Erysiphales|Erysiphaceae|Uncinula,Fungi,Ascomycota,Leotiomycetes,Erysiphales,Erysiphaceae,Uncinula adunca,550606,Uncinula,,"Holway, E.W.",,1879-10-00,1879,10,0,,,on leaves of Salix sp.,United States,Iowa,Winneshiek,Decorah,Decorah,43.303306,-91.785709,,,https://www.mycoportal.org/portal/collections/individual/index.php?occid=4390116
4390118,Incertae Sedis|Fungi|Ascomycota|Pezizomycotina|Leotiomycetes|Leotiomycetidae|Erysiphales|Erysiphaceae|Sphaerotheca,Fungi,Ascomycota,Leotiomycetes,Erysiphales,Erysiphaceae,Sphaerotheca epilobii,189361,Sphaerotheca,,"Cooke, William Bridge",,8/6/37,1937,8,6,218,,on Epilobium sp.,United States,California,Siskiyou,Mt. Shasta,Wagon Camp,41.321603,-122.25012,1829,,https://www.mycoportal.org/portal/collections/individual/index.php?occid=4390118
4390120,Incertae Sedis|Fungi|Ascomycota|Pezizomycotina|Leotiomycetes|Leotiomycetidae|Erysiphales|Erysiphaceae|Sphaerotheca,Fungi,Ascomycota,Leotiomycetes,Erysiphales,Erysiphaceae,Sphaerotheca epilobii,189361,Sphaerotheca,,"Cooke, William Bridge",,8/24/39,1939,8,24,236,,on Epilobium lactiflorum,United States,California,Siskiyou,Mt. Shasta,Squaw Valley Creek Meadows,41.3685,-122.172746,2438,,https://www.mycoportal.org/portal/collections/individual/index.php?occid=4390120
4390121,Incertae Sedis|Fungi|Ascomycota|Pezizomycotina|Leotiomycetes|Leotiomycetidae|Erysiphales|Erysiphaceae|Sphaerotheca,Fungi,Ascomycota,Leotiomycetes,Erysiphales,Erysiphaceae,Sphaerotheca epilobii,189361,Sphaerotheca,,"Sprague, R.",,8/6/37,1937,8,6,218,,on Epilobium hornemannii,United States,California,Siskiyou,Mt. Shasta,Wagon Camp,41.321603,-122.25012,1737,,https://www.mycoportal.org/portal/collections/individual/index.php?occid=4390121
4390124,Incertae Sedis|Fungi|Ascomycota|Pezizomycotina|Leotiomycetes|Leotiomycetidae|Erysiphales|Erysiphaceae|Sphaerotheca,Fungi,Ascomycota,Leotiomycetes,Erysiphales,Erysiphaceae,Sphaerotheca humuli,535763,Sphaerotheca,,"Parks, H.E.","Tracy, J.P.",6/27/34,1934,6,27,178,,on Agoseris heterophylla,United States,California,Humboldt,,Grouse Mountain,40.759026,-123.67227,1433,,https://www.mycoportal.org/portal/collections/individual/index.php?occid=4390124
4390127,Incertae Sedis|Fungi|Ascomycota|Pezizomycotina|Leotiomycetes|Leotiomycetidae|Erysiphales|Erysiphaceae|Sphaerotheca,Fungi,Ascomycota,Leotiomycetes,Erysiphales,Erysiphaceae,Sphaerotheca humuli,535763,Sphaerotheca,,"Tracy, J.P.",,8/6/33,1933,8,6,218,,on Delphinium trolliifolium,United States,California,Humboldt,,"near Coyote Peak, Bald Hills, east of Orick",41.133762,-123.859411,,,https://www.mycoportal.org/portal/collections/individual/index.php?occid=4390127
4390131,Incertae Sedis|Fungi|Ascomycota|Pezizomycotina|Leotiomycetes|Leotiomycetidae|Erysiphales|Erysiphaceae|Sphaerotheca,Fungi,Ascomycota,Leotiomycetes,Erysiphales,Erysiphaceae,Sphaerotheca humuli,535763,Sphaerotheca,,"Cooke, William Bridge",,9/8/38,1938,9,8,251,,on Viola purpurea,United States,California,Siskiyou,Mt. Shasta,near Squaw Valley Creek,41.3685,-122.172746,2286,,https://www.mycoportal.org/portal/collections/individual/index.php?occid=4390131
4390133,Incertae Sedis|Fungi|Ascomycota|Pezizomycotina|Leotiomycetes|Leotiomycetidae|Erysiphales|Erysiphaceae|Sphaerotheca,Fungi,Ascomycota,Leotiomycetes,Erysiphales,Erysiphaceae,Sphaerotheca humuli,535763,Sphaerotheca,,"Aiken, Walter H.",,1897-07-10,1897,7,10,191,,on Taraxacum officinale,United States,Ohio,Hamilton,Cincinnati,College Hill,39.20228,-84.547166,,,https://www.mycoportal.org/portal/collections/individual/index.php?occid=4390133
4390137,Incertae Sedis|Fungi|Ascomycota|Pezizomycotina|Leotiomycetes|Leotiomycetidae|Erysiphales|Erysiphaceae|Sphaerotheca|Sphaerotheca humuli,Fungi,Ascomycota,Leotiomycetes,Erysiphales,Erysiphaceae,Sphaerotheca humuli var. fuliginea,611858,Sphaerotheca,,"Aiken, Walter H.",,1902-10-00,1902,10,0,,,on Bidens sp.,United States,Ohio,Hamilton,,"Hamilton County, Ohio",39.195531,-84.542775,,,https://www.mycoportal.org/portal/collections/individual/index.php?occid=4390137
4390138,Incertae Sedis|Fungi|Ascomycota|Pezizomycotina|Leotiomycetes|Leotiomycetidae|Erysiphales|Erysiphaceae|Sphaerotheca|Sphaerotheca humuli,Fungi,Ascomycota,Leotiomycetes,Erysiphales,Erysiphaceae,Sphaerotheca humuli var. fuliginea,611858,Sphaerotheca,,"Cooke, William Bridge",,8/24/39,1939,8,24,236,,on Arnica mollis,United States,California,Siskiyou,Mt. Shasta,Squaw Valley Creek,41.3685,-122.172746,2286,2438,https://www.mycoportal.org/portal/collections/individual/index.php?occid=4390138
4390141,Incertae Sedis|Fungi|Ascomycota|Pezizomycotina|Leotiomycetes|Leotiomycetidae|Erysiphales|Erysiphaceae|Sphaerotheca,Fungi,Ascomycota,Leotiomycetes,Erysiphales,Erysiphaceae,Sphaerotheca humuli,535763,Sphaerotheca,,"Cooke, William Bridge",,8/22/39,1939,8,22,234,,on Viola purpurea,United States,California,Siskiyou,Mt. Shasta,"Wagon Camp - Horse Camp Trail, half mile above Wagon Camp",41.37252,-122.23153,1829,,https://www.mycoportal.org/portal/collections/individual/index.php?occid=4390141
4390145,Incertae Sedis|Fungi|Ascomycota|Pezizomycotina|Leotiomycetes|Leotiomycetidae|Erysiphales|Erysiphaceae|Sphaerotheca,Fungi,Ascomycota,Leotiomycetes,Erysiphales,Erysiphaceae,Sphaerotheca humuli,535763,Sphaerotheca,,"Cooke, William Bridge","Cooke, V.G.",8/8/47,1947,8,8,220,,on Epilobium sp.,United States,California,Siskiyou,Mt. Shasta,Sisson Southern Trail Spring,41.339569,-122.287735,1981,,https://www.mycoportal.org/portal/collections/individual/index.php?occid=4390145
4390147,Incertae Sedis|Fungi|Ascomycota|Pezizomycotina|Leotiomycetes|Leotiomycetidae|Erysiphales|Erysiphaceae|Sphaerotheca|Sphaerotheca humuli,Fungi,Ascomycota,Leotiomycetes,Erysiphales,Erysiphaceae,Sphaerotheca humuli var. fuliginea,611858,Sphaerotheca,,"Cooke, William Bridge","Cooke, V.G.",8/15/47,1947,8,15,227,Sierra mixed conifer,on Taraxacum officinale,United States,California,Siskiyou,Mt. Shasta,Wagon Camp,41.321603,-122.25012,1737,,https://www.mycoportal.org/portal/collections/individual/index.php?occid=4390147
4390153,Incertae Sedis|Fungi|Ascomycota|Pezizomycotina|Leotiomycetes|Leotiomycetidae|Erysiphales|Erysiphaceae|Sphaerotheca,Fungi,Ascomycota,Leotiomycetes,Erysiphales,Erysiphaceae,Sphaerotheca phtheirospermi,429762,Sphaerotheca,,"Kusano, S.",,1899-10-08,1899,10,8,281,,on Phteirophermum,Japan,Musashi,,Hachi?ji,Mt. Takao,35.626447,139.24412,,,https://www.mycoportal.org/portal/collections/individual/index.php?occid=4390153
4390156,Incertae Sedis|Fungi|Ascomycota|Pezizomycotina|Leotiomycetes|Leotiomycetidae|Erysiphales|Erysiphaceae|Sphaerotheca,Fungi,Ascomycota,Leotiomycetes,Erysiphales,Erysiphaceae,Sphaerotheca phytoptophila,429763,Sphaerotheca,,"Lloyd, Curtis Gates",,10/31/09,1909,10,31,304,,on Celtis occidentalis (affected by a Phytoptus),United States,Ohio,Hamilton,Cincinnati,College Hill,39.20228,-84.547166,,,https://www.mycoportal.org/portal/collections/individual/index.php?occid=4390156
4390162,Incertae Sedis|Fungi|Ascomycota|Pezizomycotina|Leotiomycetes|Leotiomycetidae|Erysiphales|Erysiphaceae|Sphaerotheca,Fungi,Ascomycota,Leotiomycetes,Erysiphales,Erysiphaceae,Sphaerotheca pannosa,429757,Sphaerotheca,,s.n.,,1876-08-00,1876,8,0,,,,Germany,Saxony-Anhalt,,Halle,Halle,51.481389,11.985556,,,https://www.mycoportal.org/portal/collections/individual/index.php?occid=4390162
4390164,Fungi|Ascomycota|Pezizomycotina|Leotiomycetes|Leotiomycetidae|Erysiphales|Erysiphaceae|Podosphaera,Fungi,Ascomycota,Leotiomycetes,Erysiphales,Erysiphaceae,Podosphaera tridactyla,187713,Podosphaera,,"Yarwood, C.",,10/17/35,1935,10,17,290,,on Prunus armeniaca,United States,California,Contra Costa,San Pablo,San Pablo,37.962146,-122.345526,,,https://www.mycoportal.org/portal/collections/individual/index.php?occid=4390164
4390165,Fungi|Ascomycota|Pezizomycotina|Leotiomycetes|Leotiomycetidae|Erysiphales|Erysiphaceae|Podosphaera,Fungi,Ascomycota,Leotiomycetes,Erysiphales,Erysiphaceae,Podosphaera oxyacanthae,383625,Podosphaera,,"Aiken, Walter H.",,10/25/00,1900,10,25,298,,"on Prunus, cultivated.",United States,Ohio,Hamilton,Cincinnati,College Hill,39.20228,-84.547166,,,https://www.mycoportal.org/portal/collections/individual/index.php?occid=4390165
4390169,Fungi|Ascomycota|Pezizomycotina|Leotiomycetes|Leotiomycetidae|Erysiphales|Erysiphaceae|Phyllactinia,Fungi,Ascomycota,Leotiomycetes,Erysiphales,Erysiphaceae,Phyllactinia suffulta,372625,Phyllactinia,,"Kusano, S.",,1899-11-04,1899,11,4,308,,on Alnus nicana var. glauca,Japan,Honshu,Gunma,Mount My?gi,"Mount My?gi, Gunma, Honshu",36.299696,138.745289,,,https://www.mycoportal.org/portal/collections/individual/index.php?occid=4390169
4390171,Fungi|Ascomycota|Pezizomycotina|Leotiomycetes|Leotiomycetidae|Erysiphales|Erysiphaceae|Phyllactinia,Fungi,Ascomycota,Leotiomycetes,Erysiphales,Erysiphaceae,Phyllactinia suffulta,372625,Phyllactinia,,"Cooke, William Bridge",,10/27/37,1937,10,27,300,,on Philadelphus gordonianus,United States,Oregon,Hood River,Bonneville,Bonneville,45.63595,-121.952026,,,https://www.mycoportal.org/portal/collections/individual/index.php?occid=4390171
4390173,Fungi|Ascomycota|Pezizomycotina|Leotiomycetes|Leotiomycetidae|Erysiphales|Erysiphaceae|Phyllactinia,Fungi,Ascomycota,Leotiomycetes,Erysiphales,Erysiphaceae,Phyllactinia suffulta,372625,Phyllactinia,,"Cooke, William Bridge",,10/27/37,1937,10,27,300,,on Cornus nuttallii,United States,Oregon,Hood River,,Wygant State Park,45.693856,-121.637047,,,https://www.mycoportal.org/portal/collections/individual/index.php?occid=4390173
4390175,Fungi|Ascomycota|Pezizomycotina|Leotiomycetes|Leotiomycetidae|Erysiphales|Erysiphaceae|Phyllactinia,Fungi,Ascomycota,Leotiomycetes,Erysiphales,Erysiphaceae,Phyllactinia corylea,372566,Phyllactinia,,"Kellerman, W.A.",,10/15/04,1904,10,15,289,,on Celastrus scandens,United States,Ohio,Erie,Sandusky,Sandusky,41.44894,-82.70796,,,https://www.mycoportal.org/portal/collections/individual/index.php?occid=4390175
4390178,Fungi|Ascomycota|Pezizomycotina|Leotiomycetes|Leotiomycetidae|Erysiphales|Erysiphaceae|Phyllactinia,Fungi,Ascomycota,Leotiomycetes,Erysiphales,Erysiphaceae,Phyllactinia suffulta,372625,Phyllactinia,,"Kusano, S.",,1899-11-25,1899,11,25,329,,on Alnus japonica,Japan,Kant?,Honshu,Tokyo,Tokyo Botanical Gardens,35.685,139.751389,,,https://www.mycoportal.org/portal/collections/individual/index.php?occid=4390178
4390180,Fungi|Ascomycota|Pezizomycotina|Leotiomycetes|Leotiomycetidae|Erysiphales|Erysiphaceae|Phyllactinia,Fungi,Ascomycota,Leotiomycetes,Erysiphales,Erysiphaceae,Phyllactinia suffulta,372625,Phyllactinia,,s.n.,,1898-11-15,1898,11,15,319,,on Paulowinia tomentosa,Japan,Kant?,Honshu,Tokyo,Ogikubo,35.697776,139.621224,,,https://www.mycoportal.org/portal/collections/individual/index.php?occid=4390180
4390184,Fungi|Ascomycota|Pezizomycotina|Leotiomycetes|Leotiomycetidae|Erysiphales|Erysiphaceae|Microsphaera,Fungi,Ascomycota,Leotiomycetes,Erysiphales,Erysiphaceae,Microsphaera alni,292819,Microsphaera,,"Kellerman, W.A.",,9/15/01,1901,9,15,258,,on Viburnum cassinoides,United States,Ohio,Ottawa,Lakeside,Lakeside,41.537453,-82.765897,,,https://www.mycoportal.org/portal/collections/individual/index.php?occid=4390184
4390185,Fungi|Ascomycota|Pezizomycotina|Leotiomycetes|Leotiomycetidae|Erysiphales|Erysiphaceae|Microsphaera,Fungi,Ascomycota,Leotiomycetes,Erysiphales,Erysiphaceae,Microsphaera alni,292819,Microsphaera,,"Kellerman, W.A.",,9/15/01,1901,9,15,258,,on Viburnum cassinoides,United States,Ohio,Ottawa,Lakeside,Lakeside,41.543106,-82.749074,,,https://www.mycoportal.org/portal/collections/individual/index.php?occid=4390185
4390190,Fungi|Ascomycota|Pezizomycotina|Leotiomycetes|Leotiomycetidae|Erysiphales|Erysiphaceae|Microsphaera,Fungi,Ascomycota,Leotiomycetes,Erysiphales,Erysiphaceae,Microsphaera diffusa,292863,Microsphaera,,"Tracy, J.P.",,9/3/32,1932,9,3,247,,on Vicia gigantea,United States,California,Humboldt,Table Bluff,Table Bluff,40.683183,-124.234504,,,https://www.mycoportal.org/portal/collections/individual/index.php?occid=4390190
4390192,Fungi|Ascomycota|Pezizomycotina|Leotiomycetes|Leotiomycetidae|Erysiphales|Erysiphaceae|Microsphaera,Fungi,Ascomycota,Leotiomycetes,Erysiphales,Erysiphaceae,Microsphaera diffusa,292863,Microsphaera,,"Aiken, Walter H.",,1899-08-20,1899,8,20,232,,on Symphoricarpos orbiculatus,United States,Ohio,Hamilton,Cincinnati,Cincinnati,39.162004,-84.456886,,,https://www.mycoportal.org/portal/collections/individual/index.php?occid=4390192
4390195,Fungi|Ascomycota|Pezizomycotina|Leotiomycetes|Leotiomycetidae|Erysiphales|Erysiphaceae|Microsphaera,Fungi,Ascomycota,Leotiomycetes,Erysiphales,Erysiphaceae,Microsphaera pulchra,292953,Microsphaera,,"Jackson, H.",,1879-10-00,1879,10,0,,,on leaves of Cornus sp.,United States,Pennsylvania,Chester,West Chester,West Chester,39.960664,-75.605488,,,https://www.mycoportal.org/portal/collections/individual/index.php?occid=4390195
4390201,Fungi|Ascomycota|Pezizomycotina|Leotiomycetes|Leotiomycetidae|Erysiphales|Erysiphaceae|Microsphaera,Fungi,Ascomycota,Leotiomycetes,Erysiphales,Erysiphaceae,Microsphaera alni,292819,Microsphaera,,"Aiken, Walter H.",,1898-09-05,1898,9,5,248,,on Quercus sp.,United States,Ohio,Hamilton,Cincinnati,College Hill,39.20228,-84.547166,,,https://www.mycoportal.org/portal/collections/individual/index.php?occid=4390201
4390203,Fungi|Ascomycota|Pezizomycotina|Leotiomycetes|Leotiomycetidae|Erysiphales|Erysiphaceae|Microsphaera,Fungi,Ascomycota,Leotiomycetes,Erysiphales,Erysiphaceae,Microsphaera alni,292819,Microsphaera,,"Aiken, Walter H.",,1898-09-05,1898,9,5,248,,on Quercus sp.,United States,Ohio,Hamilton,Cincinnati,College Hill,39.20228,-84.547166,,,https://www.mycoportal.org/portal/collections/individual/index.php?occid=4390203
4390204,Fungi|Ascomycota|Pezizomycotina|Leotiomycetes|Leotiomycetidae|Erysiphales|Erysiphaceae|Microsphaera,Fungi,Ascomycota,Leotiomycetes,Erysiphales,Erysiphaceae,Microsphaera alni,292819,Microsphaera,,"Aiken, Walter H.",,1897-09-15,1897,9,15,258,,on cultivated Syringa sp.,United States,Ohio,Hamilton,Cincinnati,College Hill,39.20228,-84.547166,,,https://www.mycoportal.org/portal/collections/individual/index.php?occid=4390204
4390205,Fungi|Ascomycota|Pezizomycotina|Leotiomycetes|Leotiomycetidae|Erysiphales|Erysiphaceae|Microsphaera,Fungi,Ascomycota,Leotiomycetes,Erysiphales,Erysiphaceae,Microsphaera alni,292819,Microsphaera,,"Aiken, Walter H.",,1897-10-10,1897,10,10,283,,on Platanus occidentalis,United States,Ohio,Hamilton,,"Hamilton County, Ohio",39.195531,-84.542775,,,https://www.mycoportal.org/portal/collections/individual/index.php?occid=4390205
4390207,Fungi|Ascomycota|Pezizomycotina|Leotiomycetes|Leotiomycetidae|Erysiphales|Erysiphaceae|Microsphaera,Fungi,Ascomycota,Leotiomycetes,Erysiphales,Erysiphaceae,Microsphaera alni,292819,Microsphaera,,"Aiken, Walter H.",,1897-10-00,1897,10,0,,,on Platanus occidentalis,United States,Ohio,Hamilton,Cincinnati,College Hill,39.162004,-84.456886,,,https://www.mycoportal.org/portal/collections/individual/index.php?occid=4390207
4390210,Fungi|Ascomycota|Pezizomycotina|Leotiomycetes|Leotiomycetidae|Erysiphales|Erysiphaceae|Erysiphe,Fungi,Ascomycota,Leotiomycetes,Erysiphales,Erysiphaceae,Erysiphe communis,216779,Erysiphe,,"Cooke, William Bridge","Cooke, V.G.",8/26/49,1949,8,26,238,,on Lupinus obtusilobus,United States,California,Siskiyou,Mt. Shasta,"Along the Bolam Road, north side of Mount Shasta",41.488171,-122.2333,1829,2134,https://www.mycoportal.org/portal/collections/individual/index.php?occid=4390210
4390215,Fungi|Ascomycota|Pezizomycotina|Leotiomycetes|Leotiomycetidae|Erysiphales|Erysiphaceae|Erysiphe,Fungi,Ascomycota,Leotiomycetes,Erysiphales,Erysiphaceae,Erysiphe graminis,216884,Erysiphe,,"Cooke, William Bridge",,7/7/39,1939,7,7,188,,on Agrostis exarata,United States,California,Siskiyou,Mt. Shasta,Bear Springs,41.2996,-122.300991,1524,,https://www.mycoportal.org/portal/collections/individual/index.php?occid=4390215
4390216,Fungi|Ascomycota|Pezizomycotina|Leotiomycetes|Leotiomycetidae|Erysiphales|Erysiphaceae|Erysiphe,Fungi,Ascomycota,Leotiomycetes,Erysiphales,Erysiphaceae,Erysiphe graminis,216884,Erysiphe,,"Sprague, R.",,8/20/39,1939,8,20,232,,on Sitanion hystrix,United States,California,Siskiyou,Mt. Shasta,"Shasta Alpine Lodge at Horse Camp, Upper Canadian Zone.",41.37252,-122.23153,1829,,https://www.mycoportal.org/portal/collections/individual/index.php?occid=4390216
4390217,Fungi|Ascomycota|Pezizomycotina|Leotiomycetes|Leotiomycetidae|Erysiphales|Erysiphaceae|Erysiphe,Fungi,Ascomycota,Leotiomycetes,Erysiphales,Erysiphaceae,Erysiphe graminis,216884,Erysiphe,,"Sprague, R.",,8/20/39,1939,8,20,232,,on Poa pratensis,United States,California,Siskiyou,Mt. Shasta,"Shasta Alpine Lodge at Horse Camp, Upper Canadian Zone.",41.37252,-122.23153,2438,,https://www.mycoportal.org/portal/collections/individual/index.php?occid=4390217
4390219,Fungi|Ascomycota|Pezizomycotina|Leotiomycetes|Leotiomycetidae|Erysiphales|Erysiphaceae|Erysiphe,Fungi,Ascomycota,Leotiomycetes,Erysiphales,Erysiphaceae,Erysiphe graminis,216884,Erysiphe,,"Cooke, William Bridge","Cooke, V.G.",9/4/46,1946,9,4,247,,on Sitanion hystrix,United States,California,Siskiyou,Mt. Shasta,Horse Camp,41.1665,-122.2514,2438,,https://www.mycoportal.org/portal/collections/individual/index.php?occid=4390219
4390220,Fungi|Ascomycota|Pezizomycotina|Leotiomycetes|Leotiomycetidae|Erysiphales|Erysiphaceae|Erysiphe,Fungi,Ascomycota,Leotiomycetes,Erysiphales,Erysiphaceae,Erysiphe graminis,216884,Erysiphe,,"Cooke, William Bridge","Cooke, V.G.",9/4/46,1946,9,4,247,,on Poa pratensis,United States,California,Siskiyou,Mt. Shasta,Horse Camp,41.642941,-121.156923,2438,,https://www.mycoportal.org/portal/collections/individual/index.php?occid=4390220
4390224,Fungi|Ascomycota|Pezizomycotina|Leotiomycetes|Leotiomycetidae|Erysiphales|Erysiphaceae|Erysiphe,Fungi,Ascomycota,Leotiomycetes,Erysiphales,Erysiphaceae,Erysiphe graminis,216884,Erysiphe,,"Kellerman, W.A.",,1889-05-07,1889,5,7,127,,Early stage of perithecia on Triticum vulgaris,United States,Kansas,Riley,Manhattan,Manhattan,39.183608,-96.571669,,,https://www.mycoportal.org/portal/collections/individual/index.php?occid=4390224
4390225,Fungi|Ascomycota|Pezizomycotina|Leotiomycetes|Leotiomycetidae|Erysiphales|Erysiphaceae|Erysiphe,Fungi,Ascomycota,Leotiomycetes,Erysiphales,Erysiphaceae,Erysiphe graminis,216884,Erysiphe,,"Aiken, Walter H.",,1897-06-16,1897,6,16,167,,on Poa pratensis,United States,Ohio,Hamilton,Cincinnati,College Hill,39.20228,-84.547166,,,https://www.mycoportal.org/portal/collections/individual/index.php?occid=4390225
4390226,Fungi|Ascomycota|Pezizomycotina|Leotiomycetes|Leotiomycetidae|Erysiphales|Erysiphaceae|Erysiphe,Fungi,Ascomycota,Leotiomycetes,Erysiphales,Erysiphaceae,Erysiphe graminis,216884,Erysiphe,,Best,"Sprague, R.",4/20/37,1937,4,20,110,,on Poa secunda,United States,Oregon,Wallowa,,Imnaha Canyon,45.559323,-116.833207,,,https://www.mycoportal.org/portal/collections/individual/index.php?occid=4390226
4390228,Fungi|Ascomycota|Pezizomycotina|Leotiomycetes|Leotiomycetidae|Erysiphales|Erysiphaceae|Erysiphe,Fungi,Ascomycota,Leotiomycetes,Erysiphales,Erysiphaceae,Erysiphe graminis,216884,Erysiphe,,"Sprague, R.",,7/5/37,1937,7,5,186,,on Elymus condensatus,United States,Washington,Thurston,Tumwater,Tumwater,47.007319,-122.909306,,,https://www.mycoportal.org/portal/collections/individual/index.php?occid=4390228
4390229,Fungi|Ascomycota|Pezizomycotina|Leotiomycetes|Leotiomycetidae|Erysiphales|Erysiphaceae|Erysiphe,Fungi,Ascomycota,Leotiomycetes,Erysiphales,Erysiphaceae,Erysiphe lamprocarpa,216937,Erysiphe,,"Holway, E.W.",,1880-08-00,1880,8,0,,,On leaves of Verbena urticifolia; on leaves of Phlox,United States,Iowa,Winneshiek,Decorah,Decorah,43.303306,-91.785709,,,https://www.mycoportal.org/portal/collections/individual/index.php?occid=4390229
4390231,Fungi|Ascomycota|Pezizomycotina|Leotiomycetes|Leotiomycetidae|Erysiphales|Erysiphaceae|Erysiphe,Fungi,Ascomycota,Leotiomycetes,Erysiphales,Erysiphaceae,Erysiphe lamprocarpa,216937,Erysiphe,,"Tauscher, Gyula",,1870-07-10,1870,7,10,191,,Parasitic on leaves of Leonorus cardiaca,Hungary,,,Pest,"Pest county, Csepel, jusula(?) danubialis, prope pagum Sziget ____",47.373535,19.049874,,,https://www.mycoportal.org/portal/collections/individual/index.php?occid=4390231
4390232,Fungi|Ascomycota|Pezizomycotina|Leotiomycetes|Leotiomycetidae|Erysiphales|Erysiphaceae|Erysiphe,Fungi,Ascomycota,Leotiomycetes,Erysiphales,Erysiphaceae,Erysiphe polygoni,217061,Erysiphe,,"Cooke, William Bridge",,7/26/39,1939,7,26,207,,on Eriogonum marifolium,United States,California,Siskiyou,Mt. Shasta,near Sisson Southern Trail just below Horse Camp,41.37252,-122.23153,2377,,https://www.mycoportal.org/portal/collections/individual/index.php?occid=4390232
4390233,Fungi|Ascomycota|Pezizomycotina|Leotiomycetes|Leotiomycetidae|Erysiphales|Erysiphaceae|Erysiphe,Fungi,Ascomycota,Leotiomycetes,Erysiphales,Erysiphaceae,Erysiphe polygoni,217061,Erysiphe,,"Cooke, William Bridge",,7/21/39,1939,7,21,202,,on Vicia americana,United States,California,Siskiyou,Mt. Shasta,Above the Municipal Spring above Howard,41.312931,-122.276954,1280,,https://www.mycoportal.org/portal/collections/individual/index.php?occid=4390233
4390234,Fungi|Ascomycota|Pezizomycotina|Leotiomycetes|Leotiomycetidae|Erysiphales|Erysiphaceae|Erysiphe,Fungi,Ascomycota,Leotiomycetes,Erysiphales,Erysiphaceae,Erysiphe polygoni,217061,Erysiphe,,"Cooke, William Bridge",,8/22/47,1947,8,22,234,Shasta Fir woods,on Arabis platysperma,United States,California,Siskiyou,Mt. Shasta,Along Sisson Southern Trail,41.339569,-122.287735,2134,,https://www.mycoportal.org/portal/collections/individual/index.php?occid=4390234
4390236,Fungi|Ascomycota|Pezizomycotina|Leotiomycetes|Leotiomycetidae|Erysiphales|Erysiphaceae|Erysiphe,Fungi,Ascomycota,Leotiomycetes,Erysiphales,Erysiphaceae,Erysiphe polygoni,217061,Erysiphe,,"Brenckle, J.F.",,1908-09-00,1908,9,0,,,on Polygonum aviculare,United States,North Dakota,Lamoure,Kulm,Kulm,46.301914,-98.948162,,,https://www.mycoportal.org/portal/collections/individual/index.php?occid=4390236
4390237,Fungi|Ascomycota|Pezizomycotina|Leotiomycetes|Leotiomycetidae|Erysiphales|Erysiphaceae|Erysiphe,Fungi,Ascomycota,Leotiomycetes,Erysiphales,Erysiphaceae,Erysiphe polygoni,217061,Erysiphe,,"Kellerman, W.A.",,7/24/02,1902,7,24,205,,on Polygonum erectum,United States,Ohio,Jefferson,Fernwood,Fernwood,40.334235,-80.707579,,,https://www.mycoportal.org/portal/collections/individual/index.php?occid=4390237
4390239,Fungi|Ascomycota|Pezizomycotina|Leotiomycetes|Leotiomycetidae|Erysiphales|Erysiphaceae|Erysiphe,Fungi,Ascomycota,Leotiomycetes,Erysiphales,Erysiphaceae,Erysiphe trina,217173,Erysiphe,,"Cooke, William Bridge",,3/15/42,1942,3,15,74,,Leaves,United States,California,Alameda,Berkeley,"Strawberry Canyon, Berkeley",37.871593,-122.272747,,,https://www.mycoportal.org/portal/collections/individual/index.php?occid=4390239
4390305,Fungi|Ascomycota|Pezizomycotina|Leotiomycetes|Leotiomycetidae|Erysiphales|Erysiphaceae|Erysiphe,Fungi,Ascomycota,Leotiomycetes,Erysiphales,Erysiphaceae,Erysiphe cichoracearum,497175,Erysiphe,,"Kelsey, F.D.",,1893-10-21,1893,10,21,294,,on Eupatorium perfoliatum,United States,Ohio,Lorain,Oberlin,Oberlin,41.293939,-82.217379,,,https://www.mycoportal.org/portal/collections/individual/index.php?occid=4390305
4390308,Fungi|Ascomycota|Pezizomycotina|Leotiomycetes|Leotiomycetidae|Erysiphales|Erysiphaceae|Erysiphe,Fungi,Ascomycota,Leotiomycetes,Erysiphales,Erysiphaceae,Erysiphe cichoracearum,497175,Erysiphe,,"Ricksecker, A.E.","Kelsey, F.D.",1894-08-22,1894,8,22,234,,on Actinomeris squarrosa,United States,Ohio,Lorain,Oberlin,Oberlin,41.293939,-82.217379,,,https://www.mycoportal.org/portal/collections/individual/index.php?occid=4390308
4390310,Fungi|Ascomycota|Pezizomycotina|Leotiomycetes|Leotiomycetidae|Erysiphales|Erysiphaceae|Erysiphe,Fungi,Ascomycota,Leotiomycetes,Erysiphales,Erysiphaceae,Erysiphe cichoracearum,497175,Erysiphe,,"Ricksecker, A.E.","Kelsey, F.D.",1894-09-03,1894,9,3,246,,on Chelone glabra,United States,Ohio,Lorain,Oberlin,Oberlin,41.293939,-82.217379,,,https://www.mycoportal.org/portal/collections/individual/index.php?occid=4390310
4390312,Fungi|Ascomycota|Pezizomycotina|Leotiomycetes|Leotiomycetidae|Erysiphales|Erysiphaceae|Erysiphe,Fungi,Ascomycota,Leotiomycetes,Erysiphales,Erysiphaceae,Erysiphe cichoracearum,497175,Erysiphe,,"Kelsey, F.D.",,1894-08-04,1894,8,4,216,,on Helianthus tuberosus,United States,Ohio,Lorain,Oberlin,Oberlin,41.293939,-82.217379,,,https://www.mycoportal.org/portal/collections/individual/index.php?occid=4390312
4390317,Fungi|Ascomycota|Pezizomycotina|Leotiomycetes|Leotiomycetidae|Erysiphales|Erysiphaceae|Erysiphe,Fungi,Ascomycota,Leotiomycetes,Erysiphales,Erysiphaceae,Erysiphe cichoracearum,497175,Erysiphe,,"Kelsey, F.D.",,1892-09-12,1892,9,12,256,,on Artemisia sp.,United States,Montana,Lewis And Clark,Helena,Helena,46.592712,-112.036109,,,https://www.mycoportal.org/portal/collections/individual/index.php?occid=4390317
4390319,Fungi|Ascomycota|Pezizomycotina|Leotiomycetes|Leotiomycetidae|Erysiphales|Erysiphaceae|Erysiphe,Fungi,Ascomycota,Leotiomycetes,Erysiphales,Erysiphaceae,Erysiphe cichoracearum,497175,Erysiphe,,"Kelsey, F.D.",,1889-07-00,1889,7,0,,,on Echinospermum redowskii,United States,Montana,Lewis And Clark,Helena,Helena,46.592712,-112.036109,,,https://www.mycoportal.org/portal/collections/individual/index.php?occid=4390319
4390321,Fungi|Ascomycota|Pezizomycotina|Leotiomycetes|Leotiomycetidae|Erysiphales|Erysiphaceae|Erysiphe,Fungi,Ascomycota,Leotiomycetes,Erysiphales,Erysiphaceae,Erysiphe cichoracearum,497175,Erysiphe,,"Kelsey, F.D.",,1889-07-08,1889,7,8,189,,on Phacelia menziesii,United States,Montana,Lewis And Clark,Silver City,Silver City,46.755493,-112.16973,,,https://www.mycoportal.org/portal/collections/individual/index.php?occid=4390321
4390328,Fungi|Ascomycota|Pezizomycotina|Leotiomycetes|Leotiomycetidae|Erysiphales|Erysiphaceae|Erysiphe,Fungi,Ascomycota,Leotiomycetes,Erysiphales,Erysiphaceae,Erysiphe cichoracearum,497175,Erysiphe,,"Kelsey, F.D.",,1891-09-21,1891,9,21,264,,on Juncus undulatus,United States,Montana,Lewis And Clark,Helena,Helena,46.592712,-112.036109,,,https://www.mycoportal.org/portal/collections/individual/index.php?occid=4390328
4390332,Fungi|Ascomycota|Pezizomycotina|Leotiomycetes|Leotiomycetidae|Erysiphales|Erysiphaceae|Erysiphe,Fungi,Ascomycota,Leotiomycetes,Erysiphales,Erysiphaceae,Erysiphe cichoracearum,497175,Erysiphe,,"Kelsey, F.D.",,1891-09-21,1891,9,21,264,,on Helenium autumnale,United States,Montana,Lewis And Clark,Helena,Helena,46.592712,-112.036109,,,https://www.mycoportal.org/portal/collections/individual/index.php?occid=4390332
4390334,Fungi|Ascomycota|Pezizomycotina|Leotiomycetes|Leotiomycetidae|Erysiphales|Erysiphaceae|Erysiphe,Fungi,Ascomycota,Leotiomycetes,Erysiphales,Erysiphaceae,Erysiphe cichoracearum,497175,Erysiphe,,"Kelsey, F.D.",,1891-09-12,1891,9,12,255,,on Madia glomerata,United States,Montana,Lewis And Clark,Helena,Helena,46.592712,-112.036109,,,https://www.mycoportal.org/portal/collections/individual/index.php?occid=4390334
4390335,Fungi|Ascomycota|Pezizomycotina|Leotiomycetes|Leotiomycetidae|Erysiphales|Erysiphaceae|Erysiphe,Fungi,Ascomycota,Leotiomycetes,Erysiphales,Erysiphaceae,Erysiphe cichoracearum,497175,Erysiphe,,"Kelsey, F.D.",,1891-09-12,1891,9,12,255,,on Stachys palustris,United States,Montana,Lewis And Clark,Helena,Helena,46.592712,-112.036109,,,https://www.mycoportal.org/portal/collections/individual/index.php?occid=4390335
4390340,Fungi|Ascomycota|Pezizomycotina|Leotiomycetes|Leotiomycetidae|Erysiphales|Erysiphaceae|Erysiphe,Fungi,Ascomycota,Leotiomycetes,Erysiphales,Erysiphaceae,Erysiphe cichoracearum,497175,Erysiphe,,"Aiken, Walter H.",,1897-09-10,1897,9,10,253,,on Pilea pumila,United States,Ohio,Hamilton,,"Hamilton County, Ohio",39.195531,-84.542775,,,https://www.mycoportal.org/portal/collections/individual/index.php?occid=4390340
4390342,Fungi|Ascomycota|Pezizomycotina|Leotiomycetes|Leotiomycetidae|Erysiphales|Erysiphaceae|Erysiphe,Fungi,Ascomycota,Leotiomycetes,Erysiphales,Erysiphaceae,Erysiphe cichoracearum,497175,Erysiphe,,"Aiken, Walter H.",,1899-09-20,1899,9,20,263,,on Ambrosia artemisiifolia,United States,Ohio,Hamilton,Cincinnati,College Hill,39.20228,-84.547166,,,https://www.mycoportal.org/portal/collections/individual/index.php?occid=4390342
4390343,Fungi|Ascomycota|Pezizomycotina|Leotiomycetes|Leotiomycetidae|Erysiphales|Erysiphaceae|Erysiphe,Fungi,Ascomycota,Leotiomycetes,Erysiphales,Erysiphaceae,Erysiphe cichoracearum,497175,Erysiphe,,"Aiken, Walter H.",,1897-09-17,1897,9,17,260,,on Ambrosia artemisiifolia,United States,Ohio,Hamilton,Cincinnati,College Hill,39.20228,-84.547166,,,https://www.mycoportal.org/portal/collections/individual/index.php?occid=4390343
4390346,Fungi|Ascomycota|Pezizomycotina|Leotiomycetes|Leotiomycetidae|Erysiphales|Erysiphaceae|Erysiphe,Fungi,Ascomycota,Leotiomycetes,Erysiphales,Erysiphaceae,Erysiphe cichoracearum,497175,Erysiphe,,"Aiken, Walter H.",,1897-08-10,1897,8,10,222,,on Parietaria pensylvanica,United States,Ohio,Hamilton,Cincinnati,College Hill,39.20228,-84.547166,,,https://www.mycoportal.org/portal/collections/individual/index.php?occid=4390346
4390347,Fungi|Ascomycota|Pezizomycotina|Leotiomycetes|Leotiomycetidae|Erysiphales|Erysiphaceae|Erysiphe,Fungi,Ascomycota,Leotiomycetes,Erysiphales,Erysiphaceae,Erysiphe cichoracearum,497175,Erysiphe,,"Aiken, Walter H.",,1899-05-20,1899,5,20,140,,on Hydrophyllum macrophyllum,United States,Ohio,Hamilton,Cincinnati,College Hill,39.20228,-84.547166,,,https://www.mycoportal.org/portal/collections/individual/index.php?occid=4390347
4390351,Fungi|Ascomycota|Pezizomycotina|Leotiomycetes|Leotiomycetidae|Erysiphales|Erysiphaceae|Erysiphe,Fungi,Ascomycota,Leotiomycetes,Erysiphales,Erysiphaceae,Erysiphe cichoracearum,497175,Erysiphe,,"Ricksecker, A.E.","Kelsey, F.D.",1894-09-07,1894,9,7,250,,on Ambrosia trifida,United States,Ohio,Lorain,Sheffield,Sheffield,41.421155,-82.096259,,,https://www.mycoportal.org/portal/collections/individual/index.php?occid=4390351
4390356,Fungi|Ascomycota|Pezizomycotina|Leotiomycetes|Leotiomycetidae|Erysiphales|Erysiphaceae|Erysiphe,Fungi,Ascomycota,Leotiomycetes,Erysiphales,Erysiphaceae,Erysiphe cichoracearum,497175,Erysiphe,,Janischer,,1877-06-23,1877,6,23,174,,on leaves of Stachys germanica,Finland,,,Tuusula,Tuusula,60.416667,25,,,https://www.mycoportal.org/portal/collections/individual/index.php?occid=4390356
4390360,Fungi|Ascomycota|Pezizomycotina|Leotiomycetes|Leotiomycetidae|Erysiphales|Erysiphaceae|Erysiphe,Fungi,Ascomycota,Leotiomycetes,Erysiphales,Erysiphaceae,Erysiphe cichoracearum,497175,Erysiphe,,"Sprague, R.",,8/6/37,1937,8,6,218,,on Cryptantha affinis,United States,California,Siskiyou,Mt. Shasta,Bear Springs,41.2996,-122.300991,1524,,https://www.mycoportal.org/portal/collections/individual/index.php?occid=4390360
4390362,Fungi|Ascomycota|Pezizomycotina|Leotiomycetes|Leotiomycetidae|Erysiphales|Erysiphaceae|Erysiphe,Fungi,Ascomycota,Leotiomycetes,Erysiphales,Erysiphaceae,Erysiphe cichoracearum,497175,Erysiphe,,"Cooke, William Bridge",,8/4/39,1939,8,4,216,in the chaparral,on Erigeron inornatus,United States,California,Siskiyou,Mt. Shasta,Along the Sisson Southern Trail,41.40932,-122.195009,1372,,https://www.mycoportal.org/portal/collections/individual/index.php?occid=4390362
4390368,Fungi|Ascomycota|Pezizomycotina|Leotiomycetes|Leotiomycetidae|Erysiphales|Erysiphaceae|Erysiphe,Fungi,Ascomycota,Leotiomycetes,Erysiphales,Erysiphaceae,Erysiphe cichoracearum,497175,Erysiphe,,"Cooke, William Bridge",,8/6/17,1917,8,6,218,,,United States,California,Siskiyou,Mt. Shasta,Bear Springs,41.2996,-122.300991,1524,,https://www.mycoportal.org/portal/collections/individual/index.php?occid=4390368
4390372,Fungi|Ascomycota|Pezizomycotina|Leotiomycetes|Leotiomycetidae|Erysiphales|Erysiphaceae|Erysiphe,Fungi,Ascomycota,Leotiomycetes,Erysiphales,Erysiphaceae,Erysiphe communis,216779,Erysiphe,,"Brenckle, J.F.",,1909-10-00,1909,10,0,,,on Ranunculus cymbalaria,United States,North Dakota,Lamoure,Kulm,Kulm,46.301914,-98.948162,,,https://www.mycoportal.org/portal/collections/individual/index.php?occid=4390372
4390377,Fungi|Ascomycota|Pezizomycotina|Leotiomycetes|Leotiomycetidae|Erysiphales|Erysiphaceae|Erysiphe,Fungi,Ascomycota,Leotiomycetes,Erysiphales,Erysiphaceae,Erysiphe communis,216779,Erysiphe,,"Cooke, William Bridge","Cooke, V.G.",8/1/47,1947,8,1,213,Chaparral,on Erigeron inornatus,United States,California,Siskiyou,Mt. Shasta,Shasta Snowline Highway,41.407725,-122.258205,1524,,https://www.mycoportal.org/portal/collections/individual/index.php?occid=4390377
4390379,Fungi|Ascomycota|Pezizomycotina|Leotiomycetes|Leotiomycetidae|Erysiphales|Erysiphaceae|Erysiphe,Fungi,Ascomycota,Leotiomycetes,Erysiphales,Erysiphaceae,Erysiphe communis,216779,Erysiphe,,"Cooke, William Bridge","Cooke, V.G.",8/15/47,1947,8,15,227,,on Phacelia mutabilis,United States,California,Siskiyou,Mt. Shasta,Wagon Camp,41.324043,-122.216119,1737,1737,https://www.mycoportal.org/portal/collections/individual/index.php?occid=4390379
4390381,Fungi|Ascomycota|Pezizomycotina|Leotiomycetes|Leotiomycetidae|Erysiphales|Erysiphaceae|Erysiphe,Fungi,Ascomycota,Leotiomycetes,Erysiphales,Erysiphaceae,Erysiphe communis,216779,Erysiphe,,s.n.,,1899-10-01,1899,10,1,274,,on Lysimachia nummularia,United States,Michigan,Mackinac,Hessel,Hessel,46.004183,-84.425869,,,https://www.mycoportal.org/portal/collections/individual/index.php?occid=4390381
4390383,Fungi|Ascomycota|Pezizomycotina|Leotiomycetes|Leotiomycetidae|Erysiphales|Erysiphaceae|Erysiphe,Fungi,Ascomycota,Leotiomycetes,Erysiphales,Erysiphaceae,Erysiphe polygoni,217061,Erysiphe,,"Aiken, Walter H.",,1897-08-09,1897,8,9,221,,on Anemone virginiana,United States,Ohio,Hamilton,,"Hamilton County, Ohio",39.195531,-84.542775,,,https://www.mycoportal.org/portal/collections/individual/index.php?occid=4390383
4390385,Fungi|Ascomycota|Pezizomycotina|Leotiomycetes|Leotiomycetidae|Erysiphales|Erysiphaceae|Erysiphe,Fungi,Ascomycota,Leotiomycetes,Erysiphales,Erysiphaceae,Erysiphe polygoni,217061,Erysiphe,,"Aiken, Walter H.",,1897-09-27,1897,9,27,270,,on Clematis virginiana,United States,Ohio,Hamilton,Cincinnati,College Hill,39.20228,-84.547166,,,https://www.mycoportal.org/portal/collections/individual/index.php?occid=4390385
4390387,Fungi|Ascomycota|Pezizomycotina|Leotiomycetes|Leotiomycetidae|Erysiphales|Erysiphaceae|Erysiphe,Fungi,Ascomycota,Leotiomycetes,Erysiphales,Erysiphaceae,Erysiphe communis,216779,Erysiphe,,"Staritz, Richard",,1876-05-00,1876,5,0,,,on Delphinium sp.,Germany,Saxony-Anhalt,Burgenlandkreis,Freyburg,Freyburg,51.213619,11.76804,,,https://www.mycoportal.org/portal/collections/individual/index.php?occid=4390387
4390388,Fungi|Ascomycota|Pezizomycotina|Eurotiomycetes|Eurotiomycetidae|Eurotiales|Trichocomaceae|Eurotium|Eurotium herbariorum,Fungi,Ascomycota,Eurotiomycetes,Eurotiales,Trichocomaceae,Eurotium herbariorum subsp. epixylon,497651,Eurotium,,s.n.,,1880-12-00,1880,12,0,,,"on oak firewood, closely packed.",,,,,,9999.99,9999.99,,,https://www.mycoportal.org/portal/collections/individual/index.php?occid=4390388
4390389,Fungi|Ascomycota|Pezizomycotina|Sordariomycetes|Hypocreomycetidae|Microascales|Microascaceae|Magnusia,Fungi,Ascomycota,Sordariomycetes,Microascales,Microascaceae,Magnusia nitida,280987,Magnusia,,"Harris, S.K.",,1934-08-00,1934,8,0,,,On jack rabbit dung,United States,Arizona,Coconino,,Grand Canyon,36.111975,-112.796143,,,https://www.mycoportal.org/portal/collections/individual/index.php?occid=4390389
4395200,Protozoa|Myxomycota|Myxomycetes|Trichiales,Protozoa,Myxomycota,Myxomycetes,Trichiales,Trichiaceae,Ophiotheca chrysosperma,645744,Ophiotheca,,"Risch, G.",,1/8/49,1949,1,8,8,,decaying log,United States,Ohio,Hamilton,Cincinnati,California,39.065339,-84.423274,,,https://www.mycoportal.org/portal/collections/individual/index.php?occid=4395200
4395203,Protozoa|Myxomycota|Myxomycetes|Liceales|Reticulariaceae|Lycogala,Protozoa,Myxomycota,Myxomycetes,Liceales,Tubiferaceae,Lycogala epidendrum,617008,Lycogala,,"Gray, Carolynne",,10/15/38,1938,10,15,288,,dead stump,United States,Ohio,Adams,,"Adams County, Ohio",38.845515,-83.472152,,,https://www.mycoportal.org/portal/collections/individual/index.php?occid=4395203
4395205,,,,,,,,,,,"Hoskins, John Hobart",,1931-07-00,1931,7,0,,,,United States,Indiana,Saint Joseph,South Bend,"Notre Dame, St. Mary's Ravine",41.704915,-86.234386,,,https://www.mycoportal.org/portal/collections/individual/index.php?occid=4395205
4395207,,,,,,,,,,,"Hoskins, John Hobart",,1931-07-00,1931,7,0,,,,United States,Indiana,Saint Joseph,South Bend,"Notre Dame, St. Mary's Ravine",41.700558,-86.237991,,,https://www.mycoportal.org/portal/collections/individual/index.php?occid=4395207
4395210,,,,,,,,,,,"Hoskins, John Hobart",,1931-07-00,1931,7,0,,,,United States,Indiana,Saint Joseph,South Bend,"Notre Dame, St. Mary's Ravine",41.704915,-86.234386,,,https://www.mycoportal.org/portal/collections/individual/index.php?occid=4395210
4395213,,,,,,,,,,,"Hoskins, John Hobart",,1931-07-00,1931,7,0,,,,United States,Indiana,Saint Joseph,South Bend,"South Bend, Notre Dame, St. Mary's Ravine",41.699276,-86.234901,,,https://www.mycoportal.org/portal/collections/individual/index.php?occid=4395213
4395216,,,,,,,,,,,"Hoskins, John Hobart",,1931-00-00,1931,0,0,,,,United States,Michigan,Grand Traverse,Traverse City,Traverse City,44.763057,-85.620632,,,https://www.mycoportal.org/portal/collections/individual/index.php?occid=4395216
4395219,Protozoa|Myxomycota,Protozoa,Myxomycota,,,Stemonitidaceae,Enerthenema melanospermum,636246,Enerthenema,,"Cooke, William Bridge",,7/16/41,1941,7,16,197,,on Shasta fir,United States,California,Siskiyou,Mt. Shasta,"near Horse Camp, 7800 ft.",41.37252,-122.23153,2377,,https://www.mycoportal.org/portal/collections/individual/index.php?occid=4395219
4395221,Protozoa|Myxomycota,Protozoa,Myxomycota,,,Didymiaceae,Lepidoderma granuliferum,641436,Lepidoderma,,"Cooke, William Bridge",,6/30/38,1938,6,30,181,,on Penstemon debris,United States,California,Siskiyou,Mt. Shasta,"near Horse Camp, 8100 ft.",41.37252,-122.23153,2469,,https://www.mycoportal.org/portal/collections/individual/index.php?occid=4395221
4395222,Protozoa|Myxomycota,Protozoa,Myxomycota,,,Didymiaceae,Lepidoderma granuliferum,641436,Lepidoderma,,"Cooke, William Bridge",,6/23/38,1938,6,23,174,,on Chrysothamnus bloomeri var. angustatus,United States,California,Siskiyou,Mt. Shasta,Horse Camp,41.37252,-122.23153,2438,,https://www.mycoportal.org/portal/collections/individual/index.php?occid=4395222
4395223,Protozoa|Myxomycota,Protozoa,Myxomycota,,,Didymiaceae,Lepidoderma granuliferum,641436,Lepidoderma,,"Cooke, William Bridge",,6/27/46,1946,6,27,178,,on Lupinus obtusilobus debris,United States,California,Siskiyou,Mt. Shasta,"near Horse Camp, 8100 ft.",41.37252,-122.23153,2469,,https://www.mycoportal.org/portal/collections/individual/index.php?occid=4395223
4397251,Fungi|Ascomycota|Pezizomycotina|Sordariomycetes|Xylariomycetidae|Xylariales|Xylariaceae|Hypoxylon,Fungi,Ascomycota,Sordariomycetes,Xylariales,Xylariaceae,Hypoxylon rubiginosum,249574,Hypoxylon,,"Cooke, William Bridge",,10/2/32,1932,10,2,276,,on dead rotten log,United States,Ohio,Hamilton,Cincinnati,College Hill,39.20228,-84.547166,,,https://www.mycoportal.org/portal/collections/individual/index.php?occid=4397251
4397252,Fungi|Ascomycota|Pezizomycotina|Sordariomycetes|Xylariomycetidae|Xylariales|Xylariaceae|Hypoxylon,Fungi,Ascomycota,Sordariomycetes,Xylariales,Xylariaceae,Hypoxylon rubiginosum,249574,Hypoxylon,,"Fulford, Margaret H.",,10/4/29,1929,10,4,277,woods,on bark of beech log,United States,Ohio,Hamilton,Cincinnati,Hazelwood Preserve (Harris M. Benedict Nature Preserve/Johnson Preserve),39.261725,-84.353273,,,https://www.mycoportal.org/portal/collections/individual/index.php?occid=4397252
4397254,Fungi|Ascomycota|Pezizomycotina|Sordariomycetes|Xylariomycetidae|Xylariales|Xylariaceae|Hypoxylon,Fungi,Ascomycota,Sordariomycetes,Xylariales,Xylariaceae,Hypoxylon rubiginosum,249574,Hypoxylon,,"Stephenson, H.",,5/28/30,1930,5,28,148,,beech,United States,Ohio,Hamilton,Cincinnati,Hazelwood,39.266169,-84.362996,,,https://www.mycoportal.org/portal/collections/individual/index.php?occid=4397254
4397256,Fungi|Ascomycota|Pezizomycotina|Sordariomycetes|Xylariomycetidae|Xylariales|Xylariaceae|Hypoxylon,Fungi,Ascomycota,Sordariomycetes,Xylariales,Xylariaceae,Hypoxylon rubiginosum,249574,Hypoxylon,,"Stephenson, H.",,10/4/29,1929,10,4,277,,beech,United States,Ohio,Hamilton,Cincinnati,Hazelwood Preserve (Harris M. Benedict Nature Preserve/Johnson Preserve),39.261725,-84.353273,,,https://www.mycoportal.org/portal/collections/individual/index.php?occid=4397256
4397262,Fungi|Ascomycota|Pezizomycotina|Sordariomycetes|Xylariomycetidae|Xylariales|Xylariaceae|Hypoxylon,Fungi,Ascomycota,Sordariomycetes,Xylariales,Xylariaceae,Hypoxylon rubiginosum,249574,Hypoxylon,,"Cooke, William Bridge",,10/8/35,1935,10,8,281,,,United States,Ohio,Hamilton,Cincinnati,California,39.065339,-84.423274,,,https://www.mycoportal.org/portal/collections/individual/index.php?occid=4397262
4397265,Fungi|Ascomycota|Pezizomycotina|Sordariomycetes|Xylariomycetidae|Xylariales|Xylariaceae,Fungi,Ascomycota,Sordariomycetes,Xylariales,Xylariaceae,Hypoxylon,15140,Hypoxylon,,"Cooke, William Bridge",,10/28/32,1932,10,28,302,,"dead wood, dry",United States,Ohio,Hamilton,Cincinnati,Kroger Hills,39.150157,-84.32093,,,https://www.mycoportal.org/portal/collections/individual/index.php?occid=4397265
4397267,Fungi|Ascomycota|Pezizomycotina|Sordariomycetes|Xylariomycetidae|Xylariales|Xylariaceae|Hypoxylon,Fungi,Ascomycota,Sordariomycetes,Xylariales,Xylariaceae,Hypoxylon rubiginosum,249574,Hypoxylon,,"Cooke, William Bridge",,11/14/36,1936,11,14,319,,,United States,Ohio,Hamilton,Red Bird Hollow,Red Bird Hollow,39.171121,-84.319385,,,https://www.mycoportal.org/portal/collections/individual/index.php?occid=4397267
4397269,Fungi|Ascomycota|Pezizomycotina|Sordariomycetes|Xylariomycetidae|Xylariales|Xylariaceae|Hypoxylon,Fungi,Ascomycota,Sordariomycetes,Xylariales,Xylariaceae,Hypoxylon rubiginosum,249574,Hypoxylon,,"Cooke, William Bridge",,4/11/36,1936,4,11,102,,,United States,Ohio,Jackson,,Little Salt Creek,38.957153,-82.590901,,,https://www.mycoportal.org/portal/collections/individual/index.php?occid=4397269
4397271,Fungi|Ascomycota|Pezizomycotina|Sordariomycetes|Xylariomycetidae|Xylariales|Xylariaceae|Hypoxylon,Fungi,Ascomycota,Sordariomycetes,Xylariales,Xylariaceae,Hypoxylon rubiginosum,249574,Hypoxylon,,"Cooke, William Bridge",,11/26/35,1935,11,26,330,,,United States,Ohio,Hamilton,,Salem Pike,39.079899,-84.405298,,,https://www.mycoportal.org/portal/collections/individual/index.php?occid=4397271
4397273,Fungi|Ascomycota|Pezizomycotina|Sordariomycetes|Xylariomycetidae|Xylariales|Xylariaceae,Fungi,Ascomycota,Sordariomycetes,Xylariales,Xylariaceae,Hypoxylon,15140,Hypoxylon,,"Cooke, William Bridge",,11/24/32,1932,11,24,329,,dead Quercus alba,United States,Ohio,Clermont,Branch Hill,Branch Hill,39.24617,-84.293271,,,https://www.mycoportal.org/portal/collections/individual/index.php?occid=4397273
4397275,Fungi|Ascomycota|Pezizomycotina|Sordariomycetes|Xylariomycetidae|Xylariales|Xylariaceae|Hypoxylon,Fungi,Ascomycota,Sordariomycetes,Xylariales,Xylariaceae,Hypoxylon rubiginosum,249574,Hypoxylon,,"Cooke, William Bridge",,11/26/35,1935,11,26,330,,,United States,Ohio,Hamilton,,Salem Pike,39.079899,-84.405298,,,https://www.mycoportal.org/portal/collections/individual/index.php?occid=4397275
4397277,Fungi|Ascomycota|Pezizomycotina|Sordariomycetes|Xylariomycetidae|Xylariales|Xylariaceae|Hypoxylon,Fungi,Ascomycota,Sordariomycetes,Xylariales,Xylariaceae,Hypoxylon rubiginosum,249574,Hypoxylon,,"Cooke, William Bridge",,4/12/36,1936,4,12,103,,,United States,Ohio,Jackson,Rock Run,Rock Run,38.973405,-83.163515,,,https://www.mycoportal.org/portal/collections/individual/index.php?occid=4397277
4397279,Fungi|Ascomycota|Pezizomycotina|Sordariomycetes|Xylariomycetidae|Xylariales|Xylariaceae,Fungi,Ascomycota,Sordariomycetes,Xylariales,Xylariaceae,Hypoxylon,15140,Hypoxylon,,"Cooke, William Bridge",,12/4/33,1933,12,4,338,,effused over rotten log,United States,Ohio,Clermont,Dark Hollow,Dark Hollow,38.914083,-82.678459,,,https://www.mycoportal.org/portal/collections/individual/index.php?occid=4397279
4397281,Fungi|Ascomycota|Pezizomycotina|Sordariomycetes|Xylariomycetidae|Xylariales|Xylariaceae|Hypoxylon,Fungi,Ascomycota,Sordariomycetes,Xylariales,Xylariaceae,Hypoxylon rubiginosum,249574,Hypoxylon,,"Cooke, William Bridge",,5/1/37,1937,5,1,121,,,United States,Ohio,Jackson,Rock Run,Rock Run,38.973405,-83.163515,,,https://www.mycoportal.org/portal/collections/individual/index.php?occid=4397281
4397283,Fungi|Ascomycota|Pezizomycotina|Sordariomycetes|Xylariomycetidae|Xylariales|Xylariaceae|Hypoxylon,Fungi,Ascomycota,Sordariomycetes,Xylariales,Xylariaceae,Hypoxylon rubiginosum,249574,Hypoxylon,,"Cooke, William Bridge",,2/29/36,1936,2,29,60,,,United States,Ohio,Clermont,,Alpine Road,39.047433,-84.151918,,,https://www.mycoportal.org/portal/collections/individual/index.php?occid=4397283
4397284,Fungi|Ascomycota|Pezizomycotina|Sordariomycetes|Xylariomycetidae|Xylariales|Xylariaceae|Hypoxylon,Fungi,Ascomycota,Sordariomycetes,Xylariales,Xylariaceae,Hypoxylon rubiginosum,249574,Hypoxylon,,"Cooke, William Bridge",,12/5/33,1933,12,5,339,,dead log,United States,Ohio,Highland,Seven Caves,Seven Caves (Highlands Nature Sanctuary),39.344508,-83.59742,,,https://www.mycoportal.org/portal/collections/individual/index.php?occid=4397284
4397285,Fungi|Ascomycota|Pezizomycotina|Sordariomycetes|Xylariomycetidae|Xylariales|Xylariaceae|Hypoxylon,Fungi,Ascomycota,Sordariomycetes,Xylariales,Xylariaceae,Hypoxylon rubiginosum,249574,Hypoxylon,,"Cooke, William Bridge",,2/29/36,1936,2,29,60,,,United States,Ohio,Clermont,,Alpine Road,39.047433,-84.151918,,,https://www.mycoportal.org/portal/collections/individual/index.php?occid=4397285
4397287,Fungi|Ascomycota|Pezizomycotina|Sordariomycetes|Xylariomycetidae|Xylariales|Xylariaceae|Hypoxylon,Fungi,Ascomycota,Sordariomycetes,Xylariales,Xylariaceae,Hypoxylon rubiginosum,249574,Hypoxylon,,"Blickle, A.H.",,10/1/36,1936,10,1,275,,,United States,Ohio,Hamilton,Cincinnati,Burnet Woods,39.139271,-84.517276,,,https://www.mycoportal.org/portal/collections/individual/index.php?occid=4397287
4397289,Fungi|Ascomycota|Pezizomycotina|Sordariomycetes|Xylariomycetidae|Xylariales|Xylariaceae|Hypoxylon,Fungi,Ascomycota,Sordariomycetes,Xylariales,Xylariaceae,Hypoxylon rubiginosum,249574,Hypoxylon,,"Cooke, William Bridge",,10/24/35,1935,10,24,297,,,United States,Ohio,Hamilton,Cincinnati,College Hill,39.20228,-84.547166,,,https://www.mycoportal.org/portal/collections/individual/index.php?occid=4397289
4397291,Fungi|Ascomycota|Pezizomycotina|Sordariomycetes|Xylariomycetidae|Xylariales|Xylariaceae|Hypoxylon,Fungi,Ascomycota,Sordariomycetes,Xylariales,Xylariaceae,Hypoxylon rubiginosum,249574,Hypoxylon,,"Cooke, William Bridge",,10/1/35,1935,10,1,274,,,United States,Ohio,Hamilton,,Polk Run,39.260628,-84.310779,,,https://www.mycoportal.org/portal/collections/individual/index.php?occid=4397291
4397293,Fungi|Ascomycota|Pezizomycotina|Sordariomycetes|Xylariomycetidae|Xylariales|Xylariaceae|Hypoxylon,Fungi,Ascomycota,Sordariomycetes,Xylariales,Xylariaceae,Hypoxylon rubiginosum,249574,Hypoxylon,,"Cooke, William Bridge",,11/30/35,1935,11,30,334,,,United States,Ohio,Clermont,Modest,Modest Uplands,39.193117,-84.107156,,,https://www.mycoportal.org/portal/collections/individual/index.php?occid=4397293
4397298,Fungi|Ascomycota|Pezizomycotina|Sordariomycetes|Xylariomycetidae|Xylariales|Xylariaceae,Fungi,Ascomycota,Sordariomycetes,Xylariales,Xylariaceae,Hypoxylon,15140,Hypoxylon,,"Cooke, William Bridge",,5/23/33,1933,5,23,143,,dead cherry sticks,United States,Ohio,Hamilton,Cincinnati,Burnet Woods,39.139271,-84.517276,,,https://www.mycoportal.org/portal/collections/individual/index.php?occid=4397298
4397302,Fungi|Ascomycota|Pezizomycotina|Sordariomycetes|Xylariomycetidae|Xylariales|Xylariaceae|Hypoxylon,Fungi,Ascomycota,Sordariomycetes,Xylariales,Xylariaceae,Hypoxylon rubiginosum,249574,Hypoxylon,,"Cooke, William Bridge",,10/17/35,1935,10,17,290,,,United States,Ohio,Hamilton,Dunlap,Dunlap,39.292279,-84.618002,,,https://www.mycoportal.org/portal/collections/individual/index.php?occid=4397302
4397304,Fungi|Ascomycota|Pezizomycotina|Sordariomycetes|Xylariomycetidae|Xylariales|Xylariaceae|Hypoxylon,Fungi,Ascomycota,Sordariomycetes,Xylariales,Xylariaceae,Hypoxylon rubiginosum,249574,Hypoxylon,,"Cooke, William Bridge",,11/8/33,1933,11,8,312,,Rotten wood,United States,Ohio,Clermont,Loveland,Camp Friedlander,39.215892,-84.284382,,,https://www.mycoportal.org/portal/collections/individual/index.php?occid=4397304
4397306,Fungi|Ascomycota|Pezizomycotina|Sordariomycetes|Xylariomycetidae|Xylariales|Xylariaceae|Hypoxylon,Fungi,Ascomycota,Sordariomycetes,Xylariales,Xylariaceae,Hypoxylon rubiginosum,249574,Hypoxylon,,"Cooke, William Bridge",,2/29/36,1936,2,29,60,,,United States,Ohio,Clermont,,Alpine Road,39.047433,-84.151918,,,https://www.mycoportal.org/portal/collections/individual/index.php?occid=4397306
4397308,Fungi|Ascomycota|Pezizomycotina|Sordariomycetes|Xylariomycetidae|Xylariales|Xylariaceae|Hypoxylon,Fungi,Ascomycota,Sordariomycetes,Xylariales,Xylariaceae,Hypoxylon rubiginosum,249574,Hypoxylon,,"Blickle, A.H.",,1934-10-00,1934,10,0,,,,United States,Ohio,Hamilton,Cincinnati,Burnet Woods,39.139271,-84.517276,,,https://www.mycoportal.org/portal/collections/individual/index.php?occid=4397308
4397311,Fungi|Ascomycota|Pezizomycotina|Sordariomycetes|Xylariomycetidae|Xylariales|Xylariaceae|Hypoxylon,Fungi,Ascomycota,Sordariomycetes,Xylariales,Xylariaceae,Hypoxylon rubiginosum,249574,Hypoxylon,,"Cooke, William Bridge",,3/10/36,1936,3,10,70,,,United States,Ohio,Hamilton,Sycamore Creek,Sycamore Creek,39.247559,-84.322239,,,https://www.mycoportal.org/portal/collections/individual/index.php?occid=4397311
4397313,Fungi|Ascomycota|Pezizomycotina|Sordariomycetes|Xylariomycetidae|Xylariales|Xylariaceae|Hypoxylon,Fungi,Ascomycota,Sordariomycetes,Xylariales,Xylariaceae,Hypoxylon rubiginosum,249574,Hypoxylon,,"Cooke, William Bridge",,3/5/36,1936,3,5,65,,,United States,Ohio,Hamilton,Rapid Run,Rapid Run,39.099503,-84.671335,,,https://www.mycoportal.org/portal/collections/individual/index.php?occid=4397313
4397315,Fungi|Ascomycota|Pezizomycotina|Sordariomycetes|Xylariomycetidae|Xylariales|Xylariaceae|Hypoxylon,Fungi,Ascomycota,Sordariomycetes,Xylariales,Xylariaceae,Hypoxylon rubiginosum,249574,Hypoxylon,,"Cooke, William Bridge",,11/21/35,1935,11,21,325,,,United States,Ohio,Hamilton,Sycamore Township,Brecon Woods,39.280614,-84.356606,,,https://www.mycoportal.org/portal/collections/individual/index.php?occid=4397315
4397316,Fungi|Ascomycota|Pezizomycotina|Sordariomycetes|Xylariomycetidae|Xylariales|Xylariaceae,Fungi,Ascomycota,Sordariomycetes,Xylariales,Xylariaceae,Hypoxylon,15140,Hypoxylon,,"Cooke, William Bridge",,3/10/36,1936,3,10,70,,,United States,Ohio,Hamilton,Sycamore Creek,Sycamore Creek,39.247559,-84.322239,,,https://www.mycoportal.org/portal/collections/individual/index.php?occid=4397316
4397317,Fungi|Ascomycota|Pezizomycotina|Sordariomycetes|Xylariomycetidae|Xylariales|Xylariaceae,Fungi,Ascomycota,Sordariomycetes,Xylariales,Xylariaceae,Hypoxylon,15140,Hypoxylon,,"Muhlbery, J.",,10/7/31,1931,10,7,280,,,United States,Ohio,Hamilton,Cincinnati,College Hill,39.20228,-84.547166,,,https://www.mycoportal.org/portal/collections/individual/index.php?occid=4397317
4397319,Fungi|Ascomycota|Pezizomycotina|Sordariomycetes|Xylariomycetidae|Xylariales|Xylariaceae|Hypoxylon,Fungi,Ascomycota,Sordariomycetes,Xylariales,Xylariaceae,Hypoxylon annulatum,248946,Hypoxylon,,"Cooke, William Bridge",,1934-00-00,1934,0,0,,,dead wood,United States,Ohio,Hamilton,,"Hamilton County, Ohio",39.195531,-84.542775,,,https://www.mycoportal.org/portal/collections/individual/index.php?occid=4397319
4397320,Fungi|Ascomycota|Pezizomycotina|Sordariomycetes|Xylariomycetidae|Xylariales|Xylariaceae|Hypoxylon,Fungi,Ascomycota,Sordariomycetes,Xylariales,Xylariaceae,Hypoxylon rubiginosum,249574,Hypoxylon,,"Cooke, William Bridge",,10/1/35,1935,10,1,274,,,United States,Ohio,Hamilton,Cincinnati,Polk Run,39.260628,-84.310779,,,https://www.mycoportal.org/portal/collections/individual/index.php?occid=4397320
4397321,Fungi|Ascomycota|Pezizomycotina|Sordariomycetes|Xylariomycetidae|Xylariales|Xylariaceae|Hypoxylon,Fungi,Ascomycota,Sordariomycetes,Xylariales,Xylariaceae,Hypoxylon rubiginosum,249574,Hypoxylon,,"Cooke, William Bridge",,3/5/36,1936,3,5,65,,,United States,Ohio,Hamilton,Cincinnati,Rapid Run,39.099503,-84.671335,,,https://www.mycoportal.org/portal/collections/individual/index.php?occid=4397321
4397322,Fungi|Ascomycota|Pezizomycotina|Sordariomycetes|Xylariomycetidae|Xylariales|Xylariaceae|Hypoxylon,Fungi,Ascomycota,Sordariomycetes,Xylariales,Xylariaceae,Hypoxylon rubiginosum,249574,Hypoxylon,,"Cooke, William Bridge",,3/30/37,1937,3,30,89,,,United States,Ohio,Ross,Alum Cliffs,Alum Cliffs,39.30562,-83.073238,,,https://www.mycoportal.org/portal/collections/individual/index.php?occid=4397322
4397323,Fungi|Ascomycota|Pezizomycotina|Sordariomycetes|Xylariomycetidae|Xylariales|Xylariaceae|Hypoxylon,Fungi,Ascomycota,Sordariomycetes,Xylariales,Xylariaceae,Hypoxylon rubiginosum,249574,Hypoxylon,,"Cooke, William Bridge",,11/30/35,1935,11,30,334,,,United States,Ohio,Clermont,Modest,Modest Uplands,39.193117,-84.107156,,,https://www.mycoportal.org/portal/collections/individual/index.php?occid=4397323
4397324,Fungi|Ascomycota|Pezizomycotina|Sordariomycetes|Xylariomycetidae|Xylariales|Xylariaceae,Fungi,Ascomycota,Sordariomycetes,Xylariales,Xylariaceae,Hypoxylon,15140,Hypoxylon,,"Cooke, William Bridge",,3/12/33,1933,3,12,71,,dead sticks,United States,Ohio,Clermont,Dark Hollow,Dark Hollow,38.915352,-82.693222,,,https://www.mycoportal.org/portal/collections/individual/index.php?occid=4397324
4397325,Fungi|Ascomycota|Pezizomycotina|Sordariomycetes|Xylariomycetidae|Xylariales|Xylariaceae|Hypoxylon,Fungi,Ascomycota,Sordariomycetes,Xylariales,Xylariaceae,Hypoxylon rubiginosum,249574,Hypoxylon,,"Cooke, William Bridge",,5/15/37,1937,5,15,135,,,United States,Ohio,Warren,Foster,Foster,39.319226,-84.252993,,,https://www.mycoportal.org/portal/collections/individual/index.php?occid=4397325
4397326,Fungi|Ascomycota|Pezizomycotina|Sordariomycetes|Xylariomycetidae|Xylariales|Xylariaceae|Hypoxylon,Fungi,Ascomycota,Sordariomycetes,Xylariales,Xylariaceae,Hypoxylon rubiginosum,249574,Hypoxylon,,"Sanders, P.J.",,10/25/64,1964,10,25,299,"woods, south slope",beech log,United States,Ohio,Hamilton,Cincinnati,Center Hill Life Science Field Station,39.196066,-84.508607,,,https://www.mycoportal.org/portal/collections/individual/index.php?occid=4397326
4397327,Fungi|Ascomycota|Pezizomycotina|Sordariomycetes|Xylariomycetidae|Xylariales|Xylariaceae|Hypoxylon,Fungi,Ascomycota,Sordariomycetes,Xylariales,Xylariaceae,Hypoxylon rubiginosum,249574,Hypoxylon,,"Sanders, P.J.",,11/8/64,1964,11,8,313,woods,beech log,United States,Ohio,Hamilton,Cincinnati,Center Hill Life Science Field Station,39.196066,-84.508607,,,https://www.mycoportal.org/portal/collections/individual/index.php?occid=4397327
4397328,Fungi|Ascomycota|Pezizomycotina|Leotiomycetes|Leotiomycetidae|Helotiales|Dermateaceae|Mollisia,Fungi,Ascomycota,Leotiomycetes,Helotiales,Dermateaceae,Mollisia cinerea,294586,Mollisia,,"Fulford, Margaret H.",,10/4/29,1929,10,4,277,woods,moist decayed log,United States,Ohio,Hamilton,Cincinnati,Hazelwood Preserve (Harris M. Benedict Nature Preserve/Johnson Preserve),39.261725,-84.353273,,,https://www.mycoportal.org/portal/collections/individual/index.php?occid=4397328
4397329,Fungi|Ascomycota|Pezizomycotina|Leotiomycetes|Leotiomycetidae|Helotiales|Dermateaceae|Mollisia,Fungi,Ascomycota,Leotiomycetes,Helotiales,Dermateaceae,Mollisia cinerea,294586,Mollisia,,"Cooke, William Bridge",,1/30/33,1933,1,30,30,,rotten log,United States,Ohio,Ross,Paxton Township,Jones Hill,39.20951,-83.34019,,,https://www.mycoportal.org/portal/collections/individual/index.php?occid=4397329
4397330,Fungi|Ascomycota|Pezizomycotina|Leotiomycetes|Leotiomycetidae|Helotiales|Dermateaceae|Mollisia,Fungi,Ascomycota,Leotiomycetes,Helotiales,Dermateaceae,Mollisia cinerea,294586,Mollisia,,"Cooke, William Bridge",,3/17/33,1933,3,17,76,,dead log,United States,Ohio,Warren,Hopkinsville,"Hopkinsville, White Oak",39.338948,-84.219659,,,https://www.mycoportal.org/portal/collections/individual/index.php?occid=4397330
4397331,Fungi|Ascomycota|Pezizomycotina|Leotiomycetes|Leotiomycetidae|Helotiales|Dermateaceae|Mollisia,Fungi,Ascomycota,Leotiomycetes,Helotiales,Dermateaceae,Mollisia cinerea,294586,Mollisia,,"Cooke, William Bridge",,10/31/35,1935,10,31,304,,,United States,Ohio,Hamilton,Cincinnati,Caldwell Woods,39.202231,-84.490503,,,https://www.mycoportal.org/portal/collections/individual/index.php?occid=4397331
4397332,Fungi|Ascomycota|Pezizomycotina|Leotiomycetes|Leotiomycetidae|Helotiales|Dermateaceae|Mollisia,Fungi,Ascomycota,Leotiomycetes,Helotiales,Dermateaceae,Mollisia cinerea,294586,Mollisia,,"Cooke, William Bridge",,10/17/36,1936,10,17,291,,,United States,Ohio,Hamilton,Dunlap,Dunlap,39.292279,-84.618002,,,https://www.mycoportal.org/portal/collections/individual/index.php?occid=4397332
4397333,Fungi|Ascomycota|Pezizomycotina|Leotiomycetes|Leotiomycetidae|Helotiales|Dermateaceae|Mollisia,Fungi,Ascomycota,Leotiomycetes,Helotiales,Dermateaceae,Mollisia cinerea,294586,Mollisia,,"Fulford, Margaret H.",,9/27/29,1929,9,27,270,ravine,decayed wood,United States,Ohio,Hamilton,Cincinnati,Kroger Hills,39.150157,-84.32093,,,https://www.mycoportal.org/portal/collections/individual/index.php?occid=4397333
4397334,Fungi|Ascomycota|Pezizomycotina|Lecanoromycetes|Lecanoromycetidae|Teloschistales|Physciaceae|Physcia|Physcia obscura,Fungi,Ascomycota,Lecanoromycetes,Teloschistales,Physciaceae,Physcia obscura f. endochrysea,524812,Physcia,,"Lillick, Lois",,10/28/32,1932,10,28,302,,living tree,United States,Ohio,Hamilton,Cincinnati,Terrace Park,39.159227,-84.30716,,,https://www.mycoportal.org/portal/collections/individual/index.php?occid=4397334
4397335,Fungi|Ascomycota|Pezizomycotina|Leotiomycetes|Leotiomycetidae|Helotiales|Hyaloscyphaceae|Velutaria,Fungi,Ascomycota,Leotiomycetes,Helotiales,Helotiaceae,Velutaria rufo-olivacea,557883,Velutaria,,"Parks, H.E.",,1937-11-00,1937,11,0,,,on leaves of Arbutus menziesii,United States,California,Del Norte,Darlingtonia,Smith River,41.908716,-124.159542,,,https://www.mycoportal.org/portal/collections/individual/index.php?occid=4397335
4397337,Fungi|Ascomycota|Pezizomycotina|Leotiomycetes|Leotiomycetidae|Helotiales|Dermateaceae,Fungi,Ascomycota,Leotiomycetes,Helotiales,Dermateaceae,Mollisia,16176,Mollisia,,"Cooke, William Bridge",,7/13/38,1938,7,13,194,,on Lupinus obtusilobus,United States,California,Siskiyou,Mt. Shasta,"near the water supply spring above Horse Camp, 8100 ft.",41.37252,-122.23153,2469,,https://www.mycoportal.org/portal/collections/individual/index.php?occid=4397337
4397338,Fungi|Ascomycota|Pezizomycotina|Leotiomycetes|Leotiomycetidae|Helotiales|Dermateaceae|Mollisia,Fungi,Ascomycota,Leotiomycetes,Helotiales,Dermateaceae,Mollisia cinerea,294586,Mollisia,,"Nelson, D.",,3/11/37,1937,3,11,70,,"Decayed, decorticated oak",United States,California,Alameda,Berkeley,"Strawberry Canyon, University of California campus",37.87349,-122.241848,,,https://www.mycoportal.org/portal/collections/individual/index.php?occid=4397338
4397339,Fungi|Ascomycota|Pezizomycotina|Leotiomycetes|Leotiomycetidae|Helotiales|Dermateaceae|Mollisia,Fungi,Ascomycota,Leotiomycetes,Helotiales,Dermateaceae,Mollisia dehnii,294624,Mollisia,,"Brenckle, J.F.",,1908-06-00,1908,6,0,,,on Potentilla norvegica,United States,North Dakota,Lamoure,Kulm,Kulm,46.301914,-98.948162,,,https://www.mycoportal.org/portal/collections/individual/index.php?occid=4397339
4397341,Fungi|Ascomycota|Pezizomycotina|Leotiomycetes|Leotiomycetidae|Helotiales|Dermateaceae|Tapesia,Fungi,Ascomycota,Leotiomycetes,Helotiales,Dermateaceae,Tapesia fusca,313418,Tapesia,,"Cooke, William Bridge",,11/1/37,1937,11,1,305,,on rotting Quercus garryana,United States,Oregon,Benton,,near Corvallis,44.564566,-123.262044,,,https://www.mycoportal.org/portal/collections/individual/index.php?occid=4397341
4397343,Fungi|Ascomycota|Pezizomycotina|Leotiomycetes|Leotiomycetidae|Helotiales|Dermateaceae|Tapesia|Tapesia melaleucoides,Fungi,Ascomycota,Leotiomycetes,Helotiales,Dermateaceae,Tapesia melaleucoides var. vaccinii,537807,Tapesia,,"Cooke, William Bridge",,7/28/41,1941,7,28,209,,on Arctostaphylos nevadensis,United States,California,Siskiyou,Mt. Shasta,"near Horse Camp, Mt Shasta",41.95639,-123.17278,2499,,https://www.mycoportal.org/portal/collections/individual/index.php?occid=4397343
4397345,Fungi|Ascomycota|Pezizomycotina|Leotiomycetes|Leotiomycetidae|Helotiales|Dermateaceae|Trichobelonium,Fungi,Ascomycota,Leotiomycetes,Helotiales,Dermateaceae,Trichobelonium distinguendum,544650,Trichobelonium,,"Sydow, H.",,9/26/10,1910,9,26,269,,on Phragmites sp.,Germany,Berlin,Treptow-Kpenick,Schmckwitz,Schmckwitz,52.377658,13.650516,,,https://www.mycoportal.org/portal/collections/individual/index.php?occid=4397345
4397350,Fungi|Ascomycota|Pezizomycotina|Sordariomycetes|Xylariomycetidae|Hypocreomycetidae|Xylariales|Hypocreales|Xylariaceae|Cordycipitaceae|Xylaria,Fungi,Ascomycota,Sordariomycetes,Hypocreales,Xylariaceae,Xylaria corrugata,563831,Xylaria,,"Hariot, P.",,1901-03-00,1901,3,0,,,on dead wood,New Caledonia,North Province,,Houalou,Houalou,-21.283333,165.616667,,,https://www.mycoportal.org/portal/collections/individual/index.php?occid=4397350
4397351,Fungi|Ascomycota|Pezizomycotina|Sordariomycetes|Xylariomycetidae|Hypocreomycetidae|Xylariales|Hypocreales|Xylariaceae|Cordycipitaceae|Xylaria,Fungi,Ascomycota,Sordariomycetes,Hypocreales,Xylariaceae,Xylaria digitata,190575,Xylaria,,"Cooke, William Bridge","Cooke, V.G.",11/28/47,1947,11,28,332,"dense, near-climax forest",on old stump of Pseudotsuga taxifolia var. gluca,United States,Idaho,Latah,,"North slope of west end of Thatuna Ridge, one-half mile west of U.S. Highway 95 (Near the Washington line)",46.777315,-116.999478,945,,https://www.mycoportal.org/portal/collections/individual/index.php?occid=4397351
4397353,Fungi|Ascomycota|Pezizomycotina|Sordariomycetes|Xylariomycetidae|Hypocreomycetidae|Xylariales|Hypocreales|Xylariaceae|Cordycipitaceae|Xylaria,Fungi,Ascomycota,Sordariomycetes,Hypocreales,Xylariaceae,Xylaria polymorpha,314083,Xylaria,,"Sanders, P.J.",,7/25/64,1964,7,25,207,"wooded, steep hillside","leaf mold, at base of dead elm",United States,Ohio,Hamilton,Cincinnati,Center Hill Life Science Field Station,39.196066,-84.508607,,,https://www.mycoportal.org/portal/collections/individual/index.php?occid=4397353
4397363,Fungi|Ascomycota|Pezizomycotina|Sordariomycetes|Xylariomycetidae|Xylariales|Xylariaceae,Fungi,Ascomycota,Sordariomycetes,Xylariales,Xylariaceae,Xylaria,19554,Xylaria,,"Braun, E. Lucy",,6/18/29,1929,6,18,169,,on bark of logs,United States,Ohio,Clermont,Goshen,Goshen,39.233394,-84.161324,,,https://www.mycoportal.org/portal/collections/individual/index.php?occid=4397363
4397369,Fungi|Ascomycota|Pezizomycotina|Sordariomycetes|Xylariomycetidae|Xylariales|Xylariaceae,Fungi,Ascomycota,Sordariomycetes,Xylariales,Xylariaceae,Xylaria,19554,Xylaria,,"Fulford, Margaret H.",,10/23/31,1931,10,23,296,,oak log,United States,Ohio,Hamilton,Cincinnati,"Given Road, Terrace Park",39.159227,-84.30716,,,https://www.mycoportal.org/portal/collections/individual/index.php?occid=4397369
4397371,Fungi|Ascomycota|Pezizomycotina|Sordariomycetes|Xylariomycetidae|Hypocreomycetidae|Xylariales|Hypocreales|Xylariaceae|Cordycipitaceae|Xylaria,Fungi,Ascomycota,Sordariomycetes,Hypocreales,Xylariaceae,Xylaria conocephala,563817,Xylaria,,"Cooke, William Bridge",,10/24/35,1935,10,24,297,,,United States,Ohio,Hamilton,Cincinnati,College Hill,39.20228,-84.547166,,,https://www.mycoportal.org/portal/collections/individual/index.php?occid=4397371
4397373,Fungi|Ascomycota|Pezizomycotina|Sordariomycetes|Xylariomycetidae|Hypocreomycetidae|Xylariales|Hypocreales|Xylariaceae|Cordycipitaceae|Xylaria,Fungi,Ascomycota,Sordariomycetes,Hypocreales,Xylariaceae,Xylaria hypoxylon,190576,Xylaria,,"Cooke, William Bridge",,6/7/33,1933,6,7,158,,ground in hummus,United States,Ohio,Highland,,Seven Caves,39.222845,-83.355158,,,https://www.mycoportal.org/portal/collections/individual/index.php?occid=4397373
4397375,Fungi|Ascomycota|Pezizomycotina|Sordariomycetes|Xylariomycetidae|Hypocreomycetidae|Xylariales|Hypocreales|Xylariaceae|Cordycipitaceae|Xylaria,Fungi,Ascomycota,Sordariomycetes,Hypocreales,Xylariaceae,Xylaria polymorpha,314083,Xylaria,,"Fulford, Margaret H.",,10/18/29,1929,10,18,291,woods,decayed log,United States,Ohio,Clermont,Milford,Milford,39.175338,-84.294382,,,https://www.mycoportal.org/portal/collections/individual/index.php?occid=4397375
4397377,Fungi|Ascomycota|Pezizomycotina|Sordariomycetes|Xylariomycetidae|Hypocreomycetidae|Xylariales|Hypocreales|Xylariaceae|Cordycipitaceae|Xylaria,Fungi,Ascomycota,Sordariomycetes,Hypocreales,Xylariaceae,Xylaria hypoxylon,190576,Xylaria,,"Otting, H.",,10/27/34,1934,10,27,300,,bark of dead tree,United States,Ohio,Adams,,"Adams County, Ohio",38.845515,-83.472152,,,https://www.mycoportal.org/portal/collections/individual/index.php?occid=4397377
4397379,Fungi|Ascomycota|Pezizomycotina|Sordariomycetes|Xylariomycetidae|Xylariales|Xylariaceae,Fungi,Ascomycota,Sordariomycetes,Xylariales,Xylariaceae,Xylaria,19554,Xylaria,,"Cooke, William Bridge",,6/24/35,1935,6,24,175,,dead wood,United States,Ohio,Hamilton,Symmes,Symmes,39.247003,-84.296327,,,https://www.mycoportal.org/portal/collections/individual/index.php?occid=4397379
4397380,Fungi|Ascomycota|Pezizomycotina|Sordariomycetes|Xylariomycetidae|Hypocreomycetidae|Xylariales|Hypocreales|Xylariaceae|Cordycipitaceae|Xylaria,Fungi,Ascomycota,Sordariomycetes,Hypocreales,Xylariaceae,Xylaria polymorpha,314083,Xylaria,,"Fulford, Margaret H.",,10/4/29,1929,10,4,277,ravine,decayed log,United States,Ohio,Hamilton,Cincinnati,Hazelwood,39.266169,-84.362996,,,https://www.mycoportal.org/portal/collections/individual/index.php?occid=4397380
4397382,Fungi|Ascomycota|Pezizomycotina|Sordariomycetes|Xylariomycetidae|Hypocreomycetidae|Xylariales|Hypocreales|Xylariaceae|Cordycipitaceae|Xylaria,Fungi,Ascomycota,Sordariomycetes,Hypocreales,Xylariaceae,Xylaria hypoxylon,190576,Xylaria,,"Cooke, William Bridge",,9/19/32,1932,9,19,263,,dead wood,United States,Ohio,Highland,,Seven Caves,39.222845,-83.355158,250,,https://www.mycoportal.org/portal/collections/individual/index.php?occid=4397382
4397385,Fungi|Ascomycota|Pezizomycotina|Sordariomycetes|Xylariomycetidae|Hypocreomycetidae|Xylariales|Hypocreales|Xylariaceae|Cordycipitaceae|Xylaria,Fungi,Ascomycota,Sordariomycetes,Hypocreales,Xylariaceae,Xylaria hypoxylon,190576,Xylaria,,"Phinney, Harry Kenyon",,7/28/40,1940,7,28,210,,on log,United States,Michigan,Alger,Miners Falls,Miners Falls,46.474601,-86.531394,,,https://www.mycoportal.org/portal/collections/individual/index.php?occid=4397385
4397387,Fungi|Ascomycota|Pezizomycotina|Sordariomycetes|Xylariomycetidae|Hypocreomycetidae|Xylariales|Hypocreales|Xylariaceae|Cordycipitaceae|Xylaria,Fungi,Ascomycota,Sordariomycetes,Hypocreales,Xylariaceae,Xylaria polymorpha,314083,Xylaria,,"Cooke, William Bridge",,5/23/33,1933,5,23,143,,on ground and dead wood,United States,Ohio,Hamilton,Cincinnati,Burnet Woods,39.139271,-84.517276,,,https://www.mycoportal.org/portal/collections/individual/index.php?occid=4397387
4397388,Fungi|Ascomycota|Pezizomycotina|Sordariomycetes|Xylariomycetidae|Hypocreomycetidae|Xylariales|Hypocreales|Xylariaceae|Cordycipitaceae|Xylaria,Fungi,Ascomycota,Sordariomycetes,Hypocreales,Xylariaceae,Xylaria polymorpha,314083,Xylaria,,"Bauer, Kay",,10/15/32,1932,10,15,289,,stump,United States,Kentucky,Boone,,Camp Ernst,38.999505,-84.724669,,,https://www.mycoportal.org/portal/collections/individual/index.php?occid=4397388
4397389,Fungi|Ascomycota|Pezizomycotina|Sordariomycetes|Xylariomycetidae|Hypocreomycetidae|Xylariales|Hypocreales|Xylariaceae|Cordycipitaceae|Xylaria,Fungi,Ascomycota,Sordariomycetes,Hypocreales,Xylariaceae,Xylaria polymorpha,314083,Xylaria,,"Braun, E. Lucy",,10/12/29,1929,10,12,285,,decayed log,United States,Ohio,Adams,,Cedar Falls Gorge,38.836739,-83.375466,,,https://www.mycoportal.org/portal/collections/individual/index.php?occid=4397389
4397391,Fungi|Ascomycota|Pezizomycotina|Sordariomycetes|Xylariomycetidae|Hypocreomycetidae|Xylariales|Hypocreales|Xylariaceae|Cordycipitaceae|Xylaria,Fungi,Ascomycota,Sordariomycetes,Hypocreales,Xylariaceae,Xylaria polymorpha,314083,Xylaria,,A. T. C.,,5/15/40,1940,5,15,136,,dead log,United States,Ohio,Hamilton,Cincinnati,Hazelwood,39.266169,-84.362996,,,https://www.mycoportal.org/portal/collections/individual/index.php?occid=4397391
4397394,Fungi|Ascomycota|Pezizomycotina|Sordariomycetes|Xylariomycetidae|Hypocreomycetidae|Xylariales|Hypocreales|Xylariaceae|Cordycipitaceae|Xylaria,Fungi,Ascomycota,Sordariomycetes,Hypocreales,Xylariaceae,Xylaria hypoxylon,190576,Xylaria,,"Cooke, William Bridge","Parks, H.E.",8/5/36,1936,8,5,218,,on ground in redwood forest,United States,California,Humboldt,Trinidad,Trinidad,41.059291,-124.143125,30,,https://www.mycoportal.org/portal/collections/individual/index.php?occid=4397394
4397396,Fungi|Ascomycota|Pezizomycotina|Sordariomycetes|Xylariomycetidae|Hypocreomycetidae|Xylariales|Hypocreales|Xylariaceae|Cordycipitaceae|Xylaria,Fungi,Ascomycota,Sordariomycetes,Hypocreales,Xylariaceae,Xylaria hypoxylon,190576,Xylaria,,"Murphy, J.",,10/27/34,1934,10,27,300,,living bark of tree,United States,Ohio,Adams,,"Adams County, Ohio",38.845515,-83.472152,,,https://www.mycoportal.org/portal/collections/individual/index.php?occid=4397396
4397397,Fungi|Ascomycota|Pezizomycotina|Sordariomycetes|Xylariomycetidae|Hypocreomycetidae|Xylariales|Hypocreales|Xylariaceae|Cordycipitaceae|Xylaria,Fungi,Ascomycota,Sordariomycetes,Hypocreales,Xylariaceae,Xylaria polymorpha,314083,Xylaria,,"Lillick, Lois",,10/15/32,1932,10,15,289,,dead stump,United States,Kentucky,Boone,,"Boone County, Kentucky",38.969864,-84.727866,,,https://www.mycoportal.org/portal/collections/individual/index.php?occid=4397397
4397398,Fungi|Ascomycota|Pezizomycotina|Sordariomycetes|Xylariomycetidae|Hypocreomycetidae|Xylariales|Hypocreales|Xylariaceae|Cordycipitaceae|Xylaria,Fungi,Ascomycota,Sordariomycetes,Hypocreales,Xylariaceae,Xylaria hypoxylon,190576,Xylaria,,"Cooke, William Bridge",,5/13/33,1933,5,13,133,,on log,United States,Kentucky,Powell,,Natural Bridge,37.772584,-83.684358,,,https://www.mycoportal.org/portal/collections/individual/index.php?occid=4397398
4397400,Fungi|Ascomycota|Pezizomycotina|Sordariomycetes|Xylariomycetidae|Hypocreomycetidae|Xylariales|Hypocreales|Xylariaceae|Cordycipitaceae|Xylaria,Fungi,Ascomycota,Sordariomycetes,Hypocreales,Xylariaceae,Xylaria polymorpha,314083,Xylaria,,"Johnson, Louise",,10/16/38,1938,10,16,289,mixed mesophytic woods,decaying log,United States,Ohio,Adams,Mineral Springs,Mineral Springs,38.887016,-83.329354,,,https://www.mycoportal.org/portal/collections/individual/index.php?occid=4397400
4397404,Fungi|Ascomycota|Pezizomycotina|Sordariomycetes|Xylariomycetidae|Hypocreomycetidae|Xylariales|Hypocreales|Xylariaceae|Cordycipitaceae|Xylaria,Fungi,Ascomycota,Sordariomycetes,Hypocreales,Xylariaceae,Xylaria polymorpha,314083,Xylaria,,"Cooke, William Bridge",,10/1/35,1935,10,1,274,,,United States,Ohio,Hamilton,Cincinnati,Polk Run,39.260628,-84.310779,,,https://www.mycoportal.org/portal/collections/individual/index.php?occid=4397404
4397406,Fungi|Ascomycota|Pezizomycotina|Sordariomycetes|Xylariomycetidae|Hypocreomycetidae|Xylariales|Hypocreales|Xylariaceae|Cordycipitaceae|Xylaria,Fungi,Ascomycota,Sordariomycetes,Hypocreales,Xylariaceae,Xylaria hypoxylon,190576,Xylaria,,"Williams, Jean",,10/11/34,1934,10,11,284,,on dead branch,United States,Ohio,Hamilton,Cincinnati,Kroger Hills,39.150157,-84.32093,,,https://www.mycoportal.org/portal/collections/individual/index.php?occid=4397406
4397408,Fungi|Ascomycota|Pezizomycotina|Sordariomycetes|Xylariomycetidae|Xylariales|Xylariaceae,Fungi,Ascomycota,Sordariomycetes,Xylariales,Xylariaceae,Xylaria,19554,Xylaria,,"Cooke, William Bridge",,5/22/33,1933,5,22,142,,Rotten wood,United States,Ohio,Hamilton,Cincinnati,"Cincinnati, Kroger Hills",39.150157,-84.32093,,,https://www.mycoportal.org/portal/collections/individual/index.php?occid=4397408
4397409,Fungi|Ascomycota|Pezizomycotina|Sordariomycetes|Xylariomycetidae|Hypocreomycetidae|Xylariales|Hypocreales|Xylariaceae|Cordycipitaceae|Xylaria,Fungi,Ascomycota,Sordariomycetes,Hypocreales,Xylariaceae,Xylaria hypoxylon,190576,Xylaria,,"Cooke, William Bridge",,6/7/33,1933,6,7,158,,ground,United States,Ohio,Highland,,Seven Caves,39.222845,-83.355158,,,https://www.mycoportal.org/portal/collections/individual/index.php?occid=4397409
4397411,Fungi|Ascomycota|Pezizomycotina|Sordariomycetes|Xylariomycetidae|Hypocreomycetidae|Xylariales|Hypocreales|Xylariaceae|Cordycipitaceae|Xylaria,Fungi,Ascomycota,Sordariomycetes,Hypocreales,Xylariaceae,Xylaria hypoxylon,190576,Xylaria,,"Fulford, Margaret H.",,3/5/30,1930,3,5,64,,on walnut log in field,United States,Ohio,Hamilton,Cincinnati,"Martin Road, Madisonville",39.15756,-84.391051,,,https://www.mycoportal.org/portal/collections/individual/index.php?occid=4397411
4397413,Fungi|Ascomycota|Pezizomycotina|Sordariomycetes|Xylariomycetidae|Hypocreomycetidae|Xylariales|Hypocreales|Xylariaceae|Cordycipitaceae|Xylaria,Fungi,Ascomycota,Sordariomycetes,Hypocreales,Xylariaceae,Xylaria polymorpha,314083,Xylaria,,"Cooke, William Bridge",,3/22/36,1936,3,22,82,,,United States,Ohio,Warren,Loveland,Loveland,39.268948,-84.263826,,,https://www.mycoportal.org/portal/collections/individual/index.php?occid=4397413
4397414,Fungi|Ascomycota|Pezizomycotina|Sordariomycetes|Xylariomycetidae|Hypocreomycetidae|Xylariales|Hypocreales|Xylariaceae|Cordycipitaceae|Xylaria,Fungi,Ascomycota,Sordariomycetes,Hypocreales,Xylariaceae,Xylaria polymorpha,314083,Xylaria,,"Cooke, William Bridge",,3/10/36,1936,3,10,70,,,United States,Ohio,Hamilton,Sycamore Creek,"South Fork, Sycamore Creek",39.247559,-84.322239,,,https://www.mycoportal.org/portal/collections/individual/index.php?occid=4397414
4397420,Fungi|Ascomycota|Pezizomycotina|Sordariomycetes|Xylariomycetidae|Hypocreomycetidae|Xylariales|Hypocreales|Xylariaceae|Cordycipitaceae|Xylaria,Fungi,Ascomycota,Sordariomycetes,Hypocreales,Xylariaceae,Xylaria polymorpha,314083,Xylaria,,"Diehl, George",,6/23/32,1932,6,23,175,,,United States,Ohio,Hamilton,Cincinnati,Hazelwood,39.266169,-84.362996,,,https://www.mycoportal.org/portal/collections/individual/index.php?occid=4397420
4397432,Fungi|Ascomycota|Pezizomycotina|Sordariomycetes|Xylariomycetidae|Hypocreomycetidae|Xylariales|Hypocreales|Xylariaceae|Cordycipitaceae|Xylaria,Fungi,Ascomycota,Sordariomycetes,Hypocreales,Xylariaceae,Xylaria hypoxylon,190576,Xylaria,,"Blickle, A.H.",,1935-08-00,1935,8,0,,,,Canada,Ontario,Muskoka Lakes,Bala,"Bala, Pewahee Isle, Lake Muskoka",45.033333,-79.45,,,https://www.mycoportal.org/portal/collections/individual/index.php?occid=4397432
4397442,Fungi|Ascomycota|Pezizomycotina|Sordariomycetes|Xylariomycetidae|Hypocreomycetidae|Xylariales|Hypocreales|Xylariaceae|Cordycipitaceae|Xylaria,Fungi,Ascomycota,Sordariomycetes,Hypocreales,Xylariaceae,Xylaria polymorpha,314083,Xylaria,,"Cooke, William Bridge",,10/10/35,1935,10,10,283,,,United States,Ohio,Clermont,Milford,South Milford,39.175338,-84.294382,,,https://www.mycoportal.org/portal/collections/individual/index.php?occid=4397442
4397446,Fungi|Ascomycota|Pezizomycotina|Sordariomycetes|Xylariomycetidae|Hypocreomycetidae|Xylariales|Hypocreales|Xylariaceae|Cordycipitaceae|Xylaria,Fungi,Ascomycota,Sordariomycetes,Hypocreales,Xylariaceae,Xylaria polymorpha,314083,Xylaria,,"Hopkins, W.C.",,10/16/38,1938,10,16,289,,dead wood,United States,Ohio,Adams,Mineral Springs,Mineral Springs,38.887016,-83.329354,,,https://www.mycoportal.org/portal/collections/individual/index.php?occid=4397446
4397449,Fungi|Ascomycota|Pezizomycotina|Sordariomycetes|Xylariomycetidae|Hypocreomycetidae|Xylariales|Hypocreales|Xylariaceae|Cordycipitaceae|Xylaria,Fungi,Ascomycota,Sordariomycetes,Hypocreales,Xylariaceae,Xylaria polymorpha,314083,Xylaria,,"Manley, M.L.",,12/16/38,1938,12,16,350,,on wood,United States,Ohio,Hamilton,Cincinnati,Mt. Airy Forest,39.165058,-84.574945,,,https://www.mycoportal.org/portal/collections/individual/index.php?occid=4397449
4397462,Fungi|Ascomycota|Pezizomycotina|Sordariomycetes|Xylariomycetidae|Hypocreomycetidae|Xylariales|Hypocreales|Xylariaceae|Cordycipitaceae|Xylaria,Fungi,Ascomycota,Sordariomycetes,Hypocreales,Xylariaceae,Xylaria polymorpha,314083,Xylaria,,"Cooke, William Bridge",,11/26/35,1935,11,26,330,,,United States,Ohio,Hamilton,,Salem Pike,39.079899,-84.405298,,,https://www.mycoportal.org/portal/collections/individual/index.php?occid=4397462
4397484,Fungi|Ascomycota|Pezizomycotina|Sordariomycetes|Xylariomycetidae|Hypocreomycetidae|Xylariales|Hypocreales|Xylariaceae|Cordycipitaceae|Xylaria,Fungi,Ascomycota,Sordariomycetes,Hypocreales,Xylariaceae,Xylaria polymorpha,314083,Xylaria,,s.n.,,10/1/32,1932,10,1,275,,on dead wood,United States,Ohio,Adams,,"Adams County, Ohio",38.845515,-83.472152,,,https://www.mycoportal.org/portal/collections/individual/index.php?occid=4397484
4397485,Fungi|Ascomycota|Pezizomycotina|Sordariomycetes|Xylariomycetidae|Hypocreomycetidae|Xylariales|Hypocreales|Xylariaceae|Cordycipitaceae|Xylaria,Fungi,Ascomycota,Sordariomycetes,Hypocreales,Xylariaceae,Xylaria polymorpha,314083,Xylaria,,"Fahnestack, G.",,1935-07-00,1935,7,0,,,,United States,Ohio,Brown,,"Brown County, Ohio",38.934048,-83.867428,,,https://www.mycoportal.org/portal/collections/individual/index.php?occid=4397485
4397487,Fungi|Ascomycota|Pezizomycotina|Sordariomycetes|Xylariomycetidae|Hypocreomycetidae|Xylariales|Hypocreales|Xylariaceae|Cordycipitaceae|Xylaria,Fungi,Ascomycota,Sordariomycetes,Hypocreales,Xylariaceae,Xylaria polymorpha,314083,Xylaria,,s.n.,,3/21/35,1935,3,21,80,,,United States,Ohio,Hamilton,Cincinnati,Burnet Woods,39.139271,-84.517276,,,https://www.mycoportal.org/portal/collections/individual/index.php?occid=4397487
4397488,Fungi|Ascomycota|Pezizomycotina|Sordariomycetes|Xylariomycetidae|Hypocreomycetidae|Xylariales|Hypocreales|Xylariaceae|Cordycipitaceae|Xylaria,Fungi,Ascomycota,Sordariomycetes,Hypocreales,Xylariaceae,Xylaria polymorpha,314083,Xylaria,,"Lillick, Lois",,10/2/32,1932,10,2,276,,dead log,United States,Kentucky,Campbell,Fort Thomas,Fort Thomas,39.075061,-84.447163,,,https://www.mycoportal.org/portal/collections/individual/index.php?occid=4397488
4397489,Fungi|Ascomycota|Pezizomycotina|Sordariomycetes|Xylariomycetidae|Hypocreomycetidae|Xylariales|Hypocreales|Xylariaceae|Cordycipitaceae|Xylaria,Fungi,Ascomycota,Sordariomycetes,Hypocreales,Xylariaceae,Xylaria polymorpha,314083,Xylaria,,"Blickle, A.H.",,1935-05-00,1935,5,0,,,,United States,Ohio,Hamilton,Glendale,Glendale,39.270613,-84.459387,,,https://www.mycoportal.org/portal/collections/individual/index.php?occid=4397489
4397490,Fungi|Ascomycota|Pezizomycotina|Sordariomycetes|Xylariomycetidae|Hypocreomycetidae|Xylariales|Hypocreales|Xylariaceae|Cordycipitaceae|Xylaria|Xylaria polymorpha,Fungi,Ascomycota,Sordariomycetes,Hypocreales,Xylariaceae,Xylaria polymorpha var. spathulata,564142,Xylaria,,"Sanders, P.J.",,7/4/64,1964,7,4,186,wooded hillside,base of maple stump,United States,Ohio,Hamilton,Cincinnati,Center Hill Life Science Field Station,39.196066,-84.508607,,,https://www.mycoportal.org/portal/collections/individual/index.php?occid=4397490
4397491,Fungi|Ascomycota|Pezizomycotina|Sordariomycetes|Xylariomycetidae|Hypocreomycetidae|Xylariales|Hypocreales|Xylariaceae|Cordycipitaceae|Xylaria,Fungi,Ascomycota,Sordariomycetes,Hypocreales,Xylariaceae,Xylaria polymorpha,314083,Xylaria,,"Cooke, William Bridge",,10/10/35,1935,10,10,283,,,United States,Ohio,Clermont,Milford,South Milford,39.175338,-84.294382,,,https://www.mycoportal.org/portal/collections/individual/index.php?occid=4397491
4397498,Fungi|Ascomycota|Pezizomycotina|Dothideomycetes|Dothideomycetidae|Polystomellaceae|Dothidella,Fungi,Ascomycota,Dothideomycetes,,Phyllachoraceae,Dothidella aristidae,177205,Dothidella,,"Cooke, William Bridge","Cooke, V.G.",10/28/50,1950,10,28,301,in Artemisia tridentata community along roadside,on Distichlis stricta,United States,Washington,Adams,,"along U.S. Highway 10, 22.8 miles west of Ritzville",47.127282,-118.676939,,,https://www.mycoportal.org/portal/collections/individual/index.php?occid=4397498
4397499,Fungi|Ascomycota|Pezizomycotina|Dothideomycetes|Dothideomycetidae|Polystomellaceae|Dothidella,Fungi,Ascomycota,Dothideomycetes,,Schizoparmaceae,Dothidella castaneicola,177224,Dothidella,,"Bonar, L.",,7/11/37,1937,7,11,192,,On Castanopis chrysophylla,United States,California,Mendocino,,"Pygmy Forest, two miles east of Van Damme State Park",39.276287,-123.774458,,,https://www.mycoportal.org/portal/collections/individual/index.php?occid=4397499
4397500,Fungi|Ascomycota|Pezizomycotina|Dothideomycetes|Dothideomycetidae|Polystomellaceae|Dothidella,Fungi,Ascomycota,Dothideomycetes,,Schizoparmaceae,Dothidella castaneicola,177224,Dothidella,,"Cooke, William Bridge",,7/22/38,1938,7,22,203,Chaparral. Common on occasional bushes.,on Castanopis chrysophylla,United States,California,Siskiyou,Mt. Shasta,Along the Sisson Southern Trail,41.339569,-122.287735,1524,,https://www.mycoportal.org/portal/collections/individual/index.php?occid=4397500
4397501,Fungi|Ascomycota|Pezizomycotina|Dothideomycetes|Dothideomycetidae|Polystomellaceae|Dothidella,Fungi,Ascomycota,Dothideomycetes,,Schizoparmaceae,Dothidella castaneicola,177224,Dothidella,,"Cooke, William Bridge",,6/24/37,1937,6,24,175,Occasional on the host throughout the chaparral,On Castanopis chrysophylla,United States,California,Siskiyou,Mt. Shasta,Along Sisson Southern Trail (near type locality),41.339569,-122.287735,1219,,https://www.mycoportal.org/portal/collections/individual/index.php?occid=4397501
4397502,Fungi|Ascomycota|Pezizomycotina|Dothideomycetes|Dothideomycetidae|Polystomellaceae|Dothidella,Fungi,Ascomycota,Dothideomycetes,,Polystomellaceae,Dothidella castanopsidis,177226,Dothidella,,"Cooke, William Bridge",,5/29/42,1942,5,29,149,Occasional on shrubs scattered through the chaparral,On Castanopis chrysophylla,United States,California,Siskiyou,Mt. Shasta,along the Sisson Southern Trail near MacBride Springs; 41.31 -122.30944,41.353003,-122.279152,,,https://www.mycoportal.org/portal/collections/individual/index.php?occid=4397502
4397503,Fungi|Ascomycota|Pezizomycotina|Dothideomycetes|Dothideomycetidae|Polystomellaceae|Dothidella,Fungi,Ascomycota,Dothideomycetes,,Polystomellaceae,Dothidella castanopsidis,177226,Dothidella,,"Cooke, William Bridge",,6/25/37,1937,6,25,176,,On Castanopis sempervirens,United States,California,Siskiyou,Mt. Shasta,Sisson Trail,41.339569,-122.287735,1082,1524,https://www.mycoportal.org/portal/collections/individual/index.php?occid=4397503
4397504,Fungi|Ascomycota|Pezizomycotina|Dothideomycetes|Dothideomycetidae|Polystomellaceae|Dothidella,Fungi,Ascomycota,Dothideomycetes,,Phyllachoraceae,Dothidella junci,177270,Dothidella,,"Cooke, William Bridge",,9/17/38,1938,9,17,260,,on Juncus parryi,United States,California,Siskiyou,Mt. Shasta,Cascade Gulch,41.339041,-122.293344,2134,,https://www.mycoportal.org/portal/collections/individual/index.php?occid=4397504
4397505,Fungi|Ascomycota|Pezizomycotina|Dothideomycetes|Dothideomycetidae|Polystomellaceae|Dothidella,Fungi,Ascomycota,Dothideomycetes,,Phyllachoraceae,Dothidella junci,177270,Dothidella,,"Cooke, William Bridge",,8/17/37,1937,8,17,229,Common on leaves and culms,on Juncus parryi,United States,California,Siskiyou,Mt. Shasta,near the South Gate,41.365928,-122.171961,2499,,https://www.mycoportal.org/portal/collections/individual/index.php?occid=4397505
4397507,,,,,,Sydowiellaceae,Dothidella ulmea,635725,Dothidella,,"Kelsey, F.D.",,1893-08-23,1893,8,23,235,,elm leaves,United States,Massachusetts,Essex,Andover,Andover,42.658425,-71.137001,,,https://www.mycoportal.org/portal/collections/individual/index.php?occid=4397507
4397508,Fungi|Ascomycota|Pezizomycotina|Sordariomycetes|Dothideomycetes|Sordariomycetidae|Dothideomycetidae|Dothideales|Diaporthales|Melogrammataceae|Dothioraceae|Dothiora,Fungi,Ascomycota,Dothideomycetes,Diaporthales,Dothioraceae,Dothiora salicis,177462,Dothiora,,"Vestergren, T.",,3/22/13,1913,3,22,81,,on dead Salix fragilis,Sweden,Solna,Norrtlje,Bergshamra,Bergshamra,59.635383,18.659834,,,https://www.mycoportal.org/portal/collections/individual/index.php?occid=4397508
4397509,Fungi|Ascomycota|Pezizomycotina|Dothideomycetes|Dothideomycetidae|Myriangiales|Elsinoaceae|Elsino,Fungi,Ascomycota,Dothideomycetes,Myriangiales,Elsinoaceae,Elsino ledi,179435,Elsino,,"Bonar, L.","Parks, H.E.",7/12/33,1933,7,12,193,,on Ledum glandulosum,United States,California,Humboldt,Big Lagoon,Big Lagoon,41.159613,-124.134342,,,https://www.mycoportal.org/portal/collections/individual/index.php?occid=4397509
4398759,Fungi|Ascomycota|Pezizomycotina|Sordariomycetes|Xylariomycetidae|Xylariales|Hypoxylaceae|Xylariaceae|Sphaeria,Fungi,Ascomycota,Sordariomycetes,Xylariales,Phyllachoraceae,Sphaeria aristidae,425782,Sphaeria,,"Earle, F.S.","Baker, C.F.",1897-10-14,1897,10,14,287,,on Aristida sp.,United States,Alabama,Lee,Auburn,Auburn,32.609857,-85.480782,,,https://www.mycoportal.org/portal/collections/individual/index.php?occid=4398759
4398763,Fungi|Ascomycota|Pezizomycotina|Dothideomycetes|Dothideomycetidae|Dothideales|Dothideaceae|Dothidea,Fungi,Ascomycota,Dothideomycetes,Dothideales,Dothideaceae,Dothidea perisporioides,177060,Dothidea,,"Kellerman, W.A.",Swingle,1886-00-00,1886,0,0,,,on Psoralea sp.,United States,Kansas,Riley,Manhattan,Manhattan,39.183608,-96.571669,,,https://www.mycoportal.org/portal/collections/individual/index.php?occid=4398763
4398765,Fungi|Ascomycota|Pezizomycotina|Sordariomycetes|Dothideomycetes|Dothideomycetidae|Dothideales|Phyllachorales|Dothideaceae|Phyllachoraceae|Phyllachora,Fungi,Ascomycota,Dothideomycetes,Phyllachorales,Phyllachoraceae,Phyllachora graminis,187325,Phyllachora,,"Sprague, R.",,9/24/37,1937,9,24,267,,on Festuca rubra,United States,Oregon,Clatsop,Astoria,Astoria,46.187884,-123.831253,,,https://www.mycoportal.org/portal/collections/individual/index.php?occid=4398765
4398766,Fungi|Ascomycota|Pezizomycotina|Sordariomycetes|Dothideomycetes|Dothideomycetidae|Dothideales|Phyllachorales|Dothideaceae|Phyllachoraceae|Phyllachora,Fungi,Ascomycota,Dothideomycetes,Phyllachorales,Phyllachoraceae,Phyllachora graminis,187325,Phyllachora,,"Brenckle, J.F.",,1908-09-00,1908,9,0,,,on Sporobolus asperifolius,United States,North Dakota,Lamoure,Kulm,Kulm,46.301914,-98.948162,,,https://www.mycoportal.org/portal/collections/individual/index.php?occid=4398766
4398767,Fungi|Ascomycota|Pezizomycotina|Sordariomycetes|Dothideomycetes|Dothideomycetidae|Dothideales|Phyllachorales|Dothideaceae|Phyllachoraceae|Phyllachora,Fungi,Ascomycota,Dothideomycetes,Phyllachorales,Phyllachoraceae,Phyllachora graminis,187325,Phyllachora,,"Cooke, William Bridge",,11/12/39,1939,11,12,316,in open field,,United States,Ohio,Warren,Foster,Foster,39.319226,-84.252993,,,https://www.mycoportal.org/portal/collections/individual/index.php?occid=4398767
4398768,Fungi|Ascomycota|Pezizomycotina|Sordariomycetes|Dothideomycetes|Dothideomycetidae|Dothideales|Phyllachorales|Dothideaceae|Phyllachoraceae|Phyllachora,Fungi,Ascomycota,Dothideomycetes,Phyllachorales,Phyllachoraceae,Phyllachora graminis,187325,Phyllachora,,"Cooke, William Bridge",,11/12/39,1939,11,12,316,in open field,,United States,Ohio,Warren,Foster,Foster,39.319226,-84.252993,,,https://www.mycoportal.org/portal/collections/individual/index.php?occid=4398768
4398770,Fungi|Ascomycota|Pezizomycotina|Sordariomycetes|Dothideomycetes|Dothideomycetidae|Dothideales|Phyllachorales|Dothideaceae|Phyllachoraceae|Phyllachora,Fungi,Ascomycota,Dothideomycetes,Phyllachorales,Phyllachoraceae,Phyllachora graminis,187325,Phyllachora,,"Kellerman, W.A.",,12/20/01,1901,12,20,354,,on Elymus canadensis,United States,Ohio,Franklin,Columbus,Columbus,39.961176,-82.998794,,,https://www.mycoportal.org/portal/collections/individual/index.php?occid=4398770
4398771,Fungi|Ascomycota|Pezizomycotina|Sordariomycetes|Dothideomycetes|Dothideomycetidae|Dothideales|Phyllachorales|Dothideaceae|Phyllachoraceae|Phyllachora,Fungi,Ascomycota,Dothideomycetes,Phyllachorales,Phyllachoraceae,Phyllachora graminis,187325,Phyllachora,,"Kellerman, W.A.",,12/20/01,1901,12,20,354,,on Elymus canadensis,United States,Ohio,Franklin,Columbus,Columbus,39.961176,-82.998794,,,https://www.mycoportal.org/portal/collections/individual/index.php?occid=4398771
4398772,Fungi|Ascomycota|Pezizomycotina|Sordariomycetes|Dothideomycetes|Dothideomycetidae|Dothideales|Phyllachorales|Dothideaceae|Phyllachoraceae|Phyllachora,Fungi,Ascomycota,Dothideomycetes,Phyllachorales,Phyllachoraceae,Phyllachora graminis,187325,Phyllachora,,"Cooke, William Bridge",,11/5/39,1939,11,5,309,,on Elymus sp.,United States,Ohio,Warren,Foster,along Pennsylvania R.R. tracks between Kings Mill and Foster,39.319226,-84.252993,,,https://www.mycoportal.org/portal/collections/individual/index.php?occid=4398772
4398773,Fungi|Ascomycota|Pezizomycotina|Sordariomycetes|Dothideomycetes|Dothideomycetidae|Dothideales|Phyllachorales|Dothideaceae|Phyllachoraceae|Phyllachora,Fungi,Ascomycota,Dothideomycetes,Phyllachorales,Phyllachoraceae,Phyllachora graminis,187325,Phyllachora,,"Brenckle, J.F.",,1908-01-00,1908,1,0,,,on Muhlenbergia diffusa,United States,North Dakota,Lamoure,Kulm,Kulm,46.301914,-98.948162,,,https://www.mycoportal.org/portal/collections/individual/index.php?occid=4398773
4398774,Fungi|Ascomycota|Pezizomycotina|Sordariomycetes|Dothideomycetes|Dothideomycetidae|Dothideales|Phyllachorales|Dothideaceae|Phyllachoraceae|Phyllachora,Fungi,Ascomycota,Dothideomycetes,Phyllachorales,Phyllachoraceae,Phyllachora graminis,187325,Phyllachora,,"Kellerman, W.A.",,10/12/01,1901,10,12,285,,on Panicum clandestinum,United States,Ohio,Fairfield,Sugar Grove,Sugar Grove,39.626454,-82.548493,,,https://www.mycoportal.org/portal/collections/individual/index.php?occid=4398774
4398775,Fungi|Ascomycota|Pezizomycotina|Sordariomycetes|Dothideomycetes|Dothideomycetidae|Dothideales|Phyllachorales|Dothideaceae|Phyllachoraceae|Phyllachora,Fungi,Ascomycota,Dothideomycetes,Phyllachorales,Phyllachoraceae,Phyllachora graminis,187325,Phyllachora,,s.n.,,1898-11-11,1898,11,11,315,,on Agropyron semicostatum,Japan,Kant?,Honshu,Tokyo,Botanical Gardens of Tokyo,35.685,139.751389,,,https://www.mycoportal.org/portal/collections/individual/index.php?occid=4398775
4398776,Fungi|Ascomycota|Pezizomycotina|Sordariomycetes|Dothideomycetes|Dothideomycetidae|Dothideales|Phyllachorales|Dothideaceae|Phyllachoraceae|Phyllachora,Fungi,Ascomycota,Dothideomycetes,Phyllachorales,Phyllachoraceae,Phyllachora graminis,187325,Phyllachora,,"Kellerman, W.A.",,10/12/01,1901,10,12,285,,on Panicum clandestinum,United States,Ohio,Fairfield,Sugar Grove,Sugar Grove,39.626454,-82.548493,,,https://www.mycoportal.org/portal/collections/individual/index.php?occid=4398776
4398778,Fungi|Ascomycota|Pezizomycotina|Sordariomycetes|Dothideomycetes|Dothideomycetidae|Dothideales|Phyllachorales|Dothideaceae|Phyllachoraceae|Phyllachora,Fungi,Ascomycota,Dothideomycetes,Phyllachorales,Phyllachoraceae,Phyllachora lespedezae,187350,Phyllachora,,"Kellerman, W.A.",,9/2/01,1901,9,2,245,,on Lespedeza capitata,United States,Ohio,Wood,Bowling Green,Bowling Green,41.374774,-83.651323,,,https://www.mycoportal.org/portal/collections/individual/index.php?occid=4398778
4398779,Fungi|Ascomycota|Pezizomycotina|Sordariomycetes|Dothideomycetes|Dothideomycetidae|Dothideales|Phyllachorales|Dothideaceae|Phyllachoraceae|Phyllachora,Fungi,Ascomycota,Dothideomycetes,Phyllachorales,Phyllachoraceae,Phyllachora luteomaculata,371998,Phyllachora,,"Cooke, William Bridge",,10/10/39,1939,10,10,283,creek bottoms,on Andropogon fuscata,United States,Ohio,Highland,Seven Caves,Rocky Fork of Paint Creek at 7 Caves,39.232381,-83.344432,,,https://www.mycoportal.org/portal/collections/individual/index.php?occid=4398779
4398780,Fungi|Ascomycota|Pezizomycotina|Sordariomycetes|Dothideomycetes|Dothideomycetidae|Dothideales|Phyllachorales|Dothideaceae|Phyllachoraceae|Phyllachora,Fungi,Ascomycota,Dothideomycetes,Phyllachorales,Phyllachoraceae,Phyllachora luteomaculata,371998,Phyllachora,,"Cooke, William Bridge",,10/10/39,1939,10,10,283,creek bottoms,,United States,Ohio,Highland,,Rocky Fork of Paint Creek at Seven Caves,39.231783,-83.346406,,,https://www.mycoportal.org/portal/collections/individual/index.php?occid=4398780
4398781,Fungi|Ascomycota|Pezizomycotina|Sordariomycetes|Dothideomycetes|Dothideomycetidae|Dothideales|Phyllachorales|Dothideaceae|Phyllachoraceae|Phyllachora,Fungi,Ascomycota,Dothideomycetes,Phyllachorales,Phyllachoraceae,Phyllachora luteomaculata,371998,Phyllachora,,"Cooke, William Bridge",,10/10/39,1939,10,10,283,Common on occasional clumps of the host in the gorge,on Andropogon furcatus,United States,Ohio,Highland,Seven Caves,"Rocky Fork gorge, Paint Creek, Seven Caves",39.232381,-83.344432,,,https://www.mycoportal.org/portal/collections/individual/index.php?occid=4398781
4398782,Fungi|Ascomycota|Pezizomycotina|Sordariomycetes|Dothideomycetes|Dothideomycetidae|Dothideales|Phyllachorales|Dothideaceae|Phyllachoraceae|Phyllachora,Fungi,Ascomycota,Dothideomycetes,Phyllachorales,Phyllachoraceae,Phyllachora puncta,187394,Phyllachora,,"Cooke, William Bridge",,10/10/39,1939,10,10,283,,on Panicum latifolium,United States,Ohio,Highland,,Rocky Fork gorge of Paint Creek at Seven Caves,39.232381,-83.344432,,,https://www.mycoportal.org/portal/collections/individual/index.php?occid=4398782
4398783,Fungi|Ascomycota|Pezizomycotina|Sordariomycetes|Dothideomycetes|Dothideomycetidae|Dothideales|Phyllachorales|Dothideaceae|Phyllachoraceae|Phyllachora,Fungi,Ascomycota,Dothideomycetes,Phyllachorales,Phyllachoraceae,Phyllachora puncta,187394,Phyllachora,,"Cooke, William Bridge",,10/10/39,1939,10,10,283,common on creek bottoms,on Panicum latifolium,United States,Ohio,Highland,Seven Caves,Seven Caves (Highlands Nature Sanctuary),39.344508,-83.59742,,,https://www.mycoportal.org/portal/collections/individual/index.php?occid=4398783
4398784,Fungi|Ascomycota|Pezizomycotina|Sordariomycetes|Dothideomycetes|Dothideomycetidae|Dothideales|Phyllachorales|Dothideaceae|Phyllachoraceae|Phyllachora,Fungi,Ascomycota,Dothideomycetes,Phyllachorales,Phyllachoraceae,Phyllachora tracyi,372446,Phyllachora,,"Brenckle, J.F.",,1908-08-00,1908,8,0,,,on Distichlis maritima,United States,North Dakota,Lamoure,Kulm,Kulm,46.301914,-98.948162,,,https://www.mycoportal.org/portal/collections/individual/index.php?occid=4398784
4398785,Fungi|Ascomycota|Pezizomycotina|Sordariomycetes|Dothideomycetes|Dothideomycetidae|Dothideales|Phyllachorales|Dothideaceae|Phyllachoraceae|Phyllachora,Fungi,Ascomycota,Dothideomycetes,Phyllachorales,Phyllachoraceae,Phyllachora vulgata,372498,Phyllachora,,"Cooke, William Bridge",,11/12/39,1939,11,12,316,in open field,,United States,Ohio,Warren,Foster,Foster,39.319226,-84.252993,,,https://www.mycoportal.org/portal/collections/individual/index.php?occid=4398785
4398786,Fungi|Ascomycota|Pezizomycotina|Sordariomycetes|Dothideomycetes|Dothideomycetidae|Dothideales|Phyllachorales|Dothideaceae|Phyllachoraceae|Phyllachora,Fungi,Ascomycota,Dothideomycetes,Phyllachorales,Phyllachoraceae,Phyllachora vulgata,372498,Phyllachora,,"Cooke, William Bridge",,10/10/39,1939,10,10,283,along creek bottoms,,United States,Ohio,Highland,Seven Caves,Seven Caves,39.222845,-83.355158,,,https://www.mycoportal.org/portal/collections/individual/index.php?occid=4398786
4398787,Fungi|Ascomycota|Pezizomycotina|Sordariomycetes|Dothideomycetes|Dothideomycetidae|Dothideales|Phyllachorales|Dothideaceae|Phyllachoraceae|Phyllachora,Fungi,Ascomycota,Dothideomycetes,Phyllachorales,Phyllachoraceae,Phyllachora vulgata,372498,Phyllachora,,"Cooke, William Bridge",,10/10/39,1939,10,10,283,along creek bottom,,United States,Ohio,Highland,Seven Caves,Seven Caves (Highlands Nature Sanctuary),39.344508,-83.59742,,,https://www.mycoportal.org/portal/collections/individual/index.php?occid=4398787
4398788,Fungi|Ascomycota|Pezizomycotina|Sordariomycetes|Dothideomycetes|Dothideomycetidae|Dothideales|Phyllachorales|Dothideaceae|Phyllachoraceae|Phyllachora,Fungi,Ascomycota,Dothideomycetes,Phyllachorales,Phyllachoraceae,Phyllachora vulgata,372498,Phyllachora,,"Cooke, William Bridge",,10/20/39,1939,10,20,293,in abandoned field,on Muhlenbergia sp.,United States,Ohio,Warren,Hopkinsville,Hopkinsville,39.338948,-84.219659,,,https://www.mycoportal.org/portal/collections/individual/index.php?occid=4398788
4398789,Fungi|Ascomycota|Pezizomycotina|Dothideomycetes|Pleosporomycetidae|Pleosporales|Venturiaceae|Platychora,Fungi,Ascomycota,Dothideomycetes,Pleosporales,Polystomellaceae,Platychora ulmi,379459,Platychora,,"Smarods, Julijs",,9/19/37,1937,9,19,262,,on Ulmus campestris,Latvia,Vidzeme,Riga,Sigulda,Sigulda,57.149151,24.860945,,,https://www.mycoportal.org/portal/collections/individual/index.php?occid=4398789
4398790,Fungi|Ascomycota|Pezizomycotina|Dothideomycetes|Dothideomycetidae|Dothideales|Dothioraceae|Plowrightia,Fungi,Ascomycota,Dothideomycetes,Dothideales,Venturiaceae,Plowrightia morbosa,382332,Plowrightia,,"Brenckle, J.F.",,1909-07-00,1909,7,0,,,on Prunus sp.,United States,North Dakota,Logan,Beaver Lake,Beaver Lake,46.395981,-99.606642,,,https://www.mycoportal.org/portal/collections/individual/index.php?occid=4398790
4398791,Fungi|Ascomycota|Pezizomycotina|Dothideomycetes|Dothideomycetidae|Capnodiales|Scirrhia,Fungi,Ascomycota,Dothideomycetes,Capnodiales,Dothideaceae,Scirrhia rimosa,189075,Scirrhia,,"Smarods, Julijs",,5/23/37,1937,5,23,143,,on Phragmites vulgaris,Latvia,Vidzeme,Riga,?da?i,?da?i,57.075833,24.321389,,,https://www.mycoportal.org/portal/collections/individual/index.php?occid=4398791
4398801,Fungi|Ascomycota|Pezizomycotina|Dothideomycetes|Dothideomycetidae|Capnodiales|Asterinaceae|Asterina,Fungi,Ascomycota,Dothideomycetes,Capnodiales,Venturiaceae,Asterina plantaginis,107433,Asterina,,"Kelsey, F.D.","Cowles, H.C.",1893-11-11,1893,11,11,315,,on Plantago rugelii,United States,Ohio,Lorain,Oberlin,Oberlin,41.293939,-82.217379,,,https://www.mycoportal.org/portal/collections/individual/index.php?occid=4398801
4398805,Fungi|Ascomycota|Pezizomycotina|Dothideomycetes|Dothideomycetidae|Capnodiales|Asterinaceae|Dimerosporium,Fungi,Ascomycota,Dothideomycetes,Capnodiales,Venturiaceae,Dimerosporium collinsii,172980,Dimerosporium,,"Kellerman, W.A.",,10/18/04,1904,10,18,292,,on Amelanchier canadensis,United States,Ohio,Fairfield,Lancaster,Lancaster,39.713675,-82.599329,,,https://www.mycoportal.org/portal/collections/individual/index.php?occid=4398805
4398809,Fungi|Ascomycota|Pezizomycotina|Leotiomycetes|Leotiomycetidae|Helotiales|Catinula,Fungi,Ascomycota,Leotiomycetes,Helotiales,Dothioraceae,Catinula turgida,128788,Catinula,,"Vestergren, T.",,1913-02-00,1913,2,0,,,on Corylus avellana,Sweden,,,Stockholm,Stockholm,59.3283,18.072,,,https://www.mycoportal.org/portal/collections/individual/index.php?occid=4398809
4398812,Fungi|Ascomycota|Pezizomycotina|Dothideomycetes|Dothideomycetidae|Capnodiales|Asterinaceae|Dimerosporium,Fungi,Ascomycota,Dothideomycetes,Capnodiales,Euantennariaceae,Dimerosporium abietis,172946,Dimerosporium,,"Tracy, J.P.","Parks, H.E.",1931-05-00,1931,5,0,,,on Abies grandis,United States,California,Humboldt,Trinidad,Mill Creek,41.088116,-124.107222,,,https://www.mycoportal.org/portal/collections/individual/index.php?occid=4398812
4398817,Fungi|Ascomycota|Pezizomycotina|Dothideomycetes|Dothideomycetidae|Capnodiales|Asterinaceae|Dimerosporium,Fungi,Ascomycota,Dothideomycetes,Capnodiales,Asterinaceae,Dimerosporium tropicale,173101,Dimerosporium,,"Earle, F.S.",,1887-01-21,1887,1,21,21,,on Bignonia capreolata,United States,Mississippi,Jackson,Ocean Springs,Ocean Springs,30.41131,-88.827806,,,https://www.mycoportal.org/portal/collections/individual/index.php?occid=4398817
4398819,Fungi|Ascomycota|Pezizomycotina|Dothideomycetes|Dothideomycetidae|Capnodiales|Asterinaceae|Lembosia,Fungi,Ascomycota,Dothideomycetes,Capnodiales,Asterinaceae,Lembosia coccolobae,268141,Lembosia,,"Kevorkian, A.G.",,9/8/35,1935,9,8,251,,on Coccoloba uvifera,Cuba,Santa Clara,,Soledad,"Soledad, Santa Clara Province",22.518712,-79.983583,,,https://www.mycoportal.org/portal/collections/individual/index.php?occid=4398819
4398820,Fungi|Ascomycota|Pezizomycotina|Dothideomycetes|Dothideomycetidae|Microthyriales|Microthyriaceae|Microthyrium,Fungi,Ascomycota,Dothideomycetes,Microthyriales,Microthyriaceae,Microthyrium pinophyllum,185779,Microthyrium,,"Parks, H.E.","Parks, S.T.",1938-11-00,1938,11,0,,,on needles of Pinus lambertiana,United States,California,Del Norte,Darlingtonia,Smith River,41.836224,-123.94313,122,183,https://www.mycoportal.org/portal/collections/individual/index.php?occid=4398820
4398823,Fungi|Ascomycota|Pezizomycotina|Dothideomycetes|Dothideomycetidae|Microthyriales|Muyocopronaceae|Microthyriaceae|Ellisiodothis,Fungi,Ascomycota,Dothideomycetes,Microthyriales,Muyocopronaceae,Ellisiodothis inquinans,179315,Ellisiodothis,,"Kevorkian, A.G.",,9/17/35,1935,9,17,260,,on palm,Cuba,Santa Clara,,Soledad,Soledad,20.416667,-75.466667,,,https://www.mycoportal.org/portal/collections/individual/index.php?occid=4398823
4398833,Fungi|Ascomycota|Pezizomycotina|Dothideomycetes|Pleosporomycetidae|Pleosporales|Venturiaceae|Dibotryon,Fungi,Ascomycota,Dothideomycetes,Pleosporales,Venturiaceae,Dibotryon morbosum,169486,Dibotryon,,"Cooke, William Bridge","Cooke, V.G.",6/1/46,1946,6,1,152,Common on a colony of low shrubs among pines,on Prunus pumila,United States,Michigan,Delta,,"Along U.S. Highway 2, near Ensign, Upper Penninsula, Hiawatha National Forest",45.897467,-86.86903,,,https://www.mycoportal.org/portal/collections/individual/index.php?occid=4398833
4398836,Fungi|Ascomycota|Pezizomycotina|Dothideomycetes|Pleosporomycetidae|Pleosporales|Lophiostomataceae|Lophiostoma,Fungi,Ascomycota,Dothideomycetes,Pleosporales,Lophiostomataceae,Lophiostoma praemorsum,278032,Lophiostoma,,Ellis,,1895-08-01,1895,8,1,213,,on Rubus,,,,,,9999.99,9999.99,,,https://www.mycoportal.org/portal/collections/individual/index.php?occid=4398836
4398839,Fungi|Ascomycota|Pezizomycotina|Dothideomycetes|Pleosporomycetidae|Pleosporales|Venturiaceae|Dibotryon,Fungi,Ascomycota,Dothideomycetes,Pleosporales,Venturiaceae,Dibotryon morbosum,169486,Dibotryon,,"Cooke, William Bridge","Cooke, V.G.",6/28/46,1946,6,28,179,Chaparral,on Prunus demisa,United States,California,Siskiyou,Mt. Shasta,"Along the old snowline highway, 4500 ft.",41.388514,-122.261868,1372,,https://www.mycoportal.org/portal/collections/individual/index.php?occid=4398839
4398841,Fungi|Ascomycota|Pezizomycotina|Leotiomycetes|Leotiomycetidae|Rhytismatales|Rhytismataceae|Lophodermium,Fungi,Ascomycota,Leotiomycetes,Rhytismatales,Rhytismataceae,Lophodermium phloxii,278529,Lophodermium,,"Cooke, William Bridge",,7/5/38,1938,7,5,186,On a colony of the host occurring in a gravel flat,on Phlox douglasii,United States,California,Siskiyou,Mt. Shasta,In gravel flat below Horse Camp,41.37252,-122.23153,2377,,https://www.mycoportal.org/portal/collections/individual/index.php?occid=4398841
4398842,,,,,,,Pyrenomycetes,623743,,,"Gray, Carolynne",,10/15/38,1938,10,15,288,,dead bark,United States,Ohio,Adams,,"Adams County, Ohio",38.845515,-83.472152,,,https://www.mycoportal.org/portal/collections/individual/index.php?occid=4398842
4398843,Fungi|Ascomycota|Pezizomycotina|Dothideomycetes|Botryosphaeriales|Botryosphaeriaceae,Fungi,Ascomycota,Dothideomycetes,Botryosphaeriales,Botryosphaeriaceae,Dothiorella,8456,Dothiorella,,"Cooke, William Bridge",,12/4/33,1933,12,4,338,,oak twigs,United States,Ohio,Clermont,Dark Hollow,Dark Hollow,38.915352,-82.693222,,,https://www.mycoportal.org/portal/collections/individual/index.php?occid=4398843
4398844,,,,,,,Pyrenomycetes,623743,,,"Cosner, L.",,10/16/38,1938,10,16,289,,on dead wood,United States,Ohio,Adams,Mineral Springs,Mineral Springs,38.887016,-83.329354,,,https://www.mycoportal.org/portal/collections/individual/index.php?occid=4398844
4398845,,,,,,,Pyrenomycetes,623743,,,"Gray, Carolynne",,10/15/38,1938,10,15,288,,dead twig,United States,Ohio,Adams,,"Adams County, Ohio",38.845515,-83.472152,,,https://www.mycoportal.org/portal/collections/individual/index.php?occid=4398845
4398847,,,,,,,Pyrenomycetes,623743,,,"Gray, Carolynne",,10/15/38,1938,10,15,288,,dead tree,United States,Ohio,Adams,Beaver Pond,Beaver Pond,38.939515,-83.346299,,,https://www.mycoportal.org/portal/collections/individual/index.php?occid=4398847
4398848,Fungi|Basidiomycota|Ascomycota|Pezizomycotina|Agaricomycotina|Leotiomycetes|Agaricomycetes|Leotiomycetidae|Agaricomycetidae|Helotiales|Agaricales|Mycenaceae|Helotiaceae|Helotium,Fungi,Ascomycota,Agaricomycetes,Agaricales,Helotiaceae,Helotium virgultorum,237933,Helotium,,"Vestergren, T.",,9/14/12,1912,9,14,258,,on Tilia europaea,Sweden,,Stockholm,Solna,Solna,59.369052,18.009877,,,https://www.mycoportal.org/portal/collections/individual/index.php?occid=4398848
4398849,Fungi|Basidiomycota|Ascomycota|Pezizomycotina|Agaricomycotina|Leotiomycetes|Agaricomycetes|Leotiomycetidae|Agaricomycetidae|Helotiales|Agaricales|Mycenaceae|Helotiaceae|Helotium,Fungi,Ascomycota,Agaricomycetes,Agaricales,Helotiaceae,Helotium virgultorum,237933,Helotium,,"Cooke, William Bridge","Cooke, V.G.",10/29/49,1949,10,29,302,On various kinds of sticks in the litter under Symphoricarpos albus and Rosa spauldingii in near-climax scrub on southest facing slope,,United States,Idaho,Lewis,,"3.2 miles west of Mohler, northwest side of State Route 12, between Nez Perce and Craigmont",46.289594,-116.4133,975,,https://www.mycoportal.org/portal/collections/individual/index.php?occid=4398849
4398851,Fungi|Ascomycota|Pezizomycotina|Leotiomycetes|Leotiomycetidae|Helotiales|Hyaloscyphaceae|Hyaloscypha,Fungi,Ascomycota,Leotiomycetes,Helotiales,Hyaloscyphaceae,Hyaloscypha atomaria,242603,Hyaloscypha,,"Cooke, William Bridge","Cooke, V.G.",6/22/47,1947,6,22,173,Shasta Fir Forest,on Abies magnifica v. shastensis,United States,California,Siskiyou,Mt. Shasta,"Horse Camp, Mt. Shasta",41.31,-122.30944,2438,,https://www.mycoportal.org/portal/collections/individual/index.php?occid=4398851
4398852,Fungi|Ascomycota|Pezizomycotina|Leotiomycetes|Leotiomycetidae|Helotiales|Hyaloscyphaceae|Hyaloscypha,Fungi,Ascomycota,Leotiomycetes,Helotiales,Hyaloscyphaceae,Hyaloscypha atomaria,242603,Hyaloscypha,,"Cooke, William Bridge","Cooke, V.G.",6/25/46,1946,6,25,176,Shasta Fir forest,on Abies magnifica v. shastensis,United States,California,Siskiyou,Mt. Shasta,Horse Camp,41.372268,-122.229867,2438,,https://www.mycoportal.org/portal/collections/individual/index.php?occid=4398852
4398855,Fungi|Ascomycota|Pezizomycotina|Leotiomycetes|Leotiomycetidae|Helotiales|Hyaloscyphaceae|Lachnum,Fungi,Ascomycota,Leotiomycetes,Helotiales,Lachnaceae,Lachnum bicolor,184704,Lachnum,,"Cooke, William Bridge",,7/18/41,1941,7,18,199,,On Castanopis chrysophylla,United States,California,Siskiyou,Mt. Shasta,Mt. Shasta,41.40932,-122.195009,1829,,https://www.mycoportal.org/portal/collections/individual/index.php?occid=4398855
4398859,Fungi|Ascomycota|Pezizomycotina|Leotiomycetes|Leotiomycetidae|Helotiales|Hyaloscyphaceae|Lachnum,Fungi,Ascomycota,Leotiomycetes,Helotiales,Lachnaceae,Lachnum bicolor,184704,Lachnum,,"Cooke, William Bridge","Cooke, V.G.",6/6/50,1950,6,6,157,On twigs of shrubs in lodgepole pine woods,on Sheperdia canadensis,United States,Washington,Stevens,,Along Washington State Route 8-A near Little Pend Oreille Lakes,48.629632,-117.532467,,,https://www.mycoportal.org/portal/collections/individual/index.php?occid=4398859
4398862,Fungi|Ascomycota|Pezizomycotina|Leotiomycetes|Leotiomycetidae|Helotiales|Hyaloscyphaceae|Lachnum,Fungi,Ascomycota,Leotiomycetes,Helotiales,Lachnaceae,Lachnum bicolor,184704,Lachnum,,"Cooke, William Bridge",,7/18/41,1941,7,18,199,,on Ceanothus veluntinus,United States,California,Siskiyou,Mt. Shasta,Mt. Shasta,41.40932,-122.195009,1829,,https://www.mycoportal.org/portal/collections/individual/index.php?occid=4398862
4398865,Fungi|Ascomycota|Pezizomycotina|Leotiomycetes|Leotiomycetidae|Helotiales|Hyaloscyphaceae|Lachnellula,Fungi,Ascomycota,Leotiomycetes,Helotiales,Hyaloscyphaceae,Lachnellula chrysophthalma,256831,Lachnellula,,"Cooke, William Bridge",,7/28/41,1941,7,28,209,,on Pinus albicaulis,United States,California,Siskiyou,Mt. Shasta,near Horse Camp,41.372268,-122.229867,2499,,https://www.mycoportal.org/portal/collections/individual/index.php?occid=4398865
4398867,Fungi|Ascomycota|Pezizomycotina|Leotiomycetes|Leotiomycetidae|Helotiales|Hyaloscyphaceae|Lachnum,Fungi,Ascomycota,Leotiomycetes,Helotiales,Lachnaceae,Lachnum crystalligerum,257091,Lachnum,,"Cooke, William Bridge","Cooke, V.G.",6/6/46,1946,6,6,157,Common on dead branches,on Rubus spectabilis,United States,Montana,Flathead,Belton,"near Griffin and Bernard Spring, 10 miles south of Belton, along U.S. Highway 2",48.351354,-113.978729,,,https://www.mycoportal.org/portal/collections/individual/index.php?occid=4398867
4398868,Fungi|Ascomycota|Pezizomycotina|Leotiomycetes|Leotiomycetidae|Helotiales|Hyaloscyphaceae|Lachnum,Fungi,Ascomycota,Leotiomycetes,Helotiales,Lachnaceae,Lachnum setigerum,257297,Lachnum,,"Cooke, William Bridge",,7/28/41,1941,7,28,209,base of most overwintered branches of a clump of plants,on Arnica viscosa,United States,California,Siskiyou,Mt. Shasta,"near Horse Camp, Mt Shasta",41.95639,-123.17278,2499,,https://www.mycoportal.org/portal/collections/individual/index.php?occid=4398868
4398870,Fungi|Ascomycota|Pezizomycotina|Phialea,Fungi,Ascomycota,,,Helotiaceae,Phialea cyathoidea,365579,Phialea,,"Cooke, William Bridge","Cooke, V.G., Binegar, Ronald",9/9/50,1950,9,9,252,,on fallen pods of Gleditsia triacanthos,United States,Ohio,Hamilton,Symmes,Symmes,39.247003,-84.296327,,,https://www.mycoportal.org/portal/collections/individual/index.php?occid=4398870
4398872,Fungi|Ascomycota|Pezizomycotina|Leotiomycetes|Leotiomycetidae|Helotiales|Dermateaceae|Pseudopeziza,Fungi,Ascomycota,Leotiomycetes,Helotiales,Dermateaceae,Pseudopeziza medicaginis,394911,Pseudopeziza,,"Bonar, L.",,1935-11-00,1935,11,0,,,on Medicago sativa,United States,California,Alameda,Berkeley,"University of California Botanical Garden, Strawberry Canyon",37.87349,-122.241848,,,https://www.mycoportal.org/portal/collections/individual/index.php?occid=4398872
4398873,Fungi|Basidiomycota|Ascomycota|Pezizomycotina|Agaricomycotina|Leotiomycetes|Agaricomycetes|Leotiomycetidae|Agaricomycetidae|Helotiales|Agaricales|Mycenaceae|Helotiaceae|Helotium,Fungi,Ascomycota,Agaricomycetes,Agaricales,Helotiaceae,Helotium serotinum,237807,Helotium,,"Fulford, Margaret H.",,9/27/29,1929,9,27,270,,,United States,Ohio,Hamilton,Cincinnati,Kroger Hills,39.150157,-84.32093,,,https://www.mycoportal.org/portal/collections/individual/index.php?occid=4398873
4398875,Fungi|Basidiomycota|Ascomycota|Pezizomycotina|Agaricomycotina|Leotiomycetes|Agaricomycetes|Leotiomycetidae|Agaricomycetidae|Helotiales|Agaricales|Mycenaceae|Helotiaceae|Helotium,Fungi,Ascomycota,Agaricomycetes,Agaricales,Helotiaceae,Helotium serotinum,237807,Helotium,,"Fulford, Margaret H.",,10/9/29,1929,10,9,282,,on acorns,United States,Ohio,Hamilton,Cincinnati,"College Hill, Felter's Woods",39.187836,-84.560778,,,https://www.mycoportal.org/portal/collections/individual/index.php?occid=4398875
4398876,Fungi|Ascomycota|Pezizomycotina|Leotiomycetes|Leotiomycetidae|Helotiales|Sclerotiniaceae|Sclerotinia,Fungi,Ascomycota,Leotiomycetes,Helotiales,Sclerotiniaceae,Sclerotinia pseudotuberosa,416481,Sclerotinia,,"Cooke, William Bridge",,3/21/36,1936,3,21,81,,on ground under Quercus sp.,United States,Ohio,Hamilton,Cincinnati,Polk Run,39.247745,-84.29431,,,https://www.mycoportal.org/portal/collections/individual/index.php?occid=4398876
4398878,Fungi|Ascomycota|Pezizomycotina|Leotiomycetes|Leotiomycetidae|Helotiales|Helotiaceae,Fungi,Ascomycota,Leotiomycetes,Helotiales,Helotiaceae,Helotium,14885,Helotium,,"Cooke, William Bridge",,7/31/32,1932,7,31,213,,,United States,Ohio,Highland,,Seven Caves,39.222845,-83.355158,,,https://www.mycoportal.org/portal/collections/individual/index.php?occid=4398878
4398879,Fungi|Basidiomycota|Ascomycota|Pezizomycotina|Agaricomycotina|Leotiomycetes|Agaricomycetes|Leotiomycetidae|Agaricomycetidae|Helotiales|Agaricales|Mycenaceae|Helotiaceae|Helotium,Fungi,Ascomycota,Agaricomycetes,Agaricales,Lachnaceae,Helotium pruinosum,237725,Helotium,,"Cooke, William Bridge",,10/24/35,1935,10,24,297,,,United States,Ohio,Hamilton,Cincinnati,College Hill,39.20228,-84.547166,,,https://www.mycoportal.org/portal/collections/individual/index.php?occid=4398879
4398881,Fungi|Ascomycota|Pezizomycotina|Leotiomycetes|Leotiomycetidae|Helotiales|Hyaloscyphaceae|Lachnum,Fungi,Ascomycota,Leotiomycetes,Helotiales,Lachnaceae,Lachnum bicolor,184704,Lachnum,,"Cooke, William Bridge",,3/18/34,1934,3,18,77,,rotten log,United States,Ohio,Clermont,Dark Hollow,Dark Hollow,39.113281,-84.796747,,,https://www.mycoportal.org/portal/collections/individual/index.php?occid=4398881
4398882,Fungi|Ascomycota|Pezizomycotina|Leotiomycetes|Leotiomycetidae|Helotiales|Helotiaceae,Fungi,Ascomycota,Leotiomycetes,Helotiales,Helotiaceae,Helotium,14885,Helotium,,"Cooke, William Bridge",,9/13/35,1935,9,13,256,,dead sticks,United States,Ohio,Clermont,Dark Hollow,Dark Hollow,38.915352,-82.693222,,,https://www.mycoportal.org/portal/collections/individual/index.php?occid=4398882
4398884,Fungi|Ascomycota|Pezizomycotina|Leotiomycetes|Leotiomycetidae|Helotiales|Helotiaceae,Fungi,Ascomycota,Leotiomycetes,Helotiales,Helotiaceae,Helotium,14885,Helotium,,"Cooke, William Bridge",,11/14/36,1936,11,14,319,,,United States,Ohio,Hamilton,Red Bird Hollow,Red Bird Hollow,39.171121,-84.319385,,,https://www.mycoportal.org/portal/collections/individual/index.php?occid=4398884
4398885,Fungi|Ascomycota|Pezizomycotina|Leotiomycetes|Leotiomycetidae|Helotiales|Helotiaceae,Fungi,Ascomycota,Leotiomycetes,Helotiales,Helotiaceae,Helotium,14885,Helotium,,"Cooke, William Bridge",,5/1/37,1937,5,1,121,,,United States,Ohio,Jackson,Rock Run,Rock Run,38.973405,-83.163515,,,https://www.mycoportal.org/portal/collections/individual/index.php?occid=4398885
4398888,Fungi|Ascomycota|Pezizomycotina|Leotiomycetes|Leotiomycetidae|Helotiales|Hyaloscyphaceae|Lachnum,Fungi,Ascomycota,Leotiomycetes,Helotiales,Lachnaceae,Lachnum bicolor,184704,Lachnum,,"Cooke, William Bridge",,6/10/35,1935,6,10,161,,on sticks,United States,Ohio,Hocking,,"Hocking County, Ohio, Route 180",39.497024,-82.479254,,,https://www.mycoportal.org/portal/collections/individual/index.php?occid=4398888
4398889,Fungi|Basidiomycota|Ascomycota|Pezizomycotina|Agaricomycotina|Leotiomycetes|Agaricomycetes|Leotiomycetidae|Agaricomycetidae|Helotiales|Agaricales|Mycenaceae|Helotiaceae|Helotium,Fungi,Ascomycota,Agaricomycetes,Agaricales,Lachnaceae,Helotium pruinosum,237725,Helotium,,"Cooke, William Bridge",,3/22/36,1936,3,22,82,,,United States,Ohio,Warren,Loveland,Loveland,39.268948,-84.263826,,,https://www.mycoportal.org/portal/collections/individual/index.php?occid=4398889
4398891,Fungi|Basidiomycota|Ascomycota|Pezizomycotina|Agaricomycotina|Leotiomycetes|Agaricomycetes|Leotiomycetidae|Agaricomycetidae|Helotiales|Agaricales|Mycenaceae|Helotiaceae|Helotium,Fungi,Ascomycota,Agaricomycetes,Agaricales,Helotiaceae,Helotium citrinum,237318,Helotium,,"Cosner, L.",,10/16/38,1938,10,16,289,,on dead log,United States,Ohio,Adams,Mineral Springs,Mineral Springs,38.887016,-83.329354,,,https://www.mycoportal.org/portal/collections/individual/index.php?occid=4398891
4398892,Fungi|Ascomycota|Pezizomycotina|Leotiomycetes|Leotiomycetidae|Helotiales|Helotiaceae,Fungi,Ascomycota,Leotiomycetes,Helotiales,Helotiaceae,Helotium,14885,Helotium,,"Cooke, William Bridge",,8/24/33,1933,8,24,236,,Rotten wood,United States,Ohio,Clermont,Branch Hill,South Branch Hill,39.24617,-84.293271,,,https://www.mycoportal.org/portal/collections/individual/index.php?occid=4398892
4398894,Fungi|Ascomycota|Pezizomycotina|Leotiomycetes|Leotiomycetidae|Helotiales|Sclerotiniaceae|Sclerotinia,Fungi,Ascomycota,Leotiomycetes,Helotiales,Sclerotiniaceae,Sclerotinia erythronii,416379,Sclerotinia,,"Cooke, William Bridge",,4/4/33,1933,4,4,94,,ground among sandstone rocks,United States,Ohio,Ross,Jones Hill,Jones Hill,39.20951,-83.34019,,,https://www.mycoportal.org/portal/collections/individual/index.php?occid=4398894
4398896,Fungi|Ascomycota|Pezizomycotina|Leotiomycetes|Leotiomycetidae|Helotiales|Helotiaceae,Fungi,Ascomycota,Leotiomycetes,Helotiales,Helotiaceae,Helotium,14885,Helotium,,"Cooke, William Bridge",,9/4/33,1933,9,4,247,,oak leaves and petioles,United States,Ohio,Clinton,Cowan Creek,Cowan Creek,39.381909,-83.871609,,,https://www.mycoportal.org/portal/collections/individual/index.php?occid=4398896
4398897,Fungi|Basidiomycota|Ascomycota|Pezizomycotina|Agaricomycotina|Leotiomycetes|Agaricomycetes|Leotiomycetidae|Agaricomycetidae|Helotiales|Agaricales|Mycenaceae|Helotiaceae|Helotium,Fungi,Ascomycota,Agaricomycetes,Agaricales,Helotiaceae,Helotium citrinum,237318,Helotium,,"Davidson, W.A.",,1/12/35,1935,1,12,12,,decayed branch,United States,Ohio,Brown,,"Brown County, Ohio",38.934048,-83.867428,,,https://www.mycoportal.org/portal/collections/individual/index.php?occid=4398897
4398898,Fungi|Basidiomycota|Ascomycota|Pezizomycotina|Agaricomycotina|Leotiomycetes|Agaricomycetes|Leotiomycetidae|Agaricomycetidae|Helotiales|Agaricales|Mycenaceae|Helotiaceae|Helotium,Fungi,Ascomycota,Agaricomycetes,Agaricales,Helotiaceae,Helotium citrinum,237318,Helotium,,"Cooke, William Bridge",,10/10/35,1935,10,10,283,,,United States,Ohio,Clermont,Milford,South Milford,39.175338,-84.294382,,,https://www.mycoportal.org/portal/collections/individual/index.php?occid=4398898
4398899,Fungi|Ascomycota|Pezizomycotina|Leotiomycetes|Leotiomycetidae|Helotiales|Sclerotiniaceae|Sclerotinia,Fungi,Ascomycota,Leotiomycetes,Helotiales,Sclerotiniaceae,Sclerotinia pseudotuberosa,416481,Sclerotinia,,"Cooke, William Bridge",,4/11/37,1937,4,11,101,,under Quercus sp.,United States,Ohio,Hamilton,Cincinnati,Polk Run,39.247745,-84.29431,,,https://www.mycoportal.org/portal/collections/individual/index.php?occid=4398899
4398901,Fungi|Basidiomycota|Ascomycota|Pezizomycotina|Agaricomycotina|Leotiomycetes|Agaricomycetes|Leotiomycetidae|Agaricomycetidae|Helotiales|Agaricales|Mycenaceae|Helotiaceae|Helotium,Fungi,Ascomycota,Agaricomycetes,Agaricales,Helotiaceae,Helotium citrinum,237318,Helotium,,"Manley, M.L.",,10/16/38,1938,10,16,289,mixed mesophytic forest,wet logs,United States,Ohio,Adams,Mineral Springs,Mineral Springs,38.887016,-83.329354,,,https://www.mycoportal.org/portal/collections/individual/index.php?occid=4398901
4398902,Fungi|Basidiomycota|Ascomycota|Pezizomycotina|Agaricomycotina|Leotiomycetes|Agaricomycetes|Leotiomycetidae|Agaricomycetidae|Helotiales|Agaricales|Mycenaceae|Helotiaceae|Helotium,Fungi,Ascomycota,Agaricomycetes,Agaricales,Helotiaceae,Helotium citrinum,237318,Helotium,,"Cooke, William Bridge",,11/30/35,1935,11,30,334,,,United States,Ohio,Clermont,Modest,Modest Uplands,39.193117,-84.107156,,,https://www.mycoportal.org/portal/collections/individual/index.php?occid=4398902
4398903,Fungi|Ascomycota|Pezizomycotina|Leotiomycetes|Leotiomycetidae|Helotiales|Sclerotiniaceae|Sclerotinia,Fungi,Ascomycota,Leotiomycetes,Helotiales,Sclerotiniaceae,Sclerotinia pseudotuberosa,416481,Sclerotinia,,"Cooke, William Bridge",,5/1/37,1937,5,1,121,,under oaks,United States,Ohio,Jackson,Rock Run,Rock Run,38.973405,-83.163515,,,https://www.mycoportal.org/portal/collections/individual/index.php?occid=4398903
4398904,Fungi|Basidiomycota|Ascomycota|Pezizomycotina|Agaricomycotina|Leotiomycetes|Agaricomycetes|Leotiomycetidae|Agaricomycetidae|Helotiales|Agaricales|Mycenaceae|Helotiaceae|Helotium,Fungi,Ascomycota,Agaricomycetes,Agaricales,Helotiaceae,Helotium lutescens,237590,Helotium,,"Murphy, Jean",,10/11/34,1934,10,11,284,,"on bark of tree, in crevice",United States,Ohio,Hamilton,Cincinnati,Kroger Hills,39.150157,-84.32093,,,https://www.mycoportal.org/portal/collections/individual/index.php?occid=4398904
4398906,Fungi|Basidiomycota|Ascomycota|Pezizomycotina|Agaricomycotina|Leotiomycetes|Agaricomycetes|Leotiomycetidae|Agaricomycetidae|Helotiales|Agaricales|Mycenaceae|Helotiaceae|Helotium,Fungi,Ascomycota,Agaricomycetes,Agaricales,Helotiaceae,Helotium citrinum,237318,Helotium,,"Fulford, Margaret H.",,10/23/31,1931,10,23,296,,,United States,Ohio,Hamilton,Cincinnati,Given Road,39.159227,-84.30716,,,https://www.mycoportal.org/portal/collections/individual/index.php?occid=4398906
4398907,Fungi|Basidiomycota|Ascomycota|Pezizomycotina|Agaricomycotina|Leotiomycetes|Agaricomycetes|Leotiomycetidae|Agaricomycetidae|Helotiales|Agaricales|Mycenaceae|Helotiaceae|Helotium,Fungi,Ascomycota,Agaricomycetes,Agaricales,Helotiaceae,Helotium citrinum,237318,Helotium,,"Fulford, Margaret H.",,9/27/29,1929,9,27,270,woods,decayed log,United States,Ohio,Hamilton,Cincinnati,Kroger Hills,39.150157,-84.32093,,,https://www.mycoportal.org/portal/collections/individual/index.php?occid=4398907
4398908,Fungi|Basidiomycota|Ascomycota|Pezizomycotina|Agaricomycotina|Leotiomycetes|Agaricomycetes|Leotiomycetidae|Agaricomycetidae|Helotiales|Agaricales|Mycenaceae|Helotiaceae|Helotium,Fungi,Ascomycota,Agaricomycetes,Agaricales,Helotiaceae,Helotium citrinum,237318,Helotium,,"Cobbe, Thomas J.",,10/16/38,1938,10,16,289,mixed mesophytic woods,wet log,United States,Ohio,Adams,Mineral Springs,Mineral Springs,38.887016,-83.329354,,,https://www.mycoportal.org/portal/collections/individual/index.php?occid=4398908
4398910,Fungi|Basidiomycota|Ascomycota|Pezizomycotina|Agaricomycotina|Leotiomycetes|Agaricomycetes|Leotiomycetidae|Agaricomycetidae|Helotiales|Agaricales|Mycenaceae|Helotiaceae|Helotium,Fungi,Ascomycota,Agaricomycetes,Agaricales,Helotiaceae,Helotium citrinum,237318,Helotium,,"Cooke, William Bridge",,10/31/35,1935,10,31,304,,,United States,Ohio,Hamilton,Cincinnati,Caldwell Woods,39.202231,-84.490503,,,https://www.mycoportal.org/portal/collections/individual/index.php?occid=4398910
4398912,Fungi|Basidiomycota|Ascomycota|Pezizomycotina|Agaricomycotina|Leotiomycetes|Agaricomycetes|Leotiomycetidae|Agaricomycetidae|Helotiales|Agaricales|Mycenaceae|Helotiaceae|Helotium,Fungi,Ascomycota,Agaricomycetes,Agaricales,Helotiaceae,Helotium fructigenum,237455,Helotium,,"Cooke, William Bridge",,9/6/33,1933,9,6,249,,on old nuts,United States,Ohio,Highland,,Seven Caves,39.222845,-83.355158,,,https://www.mycoportal.org/portal/collections/individual/index.php?occid=4398912
4398913,Fungi|Basidiomycota|Ascomycota|Pezizomycotina|Agaricomycotina|Leotiomycetes|Agaricomycetes|Leotiomycetidae|Agaricomycetidae|Helotiales|Agaricales|Mycenaceae|Helotiaceae|Helotium,Fungi,Ascomycota,Agaricomycetes,Agaricales,Helotiaceae,Helotium lutescens,237590,Helotium,,"Phinney, Harry Kenyon",,10/5/40,1940,10,5,279,,on rotting log,United States,Kentucky,Wolfe,Tight Holler,Tight Holler,37.757859,-83.641068,,,https://www.mycoportal.org/portal/collections/individual/index.php?occid=4398913
4398914,Fungi|Basidiomycota|Ascomycota|Pezizomycotina|Agaricomycotina|Leotiomycetes|Agaricomycetes|Leotiomycetidae|Agaricomycetidae|Helotiales|Agaricales|Mycenaceae|Helotiaceae|Helotium,Fungi,Ascomycota,Agaricomycetes,Agaricales,Helotiaceae,Helotium citrinum,237318,Helotium,,"Fulford, Margaret H.",,10/4/29,1929,10,4,277,ravine,decaying log,United States,Ohio,Hamilton,Cincinnati,Hazelwood Preserve (Harris M. Benedict Nature Preserve/Johnson Preserve),39.261725,-84.353273,,,https://www.mycoportal.org/portal/collections/individual/index.php?occid=4398914
4398916,Fungi|Basidiomycota|Ascomycota|Pezizomycotina|Agaricomycotina|Leotiomycetes|Agaricomycetes|Leotiomycetidae|Agaricomycetidae|Helotiales|Agaricales|Mycenaceae|Helotiaceae|Helotium,Fungi,Ascomycota,Agaricomycetes,Agaricales,Helotiaceae,Helotium citrinum,237318,Helotium,,"Cooke, William Bridge",,11/14/36,1936,11,14,319,,,United States,Ohio,Hamilton,Red Bird Hollow,Red Bird Hollow,39.171121,-84.319385,,,https://www.mycoportal.org/portal/collections/individual/index.php?occid=4398916
4398917,Fungi|Ascomycota|Pezizomycotina|Leotiomycetes|Leotiomycetidae|Helotiales|Hyaloscyphaceae|Lachnum,Fungi,Ascomycota,Leotiomycetes,Helotiales,Lachnaceae,Lachnum bicolor,184704,Lachnum,,"Cooke, William Bridge",,6/4/35,1935,6,4,155,,,United States,Ohio,Hamilton,Cincinnati,Polk Run,39.247745,-84.29431,,,https://www.mycoportal.org/portal/collections/individual/index.php?occid=4398917
4398918,Fungi|Basidiomycota|Ascomycota|Pezizomycotina|Agaricomycotina|Leotiomycetes|Agaricomycetes|Leotiomycetidae|Agaricomycetidae|Helotiales|Agaricales|Mycenaceae|Helotiaceae|Helotium,Fungi,Ascomycota,Agaricomycetes,Agaricales,Helotiaceae,Helotium citrinum,237318,Helotium,,"Cooke, William Bridge",,10/1/35,1935,10,1,274,,,United States,Ohio,Hamilton,Cincinnati,Polk Run,39.260628,-84.310779,,,https://www.mycoportal.org/portal/collections/individual/index.php?occid=4398918
4398919,Fungi|Ascomycota|Pezizomycotina|Leotiomycetes|Leotiomycetidae|Helotiales|Helotiaceae,Fungi,Ascomycota,Leotiomycetes,Helotiales,Helotiaceae,Helotium,14885,Helotium,,"Cooke, William Bridge",,3/17/33,1933,3,17,76,,dead white oak stump,United States,Ohio,Warren,Hopkinsville,Hopkinsville,39.338948,-84.219659,,,https://www.mycoportal.org/portal/collections/individual/index.php?occid=4398919
4398921,Fungi|Basidiomycota|Ascomycota|Pezizomycotina|Agaricomycotina|Leotiomycetes|Agaricomycetes|Leotiomycetidae|Agaricomycetidae|Helotiales|Agaricales|Mycenaceae|Helotiaceae|Helotium,Fungi,Ascomycota,Agaricomycetes,Agaricales,Helotiaceae,Helotium citrinum,237318,Helotium,,"Cooke, William Bridge",,11/8/33,1933,11,8,312,,rotten log,United States,Ohio,Clermont,Miamiville,Miamiville,39.211972,-84.300809,,,https://www.mycoportal.org/portal/collections/individual/index.php?occid=4398921
4398922,Fungi|Basidiomycota|Ascomycota|Pezizomycotina|Agaricomycotina|Leotiomycetes|Agaricomycetes|Leotiomycetidae|Agaricomycetidae|Helotiales|Agaricales|Mycenaceae|Helotiaceae|Helotium,Fungi,Ascomycota,Agaricomycetes,Agaricales,Helotiaceae,Helotium lutescens,237590,Helotium,,"Johnson, Louise",,10/13/38,1938,10,13,286,moist mixed mesophytic woods,decaying log,United States,Ohio,Hamilton,Cincinnati,California,39.065339,-84.423274,,,https://www.mycoportal.org/portal/collections/individual/index.php?occid=4398922
4398924,Fungi|Basidiomycota|Ascomycota|Pezizomycotina|Agaricomycotina|Leotiomycetes|Agaricomycetes|Leotiomycetidae|Agaricomycetidae|Helotiales|Agaricales|Mycenaceae|Helotiaceae|Helotium,Fungi,Ascomycota,Agaricomycetes,Agaricales,Helotiaceae,Helotium serotinum,237807,Helotium,,"Cooke, William Bridge",,10/9/33,1933,10,9,282,,dead sticks,United States,Ohio,Highland,Seven Caves,Seven Caves (Highlands Nature Sanctuary),39.344508,-83.59742,,,https://www.mycoportal.org/portal/collections/individual/index.php?occid=4398924
4398925,Fungi|Ascomycota|Pezizomycotina|Leotiomycetes|Leotiomycetidae|Helotiales|Helotiaceae,Fungi,Ascomycota,Leotiomycetes,Helotiales,Helotiaceae,Helotium,14885,Helotium,,"Blickle, A.H.",,1937-05-00,1937,5,0,,,on wet wood,United States,Ohio,Hamilton,Glendale,Glendale,39.270613,-84.459387,,,https://www.mycoportal.org/portal/collections/individual/index.php?occid=4398925
4398927,Fungi|Ascomycota|Pezizomycotina|Leotiomycetes|Leotiomycetidae|Helotiales|Hyaloscyphaceae|Lachnum,Fungi,Ascomycota,Leotiomycetes,Helotiales,Lachnaceae,Lachnum bicolor,184704,Lachnum,,"Cooke, William Bridge",,7/31/32,1932,7,31,213,,dead sticks with Cladonia squamales,United States,Ohio,Highland,,Seven Caves,39.222845,-83.355158,,,https://www.mycoportal.org/portal/collections/individual/index.php?occid=4398927
4398928,Fungi|Basidiomycota|Ascomycota|Pezizomycotina|Agaricomycotina|Leotiomycetes|Agaricomycetes|Leotiomycetidae|Agaricomycetidae|Helotiales|Agaricales|Mycenaceae|Helotiaceae|Helotium,Fungi,Ascomycota,Agaricomycetes,Agaricales,Helotiaceae,Helotium citrinum,237318,Helotium,,"Fulford, Margaret H.",,10/4/29,1929,10,4,277,,decayed log in stream,United States,Ohio,Hamilton,Cincinnati,Hazelwood,39.266169,-84.362996,,,https://www.mycoportal.org/portal/collections/individual/index.php?occid=4398928
4398929,Fungi|Basidiomycota|Ascomycota|Pezizomycotina|Agaricomycotina|Leotiomycetes|Agaricomycetes|Leotiomycetidae|Agaricomycetidae|Helotiales|Agaricales|Mycenaceae|Helotiaceae|Helotium,Fungi,Ascomycota,Agaricomycetes,Agaricales,Helotiaceae,Helotium citrinum,237318,Helotium,,"Stephenson, H.",,5/28/30,1930,5,28,148,,wood,United States,Ohio,Hamilton,Cincinnati,Hazelwood Preserve (Harris M. Benedict Nature Preserve/Johnson Preserve),39.261725,-84.353273,,,https://www.mycoportal.org/portal/collections/individual/index.php?occid=4398929
4398931,Fungi|Ascomycota|Pezizomycotina|Leotiomycetes|Leotiomycetidae|Helotiales|Helotiaceae,Fungi,Ascomycota,Leotiomycetes,Helotiales,Helotiaceae,Helotium,14885,Helotium,,"Cooke, William Bridge",,10/9/32,1932,10,9,283,,dead wood,United States,Ohio,Highland,,Seven Caves,39.222845,-83.355158,,,https://www.mycoportal.org/portal/collections/individual/index.php?occid=4398931
4398932,Fungi|Basidiomycota|Ascomycota|Pezizomycotina|Agaricomycotina|Leotiomycetes|Agaricomycetes|Leotiomycetidae|Agaricomycetidae|Helotiales|Agaricales|Mycenaceae|Helotiaceae|Helotium,Fungi,Ascomycota,Agaricomycetes,Agaricales,Helotiaceae,Helotium serotinum,237807,Helotium,,"Cooke, William Bridge",,10/10/35,1935,10,10,283,,,United States,Ohio,Clermont,Milford,South Milford,39.175338,-84.294382,,,https://www.mycoportal.org/portal/collections/individual/index.php?occid=4398932
4398934,Fungi|Ascomycota|Pezizomycotina|Leotiomycetes|Leotiomycetidae|Helotiales|Sclerotiniaceae|Sclerotinia,Fungi,Ascomycota,Leotiomycetes,Helotiales,Sclerotiniaceae,Sclerotinia pseudotuberosa,416481,Sclerotinia,,"Cooke, William Bridge",,4/25/36,1936,4,25,116,,,United States,Ohio,Highland,Seven Caves,Seven Caves (Highlands Nature Sanctuary),39.344508,-83.59742,,,https://www.mycoportal.org/portal/collections/individual/index.php?occid=4398934
4398935,Fungi|Basidiomycota|Ascomycota|Pezizomycotina|Agaricomycotina|Leotiomycetes|Agaricomycetes|Leotiomycetidae|Agaricomycetidae|Helotiales|Agaricales|Mycenaceae|Helotiaceae|Helotium,Fungi,Ascomycota,Agaricomycetes,Agaricales,Helotiaceae,Helotium citrinum,237318,Helotium,,"Cooke, William Bridge",,9/19/32,1932,9,19,263,,dead wood,United States,Ohio,Highland,,Seven Caves,39.222845,-83.355158,,,https://www.mycoportal.org/portal/collections/individual/index.php?occid=4398935
4398936,Fungi|Basidiomycota|Ascomycota|Pezizomycotina|Agaricomycotina|Leotiomycetes|Agaricomycetes|Leotiomycetidae|Agaricomycetidae|Helotiales|Agaricales|Mycenaceae|Helotiaceae|Helotium,Fungi,Ascomycota,Agaricomycetes,Agaricales,Helotiaceae,Helotium lutescens,237590,Helotium,,"Cobbe, Thomas J.",,10/16/38,1938,10,16,289,,wet log,United States,Ohio,Adams,Mineral Springs,Mineral Springs,38.887016,-83.329354,,,https://www.mycoportal.org/portal/collections/individual/index.php?occid=4398936
4398937,Fungi|Basidiomycota|Ascomycota|Pezizomycotina|Agaricomycotina|Leotiomycetes|Agaricomycetes|Leotiomycetidae|Agaricomycetidae|Helotiales|Agaricales|Mycenaceae|Helotiaceae|Helotium,Fungi,Ascomycota,Agaricomycetes,Agaricales,Helotiaceae,Helotium lutescens,237590,Helotium,,"Sisson, G.",,10/5/40,1940,10,5,279,,on log,United States,Kentucky,Wolfe,Tight Holler,Tight Holler,37.757859,-83.641068,,,https://www.mycoportal.org/portal/collections/individual/index.php?occid=4398937
4398940,Fungi|Ascomycota|Pezizomycotina|Leotiomycetes|Leotiomycetidae|Helotiales|Helotiaceae,Fungi,Ascomycota,Leotiomycetes,Helotiales,Helotiaceae,Helotium,14885,Helotium,,"Cooke, William Bridge",,9/13/35,1935,9,13,256,,dead wood,United States,Ohio,Clermont,Dark Hollow,Dark Hollow,39.113281,-84.796747,,,https://www.mycoportal.org/portal/collections/individual/index.php?occid=4398940
4398941,Fungi|Basidiomycota|Ascomycota|Pezizomycotina|Agaricomycotina|Leotiomycetes|Agaricomycetes|Leotiomycetidae|Agaricomycetidae|Helotiales|Agaricales|Mycenaceae|Helotiaceae|Helotium,Fungi,Ascomycota,Agaricomycetes,Agaricales,Helotiaceae,Helotium citrinum,237318,Helotium,,"Muhlbery, Jane",,10/7/31,1931,10,7,280,,,United States,Ohio,Hamilton,Cincinnati,College Hill,39.20228,-84.547166,,,https://www.mycoportal.org/portal/collections/individual/index.php?occid=4398941
4398942,Fungi|Basidiomycota|Ascomycota|Pezizomycotina|Agaricomycotina|Leotiomycetes|Agaricomycetes|Leotiomycetidae|Agaricomycetidae|Helotiales|Agaricales|Mycenaceae|Helotiaceae|Helotium,Fungi,Ascomycota,Agaricomycetes,Agaricales,Helotiaceae,Helotium citrinum,237318,Helotium,,"Stephenson, H.",,5/28/30,1930,5,28,148,,decayed wood,United States,Ohio,Hamilton,Cincinnati,Hazelwood Preserve (Harris M. Benedict Nature Preserve/Johnson Preserve),39.261725,-84.353273,,,https://www.mycoportal.org/portal/collections/individual/index.php?occid=4398942
4401964,Fungi|Ascomycota|Pezizomycotina|Dothideomycetes|Acrospermales|Acrospermaceae,Fungi,Ascomycota,Dothideomycetes,Acrospermales,Acrospermaceae,Acrospermum,7544,Acrospermum,,"Cooke, William Bridge",,3/21/38,1938,3,21,80,,on dead culms of Phalaris arundinacea,United States,Oregon,Benton,Corvallis,"Corvallis, Along railroad tracks near the OSC campus",44.564566,-123.262044,,,https://www.mycoportal.org/portal/collections/individual/index.php?occid=4401964
4401966,Fungi|Ascomycota|Pezizomycotina|Dothideomycetes|Acrospermales|Acrospermaceae|Acrospermum,Fungi,Ascomycota,Dothideomycetes,Acrospermales,Acrospermaceae,Acrospermum compressum,85150,Acrospermum,,"Cooke, William Bridge",,2/21/38,1938,2,21,52,,on grass stems,United States,Oregon,Benton,,near Wren,44.590065,-123.419166,,,https://www.mycoportal.org/portal/collections/individual/index.php?occid=4401966
4401968,Fungi|Ascomycota|Pezizomycotina|Sordariomycetes|Hypocreomycetidae|Hypocreales|Clavicipitaceae|Balansia,Fungi,Ascomycota,Sordariomycetes,Hypocreales,Clavicipitaceae,Balansia hypoxylon,111567,Balansia,,"Cooke, William Bridge","Diehl, W.W., Lentz, P.L.",8/31/48,1948,8,31,244,waste places along an old lane,on Danthonia spicata,United States,Maryland,Prince Georges,,near Greenbelt,39.004554,-76.875528,,,https://www.mycoportal.org/portal/collections/individual/index.php?occid=4401968
4401970,Fungi|Ascomycota|Pezizomycotina|Sordariomycetes|Hypocreomycetidae|Hypocreales|Clavicipitaceae|Claviceps,Fungi,Ascomycota,Sordariomycetes,Hypocreales,Clavicipitaceae,Claviceps microcephala,142909,Claviceps,,"Cooke, William Bridge",,10/16/37,1937,10,16,289,,on Lolium multiflorum,United States,Oregon,Benton,Corvallis,Corvallis,44.564566,-123.262044,,,https://www.mycoportal.org/portal/collections/individual/index.php?occid=4401970
4401971,Fungi|Ascomycota|Pezizomycotina|Sordariomycetes|Hypocreomycetidae|Hypocreales|Clavicipitaceae|Claviceps,Fungi,Ascomycota,Sordariomycetes,Hypocreales,Clavicipitaceae,Claviceps nigricans,142912,Claviceps,,"Brenckle, J.F.",,1908-08-00,1908,8,0,,,on Eleocharis palustris,United States,North Dakota,Lamoure,Kulm,Kulm,46.301914,-98.948162,,,https://www.mycoportal.org/portal/collections/individual/index.php?occid=4401971
4401974,Fungi|Ascomycota|Pezizomycotina|Sordariomycetes|Hypocreomycetidae|Hypocreales|Clavicipitaceae|Claviceps,Fungi,Ascomycota,Sordariomycetes,Hypocreales,Clavicipitaceae,Claviceps paspali,142917,Claviceps,,"Cheo, S.Y.",,9/1/33,1933,9,1,244,,on Paspalum sp.,China,Kwangsi,Yung Hsien,Ta Tseh Shan,Ta Tseh Shan,24.42084,108.362793,,,https://www.mycoportal.org/portal/collections/individual/index.php?occid=4401974
4401978,Fungi|Ascomycota|Pezizomycotina|Sordariomycetes|Hypocreomycetidae|Hypocreales|Clavicipitaceae|Claviceps,Fungi,Ascomycota,Sordariomycetes,Hypocreales,Clavicipitaceae,Claviceps purpurea,142922,Claviceps,,"Sprague, R.",,7/24/37,1937,7,24,205,,on Elymus condensatus,United States,Oregon,Umatilla,,5 miles south of Echo,45.669957,-119.195567,,,https://www.mycoportal.org/portal/collections/individual/index.php?occid=4401978
4401979,Fungi|Ascomycota|Pezizomycotina|Sordariomycetes|Hypocreomycetidae|Hypocreales|Clavicipitaceae|Claviceps,Fungi,Ascomycota,Sordariomycetes,Hypocreales,Clavicipitaceae,Claviceps purpurea,142922,Claviceps,,"Cooke, William Bridge",,10/5/41,1941,10,5,278,,on Lolium multiflorum,United States,California,Marin,Point Reyes Station,"Along the Francis Drake Highway, 0.5 mile north of Point Reyes Station",38.076339,-122.806936,3,,https://www.mycoportal.org/portal/collections/individual/index.php?occid=4401979
4402229,Fungi|Ascomycota|Pezizomycotina|Sordariomycetes|Hypocreomycetidae|Hypocreales|Clavicipitaceae|Claviceps,Fungi,Ascomycota,Sordariomycetes,Hypocreales,Clavicipitaceae,Claviceps purpurea,142922,Claviceps,,"Cooke, William Bridge","Cooke, V.G.",9/25/48,1948,9,25,269,along edge of relatively undisturbed patch of native prairie,on Bromus inermis,United States,Idaho,Lewis,,"near Mohler, between Nez Perce and Craigmont",46.290326,-116.346941,,,https://www.mycoportal.org/portal/collections/individual/index.php?occid=4402229
4402233,Fungi|Ascomycota|Pezizomycotina|Sordariomycetes|Hypocreomycetidae|Hypocreales|Clavicipitaceae|Claviceps,Fungi,Ascomycota,Sordariomycetes,Hypocreales,Clavicipitaceae,Claviceps purpurea,142922,Claviceps,,"Meiners, Jack",,10/25/48,1948,10,25,299,,on Agropyron cristatum,United States,Washington,Whitman,Pullman,"Pullman, Soil Conservation Service grass nurseries",46.731274,-117.179616,,,https://www.mycoportal.org/portal/collections/individual/index.php?occid=4402233
4402234,Fungi|Ascomycota|Pezizomycotina|Sordariomycetes|Hypocreomycetidae|Hypocreales|Clavicipitaceae|Claviceps,Fungi,Ascomycota,Sordariomycetes,Hypocreales,Clavicipitaceae,Claviceps purpurea,142922,Claviceps,,"Kusano, S.",,1899-08-14,1899,8,14,226,,on Festuca remstiflora,Japan,T?hoku,Fukushima,S?ma,S?ma,37.792833,140.929406,,,https://www.mycoportal.org/portal/collections/individual/index.php?occid=4402234
4402238,Fungi|Ascomycota|Pezizomycotina|Sordariomycetes|Hypocreomycetidae|Hypocreales|Clavicipitaceae|Claviceps,Fungi,Ascomycota,Sordariomycetes,Hypocreales,Clavicipitaceae,Claviceps purpurea,142922,Claviceps,,"Kelsey, F.D.",,1891-09-20,1891,9,20,263,,on Agropyron glaucum (syn. Thinopyrum intermedium),United States,Montana,Lewis And Clark,Helena,Helena,46.592712,-112.036109,,,https://www.mycoportal.org/portal/collections/individual/index.php?occid=4402238
4402241,Fungi|Ascomycota|Pezizomycotina|Sordariomycetes|Hypocreomycetidae|Hypocreales|Clavicipitaceae|Claviceps,Fungi,Ascomycota,Sordariomycetes,Hypocreales,Clavicipitaceae,Claviceps purpurea,142922,Claviceps,,"Kelsey, F.D.",,1892-09-21,1892,9,21,265,,on Elymus condensatus,United States,Montana,Park,Livingston,Livingston,45.66188,-110.562428,,,https://www.mycoportal.org/portal/collections/individual/index.php?occid=4402241
4402243,Fungi|Ascomycota|Pezizomycotina|Sordariomycetes|Hypocreomycetidae|Hypocreales|Clavicipitaceae|Claviceps,Fungi,Ascomycota,Sordariomycetes,Hypocreales,Clavicipitaceae,Claviceps purpurea,142922,Claviceps,,"Brenckle, J.F.",,1908-08-00,1908,8,0,,,on Calamagrostis neglecta,United States,North Dakota,Lamoure,Kulm,Kulm,46.301914,-98.948162,,,https://www.mycoportal.org/portal/collections/individual/index.php?occid=4402243
4402247,Fungi|Ascomycota|Pezizomycotina|Sordariomycetes|Hypocreomycetidae|Hypocreales|Nectriaceae|Chilonectria,Fungi,Ascomycota,Sordariomycetes,Hypocreales,Nectriaceae,Chilonectria cucurbitula,137582,Chilonectria,,"Waghorne, A.",,1888-00-00,1888,0,0,,,on Abies sp.,Canada,Newfoundland and Labrador,,,,9999.99,9999.99,,,https://www.mycoportal.org/portal/collections/individual/index.php?occid=4402247
4402248,Fungi|Ascomycota|Pezizomycotina|Sordariomycetes|Hypocreomycetidae|Hypocreales|Cordycipitaceae|Cordyceps,Fungi,Ascomycota,Sordariomycetes,Hypocreales,Ophiocordycipitaceae,Cordyceps superficialis,151983,Cordyceps,,"Darker, G.D.",,6/30/35,1935,6,30,181,,on insect larva buried in soil,United States,Massachusetts,Norfolk,Norwood,Norwood,42.194543,-71.199498,,,https://www.mycoportal.org/portal/collections/individual/index.php?occid=4402248
4402252,Fungi|Ascomycota|Pezizomycotina|Sordariomycetes|Hypocreomycetidae|Hypocreales|Clavicipitaceae|Epichlo,Fungi,Ascomycota,Sordariomycetes,Hypocreales,Clavicipitaceae,Epichlo typhina,215690,Epichlo,,"Kusano, S.",,1899-06-11,1899,6,11,162,,on Bromus japonicus,Japan,Kant?,Tokyo,Hachi?ji,Mt. Takao,35.627424,139.239656,,,https://www.mycoportal.org/portal/collections/individual/index.php?occid=4402252
4402255,Fungi|Ascomycota|Pezizomycotina|Sordariomycetes|Hypocreomycetidae|Hypocreales|Clavicipitaceae|Epichlo,Fungi,Ascomycota,Sordariomycetes,Hypocreales,Clavicipitaceae,Epichlo typhina,215690,Epichlo,,"Brenckle, J.F.",,1908-06-00,1908,6,0,,,on Koeleria cristata,United States,North Dakota,Lamoure,Kulm,Kulm,46.301914,-98.948162,,,https://www.mycoportal.org/portal/collections/individual/index.php?occid=4402255
4402258,Fungi|Ascomycota|Pezizomycotina|Sordariomycetes|Hypocreomycetidae|Hypocreales|Hypocreaceae|Hypocrea,Fungi,Ascomycota,Sordariomycetes,Hypocreales,Hypocreaceae,Hypocrea patella,247631,Hypocrea,,"Cooke, William Bridge",,10/10/37,1937,10,10,283,,on rotten wood,United States,Oregon,Lincoln,,6 miles west of Burnt Woods,44.603666,-123.74493,,,https://www.mycoportal.org/portal/collections/individual/index.php?occid=4402258
4402259,Fungi|Ascomycota|Pezizomycotina|Sordariomycetes|Hypocreomycetidae|Hypocreales|Hypocreaceae|Hypocrea,Fungi,Ascomycota,Sordariomycetes,Hypocreales,Hypocreaceae,Hypocrea sulphurea,247735,Hypocrea,,"Aiken, Walter H.",,1890-00-00,1890,0,0,,,,United States,Ohio,Hamilton,Cincinnati,Cincinnati,39.162004,-84.456886,,,https://www.mycoportal.org/portal/collections/individual/index.php?occid=4402259
4402260,Fungi|Ascomycota|Pezizomycotina|Sordariomycetes|Hypocreomycetidae|Hypocreales|Hypocreaceae|Hypocrea,Fungi,Ascomycota,Sordariomycetes,Hypocreales,Hypocreaceae,Hypocrea sulphurea,247735,Hypocrea,,"Aiken, Walter H.",,1899-09-10,1899,9,10,253,,,United States,Ohio,Hamilton,Cincinnati,College Hill,39.20228,-84.547166,,,https://www.mycoportal.org/portal/collections/individual/index.php?occid=4402260
4402262,Fungi|Ascomycota|Pezizomycotina|Sordariomycetes|Hypocreomycetidae|Hypocreales|Clavicipitaceae|Hypocrella,Fungi,Ascomycota,Sordariomycetes,Hypocreales,Clavicipitaceae,Hypocrella palmae,247847,Hypocrella,,"Thaxter, R.",,1912-00-00,1912,0,0,,,on Lecanium pseudotessellatum,Trinidad and Tobago,,Cumuto,,Aripo Savanna,10.6,-61.2,,,https://www.mycoportal.org/portal/collections/individual/index.php?occid=4402262
4402266,Fungi|Ascomycota|Pezizomycotina|Sordariomycetes|Hypocreomycetidae|Hypocreales|Clavicipitaceae|Hypocrella,Fungi,Ascomycota,Sordariomycetes,Hypocreales,Clavicipitaceae,Hypocrella sloaneae,247869,Hypocrella,,"Thaxter, R.",,1912-00-00,1912,0,0,,,on Adiantum sp.,Trinidad and Tobago,,,Port of Spain,Saint Ann's Valley,10.683333,-61.466667,,,https://www.mycoportal.org/portal/collections/individual/index.php?occid=4402266
4402267,Fungi|Ascomycota|Pezizomycotina|Sordariomycetes|Hypocreomycetidae|Hypocreales|Hypocreaceae|Hypomyces,Fungi,Ascomycota,Sordariomycetes,Hypocreales,Hypocreaceae,Hypomyces aurantius,184416,Hypomyces,,"Seaver, F.J.",,6/20/38,1938,6,20,171,,on Ganoderma oregonense,United States,California,Siskiyou,Mt. Shasta,Horse Camp,41.37252,-122.23153,2438,,https://www.mycoportal.org/portal/collections/individual/index.php?occid=4402267
4402268,Fungi|Ascomycota|Pezizomycotina|Sordariomycetes|Hypocreomycetidae|Hypocreales|Hypocreaceae|Hypomyces,Fungi,Ascomycota,Sordariomycetes,Hypocreales,Hypocreaceae,Hypomyces aurantius,184416,Hypomyces,,"Cooke, William Bridge","Cooke, V.G.",6/22/47,1947,6,22,173,Shasta Fir forest,on Ganoderma oregonense,United States,California,Siskiyou,Mt. Shasta,"Horse Camp, Mt. Shasta",41.372268,-122.229867,2438,,https://www.mycoportal.org/portal/collections/individual/index.php?occid=4402268
4402271,Fungi|Ascomycota|Pezizomycotina|Sordariomycetes|Hypocreomycetidae|Hypocreales|Hypocreaceae|Hypomyces,Fungi,Ascomycota,Sordariomycetes,Hypocreales,Hypocreaceae,Hypomyces aurantius,184416,Hypomyces,,"Cooke, William Bridge","Cooke, V.G., Binegar, R.",7/24/50,1950,7,24,205,on prostrate log in a grove of broad leaved maples,on Polyporus sulphureus and Pseudotsuga taxifolia,United States,Washington,Clallam,,"Hurricane Ridge Road, Olympic National Park",47.924456,-123.351933,,,https://www.mycoportal.org/portal/collections/individual/index.php?occid=4402271
4402272,Fungi|Ascomycota|Pezizomycotina|Sordariomycetes|Hypocreomycetidae|Hypocreales|Hypocreaceae|Hypocrea,Fungi,Ascomycota,Sordariomycetes,Hypocreales,Hypocreaceae,Hypocrea aurantiaca,247405,Hypocrea,,"Cooke, William Bridge",,2/8/38,1938,2,8,39,on old stump in field,on Polyporus versicolor,United States,Oregon,Benton,Corvallis,along Oak Creek near Corvallis,44.566715,-123.302202,,,https://www.mycoportal.org/portal/collections/individual/index.php?occid=4402272
4402276,Fungi|Ascomycota|Pezizomycotina|Sordariomycetes|Hypocreomycetidae|Hypocreales|Hypocreaceae|Hypomyces,Fungi,Ascomycota,Sordariomycetes,Hypocreales,Hypocreaceae,Hypomyces lactifluorum,248451,Hypomyces,,"Cooke, William Bridge","Cooke, V.G.",9/25/48,1948,9,25,269,in young Douglas Fir-Grand Fir woods,on Russula sp.,United States,Idaho,Idaho,,"Along Rackliff Ridge Trail, a half mile above Rackliff Creek Public Camp, Nez Perce National Forest",46.084469,-115.494665,,,https://www.mycoportal.org/portal/collections/individual/index.php?occid=4402276
4402280,Fungi|Ascomycota|Pezizomycotina|Sordariomycetes|Hypocreomycetidae|Hypocreales|Hypocreaceae|Hypomyces,Fungi,Ascomycota,Sordariomycetes,Hypocreales,Hypocreaceae,Hypomyces lactifluorum,248451,Hypomyces,,Haines,"Everhart, Wood",1879-08-00,1879,8,0,,parasitic on some Lactarius,,United States,Pennsylvania,Chester,West Chester,West Chester,39.960664,-75.605488,,,https://www.mycoportal.org/portal/collections/individual/index.php?occid=4402280
4402282,Fungi|Ascomycota|Pezizomycotina|Sordariomycetes|Hypocreomycetidae|Hypocreales|Hypocreaceae|Hypomyces,Fungi,Ascomycota,Sordariomycetes,Hypocreales,Hypocreaceae,Hypomyces lactifluorum,248451,Hypomyces,,"Cooke, William Bridge",,10/27/37,1937,10,27,300,,on diseased Agaric sp.,United States,Oregon,Hood River,,near Bonneville,45.63595,-121.952026,,,https://www.mycoportal.org/portal/collections/individual/index.php?occid=4402282
4402285,Fungi|Ascomycota|Pezizomycotina|Dothideomycetes|Pleosporomycetidae|Pleosporales|Herpotrichia,Fungi,Ascomycota,Dothideomycetes,Pleosporales,Melanommataceae,Herpotrichia nigra,240155,Herpotrichia,,"Cooke, William Bridge",,8/28/41,1941,8,28,240,occasional on branches of the host throughout its range on the mountain,on Tsuga mertensiana,United States,California,Siskiyou,Mt. Shasta,Squaw Valley Creek Basin,41.3685,-122.172746,2438,,https://www.mycoportal.org/portal/collections/individual/index.php?occid=4402285
4402291,Fungi|Basidiomycota|Pucciniomycotina|Pucciniomycetes|Pucciniales|Melampsoraceae|Melampsora,Fungi,Basidiomycota,Pucciniomycetes,Pucciniales,Melampsoraceae,Melampsora albertensis,284508,Melampsora,,"Cooke, William Bridge","Cooke, V.G.",6/6/50,1950,6,6,157,,"Common on seedlings, on Pseudotsuga taxifolia var. glauca",United States,Washington,Pend Oreille,Sullivan Lake,"two miles east of Sullivan Lake, Kaniksu National Park",48.814962,-117.289962,,,https://www.mycoportal.org/portal/collections/individual/index.php?occid=4402291
4402298,Fungi|Ascomycota|Pezizomycotina|Sordariomycetes|Hypocreomycetidae|Hypocreales|Nectriaceae|Nectria,Fungi,Ascomycota,Sordariomycetes,Hypocreales,Nectriaceae,Nectria coccinea,186181,Nectria,,"Cooke, William Bridge",,12/12/37,1937,12,12,346,,"on Rhus diversiloba, syn. Toxicodendron diversilobum",United States,Oregon,Benton,Granger,Granger,44.616232,-123.21732,,,https://www.mycoportal.org/portal/collections/individual/index.php?occid=4402298
4402303,Fungi|Ascomycota|Pezizomycotina|Sordariomycetes|Hypocreomycetidae|Hypocreales|Nectriaceae|Pleonectria,Fungi,Ascomycota,Sordariomycetes,Hypocreales,Sordariomycetes,Pleonectria berolinensis,380227,Pleonectria,,"Brenckle, J.F.",,1909-07-00,1909,7,0,,,on Ribes rubrum,United States,North Dakota,Lamoure,Kulm,Kulm,46.301914,-98.948162,,,https://www.mycoportal.org/portal/collections/individual/index.php?occid=4402303
4402311,Fungi|Ascomycota|Pezizomycotina|Sordariomycetes|Hypocreomycetidae|Hypocreales|Hypocreaceae|Hypocrea,Fungi,Ascomycota,Sordariomycetes,Hypocreales,Hypocreaceae,Hypocrea patella,247631,Hypocrea,,"Stephenson, H.",,10/6/29,1929,10,6,279,,decayed wood,United States,Ohio,Hamilton,Cincinnati,Hazelwood Preserve (Harris M. Benedict Nature Preserve/Johnson Preserve),39.261725,-84.353273,,,https://www.mycoportal.org/portal/collections/individual/index.php?occid=4402311
4402313,Fungi|Ascomycota|Pezizomycotina|Sordariomycetes|Hypocreomycetidae|Hypocreales|Hypocreaceae|Hypocrea,Fungi,Ascomycota,Sordariomycetes,Hypocreales,Hypocreaceae,Hypocrea brevipes,247420,Hypocrea,,"Cooke, William Bridge",,8/13/33,1933,8,13,225,,dead wood,United States,Ohio,Clermont,Horner Run,Horner Run,39.197552,-84.275404,,,https://www.mycoportal.org/portal/collections/individual/index.php?occid=4402313
4402316,Fungi|Ascomycota|Pezizomycotina|Sordariomycetes|Hypocreomycetidae|Hypocreales|Nectriaceae|Nectria,Fungi,Ascomycota,Sordariomycetes,Hypocreales,Nectriaceae,Nectria viridescens,304844,Nectria,,"Braun, E. Lucy",,4/18/47,1947,4,18,108,,,United States,Kentucky,Lewis,,"Big Sulphur Creek, Lewis County, Kentucky",38.531544,-83.378054,,,https://www.mycoportal.org/portal/collections/individual/index.php?occid=4402316
4402318,Fungi|Ascomycota|Pezizomycotina|Sordariomycetes|Hypocreomycetidae|Hypocreales|Hypocreaceae|Hypocrea,Fungi,Ascomycota,Sordariomycetes,Hypocreales,Hypocreaceae,Hypocrea rufa,247683,Hypocrea,,"Cooke, William Bridge",,10/28/32,1932,10,28,302,,dead wood,United States,Ohio,Hamilton,Cincinnati,Kroger Hills,39.150157,-84.32093,,,https://www.mycoportal.org/portal/collections/individual/index.php?occid=4402318
4402320,Fungi|Ascomycota|Pezizomycotina|Sordariomycetes|Hypocreomycetidae|Hypocreales|Nectriaceae|Nectria,Fungi,Ascomycota,Sordariomycetes,Hypocreales,Nectriaceae,Nectria cinnabarina,186178,Nectria,,"Fahnestack, G.",,10/4/34,1934,10,4,277,,,United States,Ohio,Hamilton,Cincinnati,College Hill,39.20228,-84.547166,,,https://www.mycoportal.org/portal/collections/individual/index.php?occid=4402320
4402325,Fungi|Ascomycota|Pezizomycotina|Sordariomycetes|Hypocreomycetidae|Hypocreales|Hypocreaceae|Peckiella,Fungi,Ascomycota,Sordariomycetes,Hypocreales,Hypocreaceae,Peckiella viridis,355366,Peckiella,,"Murrill, W.A.",,10/29/39,1939,10,29,302,,on Russula sp.,United States,Florida,Clay,,Gold Head Branch State Park,29.834506,-81.949615,,,https://www.mycoportal.org/portal/collections/individual/index.php?occid=4402325
4402327,Fungi|Ascomycota|Pezizomycotina|Sordariomycetes|Hypocreomycetidae|Hypocreales|Hypocreaceae|Hypocrea,Fungi,Ascomycota,Sordariomycetes,Hypocreales,Hypocreaceae,Hypocrea gelatinosa,184397,Hypocrea,,"Cooke, William Bridge",,8/11/33,1933,8,11,223,,Rotten wood,United States,Ohio,Hamilton,Taylor Creek,Taylor Creek,39.215374,-84.688389,,,https://www.mycoportal.org/portal/collections/individual/index.php?occid=4402327
4402329,Fungi|Ascomycota|Pezizomycotina|Sordariomycetes|Hypocreomycetidae|Hypocreales|Hypocreaceae|Hypocrea,Fungi,Ascomycota,Sordariomycetes,Hypocreales,Hypocreaceae,Hypocrea sulphurea,247735,Hypocrea,,"Cooke, William Bridge",,10/8/35,1935,10,8,281,,,United States,Ohio,Hamilton,Cincinnati,"Cincinnati, Waterworks Park",39.161448,-84.442997,,,https://www.mycoportal.org/portal/collections/individual/index.php?occid=4402329
4402333,Fungi|Ascomycota|Pezizomycotina|Sordariomycetes|Hypocreomycetidae|Hypocreales|Hypocreaceae|Hypocrea,Fungi,Ascomycota,Sordariomycetes,Hypocreales,Hypocreaceae,Hypocrea sulphurea,247735,Hypocrea,,"Cooke, William Bridge",,12/15/35,1935,12,15,349,,,United States,Ohio,Hamilton,Cincinnati,Newtown Woods,39.124505,-84.361606,,,https://www.mycoportal.org/portal/collections/individual/index.php?occid=4402333
4402335,Fungi|Ascomycota|Pezizomycotina|Sordariomycetes|Hypocreomycetidae|Hypocreales|Hypocreaceae|Hypocrea,Fungi,Ascomycota,Sordariomycetes,Hypocreales,Hypocreaceae,Hypocrea brevipes,247420,Hypocrea,,"Cooke, William Bridge",,12/12/36,1936,12,12,347,,on Pear wood,United States,Ohio,Warren,Foster,Foster,39.319226,-84.252993,,,https://www.mycoportal.org/portal/collections/individual/index.php?occid=4402335
4402337,Fungi|Ascomycota|Pezizomycotina|Sordariomycetes|Hypocreomycetidae|Hypocreales|Hypocreaceae|Hypocrea,Fungi,Ascomycota,Sordariomycetes,Hypocreales,Hypocreaceae,Hypocrea brevipes,247420,Hypocrea,,"Cooke, William Bridge",,12/24/36,1936,12,24,359,,,United States,Ohio,Hamilton,Cincinnati,Polk Run,39.247745,-84.29431,,,https://www.mycoportal.org/portal/collections/individual/index.php?occid=4402337
4402339,Fungi|Ascomycota|Pezizomycotina|Sordariomycetes|Hypocreomycetidae|Hypocreales|Hypocreaceae|Hypocrea,Fungi,Ascomycota,Sordariomycetes,Hypocreales,Hypocreaceae,Hypocrea gelatinosa,184397,Hypocrea,,"Muhlbery, J.",,10/7/31,1931,10,7,280,,,United States,Ohio,Hamilton,Cincinnati,College Hill,39.20228,-84.547166,,,https://www.mycoportal.org/portal/collections/individual/index.php?occid=4402339
4402343,Fungi|Ascomycota|Pezizomycotina|Sordariomycetes|Hypocreomycetidae|Hypocreales|Hypocreaceae|Hypocrea,Fungi,Ascomycota,Sordariomycetes,Hypocreales,Hypocreaceae,Hypocrea sulphurea,247735,Hypocrea,,"Cooke, William Bridge",,10/10/35,1935,10,10,283,,,United States,Ohio,Clermont,Milford,South Milford,39.175338,-84.294382,,,https://www.mycoportal.org/portal/collections/individual/index.php?occid=4402343
4402345,Fungi|Ascomycota|Pezizomycotina|Sordariomycetes|Hypocreomycetidae|Hypocreales|Nectriaceae|Nectria,Fungi,Ascomycota,Sordariomycetes,Hypocreales,Nectriaceae,Nectria cinnabarina,186178,Nectria,,"Cooke, William Bridge",,4/12/34,1934,4,12,102,,dead Quercus twigs,United States,Ohio,Hamilton,Cincinnati,Polk Run,39.247745,-84.29431,,,https://www.mycoportal.org/portal/collections/individual/index.php?occid=4402345
4402349,Fungi|Ascomycota|Pezizomycotina|Sordariomycetes|Hypocreomycetidae|Hypocreales|Nectriaceae|Nectria,Fungi,Ascomycota,Sordariomycetes,Hypocreales,Nectriaceae,Nectria cinnabarina,186178,Nectria,,"Cooke, William Bridge",,10/10/35,1935,10,10,283,,,United States,Ohio,Clermont,Milford,South Milford,39.175338,-84.294382,,,https://www.mycoportal.org/portal/collections/individual/index.php?occid=4402349
4402351,Fungi|Ascomycota|Pezizomycotina|Sordariomycetes|Hypocreomycetidae|Hypocreales|Nectriaceae|Nectria,Fungi,Ascomycota,Sordariomycetes,Hypocreales,Nectriaceae,Nectria cinnabarina,186178,Nectria,,"Stephenson, H.",,4/15/30,1930,4,15,105,,on beech,United States,Ohio,Hamilton,Cincinnati,Hazelwood Preserve (Harris M. Benedict Nature Preserve/Johnson Preserve),39.261725,-84.353273,,,https://www.mycoportal.org/portal/collections/individual/index.php?occid=4402351
4402353,Fungi|Ascomycota|Pezizomycotina|Sordariomycetes|Hypocreomycetidae|Hypocreales|Hypocreaceae|Hypocrea,Fungi,Ascomycota,Sordariomycetes,Hypocreales,Hypocreaceae,Hypocrea sulphurea,247735,Hypocrea,,"Fulford, Margaret H.",,10/9/31,1931,10,9,282,woods,dead log,United States,Kentucky,Boone,Woolper Creek,Woolper Creek,39.036863,-84.826018,,,https://www.mycoportal.org/portal/collections/individual/index.php?occid=4402353
4402357,Fungi|Ascomycota|Pezizomycotina|Sordariomycetes|Hypocreomycetidae|Hypocreales|Hypocreaceae|Hypocrea,Fungi,Ascomycota,Sordariomycetes,Hypocreales,Hypocreaceae,Hypocrea gelatinosa,184397,Hypocrea,,"Fulford, Margaret H.",,10/4/29,1929,10,4,277,woods,decayed log,United States,Ohio,Hamilton,Cincinnati,Hazelwood,39.266169,-84.362996,,,https://www.mycoportal.org/portal/collections/individual/index.php?occid=4402357
4402360,Fungi|Ascomycota|Pezizomycotina|Sordariomycetes|Hypocreomycetidae|Hypocreales|Hypocreaceae|Hypocrea,Fungi,Ascomycota,Sordariomycetes,Hypocreales,Hypocreaceae,Hypocrea sulphurea,247735,Hypocrea,,"Cooke, William Bridge",,6/7/33,1933,6,7,158,,dead beech log,United States,Ohio,Highland,Seven Caves,Seven Caves (Highlands Nature Sanctuary),39.344508,-83.59742,,,https://www.mycoportal.org/portal/collections/individual/index.php?occid=4402360
4402362,Fungi|Ascomycota|Pezizomycotina|Sordariomycetes|Hypocreomycetidae|Hypocreales|Hypocreaceae|Hypocrea,Fungi,Ascomycota,Sordariomycetes,Hypocreales,Hypocreaceae,Hypocrea sulphurea,247735,Hypocrea,,"Cooke, William Bridge",,10/9/32,1932,10,9,283,,dead bark,United States,Ohio,Highland,,Seven Caves,39.222845,-83.355158,,,https://www.mycoportal.org/portal/collections/individual/index.php?occid=4402362
4402367,Fungi|Ascomycota|Pezizomycotina|Sordariomycetes|Hypocreomycetidae|Hypocreales|Nectriaceae|Nectria,Fungi,Ascomycota,Sordariomycetes,Hypocreales,Nectriaceae,Nectria cinnabarina,186178,Nectria,,"Hopkins, W.C.",,10/14/38,1938,10,14,287,,on dead wood,United States,Ohio,Hamilton,Cincinnati,California,39.065339,-84.423274,,,https://www.mycoportal.org/portal/collections/individual/index.php?occid=4402367
4402368,Fungi|Ascomycota|Pezizomycotina|Sordariomycetes|Hypocreomycetidae|Hypocreales|Hypocreaceae|Hypocrea,Fungi,Ascomycota,Sordariomycetes,Hypocreales,Hypocreaceae,Hypocrea sulphurea,247735,Hypocrea,,"Cooke, William Bridge",,1/7/36,1936,1,7,7,,,United States,Ohio,Hamilton,Cincinnati,Hazelwood Preserve (Harris M. Benedict Nature Preserve/Johnson Preserve),39.261725,-84.353273,,,https://www.mycoportal.org/portal/collections/individual/index.php?occid=4402368
4402370,Fungi|Ascomycota|Pezizomycotina|Sordariomycetes|Hypocreomycetidae|Hypocreales|Nectriaceae|Nectria,Fungi,Ascomycota,Sordariomycetes,Hypocreales,Nectriaceae,Nectria cinnabarina,186178,Nectria,,"Fulford, Margaret H.",,1931-11-00,1931,11,0,,,dead twigs,United States,Ohio,Hamilton,Cincinnati,College Hill,39.20228,-84.547166,,,https://www.mycoportal.org/portal/collections/individual/index.php?occid=4402370
4402373,Fungi|Ascomycota|Pezizomycotina|Sordariomycetes|Hypocreomycetidae|Hypocreales|Hypocreaceae|Hypocrea,Fungi,Ascomycota,Sordariomycetes,Hypocreales,Hypocreaceae,Hypocrea sulphurea,247735,Hypocrea,,"Fulford, Margaret H.",,10/4/29,1929,10,4,277,woods,semi-decayed log,United States,Ohio,Hamilton,Cincinnati,Hazelwood Preserve (Harris M. Benedict Nature Preserve/Johnson Preserve),39.261725,-84.353273,,,https://www.mycoportal.org/portal/collections/individual/index.php?occid=4402373
4402375,Fungi|Ascomycota|Pezizomycotina|Sordariomycetes|Hypocreomycetidae|Hypocreales|Hypocreaceae|Hypocrea,Fungi,Ascomycota,Sordariomycetes,Hypocreales,Hypocreaceae,Hypocrea sulphurea,247735,Hypocrea,,"Cooke, William Bridge",,10/24/35,1935,10,24,297,,,United States,Ohio,Hamilton,Cincinnati,College Hill,39.20228,-84.547166,,,https://www.mycoportal.org/portal/collections/individual/index.php?occid=4402375
4402377,Fungi|Ascomycota|Pezizomycotina|Sordariomycetes|Hypocreomycetidae|Hypocreales|Hypocreaceae|Hypomyces,Fungi,Ascomycota,Sordariomycetes,Hypocreales,Hypocreaceae,Hypomyces lactifluorum,248451,Hypomyces,,"Cooke, William Bridge",,10/27/37,1937,10,27,300,,on diseased Agaric sp.,United States,Oregon,Hood River,,near Bonneville,45.6333,-121.95,,,https://www.mycoportal.org/portal/collections/individual/index.php?occid=4402377
4402381,Fungi|Ascomycota|Pezizomycotina|Sordariomycetes|Hypocreomycetidae|Hypocreales|Cordycipitaceae|Cordyceps,Fungi,Ascomycota,Sordariomycetes,Hypocreales,Ophiocordycipitaceae,Cordyceps entomorrhiza,151688,Cordyceps,,"Cooke, William Bridge",,8/29/35,1935,8,29,241,,,United States,Ohio,Hocking,,Old Man's Cave (Hocking Hills State Park),39.430622,-82.53877,,,https://www.mycoportal.org/portal/collections/individual/index.php?occid=4402381
4402382,Fungi|Ascomycota|Pezizomycotina|Sordariomycetes|Hypocreomycetidae|Hypocreales|Nectriaceae|Nectria,Fungi,Ascomycota,Sordariomycetes,Hypocreales,Nectriaceae,Nectria cinnabarina,186178,Nectria,,"Bauer, Kay",,10/21/32,1932,10,21,295,,,United States,Ohio,Hamilton,Cincinnati,College Hill,39.20228,-84.547166,,,https://www.mycoportal.org/portal/collections/individual/index.php?occid=4402382
4402385,Fungi|Ascomycota|Pezizomycotina|Sordariomycetes|Hypocreomycetidae|Hypocreales|Nectriaceae|Nectria,Fungi,Ascomycota,Sordariomycetes,Hypocreales,Nectriaceae,Nectria cinnabarina,186178,Nectria,,"Lillick, Lois",,10/21/32,1932,10,21,295,,dead wood,United States,Ohio,Hamilton,Cincinnati,College Hill,39.20228,-84.547166,,,https://www.mycoportal.org/portal/collections/individual/index.php?occid=4402385
4402394,Fungi|Ascomycota|Pezizomycotina|Sordariomycetes|Hypocreomycetidae|Hypocreales|Hypocreaceae|Hypocrea,Fungi,Ascomycota,Sordariomycetes,Hypocreales,Hypocreaceae,Hypocrea sulphurea,247735,Hypocrea,,"Cooke, William Bridge",,10/31/35,1935,10,31,304,,,United States,Ohio,Hamilton,Cincinnati,Caldwell Woods,39.202231,-84.490503,,,https://www.mycoportal.org/portal/collections/individual/index.php?occid=4402394
4402399,Fungi|Ascomycota|Pezizomycotina|Sordariomycetes|Hypocreomycetidae|Hypocreales|Hypocreaceae|Hypocrea,Fungi,Ascomycota,Sordariomycetes,Hypocreales,Hypocreaceae,Hypocrea chromosperma,247444,Hypocrea,,"Cooke, William Bridge",,8/25/33,1933,8,25,237,,dead wood,United States,Ohio,Clermont,Branch Hill,Branch Hill,39.24617,-84.293271,,,https://www.mycoportal.org/portal/collections/individual/index.php?occid=4402399
4402400,Fungi|Ascomycota|Pezizomycotina|Sordariomycetes|Hypocreomycetidae|Hypocreales|Nectriaceae|Nectria,Fungi,Ascomycota,Sordariomycetes,Hypocreales,Nectriaceae,Nectria cinnabarina,186178,Nectria,,"Cooke, William Bridge",,2/29/36,1936,2,29,60,,,United States,Ohio,Clermont,,"Alpine Road (Clermont County, Ohio)",39.047433,-84.151918,,,https://www.mycoportal.org/portal/collections/individual/index.php?occid=4402400
4402404,Fungi|Ascomycota|Pezizomycotina|Sordariomycetes|Hypocreomycetidae|Hypocreales|Cordycipitaceae|Cordyceps,Fungi,Ascomycota,Sordariomycetes,Hypocreales,Cordycipitaceae,Cordyceps herculea,151739,Cordyceps,,"Cooke, William Bridge",,6/21/35,1935,6,21,172,,ground on insect,United States,Indiana,Brown,,Brown County State Park,39.14482,-86.230722,,,https://www.mycoportal.org/portal/collections/individual/index.php?occid=4402404
4402408,Fungi|Ascomycota|Pezizomycotina|Sordariomycetes|Hypocreomycetidae|Hypocreales|Hypocreaceae|Hypocrea,Fungi,Ascomycota,Sordariomycetes,Hypocreales,Hypocreaceae,Hypocrea sulphurea,247735,Hypocrea,,"Cooke, William Bridge",,10/15/36,1936,10,15,289,,on beech and Exidia glandulosa,United States,Ohio,Hamilton,Cincinnati,California,39.068271,-84.408854,,,https://www.mycoportal.org/portal/collections/individual/index.php?occid=4402408
4402410,Fungi|Ascomycota|Pezizomycotina|Sordariomycetes|Hypocreomycetidae|Hypocreales|Hypocreaceae|Hypocrea,Fungi,Ascomycota,Sordariomycetes,Hypocreales,Hypocreaceae,Hypocrea sulphurea,247735,Hypocrea,,"Kaps, C.",,10/27/34,1934,10,27,300,,,United States,Ohio,Adams,,"Adams County, Ohio",38.845515,-83.472152,,,https://www.mycoportal.org/portal/collections/individual/index.php?occid=4402410
4402414,Fungi|Ascomycota|Pezizomycotina|Sordariomycetes|Hypocreomycetidae|Hypocreales|Nectriaceae|Nectria,Fungi,Ascomycota,Sordariomycetes,Hypocreales,Nectriaceae,Nectria cinnabarina,186178,Nectria,,"Cooke, William Bridge",,10/31/35,1935,10,31,304,,,United States,Ohio,Hamilton,Cincinnati,Caldwell Woods,39.202231,-84.490503,,,https://www.mycoportal.org/portal/collections/individual/index.php?occid=4402414
4402417,Fungi|Ascomycota|Pezizomycotina|Sordariomycetes|Hypocreomycetidae|Hypocreales|Hypocreaceae|Hypocrea,Fungi,Ascomycota,Sordariomycetes,Hypocreales,Hypocreaceae,Hypocrea sulphurea,247735,Hypocrea,,"Cooke, William Bridge",,11/14/36,1936,11,14,319,,,United States,Ohio,Hamilton,Red Bird Hollow,Red Bird Hollow,39.171121,-84.319385,,,https://www.mycoportal.org/portal/collections/individual/index.php?occid=4402417
4402419,Fungi|Ascomycota|Pezizomycotina|Sordariomycetes|Hypocreomycetidae|Hypocreales|Nectriaceae|Nectria,Fungi,Ascomycota,Sordariomycetes,Hypocreales,Nectriaceae,Nectria cinnabarina,186178,Nectria,,"Williams, Jean",,12/28/34,1934,12,28,362,,on oak,United States,Georgia,Fulton,Atlanta,"East Lake Forest, Atlanta",33.746426,-84.299748,,,https://www.mycoportal.org/portal/collections/individual/index.php?occid=4402419
4402421,Fungi|Ascomycota|Pezizomycotina|Sordariomycetes|Hypocreomycetidae|Hypocreales|Hypocreaceae|Hypocrea,Fungi,Ascomycota,Sordariomycetes,Hypocreales,Hypocreaceae,Hypocrea citrina,247449,Hypocrea,,"Cooke, William Bridge",,9/13/35,1935,9,13,256,,,United States,Ohio,Clermont,Dark Hollow,Dark Hollow,38.915352,-82.693222,,,https://www.mycoportal.org/portal/collections/individual/index.php?occid=4402421
4402423,Fungi|Ascomycota|Pezizomycotina|Sordariomycetes|Hypocreomycetidae|Hypocreales|Hypocreaceae|Hypocrea,Fungi,Ascomycota,Sordariomycetes,Hypocreales,Hypocreaceae,Hypocrea brevipes,247420,Hypocrea,,"Cooke, William Bridge",,11/21/35,1935,11,21,325,,,United States,Ohio,Hamilton,Sycamore Township,Brecon Woods,39.280614,-84.356606,,,https://www.mycoportal.org/portal/collections/individual/index.php?occid=4402423
4402425,Fungi|Ascomycota|Pezizomycotina|Sordariomycetes|Hypocreomycetidae|Hypocreales|Nectriaceae|Nectria,Fungi,Ascomycota,Sordariomycetes,Hypocreales,Nectriaceae,Nectria cinnabarina,186178,Nectria,,"Fulford, Margaret H.",,10/18/29,1929,10,18,291,woods,dead twigs,United States,Ohio,Clermont,Milford,Milford,39.175338,-84.294382,,,https://www.mycoportal.org/portal/collections/individual/index.php?occid=4402425
4402427,Fungi|Ascomycota|Pezizomycotina|Sordariomycetes|Hypocreomycetidae|Hypocreales|Nectriaceae|Nectria,Fungi,Ascomycota,Sordariomycetes,Hypocreales,Nectriaceae,Nectria cinnabarina,186178,Nectria,,"Fulford, Margaret H.",,9/27/29,1929,9,27,270,,on beech,United States,Ohio,Hamilton,Cincinnati,Kroger Hills,39.150157,-84.32093,,,https://www.mycoportal.org/portal/collections/individual/index.php?occid=4402427
4402555,Fungi|Ascomycota|Pezizomycotina|Sordariomycetes|Hypocreomycetidae|Hypocreales|Hypocreaceae|Hypocrea,Fungi,Ascomycota,Sordariomycetes,Hypocreales,Hypocreaceae,Hypocrea citrina,247449,Hypocrea,,"Fulford, Margaret H.",,9/27/29,1929,9,27,270,,,United States,Ohio,Hamilton,Cincinnati,Kroger Hills,39.150157,-84.32093,,,https://www.mycoportal.org/portal/collections/individual/index.php?occid=4402555
4402557,Fungi|Ascomycota|Pezizomycotina|Sordariomycetes|Hypocreomycetidae|Hypocreales|Hypocreaceae|Hypocrea,Fungi,Ascomycota,Sordariomycetes,Hypocreales,Hypocreaceae,Hypocrea sulphurea,247735,Hypocrea,,"Cooke, William Bridge",,10/18/29,1929,10,18,291,,on wild cherry and Exidia glandulosa,,,,,,9999.99,9999.99,,,https://www.mycoportal.org/portal/collections/individual/index.php?occid=4402557
4402569,Fungi|Ascomycota|Pezizomycotina|Sordariomycetes|Sordariomycetidae|Diaporthales|Melanconidaceae|Melanconis,Fungi,Ascomycota,Sordariomycetes,Diaporthales,Melanconidaceae,Melanconis thelebola,284904,Melanconis,,"Smarods, Julijs",,7/14/36,1936,7,14,196,,on Alnus incana,Latvia,Zemgale,Jelgava,Vecsvirlauka,Vecsvirlauka,56.606389,23.891111,,,https://www.mycoportal.org/portal/collections/individual/index.php?occid=4402569
4402571,Fungi|Ascomycota|Pezizomycotina|Dothideomycetes|Dothideomycetidae|Dothideales|Saccotheciaceae|Dothioraceae|Metasphaeria,Fungi,Ascomycota,Dothideomycetes,Dothideales,Leptosphaeriaceae,Metasphaeria sepalorum,290498,Metasphaeria,,"Cooke, William Bridge","Bonar, L.",9/17/38,1938,9,17,260,Occasional colonies of the host have this fungus commonly on the perianth segments,on Juncus parryi,United States,California,Siskiyou,Mt. Shasta,"Cascade Gulch, Mount Shasta",41.4,-122.2,2134,,https://www.mycoportal.org/portal/collections/individual/index.php?occid=4402571
4402573,Fungi|Ascomycota|Pezizomycotina|Dothideomycetes|Dothideomycetidae|Dothideales|Saccotheciaceae|Dothioraceae|Metasphaeria,Fungi,Ascomycota,Dothideomycetes,Dothideales,Leptosphaeriaceae,Metasphaeria sepalorum,290498,Metasphaeria,,"Cooke, William Bridge","Bonar, L.",8/24/39,1939,8,24,236,Occasional colonies of the host have this fungus commonly on the perianth segments,on Juncus parryi,United States,California,Siskiyou,Mt. Shasta,South Gate,41.365928,-122.171961,2438,,https://www.mycoportal.org/portal/collections/individual/index.php?occid=4402573
4402575,Fungi|Ascomycota|Pezizomycotina|Dothideomycetes|Dothideomycetidae|Dothideales|Saccotheciaceae|Dothioraceae|Metasphaeria,Fungi,Ascomycota,Dothideomycetes,Dothideales,Leptosphaeriaceae,Metasphaeria sepalorum,290498,Metasphaeria,,"Cooke, William Bridge",,7/10/47,1947,7,10,191,Common on overwintered perianth segments which remain on flowers in place on scapes,on Juncus parryi,United States,California,Siskiyou,Mt. Shasta,near Squaw Valley Creek Meadows,41.3685,-122.172746,2591,,https://www.mycoportal.org/portal/collections/individual/index.php?occid=4402575
4402576,Fungi|Ascomycota|Pezizomycotina|Dothideomycetes|Dothideomycetidae|Dothideales|Saccotheciaceae|Dothioraceae|Metasphaeria,Fungi,Ascomycota,Dothideomycetes,Dothideales,Leptosphaeriaceae,Metasphaeria sepalorum,290498,Metasphaeria,,"Cooke, William Bridge","Cooke, V.G.",7/12/48,1948,7,12,194,In subalpine meadows,on Juncus parryi,United States,Washington,Whatcom,,"along Washington Route 1, near Mount Baker Lodge, Mount Baker National Forest",48.863458,-121.682363,,,https://www.mycoportal.org/portal/collections/individual/index.php?occid=4402576
4402584,Fungi|Ascomycota|Pezizomycotina|Dothideomycetes|Dothideomycetidae|Capnodiales|Mycosphaerellaceae|Mycosphaerella,Fungi,Ascomycota,Dothideomycetes,Capnodiales,Mycosphaerellaceae,Mycosphaerella aquilegiae,300064,Mycosphaerella,,"Bonar, L.",,6/29/37,1937,6,29,180,On dead overwintered sticks,on Lupinus obtusilobus,United States,California,Siskiyou,Mt. Shasta,Horse Camp,41.37252,-122.23153,2438,,https://www.mycoportal.org/portal/collections/individual/index.php?occid=4402584
4402596,Fungi|Ascomycota|Pezizomycotina|Dothideomycetes|Dothideomycetidae|Capnodiales|Mycosphaerellaceae|Mycosphaerella,Fungi,Ascomycota,Dothideomycetes,Capnodiales,Mycosphaerellaceae,Mycosphaerella caespitosa,300188,Mycosphaerella,,"Cooke, William Bridge",,9/23/40,1940,9,23,267,Common on shrubs on the host which form extensive thickets in mixed conifer woods,on Quercus sadleriana,United States,California,Del Norte,,"Bear Basin Butte, Siskiyou National Forest woods",41.809004,-123.741736,1524,,https://www.mycoportal.org/portal/collections/individual/index.php?occid=4402596
4402600,Fungi|Ascomycota|Pezizomycotina|Dothideomycetes|Dothideomycetidae|Capnodiales|Mycosphaerellaceae,Fungi,Ascomycota,Dothideomycetes,Capnodiales,Mycosphaerellaceae,Mycosphaerella,16326,Mycosphaerella,,"Parks, H.E.",,1932-07-00,1932,7,0,,,on Thuja plicata,United States,California,Humboldt,Trinidad,Trinidad,41.059291,-124.143125,244,,https://www.mycoportal.org/portal/collections/individual/index.php?occid=4402600
4402602,Fungi|Ascomycota|Pezizomycotina|Dothideomycetes|Dothideomycetidae|Capnodiales|Mycosphaerellaceae|Mycosphaerella,Fungi,Ascomycota,Dothideomycetes,Capnodiales,Mycosphaerellaceae,Mycosphaerella caespitosa,300188,Mycosphaerella,,"Parks, H.E.","Tracy, J.P.",7/21/38,1938,7,21,202,,on Quercus sadleriana,United States,California,Del Norte,Monumental,3 miles north of Monumental; along Oregon-California boundary,42.018024,-123.805072,,,https://www.mycoportal.org/portal/collections/individual/index.php?occid=4402602
4402605,Fungi|Ascomycota|Pezizomycotina|Dothideomycetes|Dothideomycetidae|Capnodiales|Mycosphaerellaceae|Mycosphaerella,Fungi,Ascomycota,Dothideomycetes,Capnodiales,Mycosphaerellaceae,Mycosphaerella filicum,186056,Mycosphaerella,,"Lind., J.",,9/16/05,1905,9,16,259,,on Aspidii spinulosa,Denmark,Jutland,,Viborg,Viborg,56.45282,9.404291,,,https://www.mycoportal.org/portal/collections/individual/index.php?occid=4402605
4402609,Fungi|Ascomycota|Pezizomycotina|Dothideomycetes|Dothideomycetidae|Capnodiales|Mycosphaerellaceae|Mycosphaerella,Fungi,Ascomycota,Dothideomycetes,Capnodiales,Mycosphaerellaceae,Mycosphaerella tulasnei,301475,Mycosphaerella,,"Cooke, William Bridge","Sprague, R.",7/7/37,1937,7,7,188,dead culms and leaves,on Juncus balticus v. montanus,United States,California,Siskiyou,Mt. Shasta,Horse Camp,41.37252,-122.23153,2438,2438,https://www.mycoportal.org/portal/collections/individual/index.php?occid=4402609
4402610,Fungi|Ascomycota|Pezizomycotina|Dothideomycetes|Dothideomycetidae|Capnodiales|Mycosphaerellaceae|Mycosphaerella,Fungi,Ascomycota,Dothideomycetes,Capnodiales,Mycosphaerellaceae,Mycosphaerella tulasnei,301475,Mycosphaerella,,"Cooke, William Bridge","Sprague, R.",8/17/37,1937,8,17,229,dead culms and leaves,on Trisetum spicatum,United States,California,Siskiyou,Mt. Shasta,Horse Camp,41.37252,-122.23153,2515,,https://www.mycoportal.org/portal/collections/individual/index.php?occid=4402610
4402612,Fungi|Ascomycota|Pezizomycotina|Dothideomycetes|Pleosporomycetidae|Pleosporales|Neopeckia,Fungi,Ascomycota,Dothideomycetes,Pleosporales,Dothideomycetes,Neopeckia coulteri,186285,Neopeckia,,"Cooke, William Bridge",,7/28/38,1938,7,28,209,Common throughout the range of the host above the timberline in the Hudsonian Zone.,on Pinus albicaulis,United States,California,Siskiyou,Mt. Shasta,"Mt. Shasta, above timberline in the Hudsonian Zone",41.40932,-122.195009,2743,,https://www.mycoportal.org/portal/collections/individual/index.php?occid=4402612
4402613,Fungi|Ascomycota|Pezizomycotina|Dothideomycetes|Pleosporomycetidae|Pleosporales|Neopeckia,Fungi,Ascomycota,Dothideomycetes,Pleosporales,Dothideomycetes,Neopeckia coulteri,186285,Neopeckia,,"Bonar, L.",,7/8/34,1934,7,8,189,,on Pinus monticola,United States,California,Shasta,,"Summit Lake, Lassen Volcanic National Park",40.492919,-121.423386,,,https://www.mycoportal.org/portal/collections/individual/index.php?occid=4402613
4402616,Fungi|Ascomycota|Pezizomycotina|Dothideomycetes|Pleosporomycetidae|Pleosporales|Neopeckia,Fungi,Ascomycota,Dothideomycetes,Pleosporales,Dothideomycetes,Neopeckia coulteri,186285,Neopeckia,,"Cooke, William Bridge",,7/28/38,1938,7,28,209,Common throughout the range of the host in the Hudsonian Zone.,on Pinus albicaulis,United States,California,Siskiyou,Mt. Shasta,"Hudsonian Zone, ridge north of Horse Camp",41.37252,-122.23153,2743,,https://www.mycoportal.org/portal/collections/individual/index.php?occid=4402616
4402619,Fungi|Ascomycota|Pezizomycotina|Dothideomycetes|Pleosporomycetidae|Pleosporales|Neopeckia,Fungi,Ascomycota,Dothideomycetes,Pleosporales,Dothideomycetes,Neopeckia coulteri,186285,Neopeckia,,"Cooke, William Bridge",,9/8/38,1938,9,8,251,,on Abies magnifica v. shastensis,United States,California,Siskiyou,Mt. Shasta,In the vicinity of Squaw Valley Creek,41.3685,-122.172746,2438,,https://www.mycoportal.org/portal/collections/individual/index.php?occid=4402619
4402620,Fungi|Ascomycota|Pezizomycotina|Sordariomycetes|Xylariomycetidae|Xylariales|Xylariaceae|Nummularia,Fungi,Ascomycota,Sordariomycetes,Xylariales,Xylariaceae,Nummularia bulliardii,307381,Nummularia,,"Cooke, William Bridge",,3/6/45,1945,3,6,65,Almost completely covering the bark of a tree between 6 and 10 feet above the ground,on Quercus velutinus,United States,Virginia,Fauquier,Vint Hill Farms,Vint Hill Farms,36.707876,-82.647935,,,https://www.mycoportal.org/portal/collections/individual/index.php?occid=4402620
4406028,Fungi|Ascomycota|Pezizomycotina|Dothideomycetes|Pleosporomycetidae|Pleosporales|Leptosphaeriaceae|Ophiobolus,Fungi,Ascomycota,Dothideomycetes,Pleosporales,Phaeosphaeriaceae,Ophiobolus acuminatus,186467,Ophiobolus,,"Smarods, Julijs",,6/15/00,1900,6,15,166,,on Cirsium arvense,Latvia,Vidzeme,Riga,Spilve,Spilve,56.99194,24.07444,,,https://www.mycoportal.org/portal/collections/individual/index.php?occid=4406028
4406031,Fungi|Ascomycota|Pezizomycotina|Dothideomycetes|Dothideomycetidae|Capnodiales|Mycosphaerellaceae|Ophiocarpella,Fungi,Ascomycota,Dothideomycetes,Capnodiales,Mycosphaerellaceae,Ophiocarpella tarda,346774,Ophiocarpella,,"Bonar, L.",,8/7/26,1926,8,7,219,,"on Rhus diversiloba, syn. Toxicodendron diversilobum",United States,California,Marin,Ross,Ross,37.962424,-122.554978,,,https://www.mycoportal.org/portal/collections/individual/index.php?occid=4406031
4406033,Fungi|Ascomycota|Pezizomycotina|Sordariomycetes|Xylariomycetidae|Xylariales|Amphisphaeriaceae|Pestalotia,Fungi,Ascomycota,Sordariomycetes,Xylariales,Pestalotiopsidaceae,Pestalotia macrotricha,359333,Pestalotia,,"Bonar, L.",,10/1/33,1933,10,1,274,,on Rhododendron sp.,United States,California,San Francisco,San Francisco,Golden Gate Park,37.769097,-122.48025,,,https://www.mycoportal.org/portal/collections/individual/index.php?occid=4406033
4406035,Fungi|Ascomycota|Pezizomycotina|Sordariomycetes|Xylariomycetidae|Xylariales|Amphisphaeriaceae|Pestalotia,Fungi,Ascomycota,Sordariomycetes,Xylariales,Amphisphaeriaceae,Pestalotia polychaeta,359432,Pestalotia,,"Bonar, L.",,1/5/34,1934,1,5,5,,on Araucaria imbricata (syn. Araucaria araucana),United States,California,Marin,San Rafael,San Rafael,37.973535,-122.531087,,,https://www.mycoportal.org/portal/collections/individual/index.php?occid=4406035
4406037,Fungi|Ascomycota|Pezizomycotina|Sordariomycetes|Xylariomycetidae|Xylariales|Amphisphaeriaceae|Pestalotia,Fungi,Ascomycota,Sordariomycetes,Xylariales,Pestalotiopsidaceae,Pestalotia virgatula,359545,Pestalotia,,"Cooke, William Bridge",,1944-00-00,1944,0,0,,Isolated from textile sample exposed in Panama Canal Zone,Grows well on potato dextrose agar and cellulose substrates,Panama,,,,Panama Canal Zone,9999.99,9999.99,,,https://www.mycoportal.org/portal/collections/individual/index.php?occid=4406037
4406038,Fungi|Ascomycota|Pezizomycotina|Dothideomycetes|Pleosporomycetidae|Pleosporales|Pleosporaceae|Pleospora,Fungi,Ascomycota,Dothideomycetes,Pleosporales,Pleosporaceae,Pleospora balsamorrhizae,380476,Pleospora,,"Cooke, William Bridge",,7/13/38,1938,7,13,194,on dead sticks near Horse Camp,on Lupinus albicaulis var. shastensis,United States,California,Siskiyou,Mt. Shasta,near Horse Camp,41.37252,-122.23153,2438,,https://www.mycoportal.org/portal/collections/individual/index.php?occid=4406038
4406039,Fungi|Ascomycota|Pezizomycotina|Dothideomycetes|Pleosporomycetidae|Pleosporales|Pleosporaceae|Pleospora,Fungi,Ascomycota,Dothideomycetes,Pleosporales,Diademaceae,Pleospora diplospora,380601,Pleospora,,"Cooke, William Bridge","Cooke, V.G.",6/27/46,1946,6,27,178,,on Monardella odoratissima,United States,California,Siskiyou,Mt. Shasta,Horse Camp,41.372268,-122.229867,2438,2438,https://www.mycoportal.org/portal/collections/individual/index.php?occid=4406039
4406041,Fungi|Ascomycota|Pezizomycotina|Dothideomycetes|Pleosporomycetidae|Pleosporales|Pleosporaceae|Pleospora,Fungi,Ascomycota,Dothideomycetes,Pleosporales,Diademaceae,Pleospora elynae,380627,Pleospora,,"Sprague, R.",,8/17/37,1937,8,17,229,,on dead leaves of Carex spectabilis,United States,California,Siskiyou,Mt. Shasta,South Gate Springs,41.365928,-122.171961,2469,,https://www.mycoportal.org/portal/collections/individual/index.php?occid=4406041
4406042,Fungi|Ascomycota|Pezizomycotina|Dothideomycetes|Pleosporomycetidae|Pleosporales|Pleosporaceae|Pleospora,Fungi,Ascomycota,Dothideomycetes,Pleosporales,Diademaceae,Pleospora elynae,380627,Pleospora,,"Cooke, William Bridge","Cooke, V.G.",9/2/46,1946,9,2,245,,on Juncus mertensianus,United States,California,Siskiyou,Mt. Shasta,Near a small spring along the Sisson Southern Trail above Horse Camp,41.37252,-122.23153,2515,,https://www.mycoportal.org/portal/collections/individual/index.php?occid=4406042
4406044,Fungi|Ascomycota|Pezizomycotina|Dothideomycetes|Pleosporomycetidae|Pleosporales|Pleosporaceae|Pleospora,Fungi,Ascomycota,Dothideomycetes,Pleosporales,Pleosporaceae,Pleospora gigaspora,380690,Pleospora,,"Cooke, William Bridge",,7/28/37,1937,7,28,209,on dead sticks,on Lupinus obtusilobus,United States,California,Siskiyou,Mt. Shasta,near Horse Camp,41.37252,-122.23153,2591,,https://www.mycoportal.org/portal/collections/individual/index.php?occid=4406044
4406045,Fungi|Ascomycota|Pezizomycotina|Dothideomycetes|Pleosporomycetidae|Pleosporales|Pleosporaceae|Pleospora,Fungi,Ascomycota,Dothideomycetes,Pleosporales,Pleosporaceae,Pleospora herbarum,187615,Pleospora,,"Sprague, R.",,8/17/37,1937,8,17,229,,on Agrostis thurberiana,United States,California,Siskiyou,Mt. Shasta,Panther Creek meadow,41.356389,-122.199033,2286,,https://www.mycoportal.org/portal/collections/individual/index.php?occid=4406045
4406047,Fungi|Ascomycota|Pezizomycotina|Dothideomycetes|Pleosporomycetidae|Pleosporales|Pleosporaceae|Pleospora,Fungi,Ascomycota,Dothideomycetes,Pleosporales,Pleosporaceae,Pleospora herbarum,187615,Pleospora,,"Cooke, William Bridge",,8/15/41,1941,8,15,227,on dead sticks in colonies of the host,on Eupatorium occidentale (syn. Ageratina occidentalis),United States,California,Siskiyou,Mt. Shasta,in the Lava Park area above Hotlum,41.47404,-122.314458,1676,,https://www.mycoportal.org/portal/collections/individual/index.php?occid=4406047
4406049,Fungi|Ascomycota|Pezizomycotina|Dothideomycetes|Pleosporomycetidae|Pleosporales|Pleosporaceae|Pleospora,Fungi,Ascomycota,Dothideomycetes,Pleosporales,Pleosporaceae,Pleospora herbarum,187615,Pleospora,,"Sprague, R.",,7/28/37,1937,7,28,209,on dead sticks,on Arnica viscosa,United States,California,Siskiyou,Mt. Shasta,near Horse Camp,41.37252,-122.23153,2515,,https://www.mycoportal.org/portal/collections/individual/index.php?occid=4406049
4406051,Fungi|Ascomycota|Pezizomycotina|Dothideomycetes|Pleosporomycetidae|Pleosporales|Pleosporaceae|Pleospora,Fungi,Ascomycota,Dothideomycetes,Pleosporales,Diademaceae,Pleospora permunda,380947,Pleospora,,"Cooke, William Bridge",,8/18/41,1941,8,18,230,Shasta fir woods,on Arabis platysperma,United States,California,Siskiyou,Mt. Shasta,Along the Memorial Highway,41.339083,-122.253483,2134,,https://www.mycoportal.org/portal/collections/individual/index.php?occid=4406051
4406053,Fungi|Ascomycota|Pezizomycotina|Dothideomycetes|Pleosporomycetidae|Pleosporales|Pleosporaceae|Pleospora,Fungi,Ascomycota,Dothideomycetes,Pleosporales,Diademaceae,Pleospora permunda,380947,Pleospora,,"Cooke, William Bridge",,7/21/38,1938,7,21,202,on dead overwintered sticks,on Anemone occidentalis,United States,California,Siskiyou,Mt. Shasta,on ridge between Horse Camp and Panther Creek,41.37252,-122.23153,2591,,https://www.mycoportal.org/portal/collections/individual/index.php?occid=4406053
4406054,Fungi|Ascomycota|Pezizomycotina|Dothideomycetes|Pleosporomycetidae|Pleosporales|Pleosporaceae|Pleospora,Fungi,Ascomycota,Dothideomycetes,Pleosporales,Diademaceae,Pleospora permunda,380947,Pleospora,,"Sprague, R.",,6/24/37,1937,6,24,175,dead sticks,on Monardella odoratissima,United States,California,Siskiyou,Mt. Shasta,Horse Camp,41.37252,-122.23153,2438,,https://www.mycoportal.org/portal/collections/individual/index.php?occid=4406054
4406055,Fungi|Ascomycota|Pezizomycotina|Dothideomycetes|Pleosporomycetidae|Pleosporales|Pleosporaceae|Pleospora,Fungi,Ascomycota,Dothideomycetes,Pleosporales,Diademaceae,Pleospora permunda,380947,Pleospora,,"Cooke, William Bridge",,6/29/37,1937,6,29,180,dead sticks,on Ligusticum grayi,United States,California,Siskiyou,Mt. Shasta,Panther Creek,41.356389,-122.199033,2438,,https://www.mycoportal.org/portal/collections/individual/index.php?occid=4406055
4406057,Fungi|Ascomycota|Pezizomycotina|Dothideomycetes|Pleosporomycetidae|Pleosporales|Pleosporaceae|Pleospora,Fungi,Ascomycota,Dothideomycetes,Pleosporales,Diademaceae,Pleospora permunda,380947,Pleospora,,"Cooke, William Bridge",,6/24/37,1937,6,24,175,dead sticks,on Penstemon gracilentus,United States,California,Siskiyou,Mt. Shasta,Horse Camp,41.37252,-122.23153,2438,,https://www.mycoportal.org/portal/collections/individual/index.php?occid=4406057
4406058,Fungi|Ascomycota|Pezizomycotina|Dothideomycetes|Pleosporomycetidae|Pleosporales|Pleosporaceae|Pleospora,Fungi,Ascomycota,Dothideomycetes,Pleosporales,Diademaceae,Pleospora permunda,380947,Pleospora,,"Cooke, William Bridge",,9/3/37,1937,9,3,246,dead leaves and stems,on Cycladenia humilis,United States,California,Siskiyou,Mt. Shasta,near the Sisson Southern Trail,41.339569,-122.287735,1981,,https://www.mycoportal.org/portal/collections/individual/index.php?occid=4406058
4406060,Fungi|Ascomycota|Pezizomycotina|Dothideomycetes|Pleosporomycetidae|Pleosporales|Pleosporaceae|Pleospora,Fungi,Ascomycota,Dothideomycetes,Pleosporales,Diademaceae,Pleospora permunda,380947,Pleospora,,"Cooke, William Bridge","Cooke, V.G.",7/16/46,1946,7,16,197,,on Cycladenia humilis,United States,California,Siskiyou,Mt. Shasta,"ridges north of Horse Camp, Mt. Shasta",41.392347,-122.246022,,,https://www.mycoportal.org/portal/collections/individual/index.php?occid=4406060
4406062,Fungi|Ascomycota|Pezizomycotina|Dothideomycetes|Pleosporomycetidae|Pleosporales|Pleosporaceae|Pleospora,Fungi,Ascomycota,Dothideomycetes,Pleosporales,Diademaceae,Pleospora permunda,380947,Pleospora,,"Cooke, William Bridge",,6/24/37,1937,6,24,175,,on stems of Penstemon confertus,United States,California,Siskiyou,Mt. Shasta,Mt. Shasta,41.409716,-122.202173,2438,,https://www.mycoportal.org/portal/collections/individual/index.php?occid=4406062
4406063,Fungi|Ascomycota|Pezizomycotina|Sordariomycetes|Xylariomycetidae|Xylariales|Hyponectriaceae|Physalospora,Fungi,Ascomycota,Sordariomycetes,Xylariales,Phyllachoraceae,Physalospora cynodontis,376134,Physalospora,,"Bonar, L.",,9/9/34,1934,9,9,252,,on Distichlis spicata,United States,California,San Francisco,,Lake Merced,37.77493,-122.419416,,,https://www.mycoportal.org/portal/collections/individual/index.php?occid=4406063
4406065,Fungi|Ascomycota|Pezizomycotina|Dothideomycetes|Pleosporomycetidae|Pleosporales|Pleosporaceae|Pleospora,Fungi,Ascomycota,Dothideomycetes,Pleosporales,Diademaceae,Pleospora permunda,380947,Pleospora,,"Sprague, R.",,6/24/37,1937,6,24,175,common on dead sticks of host after spring melting of heavy snows,on Penstemon gracilentus,United States,California,Siskiyou,Mt. Shasta,"Horse Camp, upper Canadian Zone",41.37252,-122.23153,2438,,https://www.mycoportal.org/portal/collections/individual/index.php?occid=4406065
4406066,Fungi|Ascomycota|Pezizomycotina|Dothideomycetes|Pleosporomycetidae|Pleosporales|Pleosporaceae|Pleospora,Fungi,Ascomycota,Dothideomycetes,Pleosporales,Pleosporaceae,Pleospora amplispora,380429,Pleospora,,"Cooke, William Bridge",,7/21/38,1938,7,21,202,common on dead stems of previous year after heavy snows,on Lupinus albicaulis var. shastensis,United States,California,Siskiyou,Mt. Shasta,on ridge south of Horse Camp,41.37252,-122.23153,2438,,https://www.mycoportal.org/portal/collections/individual/index.php?occid=4406066
4406075,Fungi|Ascomycota|Pezizomycotina|Dothideomycetes|Pleosporomycetidae|Pleosporales|Pleosporaceae|Pleospora,Fungi,Ascomycota,Dothideomycetes,Pleosporales,Pleosporaceae,Pleospora balsamorrhizae,380476,Pleospora,,"Cooke, William Bridge",,7/13/38,1938,7,13,194,common on dead sticks of previous year after melting of heavy snows,on Lupinus obtusilobus,United States,California,Siskiyou,Mt. Shasta,in the vicinity of Horse Camp,41.37252,-122.23153,2438,,https://www.mycoportal.org/portal/collections/individual/index.php?occid=4406075
4406077,Fungi|Ascomycota|Pezizomycotina|Dothideomycetes|Pleosporomycetidae|Pleosporales|Pleosporaceae|Pleospora,Fungi,Ascomycota,Dothideomycetes,Pleosporales,Pleosporaceae,Pleospora amplispora,380429,Pleospora,,"Cooke, William Bridge",,7/21/38,1938,7,21,202,on dead sticks near Horse Camp,on Lupinus obtusilobus,United States,California,Siskiyou,Mt. Shasta,"near Horse Camp, Mount Shasta",41.40726,-122.222475,2438,,https://www.mycoportal.org/portal/collections/individual/index.php?occid=4406077
4406078,Fungi|Ascomycota|Pezizomycotina|Dothideomycetes|Pleosporomycetidae|Pleosporales|Pleosporaceae|Pleospora,Fungi,Ascomycota,Dothideomycetes,Pleosporales,Pleosporaceae,Pleospora herbarum,187615,Pleospora,,"Parks, H.E.",,1934-03-00,1934,3,0,,,on Dactylis glomerata,United States,California,Humboldt,Trinidad,"Spruce Cove, Trinidad",41.059291,-124.143125,,,https://www.mycoportal.org/portal/collections/individual/index.php?occid=4406078
4406080,Fungi|Ascomycota|Pezizomycotina|Sordariomycetes|Sordariomycetidae|Calosphaeriales|Pleurostomataceae|Pleurostoma,Fungi,Ascomycota,Sordariomycetes,Calosphaeriales,Pleurostomataceae,Pleurostoma candollei,381498,Pleurostoma,,"Darker, G.D.",,4/20/36,1936,4,20,111,,on inner surface of bark of standing beech tree,United States,Massachusetts,Middlesex,Medford,Medford,42.41843,-71.106164,,,https://www.mycoportal.org/portal/collections/individual/index.php?occid=4406080
4406082,Fungi|Ascomycota|Pezizomycotina|Dothideomycetes|Pleosporomycetidae|Pleosporales|Pleosporaceae|Pyrenophora,Fungi,Ascomycota,Dothideomycetes,Pleosporales,Pleosporaceae,Pyrenophora fenestrata,402012,Pyrenophora,,"Cooke, William Bridge",,8/8/41,1941,8,8,220,on overwintered sticks in chapparral,on Castilleja pinetorum,United States,California,Siskiyou,Mt. Shasta,near Bear Springs,41.2996,-122.300991,1524,,https://www.mycoportal.org/portal/collections/individual/index.php?occid=4406082
4406084,Fungi|Ascomycota|Pezizomycotina|Dothideomycetes|Pleosporomycetidae|Pleosporales|Pleosporaceae|Pyrenophora,Fungi,Ascomycota,Dothideomycetes,Pleosporales,Pleosporaceae,Pyrenophora hispida,402021,Pyrenophora,,"Cooke, William Bridge",,8/18/41,1941,8,18,230,on dead sticks in clumps of the host,on Aster shastensis,United States,California,Siskiyou,Mt. Shasta,Along the Junction Highway above Wagon Camp,41.321603,-122.25012,1829,,https://www.mycoportal.org/portal/collections/individual/index.php?occid=4406084
4406087,Fungi|Ascomycota|Pezizomycotina|Sordariomycetes|Xylariomycetidae|Xylariales|Xylariaceae|Nummularia,Fungi,Ascomycota,Sordariomycetes,Xylariales,Xylariaceae,Nummularia bulliardi,307380,Nummularia,,"Cooke, William Bridge",,10/31/35,1935,10,31,304,,,United States,Ohio,Hamilton,Cincinnati,Caldwell Woods,39.202231,-84.490503,,,https://www.mycoportal.org/portal/collections/individual/index.php?occid=4406087
4406088,Fungi|Ascomycota|Pezizomycotina|Sordariomycetes|Xylariomycetidae|Xylariales|Xylariaceae|Nummularia,Fungi,Ascomycota,Sordariomycetes,Xylariales,Xylariaceae,Nummularia bulliardi,307380,Nummularia,,"Cooke, William Bridge",,11/30/35,1935,11,30,334,,,United States,Ohio,Clermont,Modest,Modest Uplands,39.193117,-84.107156,,,https://www.mycoportal.org/portal/collections/individual/index.php?occid=4406088
4406089,Fungi|Ascomycota|Pezizomycotina|Sordariomycetes|Xylariomycetidae|Xylariales|Xylariaceae|Nummularia,Fungi,Ascomycota,Sordariomycetes,Xylariales,Xylariaceae,Nummularia bulliardi,307380,Nummularia,,"Cooke, William Bridge",,2/9/37,1937,2,9,40,,,United States,Ohio,Hamilton,Cincinnati,Mt. Airy Forest,39.165058,-84.574945,,,https://www.mycoportal.org/portal/collections/individual/index.php?occid=4406089
4406091,Fungi|Ascomycota|Pezizomycotina|Sordariomycetes|Xylariomycetidae|Xylariales|Xylariaceae|Nummularia,Fungi,Ascomycota,Sordariomycetes,Xylariales,Xylariaceae,Nummularia bulliardi,307380,Nummularia,,"Cooke, William Bridge",,5/1/37,1937,5,1,121,,,United States,Ohio,Jackson,Rock Run,Rock Run,38.973405,-83.163515,,,https://www.mycoportal.org/portal/collections/individual/index.php?occid=4406091
4406092,Fungi|Ascomycota|Pezizomycotina|Sordariomycetes|Xylariomycetidae|Xylariales|Xylariaceae|Nummularia,Fungi,Ascomycota,Sordariomycetes,Xylariales,Xylariaceae,Nummularia bulliardi,307380,Nummularia,,"Cooke, William Bridge",,12/25/32,1932,12,25,360,,beech branches,United States,Ohio,Clermont,Dark Hollow,Dark Hollow,39.113281,-84.796747,,,https://www.mycoportal.org/portal/collections/individual/index.php?occid=4406092
4406093,Fungi|Ascomycota|Pezizomycotina|Sordariomycetes|Xylariomycetidae|Xylariales|Xylariaceae|Nummularia,Fungi,Ascomycota,Sordariomycetes,Xylariales,Xylariaceae,Nummularia bulliardi,307380,Nummularia,,"Cooke, William Bridge",,11/30/35,1935,11,30,334,,,United States,Ohio,Clermont,Modest,Modest Uplands,39.193117,-84.107156,,,https://www.mycoportal.org/portal/collections/individual/index.php?occid=4406093
4406094,Fungi|Ascomycota|Pezizomycotina|Sordariomycetes|Xylariomycetidae|Xylariales|Xylariaceae|Nummularia,Fungi,Ascomycota,Sordariomycetes,Xylariales,Xylariaceae,Nummularia bulliardi,307380,Nummularia,,"Cooke, William Bridge",,3/10/36,1936,3,10,70,,,United States,Ohio,Hamilton,Sycamore Creek,Sycamore Creek,39.247559,-84.322239,,,https://www.mycoportal.org/portal/collections/individual/index.php?occid=4406094
4406096,Fungi|Ascomycota|Pezizomycotina|Sordariomycetes|Xylariomycetidae|Xylariales|Xylariaceae|Nummularia,Fungi,Ascomycota,Sordariomycetes,Xylariales,Xylariaceae,Nummularia bulliardi,307380,Nummularia,,"Cooke, William Bridge",,7/31/32,1932,7,31,213,,under dead bark,United States,Ohio,Highland,,Seven Caves,39.222845,-83.355158,,,https://www.mycoportal.org/portal/collections/individual/index.php?occid=4406096
4406097,Fungi|Ascomycota|Pezizomycotina|Sordariomycetes|Xylariomycetidae|Xylariales|Xylariaceae|Nummularia,Fungi,Ascomycota,Sordariomycetes,Xylariales,Xylariaceae,Nummularia bulliardi,307380,Nummularia,,"Cooke, William Bridge",,9/28/35,1935,9,28,271,,,United States,Ohio,Hamilton,Cincinnati,Mt. Airy Forest,39.165058,-84.574945,,,https://www.mycoportal.org/portal/collections/individual/index.php?occid=4406097
4406098,Fungi|Ascomycota|Pezizomycotina|Sordariomycetes|Xylariomycetidae|Xylariales|Xylariaceae|Nummularia,Fungi,Ascomycota,Sordariomycetes,Xylariales,Xylariaceae,Nummularia bulliardi,307380,Nummularia,,"Cooke, William Bridge",,2/9/37,1937,2,9,40,,,United States,Ohio,Hamilton,Cincinnati,Mt. Airy Forest,39.165058,-84.574945,,,https://www.mycoportal.org/portal/collections/individual/index.php?occid=4406098
4406099,Fungi|Ascomycota|Pezizomycotina|Sordariomycetes|Xylariomycetidae|Xylariales|Xylariaceae|Nummularia,Fungi,Ascomycota,Sordariomycetes,Xylariales,Xylariaceae,Nummularia bulliardi,307380,Nummularia,,"Cooke, William Bridge",,10/31/35,1935,10,31,304,,,United States,Ohio,Hamilton,Cincinnati,Caldwell Woods,39.202231,-84.490503,,,https://www.mycoportal.org/portal/collections/individual/index.php?occid=4406099
4406101,Fungi|Ascomycota|Pezizomycotina|Sordariomycetes|Xylariomycetidae|Xylariales|Xylariaceae|Nummularia,Fungi,Ascomycota,Sordariomycetes,Xylariales,Xylariaceae,Nummularia bulliardi,307380,Nummularia,,"Cooke, William Bridge",,3/10/36,1936,3,10,70,,on beech,United States,Ohio,Hamilton,Sycamore Creek,"South Fork, Sycamore Creek",39.247559,-84.322239,,,https://www.mycoportal.org/portal/collections/individual/index.php?occid=4406101
4406102,Fungi|Ascomycota|Pezizomycotina|Sordariomycetes|Xylariomycetidae|Xylariales|Xylariaceae|Nummularia,Fungi,Ascomycota,Sordariomycetes,Xylariales,Xylariaceae,Nummularia bulliardi,307380,Nummularia,,"Cooke, William Bridge",,10/1/35,1935,10,1,274,,,United States,Ohio,Hamilton,Cincinnati,Polk Run,39.247745,-84.29431,,,https://www.mycoportal.org/portal/collections/individual/index.php?occid=4406102
4406103,Fungi|Ascomycota|Pezizomycotina|Sordariomycetes|Xylariomycetidae|Xylariales|Xylariaceae|Nummularia,Fungi,Ascomycota,Sordariomycetes,Xylariales,Xylariaceae,Nummularia bulliardi,307380,Nummularia,,H. K. P.,,10/3/40,1940,10,3,277,,log on dry ridge,United States,Ohio,Hamilton,Cincinnati,Kroger Hills,39.150157,-84.32093,,,https://www.mycoportal.org/portal/collections/individual/index.php?occid=4406103
4406105,Fungi|Ascomycota|Pezizomycotina|Sordariomycetes|Xylariomycetidae|Xylariales|Xylariaceae|Nummularia,Fungi,Ascomycota,Sordariomycetes,Xylariales,Xylariaceae,Nummularia bulliardi,307380,Nummularia,,"Cooke, William Bridge",,6/13/33,1933,6,13,164,,Sycamore bark,United States,Kentucky,Boone,Walton,Walton,38.875619,-84.610221,,,https://www.mycoportal.org/portal/collections/individual/index.php?occid=4406105
4406106,Fungi|Ascomycota|Pezizomycotina|Sordariomycetes|Xylariomycetidae|Xylariales|Xylariaceae|Nummularia,Fungi,Ascomycota,Sordariomycetes,Xylariales,Xylariaceae,Nummularia bulliardi,307380,Nummularia,,"Cooke, William Bridge",,4/12/36,1936,4,12,103,,,United States,Ohio,Jackson,Rock Run,Rock Run,38.973405,-83.163515,,,https://www.mycoportal.org/portal/collections/individual/index.php?occid=4406106
4406107,Fungi|Ascomycota|Pezizomycotina|Dothideomycetes|Pleosporomycetidae|Pleosporales|Neopeckia,Fungi,Ascomycota,Dothideomycetes,Pleosporales,Dothideomycetes,Neopeckia coulteri,186285,Neopeckia,,"Cooke, William Bridge",,7/28/37,1937,7,28,209,,on Pinus albicaulis,United States,California,Siskiyou,Mt. Shasta,Ridges north of Horse Camp,41.37252,-122.23153,,,https://www.mycoportal.org/portal/collections/individual/index.php?occid=4406107
4406108,Fungi|Ascomycota|Pezizomycotina|Sordariomycetes|Xylariomycetidae|Xylariales|Xylariaceae|Nummularia,Fungi,Ascomycota,Sordariomycetes,Xylariales,Xylariaceae,Nummularia bulliardi,307380,Nummularia,,"Cooke, William Bridge",,11/30/36,1936,11,30,335,,,United States,Ohio,Clermont,Modest,Modest Uplands,39.193117,-84.107156,,,https://www.mycoportal.org/portal/collections/individual/index.php?occid=4406108
4406111,Fungi|Ascomycota|Pezizomycotina|Sordariomycetes|Sordariomycetidae|Sordariales|Lasiosphaeriaceae|Lasiosphaeria,Fungi,Ascomycota,Sordariomycetes,Sordariales,Lasiosphaeriaceae,Lasiosphaeria ovina,259500,Lasiosphaeria,,"Stephenson, H.",,5/28/30,1930,5,28,148,woods,,United States,Ohio,Hamilton,Cincinnati,Hazelwood Preserve (Harris M. Benedict Nature Preserve/Johnson Preserve),39.261725,-84.353273,,,https://www.mycoportal.org/portal/collections/individual/index.php?occid=4406111
4406112,Fungi|Ascomycota|Pezizomycotina|Dothideomycetes|Dothideomycetidae|Dothideales|Saccotheciaceae|Dothioraceae|Metasphaeria,Fungi,Ascomycota,Dothideomycetes,Dothideales,Saccotheciaceae,Metasphaeria ceratotheca,290175,Metasphaeria,,"Cooke, William Bridge",,5/22/37,1937,5,22,142,,on dead stems of Zea mays,United States,Kentucky,Boone,Bullitsville,Bullitsville,39.075272,-84.73852,,,https://www.mycoportal.org/portal/collections/individual/index.php?occid=4406112
4406113,Fungi|Ascomycota|Pezizomycotina|Sordariomycetes|Sordariomycetidae|Diaporthales,Fungi,Ascomycota,Sordariomycetes,Diaporthales,Dothideaceae,Linospora,9122,Linospora,,"Cooke, William Bridge",,8/27/36,1936,8,27,240,,dead fir sticks,United States,California,Siskiyou,Mt. Shasta,Mt. Shasta,41.40932,-122.195009,2286,,https://www.mycoportal.org/portal/collections/individual/index.php?occid=4406113
4412281,Fungi|Basidiomycota|Agaricomycotina|Agaricomycetes|Agaricomycetidae|Boletales|Coniophoraceae,Fungi,Basidiomycota,Agaricomycetes,Boletales,Coniophoraceae,Coniophora,13321,Coniophora,,"Fulford, Margaret H.",,10/4/29,1929,10,4,277,,on old wood and oats mat in barn,United States,Ohio,Hamilton,Cincinnati,Hazelwood Preserve (Harris M. Benedict Nature Preserve/Johnson Preserve),39.261725,-84.353273,,,https://www.mycoportal.org/portal/collections/individual/index.php?occid=4412281
4412285,Fungi|Ascomycota|Pezizomycotina|Dothideomycetes|Dothideomycetidae|Capnodiales|Mycosphaerellaceae,Fungi,Ascomycota,Dothideomycetes,Capnodiales,Mycosphaerellaceae,Sphaerialea,18542,Sphaerialea,,"Cooke, William Bridge",,5/10/36,1936,5,10,131,,,United States,Kentucky,Boone,,"Sleep Creek, Boone County, Kentucky",38.969864,-84.727866,,,https://www.mycoportal.org/portal/collections/individual/index.php?occid=4412285
4412293,Fungi|Basidiomycota|Agaricomycotina|Agaricomycetes|Russulales|Peniophoraceae|Peniophora,Fungi,Basidiomycota,Agaricomycetes,Russulales,Peniophoraceae,Peniophora cinerea,186807,Peniophora,,"Fulford, Margaret H.",,10/17/29,1929,10,17,290,,on purple willow,United States,Ohio,Hamilton,Cincinnati,Hazelwood,39.266169,-84.362996,,,https://www.mycoportal.org/portal/collections/individual/index.php?occid=4412293
4412298,,,,,,Tremellaceae,Tremella frondosa,656624,Tremella,,"Cooke, William Bridge",,4/5/34,1934,4,5,95,,dead beech log,United States,Ohio,Ross,Alum Cliffs,Alum Cliffs,39.30562,-83.073238,,,https://www.mycoportal.org/portal/collections/individual/index.php?occid=4412298
4412308,Fungi|Ascomycota|Pezizomycotina|Sordariomycetes|Hypocreomycetidae|Hypocreales|Hypocreaceae|Hypomyces,Fungi,Ascomycota,Sordariomycetes,Hypocreales,Hypocreaceae,Hypomyces aurantius,184416,Hypomyces,,"Cooke, William Bridge",,4/18/34,1934,4,18,108,,Daelalia confragosa,United States,Ohio,Clermont,Branch Hill,South Branch Hill,39.24617,-84.293271,,,https://www.mycoportal.org/portal/collections/individual/index.php?occid=4412308
4412310,Fungi|Basidiomycota|Agaricomycotina|Agaricomycetes|Corticiales|Corticiaceae|Cytidia,Fungi,Basidiomycota,Agaricomycetes,Corticiales,Corticiaceae,Cytidia salicina,162819,Cytidia,,"Fulford, Margaret H.",,10/17/29,1929,10,17,290,,on purple willow,United States,Ohio,Hamilton,Cincinnati,Hazelwood,39.266169,-84.362996,,,https://www.mycoportal.org/portal/collections/individual/index.php?occid=4412310
4412314,Fungi|Ascomycota|Pezizomycotina|Leotiomycetes|Leotiomycetidae|Rhytismatales|Rhytismataceae|Coccomyces,Fungi,Ascomycota,Leotiomycetes,Rhytismatales,Rhytismataceae,Coccomyces triangularis,145392,Coccomyces,,"Cooke, William Bridge",,9/28/35,1935,9,28,271,,on Ailanthus glandulosa (syn. Ailanthus altissima),United States,Ohio,Hamilton,Cincinnati,Mt. Airy Forest,39.165058,-84.574945,,,https://www.mycoportal.org/portal/collections/individual/index.php?occid=4412314
4412316,Fungi|Ascomycota|Pezizomycotina|Sordariomycetes|Xylariomycetidae|Xylariales|Diatrypaceae|Diatrype,Fungi,Ascomycota,Sordariomycetes,Xylariales,Diatrypaceae,Diatrype stigma,169292,Diatrype,,"Cooke, William Bridge",,10/10/35,1935,10,10,283,,on Quercus sp.,United States,Ohio,Clermont,Milford,South Milford,39.175338,-84.294382,,,https://www.mycoportal.org/portal/collections/individual/index.php?occid=4412316
4412318,Fungi|Ascomycota|Pezizomycotina|Pezizomycetes|Pezizomycetidae|Pezizales|Morchellaceae|Morchella,Fungi,Ascomycota,Pezizomycetes,Pezizales,Morchellaceae,Morchella crassipes,296200,Morchella,,"Cooke, William Bridge",,,1937,0,0,,,,United States,Ohio,Hamilton,Cincinnati,,9999.99,9999.99,,,https://www.mycoportal.org/portal/collections/individual/index.php?occid=4412318
4412328,Fungi|Basidiomycota|Agaricomycotina|Agaricomycetes|Russulales|Stereaceae|Stereum,Fungi,Basidiomycota,Agaricomycetes,Russulales,Stereaceae,Stereum rufum,435053,Stereum,,"Cooke, William Bridge",,11/10/35,1935,11,10,314,,,United States,Ohio,Clermont,Mount Repose,Mt. Repose II,39.200616,-84.22438,,,https://www.mycoportal.org/portal/collections/individual/index.php?occid=4412328
4412334,Fungi|Ascomycota|Pezizomycotina|Sordariomycetes|Sordariomycetidae|Diaporthales|Valsaceae|Gnomoniaceae|Radulum,Fungi,Ascomycota,Sordariomycetes,Diaporthales,Schizoporaceae,Radulum orbiculare,403520,Radulum,,"Fulford, Margaret H.",,11/3/32,1932,11,3,308,,,United States,Ohio,Hamilton,Cincinnati,"Given Rd., Terrace Park",39.159227,-84.30716,,,https://www.mycoportal.org/portal/collections/individual/index.php?occid=4412334
4412338,Fungi|Basidiomycota|Agaricomycotina|Agaricomycetes|Cantharellales|Hydnaceae|Hydnum,Fungi,Basidiomycota,Agaricomycetes,Cantharellales,Phanerochaetaceae,Hydnum septentrionale,243543,Hydnum,,"Fahnestack, G.",,1935-07-00,1935,7,0,,,,United States,Ohio,Brown,,"Brown County, Ohio",38.934048,-83.867428,,,https://www.mycoportal.org/portal/collections/individual/index.php?occid=4412338
4412341,Fungi|Basidiomycota|Agaricomycotina|Agaricomycetes|Agaricomycetidae|Polyporales|Meruliaceae|Irpex,Fungi,Basidiomycota,Agaricomycetes,Polyporales,Hymenochaetaceae,Irpex cinnamomeus,253109,Irpex,,"Benedict, Harris",,1929-11-00,1929,11,0,,woods,,United States,Ohio,Hamilton,Cincinnati,College Hill,39.20228,-84.547166,,,https://www.mycoportal.org/portal/collections/individual/index.php?occid=4412341
4412343,Fungi|Basidiomycota|Agaricomycotina|Agaricomycetes|Agaricomycetidae|Polyporales|Meruliaceae|Irpex,Fungi,Basidiomycota,Agaricomycetes,Polyporales,Hymenochaetaceae,Irpex cinnamomeus,253109,Irpex,,"McCafferty, Pat",,10/30/32,1932,10,30,304,,,United States,Ohio,Hamilton,Cincinnati,McFarlan's Woods,39.154947,-84.591253,,,https://www.mycoportal.org/portal/collections/individual/index.php?occid=4412343
